torch/lib/rocm/.miopen/db/gfx1151_20.HIP.3_5_0_1c3d4a724f.ufdb.txt
16-13-60-104-1x2x2-1536-13-30-52-1-0x0x0-1x2x2-1x1x1-0-NCDHW-FP16-F=GemmFwdRest:0.435174,2595840,miopenConvolutionFwdAlgoGEMM
16-13-60-104-1x1x1-16-13-60-104-1-0x0x0-1x1x1-1x1x1-0-NCDHW-FP16-F=GemmFwd1x1_0_1:0.069988,0,miopenConvolutionFwdAlgoGEMM
16-3-62-106-3x3x3-384-1-60-104-1-0x0x0-1x1x1-1x1x1-0-NCDHW-FP16-F=GemmFwdRest:0.271306,5391360,miopenConvolutionFwdAlgoGEMM
384-3-62-106-3x3x3-384-1-60-104-1-0x0x0-1x1x1-1x1x1-0-NCDHW-FP16-F=GemmFwdRest:5.02714,129392640,miopenConvolutionFwdAlgoGEMM
384-60-104-1x1-1152-60-104-1-0x0-1x1-1x1-0-NCHW-FP16-F=ConvBinWinogradRxSf2x3g1:2.33974,0,miopenConvolutionFwdAlgoWinograd;GemmFwd1x1_0_1:0.178322,0,miopenConvolutionFwdAlgoGEMM;ConvBinWinogradRxSf3x2:1.04435,0,miopenConvolutionFwdAlgoWinograd
384-60-104-1x1-384-60-104-1-0x0-1x1-1x1-0-NCHW-FP16-F=ConvBinWinogradRxSf2x3g1:0.8323,0,miopenConvolutionFwdAlgoWinograd;GemmFwd1x1_0_1:0.0805383,0,miopenConvolutionFwdAlgoGEMM;ConvBinWinogradRxSf3x2:0.402583,0,miopenConvolutionFwdAlgoWinograd
384-120-208-3x3-192-120-208-1-1x1-1x1-1x1-0-NCHW-FP16-F=GemmFwdRest:2.84705,172523520,miopenConvolutionFwdAlgoGEMM;ConvBinWinogradRxSf3x2:2.77021,0,miopenConvolutionFwdAlgoWinograd;ConvBinWinogradRxSf2x3g1:1.60125,0,miopenConvolutionFwdAlgoWinograd
192-1-120-208-1x1x1-384-1-120-208-1-0x0x0-1x1x1-1x1x1-0-NCDHW-FP16-F=GemmFwd1x1_0_1:0.13249,0,miopenConvolutionFwdAlgoGEMM
192-3-122-210-3x3x3-384-1-120-208-1-0x0x0-1x1x1-1x1x1-0-NCDHW-FP16-F=GemmFwdRest:9.1951,258785280,miopenConvolutionFwdAlgoGEMM
384-3-122-210-3x3x3-384-1-120-208-1-0x0x0-1x1x1-1x1x1-0-NCDHW-FP16-F=GemmFwdRest:18.3618,517570560,miopenConvolutionFwdAlgoGEMM
384-240-416-3x3-192-240-416-1-1x1-1x1-1x1-0-NCHW-FP16-F=GemmFwdRest:10.7279,690094080,miopenConvolutionFwdAlgoGEMM;ConvBinWinogradRxSf3x2:10.1252,0,miopenConvolutionFwdAlgoWinograd;ConvBinWinogradRxSf2x3g1:5.86512,0,miopenConvolutionFwdAlgoWinograd
192-3-242-418-3x3x3-192-1-240-416-1-0x0x0-1x1x1-1x1x1-0-NCDHW-FP16-F=GemmFwdRest:36.0503,1035141120,miopenConvolutionFwdAlgoGEMM
192-480-832-3x3-96-480-832-1-1x1-1x1-1x1-0-NCHW-FP16-F=GemmFwdRest:15.5968,1380188160,miopenConvolutionFwdAlgoGEMM;ConvBinWinogradRxSf3x2:10.1483,0,miopenConvolutionFwdAlgoWinograd;ConvBinWinogradRxSf2x3g1:6.00041,0,miopenConvolutionFwdAlgoWinograd
96-3-482-834-3x3x3-96-1-480-832-1-0x0x0-1x1x1-1x1x1-0-NCDHW-FP16-F=GemmFwdRest:66.297,2070282240,miopenConvolutionFwdAlgoGEMM
96-3-482-834-3x3x3-3-1-480-832-1-0x0x0-1x1x1-1x1x1-0-NCDHW-FP16-F=GemmFwdRest:64.8515,2070282240,miopenConvolutionFwdAlgoGEMM
384-3-60-104-3x1x1-768-1-60-104-1-0x0x0-1x1x1-1x1x1-0-NCDHW-FP16-F=GemmFwdRest:0.731585,14376960,miopenConvolutionFwdAlgoGEMM
384-120-208-3x3-192-120-208-2-1x1-1x1-1x1-0-NCHW-FP16-F=GemmFwdRest:5.67045,172523520,miopenConvolutionFwdAlgoGEMM;ConvBinWinogradRxSf3x2:5.27836,0,miopenConvolutionFwdAlgoWinograd;ConvBinWinogradRxSf2x3g1:3.05581,0,miopenConvolutionFwdAlgoWinograd
192-2-120-208-1x1x1-384-2-120-208-1-0x0x0-1x1x1-1x1x1-0-NCDHW-FP16-F=GemmFwd1x1_0_1:0.389408,0,miopenConvolutionFwdAlgoGEMM
192-4-122-210-3x3x3-384-2-120-208-1-0x0x0-1x1x1-1x1x1-0-NCDHW-FP16-F=GemmFwdRest:18.3872,517570560,miopenConvolutionFwdAlgoGEMM
384-4-122-210-3x3x3-384-2-120-208-1-0x0x0-1x1x1-1x1x1-0-NCDHW-FP16-F=GemmFwdRest:36.6888,1035141120,miopenConvolutionFwdAlgoGEMM
384-4-120-208-3x1x1-768-2-120-208-1-0x0x0-1x1x1-1x1x1-0-NCDHW-FP16-F=GemmFwdRest:5.36971,115015680,miopenConvolutionFwdAlgoGEMM
384-240-416-3x3-192-240-416-4-1x1-1x1-1x1-0-NCHW-FP16-F=GemmFwdRest:43.0018,690094080,miopenConvolutionFwdAlgoGEMM;ConvBinWinogradRxSf3x2:39.6689,0,miopenConvolutionFwdAlgoWinograd;ConvBinWinogradRxSf2x3g1:23.183,0,miopenConvolutionFwdAlgoWinograd
192-6-242-418-3x3x3-192-4-240-416-1-0x0x0-1x1x1-1x1x1-0-NCDHW-FP16-F=GemmFwdRest:152.635,4140564480,miopenConvolutionFwdAlgoGEMM
192-480-832-3x3-96-480-832-4-1x1-1x1-1x1-0-NCHW-FP16-F=GemmFwdRest:62.5443,1380188160,miopenConvolutionFwdAlgoGEMM;ConvBinWinogradRxSf3x2:39.8699,0,miopenConvolutionFwdAlgoWinograd;ConvBinWinogradRxSf2x3g1:23.4846,0,miopenConvolutionFwdAlgoWinograd
96-6-482-834-3x3x3-96-4-480-832-1-0x0x0-1x1x1-1x1x1-0-NCDHW-FP16-F=GemmFwdRest:256.177,8281128960,miopenConvolutionFwdAlgoGEMM
96-6-482-834-3x3x3-3-4-480-832-1-0x0x0-1x1x1-1x1x1-0-NCDHW-FP16-F=GemmFwdRest:251.502,8281128960,miopenConvolutionFwdAlgoGEMM
