torch/lib/rocm/.miopen/db/gfx1151_20.HIP.3_5_0_9282a6674b-dirty.ufdb.txt
48-21-30-52-1x2x2-3072-21-15-26-1-0x0x0-1x2x2-1x1x1-0-NCDHW-FP16-F=GemmFwdRest:0.534235,3144960,miopenConvolutionFwdAlgoGEMM;ConvHipImplicitGemm3DGroupFwdXdlops:3.88615,54643968,miopenConvolutionFwdAlgoImplicitGEMM;GemmFwdRest_hipblaslt:0.704577,3144960,miopenConvolutionFwdAlgoGEMM
48-21-30-52-1x1x1-48-21-30-52-1-0x0x0-1x1x1-1x1x1-0-NCDHW-BF16-F=GemmFwd1x1_0_1:0.048425,0,miopenConvolutionFwdAlgoGEMM;GemmFwd1x1_0_1_hipblaslt:0.0290557,0,miopenConvolutionFwdAlgoGEMM;ConvHipImplicitGemm3DGroupFwdXdlops:0.229411,6294528,miopenConvolutionFwdAlgoImplicitGEMM
48-3-32-54-3x3x3-1024-1-30-52-1-0x0x0-1x1x1-1x1x1-0-NCDHW-BF16-F=GemmFwdRest:0.270616,4043520,miopenConvolutionFwdAlgoGEMM;ConvHipImplicitGemm3DGroupFwdXdlops:0.847017,6346752,miopenConvolutionFwdAlgoImplicitGEMM;GemmFwdRest_hipblaslt:0.316653,4043520,miopenConvolutionFwdAlgoGEMM
1024-3-32-54-3x3x3-1024-1-30-52-1-0x0x0-1x1x1-1x1x1-0-NCDHW-BF16-F=GemmFwdRest:8.18432,86261760,miopenConvolutionFwdAlgoGEMM;ConvHipImplicitGemm3DGroupFwdXdlops:19.9297,70434816,miopenConvolutionFwdAlgoImplicitGEMM;GemmFwdRest_hipblaslt:6.74886,86261760,miopenConvolutionFwdAlgoGEMM
1024-30-52-1x1-3072-30-52-1-0x0-1x1-1x1-0-NCHW-BF16-F=GemmFwd1x1_0_1:0.386788,0,miopenConvolutionFwdAlgoGEMM;GemmFwd1x1_0_1_hipblaslt:0.343414,0,miopenConvolutionFwdAlgoGEMM;ConvHipImplicitGemmGroupFwdXdlops:1.41219,19070976,miopenConvolutionFwdAlgoImplicitGEMM
1024-30-52-1x1-1024-30-52-1-0x0-1x1-1x1-0-NCHW-BF16-F=GemmFwd1x1_0_1:0.166292,0,miopenConvolutionFwdAlgoGEMM;GemmFwd1x1_0_1_hipblaslt:0.202297,0,miopenConvolutionFwdAlgoGEMM;ConvHipImplicitGemmGroupFwdXdlops:0.766303,8486912,miopenConvolutionFwdAlgoImplicitGEMM
1024-60-104-3x3-1024-60-104-1-1x1-1x1-1x1-0-NCHW-BF16-F=GemmFwdRest:10.1704,115015680,miopenConvolutionFwdAlgoGEMM;GemmFwdRest_hipblaslt:15.2325,115015680,miopenConvolutionFwdAlgoGEMM;ConvHipImplicitGemmGroupFwdXdlops:21.2663,44433408,miopenConvolutionFwdAlgoImplicitGEMM
1024-3-62-106-3x3x3-1024-1-60-104-1-0x0x0-1x1x1-1x1x1-0-NCDHW-BF16-F=GemmFwdRest:57.6804,345047040,miopenConvolutionFwdAlgoGEMM;ConvHipImplicitGemm3DGroupFwdXdlops:85.2374,109780992,miopenConvolutionFwdAlgoImplicitGEMM;GemmFwdRest_hipblaslt:69.6359,345047040,miopenConvolutionFwdAlgoGEMM
1024-120-208-3x3-1024-120-208-1-1x1-1x1-1x1-0-NCHW-BF16-F=GemmFwdRest:64.9535,460062720,miopenConvolutionFwdAlgoGEMM;GemmFwdRest_hipblaslt:84.0917,460062720,miopenConvolutionFwdAlgoGEMM;ConvHipImplicitGemmGroupFwdXdlops:69.331,121110528,miopenConvolutionFwdAlgoImplicitGEMM
1024-1-120-208-1x1x1-512-1-120-208-1-0x0x0-1x1x1-1x1x1-0-NCDHW-BF16-F=GemmFwd1x1_0_1:1.12455,0,miopenConvolutionFwdAlgoGEMM;GemmFwd1x1_0_1_hipblaslt:2.2065,0,miopenConvolutionFwdAlgoGEMM;ConvHipImplicitGemm3DGroupFwdXdlops:7.70862,77725696,miopenConvolutionFwdAlgoImplicitGEMM
1024-3-122-210-3x3x3-512-1-120-208-1-0x0x0-1x1x1-1x1x1-0-NCDHW-BF16-F=GemmFwdRest:127.668,1380188160,miopenConvolutionFwdAlgoGEMM;ConvHipImplicitGemm3DGroupFwdXdlops:169.265,211279872,miopenConvolutionFwdAlgoImplicitGEMM;GemmFwdRest_hipblaslt:174.862,1380188160,miopenConvolutionFwdAlgoGEMM
512-3-122-210-3x3x3-512-1-120-208-1-0x0x0-1x1x1-1x1x1-0-NCDHW-BF16-F=GemmFwdRest:65.1434,690094080,miopenConvolutionFwdAlgoGEMM;ConvHipImplicitGemm3DGroupFwdXdlops:70.6809,118419456,miopenConvolutionFwdAlgoImplicitGEMM;GemmFwdRest_hipblaslt:92.3936,690094080,miopenConvolutionFwdAlgoGEMM
512-240-416-3x3-512-240-416-1-1x1-1x1-1x1-0-NCHW-BF16-F=GemmFwdRest:37.2907,920125440,miopenConvolutionFwdAlgoGEMM;GemmFwdRest_hipblaslt:62.6893,920125440,miopenConvolutionFwdAlgoGEMM;ConvHipImplicitGemmGroupFwdXdlops:67.2306,209190912,miopenConvolutionFwdAlgoImplicitGEMM
512-1-240-416-1x1x1-256-1-240-416-1-0x0x0-1x1x1-1x1x1-0-NCDHW-BF16-F=GemmFwd1x1_0_1:2.08371,0,miopenConvolutionFwdAlgoGEMM;GemmFwd1x1_0_1_hipblaslt:2.69111,0,miopenConvolutionFwdAlgoGEMM;ConvHipImplicitGemm3DGroupFwdXdlops:8.80469,153616384,miopenConvolutionFwdAlgoImplicitGEMM
512-3-242-418-3x3x3-256-1-240-416-1-0x0x0-1x1x1-1x1x1-0-NCDHW-BF16-F=GemmFwdRest:204.448,2760376320,miopenConvolutionFwdAlgoGEMM;ConvHipImplicitGemm3DGroupFwdXdlops:141.935,368947200,miopenConvolutionFwdAlgoImplicitGEMM;GemmFwdRest_hipblaslt:272.008,2760376320,miopenConvolutionFwdAlgoGEMM
256-3-242-418-3x3x3-256-1-240-416-1-0x0x0-1x1x1-1x1x1-0-NCDHW-BF16-F=GemmFwdRest:91.9809,1380188160,miopenConvolutionFwdAlgoGEMM;ConvHipImplicitGemm3DGroupFwdXdlops:75.3853,210032640,miopenConvolutionFwdAlgoImplicitGEMM;GemmFwdRest_hipblaslt:130.952,1380188160,miopenConvolutionFwdAlgoGEMM
256-3-242-418-3x3x3-12-1-240-416-1-0x0x0-1x1x1-1x1x1-0-NCDHW-BF16-F=GemmFwdRest:65.546,1380188160,miopenConvolutionFwdAlgoGEMM;ConvHipImplicitGemm3DGroupFwdXdlops:20.8153,157937664,miopenConvolutionFwdAlgoImplicitGEMM;GemmFwdRest_hipblaslt:65.9569,1380188160,miopenConvolutionFwdAlgoGEMM
1024-3-30-52-3x1x1-2048-1-30-52-1-0x0x0-1x1x1-1x1x1-0-NCDHW-BF16-F=GemmFwdRest:1.38617,9584640,miopenConvolutionFwdAlgoGEMM;ConvHipImplicitGemm3DGroupFwdXdlops:4.54849,28557312,miopenConvolutionFwdAlgoImplicitGEMM;GemmFwdRest_hipblaslt:1.36676,9584640,miopenConvolutionFwdAlgoGEMM
1024-60-104-3x3-1024-60-104-2-1x1-1x1-1x1-0-NCHW-BF16-F=GemmFwdRest:20.1504,115015680,miopenConvolutionFwdAlgoGEMM;GemmFwdRest_hipblaslt:28.3607,115015680,miopenConvolutionFwdAlgoGEMM;ConvHipImplicitGemmGroupFwdXdlops:36.6465,69992448,miopenConvolutionFwdAlgoImplicitGEMM
1024-4-62-106-3x3x3-1024-2-60-104-1-0x0x0-1x1x1-1x1x1-0-NCDHW-BF16-F=GemmFwdRest:143.084,690094080,miopenConvolutionFwdAlgoGEMM;ConvHipImplicitGemm3DGroupFwdXdlops:172.377,136019968,miopenConvolutionFwdAlgoImplicitGEMM;GemmFwdRest_hipblaslt:164.891,690094080,miopenConvolutionFwdAlgoGEMM
1024-4-60-104-3x1x1-2048-2-60-104-1-0x0x0-1x1x1-1x1x1-0-NCDHW-BF16-F=GemmFwdRest:13.9965,76677120,miopenConvolutionFwdAlgoGEMM;ConvHipImplicitGemm3DGroupFwdXdlops:32.6756,114819072,miopenConvolutionFwdAlgoImplicitGEMM;GemmFwdRest_hipblaslt:20.6207,76677120,miopenConvolutionFwdAlgoGEMM
1024-120-208-3x3-1024-120-208-4-1x1-1x1-1x1-0-NCHW-BF16-F=GemmFwdRest:252.789,460062720,miopenConvolutionFwdAlgoGEMM;GemmFwdRest_hipblaslt:333.642,460062720,miopenConvolutionFwdAlgoGEMM;ConvHipImplicitGemmGroupFwdXdlops:283.416,427819008,miopenConvolutionFwdAlgoImplicitGEMM
1024-4-120-208-1x1x1-512-4-120-208-1-0x0x0-1x1x1-1x1x1-0-NCDHW-BF16-F=GemmFwd1x1_0_1:6.77318,0,miopenConvolutionFwdAlgoGEMM;GemmFwd1x1_0_1_hipblaslt:11.2255,0,miopenConvolutionFwdAlgoGEMM;ConvHipImplicitGemm3DGroupFwdXdlops:32.7512,307757056,miopenConvolutionFwdAlgoImplicitGEMM
1024-6-122-210-3x3x3-512-4-120-208-1-0x0x0-1x1x1-1x1x1-0-NCDHW-BF16-F=GemmFwdRest:708.424,5520752640,miopenConvolutionFwdAlgoGEMM;ConvHipImplicitGemm3DGroupFwdXdlops:736.71,445366272,miopenConvolutionFwdAlgoImplicitGEMM;GemmFwdRest_hipblaslt:1062.87,5520752640,miopenConvolutionFwdAlgoGEMM
512-6-122-210-3x3x3-512-4-120-208-1-0x0x0-1x1x1-1x1x1-0-NCDHW-BF16-F=GemmFwdRest:287.186,2760376320,miopenConvolutionFwdAlgoGEMM;ConvHipImplicitGemm3DGroupFwdXdlops:365.823,273801216,miopenConvolutionFwdAlgoImplicitGEMM;GemmFwdRest_hipblaslt:473.466,2760376320,miopenConvolutionFwdAlgoGEMM
512-240-416-3x3-512-240-416-4-1x1-1x1-1x1-0-NCHW-BF16-F=GemmFwdRest:135.632,920125440,miopenConvolutionFwdAlgoGEMM;GemmFwdRest_hipblaslt:261.243,920125440,miopenConvolutionFwdAlgoGEMM;ConvHipImplicitGemmGroupFwdXdlops:278.899,822607872,miopenConvolutionFwdAlgoImplicitGEMM
512-4-240-416-1x1x1-256-4-240-416-1-0x0x0-1x1x1-1x1x1-0-NCDHW-BF16-F=GemmFwd1x1_0_1:7.78156,0,miopenConvolutionFwdAlgoGEMM;GemmFwd1x1_0_1_hipblaslt:9.635,0,miopenConvolutionFwdAlgoGEMM;ConvHipImplicitGemm3DGroupFwdXdlops:34.2871,613679104,miopenConvolutionFwdAlgoImplicitGEMM
512-6-242-418-3x3x3-256-4-240-416-1-0x0x0-1x1x1-1x1x1-0-NCDHW-BF16-F=ConvHipImplicitGemm3DGroupFwdXdlops:582.8,833052672,miopenConvolutionFwdAlgoImplicitGEMM
256-6-242-418-3x3x3-256-4-240-416-1-0x0x0-1x1x1-1x1x1-0-NCDHW-BF16-F=GemmFwdRest:409.262,5520752640,miopenConvolutionFwdAlgoGEMM;ConvHipImplicitGemm3DGroupFwdXdlops:281.766,518762496,miopenConvolutionFwdAlgoImplicitGEMM;GemmFwdRest_hipblaslt:573.08,5520752640,miopenConvolutionFwdAlgoGEMM
256-6-242-418-3x3x3-12-4-240-416-1-0x0x0-1x1x1-1x1x1-0-NCDHW-BF16-F=GemmFwdRest:309.794,5520752640,miopenConvolutionFwdAlgoGEMM;ConvHipImplicitGemm3DGroupFwdXdlops:75.8313,320501760,miopenConvolutionFwdAlgoImplicitGEMM;GemmFwdRest_hipblaslt:318.588,5520752640,miopenConvolutionFwdAlgoGEMM
16-21-60-104-1x2x2-1536-21-30-52-1-0x0x0-1x2x2-1x1x1-0-NCDHW-FP16-F=GemmFwdRest:0.847327,4193280,miopenConvolutionFwdAlgoGEMM;ConvHipImplicitGemm3DGroupFwdXdlops:4.19155,105028608,miopenConvolutionFwdAlgoImplicitGEMM;GemmFwdRest_hipblaslt:0.955011,4193280,miopenConvolutionFwdAlgoGEMM
16-23-60-104-3x3x3-384-21-60-104-1-0x1x1-1x1x1-1x1x1-0-NCDHW-FP16-F=GemmFwdRest:5.31562,113218560,miopenConvolutionFwdAlgoGEMM;ConvHipImplicitGemm3DGroupFwdXdlops:12.5332,105563136,miopenConvolutionFwdAlgoImplicitGEMM;GemmFwdRest_hipblaslt:5.52549,113218560,miopenConvolutionFwdAlgoGEMM
384-25-60-104-5x5x5-384-21-60-104-1-0x2x2-1x1x1-1x1x1-0-NCDHW-FP16-F_g384=ConvHipImplicitGemm3DGroupFwdXdlops:284.932,220542720,miopenConvolutionFwdAlgoImplicitGEMM
384-21-60-104-1x1x1-384-21-60-104-1-0x0x0-1x1x1-1x1x1-0-NCDHW-FP16-F=GemmFwd1x1_0_1:1.51214,0,miopenConvolutionFwdAlgoGEMM;GemmFwd1x1_0_1_hipblaslt:2.24148,0,miopenConvolutionFwdAlgoGEMM;ConvHipImplicitGemm3DGroupFwdXdlops:11.4937,201572352,miopenConvolutionFwdAlgoImplicitGEMM
384-23-60-104-3x3x3-192-21-60-104-1-0x1x1-1x1x1-1x1x1-0-NCDHW-FP16-F=GemmFwdRest:127.908,2717245440,miopenConvolutionFwdAlgoGEMM;ConvHipImplicitGemm3DGroupFwdXdlops:100.898,164524032,miopenConvolutionFwdAlgoImplicitGEMM;GemmFwdRest_hipblaslt:143.335,2717245440,miopenConvolutionFwdAlgoGEMM
192-23-60-104-3x3x3-192-21-60-104-1-0x1x1-1x1x1-1x1x1-0-NCDHW-FP16-F=GemmFwdRest:74.862,1358622720,miopenConvolutionFwdAlgoGEMM;ConvHipImplicitGemm3DGroupFwdXdlops:64.1533,107421696,miopenConvolutionFwdAlgoImplicitGEMM;GemmFwdRest_hipblaslt:81.1941,1358622720,miopenConvolutionFwdAlgoGEMM
384-21-60-104-1x1x1-192-21-60-104-1-0x0x0-1x1x1-1x1x1-0-NCDHW-FP16-F=GemmFwd1x1_0_1:0.979574,0,miopenConvolutionFwdAlgoGEMM;GemmFwd1x1_0_1_hipblaslt:1.17237,0,miopenConvolutionFwdAlgoGEMM;ConvHipImplicitGemm3DGroupFwdXdlops:7.08385,151105536,miopenConvolutionFwdAlgoImplicitGEMM
192-23-60-104-3x3x3-1536-21-60-104-1-0x1x1-1x1x1-1x1x1-0-NCDHW-FP16-F=GemmFwdRest:329.705,1358622720,miopenConvolutionFwdAlgoGEMM;ConvHipImplicitGemm3DGroupFwdXdlops:393.633,473591808,miopenConvolutionFwdAlgoImplicitGEMM;GemmFwdRest_hipblaslt:319.097,1358622720,miopenConvolutionFwdAlgoGEMM
192-43-120-208-3x3x3-192-41-120-208-1-0x1x1-1x1x1-1x1x1-0-NCDHW-FP16-F=ConvHipImplicitGemm3DGroupFwdXdlops:367.943,807100416,miopenConvolutionFwdAlgoImplicitGEMM
192-43-120-208-3x3x3-48-41-120-208-1-0x1x1-1x1x1-1x1x1-0-NCDHW-FP16-F=ConvHipImplicitGemm3DGroupFwdXdlops:128.38,510879744,miopenConvolutionFwdAlgoImplicitGEMM
48-43-120-208-3x3x3-48-41-120-208-1-0x1x1-1x1x1-1x1x1-0-NCDHW-FP16-F=GemmFwdRest:98.0398,2652549120,miopenConvolutionFwdAlgoGEMM;ConvHipImplicitGemm3DGroupFwdXdlops:33.9579,201401856,miopenConvolutionFwdAlgoImplicitGEMM;GemmFwdRest_hipblaslt:94.9259,2652549120,miopenConvolutionFwdAlgoGEMM
192-41-120-208-1x1x1-48-41-120-208-1-0x0x0-1x1x1-1x1x1-0-NCDHW-FP16-F=GemmFwd1x1_0_1:2.60937,0,miopenConvolutionFwdAlgoGEMM;GemmFwd1x1_0_1_hipblaslt:2.50132,0,miopenConvolutionFwdAlgoGEMM;ConvHipImplicitGemm3DGroupFwdXdlops:12.4085,491231232,miopenConvolutionFwdAlgoImplicitGEMM
48-43-120-208-3x3x3-384-41-120-208-1-0x1x1-1x1x1-1x1x1-0-NCDHW-FP16-F=GemmFwdRest:138.327,2652549120,miopenConvolutionFwdAlgoGEMM;ConvHipImplicitGemm3DGroupFwdXdlops:201.813,889970688,miopenConvolutionFwdAlgoImplicitGEMM;GemmFwdRest_hipblaslt:304.525,2652549120,miopenConvolutionFwdAlgoGEMM
48-83-240-416-3x3x3-48-81-240-416-1-0x1x1-1x1x1-1x1x1-0-NCDHW-FP16-F=ConvHipImplicitGemm3DGroupFwdXdlops:270.663,1572005376,miopenConvolutionFwdAlgoImplicitGEMM
48-83-240-416-3x3x3-16-81-240-416-1-0x1x1-1x1x1-1x1x1-0-NCDHW-FP16-F=ConvHipImplicitGemm3DGroupFwdXdlops:250.663,1054351872,miopenConvolutionFwdAlgoImplicitGEMM
16-83-240-416-3x3x3-16-81-240-416-1-0x1x1-1x1x1-1x1x1-0-NCDHW-FP16-F=GemmFwdRest:279.7,6987202560,miopenConvolutionFwdAlgoGEMM;ConvHipImplicitGemm3DGroupFwdXdlops:85.562,523974144,miopenConvolutionFwdAlgoImplicitGEMM;GemmFwdRest_hipblaslt:259.303,6987202560,miopenConvolutionFwdAlgoGEMM
48-81-240-416-1x1x1-16-81-240-416-1-0x0x0-1x1x1-1x1x1-0-NCDHW-FP16-F=GemmFwd1x1_0_1:8.52391,0,miopenConvolutionFwdAlgoGEMM;GemmFwd1x1_0_1_hipblaslt:5.0235,0,miopenConvolutionFwdAlgoGEMM;ConvHipImplicitGemm3DGroupFwdXdlops:33.0718,1035142656,miopenConvolutionFwdAlgoImplicitGEMM
16-83-240-416-3x3x3-64-81-240-416-1-0x1x1-1x1x1-1x1x1-0-NCDHW-FP16-F=GemmFwdRest:258.374,6987202560,miopenConvolutionFwdAlgoGEMM;ConvHipImplicitGemm3DGroupFwdXdlops:109.821,1300371456,miopenConvolutionFwdAlgoImplicitGEMM;GemmFwdRest_hipblaslt:241.822,6987202560,miopenConvolutionFwdAlgoGEMM
16-83-480-832-3x3x3-16-81-480-832-1-0x1x1-1x1x1-1x1x1-0-NCDHW-FP16-F=ConvHipImplicitGemm3DGroupFwdXdlops:354.837,2095855104,miopenConvolutionFwdAlgoImplicitGEMM
16-83-480-832-3x3x3-3-81-480-832-1-0x1x1-1x1x1-1x1x1-0-NCDHW-FP16-F=ConvHipImplicitGemm3DGroupFwdXdlops:327.89,1254791936,miopenConvolutionFwdAlgoImplicitGEMM
4-40-64-3x3-320-40-64-26-1x1-1x1-1x1-0-NCHW-FP16-F=GemmFwdRest:1.82332,184320,miopenConvolutionFwdAlgoGEMM;GemmFwdRest_hipblaslt:2.04934,184320,miopenConvolutionFwdAlgoGEMM;ConvHipImplicitGemmGroupFwdXdlops:1.60956,43153920,miopenConvolutionFwdAlgoImplicitGEMM;ConvBinWinogradRxSf3x2:0.413643,0,miopenConvolutionFwdAlgoWinograd;ConvBinWinogradRxSf2x3g1:0.375986,0,miopenConvolutionFwdAlgoWinograd
320-1-26-1x1-512-1-26-2560-0x0-1x1-1x1-0-NCHW-FP16-F=ConvBinWinogradRxSf2x3g1:20.4976,0,miopenConvolutionFwdAlgoWinograd;GemmFwd1x1_0_1:4.63828,0,miopenConvolutionFwdAlgoGEMM;ConvBinWinogradRxSf3x2:14.7955,0,miopenConvolutionFwdAlgoWinograd;GemmFwd1x1_0_1_hipblaslt:4.95736,0,miopenConvolutionFwdAlgoGEMM;ConvHipImplicitGemmGroupFwdXdlops:6.76505,111083520,miopenConvolutionFwdAlgoImplicitGEMM
512-1-26-1x1-320-1-26-2560-0x0-1x1-1x1-0-NCHW-FP16-F=ConvBinWinogradRxSf2x3g1:19.5521,0,miopenConvolutionFwdAlgoWinograd;GemmFwd1x1_0_1:7.7751,0,miopenConvolutionFwdAlgoGEMM;ConvBinWinogradRxSf3x2:13.0778,0,miopenConvolutionFwdAlgoWinograd;GemmFwd1x1_0_1_hipblaslt:8.84669,0,miopenConvolutionFwdAlgoGEMM;ConvHipImplicitGemmGroupFwdXdlops:5.33707,111083520,miopenConvolutionFwdAlgoImplicitGEMM
320-40-64-3x3-320-40-64-26-1x1-1x1-1x1-0-NCHW-FP16-F=GemmFwdRest:9.22423,14745600,miopenConvolutionFwdAlgoGEMM;GemmFwdRest_hipblaslt:12.9165,14745600,miopenConvolutionFwdAlgoGEMM;ConvHipImplicitGemmGroupFwdXdlops:21.6432,87040000,miopenConvolutionFwdAlgoImplicitGEMM;ConvBinWinogradRxSf3x2:14.4327,0,miopenConvolutionFwdAlgoWinograd;ConvBinWinogradRxSf2x3g1:8.55114,0,miopenConvolutionFwdAlgoWinograd
320-26-40-64-3x1x1-320-26-40-64-1-1x0x0-1x1x1-1x1x1-0-NCDHW-FP16-F=GemmFwdRest:4.82685,127795200,miopenConvolutionFwdAlgoGEMM;ConvHipImplicitGemm3DGroupFwdXdlops:9.29259,85811200,miopenConvolutionFwdAlgoImplicitGEMM;GemmFwdRest_hipblaslt:6.26069,127795200,miopenConvolutionFwdAlgoGEMM
320-40-64-3x3-320-20-32-26-1x1-2x2-1x1-0-NCHW-FP16-F=GemmFwdRest:5.21473,3686400,miopenConvolutionFwdAlgoGEMM;GemmFwdRest_hipblaslt:4.49752,3686400,miopenConvolutionFwdAlgoGEMM;ConvHipImplicitGemmGroupFwdXdlops:5.22216,55091200,miopenConvolutionFwdAlgoImplicitGEMM;ConvBinWinogradRxSf3x2:2.92219,0,miopenConvolutionFwdAlgoWinograd;ConvBinWinogradRxSf2x3g1:8.32397,0,miopenConvolutionFwdAlgoWinograd
320-20-32-3x3-640-20-32-26-1x1-1x1-1x1-0-NCHW-FP16-F=GemmFwdRest:5.6174,3686400,miopenConvolutionFwdAlgoGEMM;GemmFwdRest_hipblaslt:6.20493,3686400,miopenConvolutionFwdAlgoGEMM;ConvHipImplicitGemmGroupFwdXdlops:10.6157,35635200,miopenConvolutionFwdAlgoImplicitGEMM;ConvBinWinogradRxSf3x2:6.433,0,miopenConvolutionFwdAlgoWinograd;ConvBinWinogradRxSf2x3g1:4.51746,0,miopenConvolutionFwdAlgoWinograd
640-20-32-3x3-640-20-32-26-1x1-1x1-1x1-0-NCHW-FP16-F=GemmFwdRest:9.59328,7372800,miopenConvolutionFwdAlgoGEMM;GemmFwdRest_hipblaslt:10.3644,7372800,miopenConvolutionFwdAlgoGEMM;ConvHipImplicitGemmGroupFwdXdlops:21.3272,49971200,miopenConvolutionFwdAlgoImplicitGEMM;ConvBinWinogradRxSf3x2:13.9315,0,miopenConvolutionFwdAlgoWinograd;ConvBinWinogradRxSf2x3g1:8.39539,0,miopenConvolutionFwdAlgoWinograd
320-20-32-1x1-640-20-32-26-0x0-1x1-1x1-0-NCHW-FP16-F=ConvBinWinogradRxSf2x3g1:2.7247,0,miopenConvolutionFwdAlgoWinograd;GemmFwd1x1_0_1:0.235814,0,miopenConvolutionFwdAlgoGEMM;ConvBinWinogradRxSf3x2:0.994,0,miopenConvolutionFwdAlgoWinograd;GemmFwd1x1_0_1_hipblaslt:0.360188,0,miopenConvolutionFwdAlgoGEMM;ConvHipImplicitGemmGroupFwdXdlops:1.42031,32358400,miopenConvolutionFwdAlgoImplicitGEMM
640-26-20-32-3x1x1-640-26-20-32-1-1x0x0-1x1x1-1x1x1-0-NCDHW-FP16-F=GemmFwdRest:4.53347,63897600,miopenConvolutionFwdAlgoGEMM;ConvHipImplicitGemm3DGroupFwdXdlops:8.96795,45056000,miopenConvolutionFwdAlgoImplicitGEMM;GemmFwdRest_hipblaslt:5.20276,63897600,miopenConvolutionFwdAlgoGEMM
640-20-32-3x3-640-10-16-26-1x1-2x2-1x1-0-NCHW-FP16-F=GemmFwdRest:6.37625,1843200,miopenConvolutionFwdAlgoGEMM;GemmFwdRest_hipblaslt:5.16101,1843200,miopenConvolutionFwdAlgoGEMM;ConvHipImplicitGemmGroupFwdXdlops:4.87641,33996800,miopenConvolutionFwdAlgoImplicitGEMM;ConvBinWinogradRxSf3x2:3.35714,0,miopenConvolutionFwdAlgoWinograd;ConvBinWinogradRxSf2x3g1:7.98216,0,miopenConvolutionFwdAlgoWinograd
640-10-16-3x3-1280-10-16-26-1x1-1x1-1x1-0-NCHW-FP16-F=GemmFwdRest:6.96161,1843200,miopenConvolutionFwdAlgoGEMM;GemmFwdRest_hipblaslt:8.90331,1843200,miopenConvolutionFwdAlgoGEMM;ConvHipImplicitGemmGroupFwdXdlops:9.4017,30720000,miopenConvolutionFwdAlgoImplicitGEMM;ConvBinWinogradRxSf3x2:6.78401,0,miopenConvolutionFwdAlgoWinograd;ConvBinWinogradRxSf2x3g1:4.06444,0,miopenConvolutionFwdAlgoWinograd
1280-10-16-3x3-1280-10-16-26-1x1-1x1-1x1-0-NCHW-FP16-F=GemmFwdRest:13.7705,3686400,miopenConvolutionFwdAlgoGEMM;GemmFwdRest_hipblaslt:16.51,3686400,miopenConvolutionFwdAlgoGEMM;ConvHipImplicitGemmGroupFwdXdlops:20.2407,50790400,miopenConvolutionFwdAlgoImplicitGEMM;ConvBinWinogradRxSf3x2:15.214,0,miopenConvolutionFwdAlgoWinograd;ConvBinWinogradRxSf2x3g1:8.90023,0,miopenConvolutionFwdAlgoWinograd
640-10-16-1x1-1280-10-16-26-0x0-1x1-1x1-0-NCHW-FP16-F=ConvBinWinogradRxSf2x3g1:2.80184,0,miopenConvolutionFwdAlgoWinograd;GemmFwd1x1_0_1:0.339717,0,miopenConvolutionFwdAlgoGEMM;ConvBinWinogradRxSf3x2:1.19575,0,miopenConvolutionFwdAlgoWinograd;GemmFwd1x1_0_1_hipblaslt:0.508658,0,miopenConvolutionFwdAlgoGEMM;ConvHipImplicitGemmGroupFwdXdlops:1.12712,17612800,miopenConvolutionFwdAlgoImplicitGEMM
1280-26-10-16-3x1x1-1280-26-10-16-1-1x0x0-1x1x1-1x1x1-0-NCDHW-FP16-F=GemmFwdRest:2.19038,31948800,miopenConvolutionFwdAlgoGEMM;ConvHipImplicitGemm3DGroupFwdXdlops:9.12552,31129600,miopenConvolutionFwdAlgoImplicitGEMM;GemmFwdRest_hipblaslt:3.21202,31948800,miopenConvolutionFwdAlgoGEMM
1280-10-16-3x3-1280-5-8-26-1x1-2x2-1x1-0-NCHW-FP16-F=GemmFwdRest:11.0475,921600,miopenConvolutionFwdAlgoGEMM;GemmFwdRest_hipblaslt:7.36381,921600,miopenConvolutionFwdAlgoGEMM;ConvHipImplicitGemmGroupFwdXdlops:5.31915,42803200,miopenConvolutionFwdAlgoImplicitGEMM;ConvBinWinogradRxSf3x2:3.41641,0,miopenConvolutionFwdAlgoWinograd;ConvBinWinogradRxSf2x3g1:9.2333,0,miopenConvolutionFwdAlgoWinograd
1280-5-8-3x3-1280-5-8-26-1x1-1x1-1x1-0-NCHW-FP16-F=GemmFwdRest:10.6646,921600,miopenConvolutionFwdAlgoGEMM;GemmFwdRest_hipblaslt:7.09021,921600,miopenConvolutionFwdAlgoGEMM;ConvHipImplicitGemmGroupFwdXdlops:5.36131,34816000,miopenConvolutionFwdAlgoImplicitGEMM;ConvBinWinogradRxSf3x2:2.97463,0,miopenConvolutionFwdAlgoWinograd;ConvBinWinogradRxSf2x3g1:2.21893,0,miopenConvolutionFwdAlgoWinograd
1280-26-5-8-3x1x1-1280-26-5-8-1-1x0x0-1x1x1-1x1x1-0-NCDHW-FP16-F=GemmFwdRest:0.583592,7987200,miopenConvolutionFwdAlgoGEMM;ConvHipImplicitGemm3DGroupFwdXdlops:2.42411,15155200,miopenConvolutionFwdAlgoImplicitGEMM;GemmFwdRest_hipblaslt:0.659457,7987200,miopenConvolutionFwdAlgoGEMM
2560-5-8-3x3-1280-5-8-26-1x1-1x1-1x1-0-NCHW-FP16-F=GemmFwdRest:29.8525,1843200,miopenConvolutionFwdAlgoGEMM;GemmFwdRest_hipblaslt:13.231,1843200,miopenConvolutionFwdAlgoGEMM;ConvHipImplicitGemmGroupFwdXdlops:10.9581,66969600,miopenConvolutionFwdAlgoImplicitGEMM;ConvBinWinogradRxSf3x2:6.39183,0,miopenConvolutionFwdAlgoWinograd;ConvBinWinogradRxSf2x3g1:4.3611,0,miopenConvolutionFwdAlgoWinograd
2560-5-8-1x1-1280-5-8-26-0x0-1x1-1x1-0-NCHW-FP16-F=ConvBinWinogradRxSf2x3g1:3.21599,0,miopenConvolutionFwdAlgoWinograd;GemmFwd1x1_0_1:0.608823,0,miopenConvolutionFwdAlgoGEMM;ConvBinWinogradRxSf3x2:1.22873,0,miopenConvolutionFwdAlgoWinograd;GemmFwd1x1_0_1_hipblaslt:1.18772,0,miopenConvolutionFwdAlgoGEMM;ConvHipImplicitGemmGroupFwdXdlops:1.36035,14540800,miopenConvolutionFwdAlgoImplicitGEMM
2560-10-16-3x3-1280-10-16-26-1x1-1x1-1x1-0-NCHW-FP16-F=GemmFwdRest:40.3812,7372800,miopenConvolutionFwdAlgoGEMM;GemmFwdRest_hipblaslt:30.799,7372800,miopenConvolutionFwdAlgoGEMM;ConvHipImplicitGemmGroupFwdXdlops:39.8771,90931200,miopenConvolutionFwdAlgoImplicitGEMM;ConvBinWinogradRxSf3x2:29.1015,0,miopenConvolutionFwdAlgoWinograd;ConvBinWinogradRxSf2x3g1:16.1056,0,miopenConvolutionFwdAlgoWinograd
2560-10-16-1x1-1280-10-16-26-0x0-1x1-1x1-0-NCHW-FP16-F=ConvBinWinogradRxSf2x3g1:13.2608,0,miopenConvolutionFwdAlgoWinograd;GemmFwd1x1_0_1:1.61693,0,miopenConvolutionFwdAlgoGEMM;ConvBinWinogradRxSf3x2:6.13989,0,miopenConvolutionFwdAlgoWinograd;GemmFwd1x1_0_1_hipblaslt:2.92998,0,miopenConvolutionFwdAlgoGEMM;ConvHipImplicitGemmGroupFwdXdlops:4.56153,38502400,miopenConvolutionFwdAlgoImplicitGEMM
1920-10-16-3x3-1280-10-16-26-1x1-1x1-1x1-0-NCHW-FP16-F=GemmFwdRest:20.3915,5529600,miopenConvolutionFwdAlgoGEMM;GemmFwdRest_hipblaslt:23.2461,5529600,miopenConvolutionFwdAlgoGEMM;ConvHipImplicitGemmGroupFwdXdlops:28.3389,70860800,miopenConvolutionFwdAlgoImplicitGEMM;ConvBinWinogradRxSf3x2:21.9447,0,miopenConvolutionFwdAlgoWinograd;ConvBinWinogradRxSf2x3g1:12.7858,0,miopenConvolutionFwdAlgoWinograd
1920-10-16-1x1-1280-10-16-26-0x0-1x1-1x1-0-NCHW-FP16-F=ConvBinWinogradRxSf2x3g1:10.7169,0,miopenConvolutionFwdAlgoWinograd;GemmFwd1x1_0_1:1.09556,0,miopenConvolutionFwdAlgoGEMM;ConvBinWinogradRxSf3x2:4.41953,0,miopenConvolutionFwdAlgoWinograd;GemmFwd1x1_0_1_hipblaslt:2.05912,0,miopenConvolutionFwdAlgoGEMM;ConvHipImplicitGemmGroupFwdXdlops:3.54865,31539200,miopenConvolutionFwdAlgoImplicitGEMM
1280-20-32-3x3-1280-20-32-26-1x1-1x1-1x1-0-NCHW-FP16-F=GemmFwdRest:27.051,14745600,miopenConvolutionFwdAlgoGEMM;GemmFwdRest_hipblaslt:33.0897,14745600,miopenConvolutionFwdAlgoGEMM;ConvHipImplicitGemmGroupFwdXdlops:73.5078,114688000,miopenConvolutionFwdAlgoImplicitGEMM;ConvBinWinogradRxSf3x2:47.1288,0,miopenConvolutionFwdAlgoWinograd;ConvBinWinogradRxSf2x3g1:24.0739,0,miopenConvolutionFwdAlgoWinograd
1920-20-32-3x3-640-20-32-26-1x1-1x1-1x1-0-NCHW-FP16-F=GemmFwdRest:26.3181,22118400,miopenConvolutionFwdAlgoGEMM;GemmFwdRest_hipblaslt:30.0446,22118400,miopenConvolutionFwdAlgoGEMM;ConvHipImplicitGemmGroupFwdXdlops:56.7797,107315200,miopenConvolutionFwdAlgoImplicitGEMM;ConvBinWinogradRxSf3x2:37.4529,0,miopenConvolutionFwdAlgoWinograd;ConvBinWinogradRxSf2x3g1:19.4427,0,miopenConvolutionFwdAlgoWinograd
1920-20-32-1x1-640-20-32-26-0x0-1x1-1x1-0-NCHW-FP16-F=ConvBinWinogradRxSf2x3g1:21.3502,0,miopenConvolutionFwdAlgoWinograd;GemmFwd1x1_0_1:1.60696,0,miopenConvolutionFwdAlgoGEMM;ConvBinWinogradRxSf3x2:10.4746,0,miopenConvolutionFwdAlgoWinograd;GemmFwd1x1_0_1_hipblaslt:2.75596,0,miopenConvolutionFwdAlgoGEMM;ConvHipImplicitGemmGroupFwdXdlops:7.87778,87654400,miopenConvolutionFwdAlgoImplicitGEMM
960-20-32-3x3-640-20-32-26-1x1-1x1-1x1-0-NCHW-FP16-F=GemmFwdRest:12.878,11059200,miopenConvolutionFwdAlgoGEMM;GemmFwdRest_hipblaslt:14.8822,11059200,miopenConvolutionFwdAlgoGEMM;ConvHipImplicitGemmGroupFwdXdlops:27.8223,64307200,miopenConvolutionFwdAlgoImplicitGEMM;ConvBinWinogradRxSf3x2:17.8677,0,miopenConvolutionFwdAlgoWinograd;ConvBinWinogradRxSf2x3g1:10.2748,0,miopenConvolutionFwdAlgoWinograd
960-20-32-1x1-640-20-32-26-0x0-1x1-1x1-0-NCHW-FP16-F=ConvBinWinogradRxSf2x3g1:11.2274,0,miopenConvolutionFwdAlgoWinograd;GemmFwd1x1_0_1:0.736462,0,miopenConvolutionFwdAlgoGEMM;ConvBinWinogradRxSf3x2:3.98077,0,miopenConvolutionFwdAlgoWinograd;GemmFwd1x1_0_1_hipblaslt:1.03447,0,miopenConvolutionFwdAlgoGEMM;ConvHipImplicitGemmGroupFwdXdlops:3.83932,54476800,miopenConvolutionFwdAlgoImplicitGEMM
640-40-64-3x3-640-40-64-26-1x1-1x1-1x1-0-NCHW-FP16-F=GemmFwdRest:27.1634,29491200,miopenConvolutionFwdAlgoGEMM;GemmFwdRest_hipblaslt:34.9392,29491200,miopenConvolutionFwdAlgoGEMM;ConvHipImplicitGemmGroupFwdXdlops:73.1943,177766400,miopenConvolutionFwdAlgoImplicitGEMM;ConvBinWinogradRxSf3x2:46.5774,0,miopenConvolutionFwdAlgoWinograd;ConvBinWinogradRxSf2x3g1:24.3067,0,miopenConvolutionFwdAlgoWinograd
960-40-64-3x3-320-40-64-26-1x1-1x1-1x1-0-NCHW-FP16-F=GemmFwdRest:29.6942,44236800,miopenConvolutionFwdAlgoGEMM;GemmFwdRest_hipblaslt:35.4006,44236800,miopenConvolutionFwdAlgoGEMM;ConvHipImplicitGemmGroupFwdXdlops:56.8759,175923200,miopenConvolutionFwdAlgoImplicitGEMM;ConvBinWinogradRxSf3x2:36.1566,0,miopenConvolutionFwdAlgoWinograd;ConvBinWinogradRxSf2x3g1:20.0786,0,miopenConvolutionFwdAlgoWinograd
960-40-64-1x1-320-40-64-26-0x0-1x1-1x1-0-NCHW-FP16-F=ConvBinWinogradRxSf2x3g1:21.4269,0,miopenConvolutionFwdAlgoWinograd;GemmFwd1x1_0_1:1.79058,0,miopenConvolutionFwdAlgoGEMM;ConvBinWinogradRxSf3x2:9.90663,0,miopenConvolutionFwdAlgoWinograd;GemmFwd1x1_0_1_hipblaslt:3.09219,0,miopenConvolutionFwdAlgoGEMM;ConvHipImplicitGemmGroupFwdXdlops:9.05554,171008000,miopenConvolutionFwdAlgoImplicitGEMM
640-40-64-3x3-320-40-64-26-1x1-1x1-1x1-0-NCHW-FP16-F=GemmFwdRest:18.7629,29491200,miopenConvolutionFwdAlgoGEMM;GemmFwdRest_hipblaslt:22.8515,29491200,miopenConvolutionFwdAlgoGEMM;ConvHipImplicitGemmGroupFwdXdlops:39.8953,131481600,miopenConvolutionFwdAlgoImplicitGEMM;ConvBinWinogradRxSf3x2:24.7827,0,miopenConvolutionFwdAlgoWinograd;ConvBinWinogradRxSf2x3g1:13.3908,0,miopenConvolutionFwdAlgoWinograd
640-40-64-1x1-320-40-64-26-0x0-1x1-1x1-0-NCHW-FP16-F=ConvBinWinogradRxSf2x3g1:15.0945,0,miopenConvolutionFwdAlgoWinograd;GemmFwd1x1_0_1:1.1276,0,miopenConvolutionFwdAlgoGEMM;ConvBinWinogradRxSf3x2:5.77504,0,miopenConvolutionFwdAlgoWinograd;GemmFwd1x1_0_1_hipblaslt:1.68707,0,miopenConvolutionFwdAlgoGEMM;ConvHipImplicitGemmGroupFwdXdlops:6.43,128204800,miopenConvolutionFwdAlgoImplicitGEMM
320-40-64-3x3-4-40-64-26-1x1-1x1-1x1-0-NCHW-FP16-F=GemmFwdRest:6.30652,14745600,miopenConvolutionFwdAlgoGEMM;GemmFwdRest_hipblaslt:4.8932,14745600,miopenConvolutionFwdAlgoGEMM;ConvHipImplicitGemmGroupFwdXdlops:3.68173,43153920,miopenConvolutionFwdAlgoImplicitGEMM;ConvBinWinogradRxSf3x2:0.82475,0,miopenConvolutionFwdAlgoWinograd;ConvBinWinogradRxSf2x3g1:0.565017,0,miopenConvolutionFwdAlgoWinograd
4-40-64-1x1-4-40-64-1-0x0-1x1-1x1-0-NCHW-FP16-F=ConvBinWinogradRxSf2x3g1:0.0529857,0,miopenConvolutionFwdAlgoWinograd;GemmFwd1x1_0_1:0.0465857,0,miopenConvolutionFwdAlgoGEMM;ConvBinWinogradRxSf3x2:0.0552714,0,miopenConvolutionFwdAlgoWinograd;GemmFwd1x1_0_1_hipblaslt:0.0216333,0,miopenConvolutionFwdAlgoGEMM;ConvHipImplicitGemmGroupFwdXdlops:0.113973,41216,miopenConvolutionFwdAlgoImplicitGEMM
4-40-64-3x3-512-40-64-1-1x1-1x1-1x1-0-NCHW-FP16-F=GemmFwdRest:0.0971567,184320,miopenConvolutionFwdAlgoGEMM;GemmFwdRest_hipblaslt:0.073548,184320,miopenConvolutionFwdAlgoGEMM;ConvHipImplicitGemmGroupFwdXdlops:0.184883,2678784,miopenConvolutionFwdAlgoImplicitGEMM;ConvBinWinogradRxSf3x2:0.066625,0,miopenConvolutionFwdAlgoWinograd;ConvBinWinogradRxSf2x3g1:0.0601167,0,miopenConvolutionFwdAlgoWinograd
512-40-64-3x3-512-40-64-1-1x1-1x1-1x1-0-NCHW-FP16-F=GemmFwdRest:0.425313,23592960,miopenConvolutionFwdAlgoGEMM;GemmFwdRest_hipblaslt:0.837101,23592960,miopenConvolutionFwdAlgoGEMM;ConvHipImplicitGemmGroupFwdXdlops:1.92118,9961472,miopenConvolutionFwdAlgoImplicitGEMM;ConvBinWinogradRxSf3x2:0.746757,0,miopenConvolutionFwdAlgoWinograd;ConvBinWinogradRxSf2x3g1:0.448533,0,miopenConvolutionFwdAlgoWinograd
512-40-64-1x1-512-40-64-1-0x0-1x1-1x1-0-NCHW-FP16-F=ConvBinWinogradRxSf2x3g1:0.562714,0,miopenConvolutionFwdAlgoWinograd;GemmFwd1x1_0_1:0.0957167,0,miopenConvolutionFwdAlgoGEMM;ConvBinWinogradRxSf3x2:0.323983,0,miopenConvolutionFwdAlgoWinograd;GemmFwd1x1_0_1_hipblaslt:0.152978,0,miopenConvolutionFwdAlgoGEMM;ConvHipImplicitGemmGroupFwdXdlops:0.509238,5767168,miopenConvolutionFwdAlgoImplicitGEMM
512-80-128-3x3-512-80-128-1-1x1-1x1-1x1-0-NCHW-FP16-F=GemmFwdRest:5.73678,94371840,miopenConvolutionFwdAlgoGEMM;GemmFwdRest_hipblaslt:3.02933,94371840,miopenConvolutionFwdAlgoGEMM;ConvHipImplicitGemmGroupFwdXdlops:9.49108,25690112,miopenConvolutionFwdAlgoImplicitGEMM;ConvBinWinogradRxSf3x2:4.88841,0,miopenConvolutionFwdAlgoWinograd;ConvBinWinogradRxSf2x3g1:3.37063,0,miopenConvolutionFwdAlgoWinograd
512-160-256-3x3-512-160-256-1-1x1-1x1-1x1-0-NCHW-FP16-F=GemmFwdRest:15.8887,377487360,miopenConvolutionFwdAlgoGEMM;GemmFwdRest_hipblaslt:19.8079,377487360,miopenConvolutionFwdAlgoGEMM;ConvHipImplicitGemmGroupFwdXdlops:33.1135,88604672,miopenConvolutionFwdAlgoImplicitGEMM;ConvBinWinogradRxSf3x2:20.8381,0,miopenConvolutionFwdAlgoWinograd;ConvBinWinogradRxSf2x3g1:11.5667,0,miopenConvolutionFwdAlgoWinograd
512-160-256-3x3-256-160-256-1-1x1-1x1-1x1-0-NCHW-FP16-F=GemmFwdRest:7.64246,377487360,miopenConvolutionFwdAlgoGEMM;GemmFwdRest_hipblaslt:11.6006,377487360,miopenConvolutionFwdAlgoGEMM;ConvHipImplicitGemmGroupFwdXdlops:17.0764,65273856,miopenConvolutionFwdAlgoImplicitGEMM;ConvBinWinogradRxSf3x2:9.68304,0,miopenConvolutionFwdAlgoWinograd;ConvBinWinogradRxSf2x3g1:6.9052,0,miopenConvolutionFwdAlgoWinograd
256-160-256-3x3-256-160-256-1-1x1-1x1-1x1-0-NCHW-FP16-F=GemmFwdRest:2.86042,188743680,miopenConvolutionFwdAlgoGEMM;GemmFwdRest_hipblaslt:4.94972,188743680,miopenConvolutionFwdAlgoGEMM;ConvHipImplicitGemmGroupFwdXdlops:8.47906,43122688,miopenConvolutionFwdAlgoImplicitGEMM;ConvBinWinogradRxSf3x2:4.1271,0,miopenConvolutionFwdAlgoWinograd;ConvBinWinogradRxSf2x3g1:3.12742,0,miopenConvolutionFwdAlgoWinograd
512-160-256-1x1-256-160-256-1-0x0-1x1-1x1-0-NCHW-FP16-F=ConvBinWinogradRxSf2x3g1:5.52424,0,miopenConvolutionFwdAlgoWinograd;GemmFwd1x1_0_1:0.371073,0,miopenConvolutionFwdAlgoGEMM;ConvBinWinogradRxSf3x2:1.703,0,miopenConvolutionFwdAlgoWinograd;GemmFwd1x1_0_1_hipblaslt:0.787182,0,miopenConvolutionFwdAlgoGEMM;ConvHipImplicitGemmGroupFwdXdlops:2.95973,63176704,miopenConvolutionFwdAlgoImplicitGEMM
256-320-512-3x3-256-320-512-1-1x1-1x1-1x1-0-NCHW-FP16-F=GemmFwdRest:17.6598,754974720,miopenConvolutionFwdAlgoGEMM;GemmFwdRest_hipblaslt:21.3814,754974720,miopenConvolutionFwdAlgoGEMM;ConvHipImplicitGemmGroupFwdXdlops:31.5727,168951808,miopenConvolutionFwdAlgoImplicitGEMM;ConvBinWinogradRxSf3x2:17.732,0,miopenConvolutionFwdAlgoWinograd;ConvBinWinogradRxSf2x3g1:10.9386,0,miopenConvolutionFwdAlgoWinograd
256-320-512-3x3-128-320-512-1-1x1-1x1-1x1-0-NCHW-FP16-F=GemmFwdRest:10.9317,754974720,miopenConvolutionFwdAlgoGEMM;GemmFwdRest_hipblaslt:16.6412,754974720,miopenConvolutionFwdAlgoGEMM;ConvHipImplicitGemmGroupFwdXdlops:17.2545,126418944,miopenConvolutionFwdAlgoImplicitGEMM;ConvBinWinogradRxSf3x2:9.24447,0,miopenConvolutionFwdAlgoWinograd;ConvBinWinogradRxSf2x3g1:7.12064,0,miopenConvolutionFwdAlgoWinograd
128-320-512-3x3-128-320-512-1-1x1-1x1-1x1-0-NCHW-FP16-F=GemmFwdRest:4.97998,377487360,miopenConvolutionFwdAlgoGEMM;GemmFwdRest_hipblaslt:7.45775,377487360,miopenConvolutionFwdAlgoGEMM;ConvHipImplicitGemmGroupFwdXdlops:9.12795,84180992,miopenConvolutionFwdAlgoImplicitGEMM;ConvBinWinogradRxSf3x2:4.17617,0,miopenConvolutionFwdAlgoWinograd;ConvBinWinogradRxSf2x3g1:3.54069,0,miopenConvolutionFwdAlgoWinograd
256-320-512-1x1-128-320-512-1-0x0-1x1-1x1-0-NCHW-FP16-F=ConvBinWinogradRxSf2x3g1:5.9171,0,miopenConvolutionFwdAlgoWinograd;GemmFwd1x1_0_1:0.69725,0,miopenConvolutionFwdAlgoGEMM;ConvBinWinogradRxSf3x2:1.88405,0,miopenConvolutionFwdAlgoWinograd;GemmFwd1x1_0_1_hipblaslt:0.96994,0,miopenConvolutionFwdAlgoGEMM;ConvHipImplicitGemmGroupFwdXdlops:4.1247,125894656,miopenConvolutionFwdAlgoImplicitGEMM
128-320-512-3x3-3-320-512-1-1x1-1x1-1x1-0-NCHW-FP16-F=GemmFwdRest:4.78749,377487360,miopenConvolutionFwdAlgoGEMM;GemmFwdRest_hipblaslt:4.92584,377487360,miopenConvolutionFwdAlgoGEMM;ConvHipImplicitGemmGroupFwdXdlops:3.96799,42932992,miopenConvolutionFwdAlgoImplicitGEMM;ConvBinWinogradRxSf3x2:0.8153,0,miopenConvolutionFwdAlgoWinograd;ConvBinWinogradRxSf2x3g1:0.61788,0,miopenConvolutionFwdAlgoWinograd
4-64-64-3x3-320-64-64-2-1x1-1x1-1x1-0-NCHW-FP16-F=GemmFwdRest:0.111992,294912,miopenConvolutionFwdAlgoGEMM;GemmFwdRest_hipblaslt:0.138306,294912,miopenConvolutionFwdAlgoGEMM;ConvHipImplicitGemmGroupFwdXdlops:0.191762,5331456,miopenConvolutionFwdAlgoImplicitGEMM;ConvBinWinogradRxSf3x2:0.0701429,0,miopenConvolutionFwdAlgoWinograd;ConvBinWinogradRxSf2x3g1:0.06345,0,miopenConvolutionFwdAlgoWinograd
320-64-64-3x3-320-64-64-2-1x1-1x1-1x1-0-NCHW-FP16-F=GemmFwdRest:0.777573,23592960,miopenConvolutionFwdAlgoGEMM;GemmFwdRest_hipblaslt:1.02222,23592960,miopenConvolutionFwdAlgoGEMM;ConvHipImplicitGemmGroupFwdXdlops:1.78193,12328960,miopenConvolutionFwdAlgoImplicitGEMM;ConvBinWinogradRxSf3x2:0.856586,0,miopenConvolutionFwdAlgoWinograd;ConvBinWinogradRxSf2x3g1:0.547471,0,miopenConvolutionFwdAlgoWinograd
320-64-64-1x1-320-64-64-2-0x0-1x1-1x1-0-NCHW-FP16-F=ConvBinWinogradRxSf2x3g1:0.454057,0,miopenConvolutionFwdAlgoWinograd;GemmFwd1x1_0_1:0.0601033,0,miopenConvolutionFwdAlgoGEMM;ConvBinWinogradRxSf3x2:0.199286,0,miopenConvolutionFwdAlgoWinograd;GemmFwd1x1_0_1_hipblaslt:0.0916333,0,miopenConvolutionFwdAlgoGEMM;ConvHipImplicitGemmGroupFwdXdlops:0.365327,10690560,miopenConvolutionFwdAlgoImplicitGEMM
320-64-64-3x3-320-32-32-2-1x1-2x2-1x1-0-NCHW-FP16-F=GemmFwdRest:0.350518,5898240,miopenConvolutionFwdAlgoGEMM;GemmFwdRest_hipblaslt:0.35457,5898240,miopenConvolutionFwdAlgoGEMM;ConvHipImplicitGemmGroupFwdXdlops:0.513468,8396800,miopenConvolutionFwdAlgoImplicitGEMM;ConvBinWinogradRxSf3x2:0.222975,0,miopenConvolutionFwdAlgoWinograd;ConvBinWinogradRxSf2x3g1:0.498614,0,miopenConvolutionFwdAlgoWinograd
320-32-32-3x3-640-32-32-2-1x1-1x1-1x1-0-NCHW-FP16-F=GemmFwdRest:0.362973,5898240,miopenConvolutionFwdAlgoGEMM;GemmFwdRest_hipblaslt:0.39297,5898240,miopenConvolutionFwdAlgoGEMM;ConvHipImplicitGemmGroupFwdXdlops:0.951165,7618560,miopenConvolutionFwdAlgoImplicitGEMM;ConvBinWinogradRxSf3x2:0.394943,0,miopenConvolutionFwdAlgoWinograd;ConvBinWinogradRxSf2x3g1:0.268757,0,miopenConvolutionFwdAlgoWinograd
640-32-32-3x3-640-32-32-2-1x1-1x1-1x1-0-NCHW-FP16-F=GemmFwdRest:0.57829,11796480,miopenConvolutionFwdAlgoGEMM;GemmFwdRest_hipblaslt:0.765597,11796480,miopenConvolutionFwdAlgoGEMM;ConvHipImplicitGemmGroupFwdXdlops:1.8691,12615680,miopenConvolutionFwdAlgoImplicitGEMM;ConvBinWinogradRxSf3x2:0.707457,0,miopenConvolutionFwdAlgoWinograd;ConvBinWinogradRxSf2x3g1:0.444,0,miopenConvolutionFwdAlgoWinograd
320-32-32-1x1-640-32-32-2-0x0-1x1-1x1-0-NCHW-FP16-F=ConvBinWinogradRxSf2x3g1:0.249117,0,miopenConvolutionFwdAlgoWinograd;GemmFwd1x1_0_1:0.0434314,0,miopenConvolutionFwdAlgoGEMM;ConvBinWinogradRxSf3x2:0.14764,0,miopenConvolutionFwdAlgoWinograd;GemmFwd1x1_0_1_hipblaslt:0.0772983,0,miopenConvolutionFwdAlgoGEMM;ConvHipImplicitGemmGroupFwdXdlops:0.283042,4341760,miopenConvolutionFwdAlgoImplicitGEMM
640-32-32-1x1-640-32-32-2-0x0-1x1-1x1-0-NCHW-FP16-F=ConvBinWinogradRxSf2x3g1:0.433771,0,miopenConvolutionFwdAlgoWinograd;GemmFwd1x1_0_1:0.057754,0,miopenConvolutionFwdAlgoGEMM;ConvBinWinogradRxSf3x2:0.193767,0,miopenConvolutionFwdAlgoWinograd;GemmFwd1x1_0_1_hipblaslt:0.0817614,0,miopenConvolutionFwdAlgoGEMM;ConvHipImplicitGemmGroupFwdXdlops:0.318965,6062080,miopenConvolutionFwdAlgoImplicitGEMM
640-32-32-3x3-640-16-16-2-1x1-2x2-1x1-0-NCHW-FP16-F=GemmFwdRest:0.477107,2949120,miopenConvolutionFwdAlgoGEMM;GemmFwdRest_hipblaslt:0.413796,2949120,miopenConvolutionFwdAlgoGEMM;ConvHipImplicitGemmGroupFwdXdlops:0.619792,10649600,miopenConvolutionFwdAlgoImplicitGEMM;ConvBinWinogradRxSf3x2:0.468243,0,miopenConvolutionFwdAlgoWinograd;ConvBinWinogradRxSf2x3g1:0.57055,0,miopenConvolutionFwdAlgoWinograd
640-16-16-3x3-1280-16-16-2-1x1-1x1-1x1-0-NCHW-FP16-F=GemmFwdRest:0.437139,2949120,miopenConvolutionFwdAlgoGEMM;GemmFwdRest_hipblaslt:0.482127,2949120,miopenConvolutionFwdAlgoGEMM;ConvHipImplicitGemmGroupFwdXdlops:1.08442,16711680,miopenConvolutionFwdAlgoImplicitGEMM;ConvBinWinogradRxSf3x2:0.604157,0,miopenConvolutionFwdAlgoWinograd;ConvBinWinogradRxSf2x3g1:0.266225,0,miopenConvolutionFwdAlgoWinograd
1280-16-16-3x3-1280-16-16-2-1x1-1x1-1x1-0-NCHW-FP16-F=GemmFwdRest:0.968274,5898240,miopenConvolutionFwdAlgoGEMM;GemmFwdRest_hipblaslt:0.93335,5898240,miopenConvolutionFwdAlgoGEMM;ConvHipImplicitGemmGroupFwdXdlops:2.00759,32112640,miopenConvolutionFwdAlgoImplicitGEMM;ConvBinWinogradRxSf3x2:1.14224,0,miopenConvolutionFwdAlgoWinograd;ConvBinWinogradRxSf2x3g1:0.5698,0,miopenConvolutionFwdAlgoWinograd
640-16-16-1x1-1280-16-16-2-0x0-1x1-1x1-0-NCHW-FP16-F=ConvBinWinogradRxSf2x3g1:0.365329,0,miopenConvolutionFwdAlgoWinograd;GemmFwd1x1_0_1:0.0994986,0,miopenConvolutionFwdAlgoGEMM;ConvBinWinogradRxSf3x2:0.30722,0,miopenConvolutionFwdAlgoWinograd;GemmFwd1x1_0_1_hipblaslt:0.1883,0,miopenConvolutionFwdAlgoGEMM;ConvHipImplicitGemmGroupFwdXdlops:0.458817,3604480,miopenConvolutionFwdAlgoImplicitGEMM
1280-16-16-1x1-1280-16-16-2-0x0-1x1-1x1-0-NCHW-FP16-F=ConvBinWinogradRxSf2x3g1:0.593614,0,miopenConvolutionFwdAlgoWinograd;GemmFwd1x1_0_1:0.1832,0,miopenConvolutionFwdAlgoGEMM;ConvBinWinogradRxSf3x2:0.540086,0,miopenConvolutionFwdAlgoWinograd;GemmFwd1x1_0_1_hipblaslt:0.405886,0,miopenConvolutionFwdAlgoGEMM;ConvHipImplicitGemmGroupFwdXdlops:0.948573,5898240,miopenConvolutionFwdAlgoImplicitGEMM
1280-16-16-3x3-1280-8-8-2-1x1-2x2-1x1-0-NCHW-FP16-F=GemmFwdRest:1.03461,1474560,miopenConvolutionFwdAlgoGEMM;GemmFwdRest_hipblaslt:0.58188,1474560,miopenConvolutionFwdAlgoGEMM;ConvHipImplicitGemmGroupFwdXdlops:0.978732,31129600,miopenConvolutionFwdAlgoImplicitGEMM;ConvBinWinogradRxSf3x2:0.413967,0,miopenConvolutionFwdAlgoWinograd;ConvBinWinogradRxSf2x3g1:0.457814,0,miopenConvolutionFwdAlgoWinograd
1280-8-8-3x3-1280-8-8-2-1x1-1x1-1x1-0-NCHW-FP16-F=GemmFwdRest:1.07054,1474560,miopenConvolutionFwdAlgoGEMM;GemmFwdRest_hipblaslt:0.550307,1474560,miopenConvolutionFwdAlgoGEMM;ConvHipImplicitGemmGroupFwdXdlops:0.93318,30146560,miopenConvolutionFwdAlgoImplicitGEMM;ConvBinWinogradRxSf3x2:0.3459,0,miopenConvolutionFwdAlgoWinograd;ConvBinWinogradRxSf2x3g1:0.130333,0,miopenConvolutionFwdAlgoWinograd
1280-8-8-1x1-1280-8-8-2-0x0-1x1-1x1-0-NCHW-FP16-F=ConvBinWinogradRxSf2x3g1:0.154071,0,miopenConvolutionFwdAlgoWinograd;GemmFwd1x1_0_1:0.07317,0,miopenConvolutionFwdAlgoGEMM;ConvBinWinogradRxSf3x2:0.1493,0,miopenConvolutionFwdAlgoWinograd;GemmFwd1x1_0_1_hipblaslt:0.07675,0,miopenConvolutionFwdAlgoGEMM;ConvHipImplicitGemmGroupFwdXdlops:0.271588,3932160,miopenConvolutionFwdAlgoImplicitGEMM
2560-8-8-3x3-1280-8-8-2-1x1-1x1-1x1-0-NCHW-FP16-F=GemmFwdRest:2.02786,2949120,miopenConvolutionFwdAlgoGEMM;GemmFwdRest_hipblaslt:0.80272,2949120,miopenConvolutionFwdAlgoGEMM;ConvHipImplicitGemmGroupFwdXdlops:1.60587,59965440,miopenConvolutionFwdAlgoImplicitGEMM;ConvBinWinogradRxSf3x2:0.706157,0,miopenConvolutionFwdAlgoWinograd;ConvBinWinogradRxSf2x3g1:0.355517,0,miopenConvolutionFwdAlgoWinograd
2560-8-8-1x1-1280-8-8-2-0x0-1x1-1x1-0-NCHW-FP16-F=ConvBinWinogradRxSf2x3g1:0.3103,0,miopenConvolutionFwdAlgoWinograd;GemmFwd1x1_0_1:0.173865,0,miopenConvolutionFwdAlgoGEMM;ConvBinWinogradRxSf3x2:0.29755,0,miopenConvolutionFwdAlgoWinograd;GemmFwd1x1_0_1_hipblaslt:0.16629,0,miopenConvolutionFwdAlgoGEMM;ConvHipImplicitGemmGroupFwdXdlops:0.451495,7536640,miopenConvolutionFwdAlgoImplicitGEMM
2560-16-16-3x3-1280-16-16-2-1x1-1x1-1x1-0-NCHW-FP16-F=GemmFwdRest:2.57573,11796480,miopenConvolutionFwdAlgoGEMM;GemmFwdRest_hipblaslt:1.52955,11796480,miopenConvolutionFwdAlgoGEMM;ConvHipImplicitGemmGroupFwdXdlops:5.03034,62914560,miopenConvolutionFwdAlgoImplicitGEMM;ConvBinWinogradRxSf3x2:4.38451,0,miopenConvolutionFwdAlgoWinograd;ConvBinWinogradRxSf2x3g1:2.17652,0,miopenConvolutionFwdAlgoWinograd
2560-16-16-1x1-1280-16-16-2-0x0-1x1-1x1-0-NCHW-FP16-F=ConvBinWinogradRxSf2x3g1:1.07216,0,miopenConvolutionFwdAlgoWinograd;GemmFwd1x1_0_1:0.09432,0,miopenConvolutionFwdAlgoGEMM;ConvBinWinogradRxSf3x2:0.635767,0,miopenConvolutionFwdAlgoWinograd;GemmFwd1x1_0_1_hipblaslt:0.205946,0,miopenConvolutionFwdAlgoGEMM;ConvHipImplicitGemmGroupFwdXdlops:0.612722,10485760,miopenConvolutionFwdAlgoImplicitGEMM
1920-16-16-3x3-1280-16-16-2-1x1-1x1-1x1-0-NCHW-FP16-F=GemmFwdRest:1.35076,8847360,miopenConvolutionFwdAlgoGEMM;GemmFwdRest_hipblaslt:1.42272,8847360,miopenConvolutionFwdAlgoGEMM;ConvHipImplicitGemmGroupFwdXdlops:3.93049,47513600,miopenConvolutionFwdAlgoImplicitGEMM;ConvBinWinogradRxSf3x2:2.68183,0,miopenConvolutionFwdAlgoWinograd;ConvBinWinogradRxSf2x3g1:1.37493,0,miopenConvolutionFwdAlgoWinograd
1920-16-16-1x1-1280-16-16-2-0x0-1x1-1x1-0-NCHW-FP16-F=ConvBinWinogradRxSf2x3g1:0.729014,0,miopenConvolutionFwdAlgoWinograd;GemmFwd1x1_0_1:0.072935,0,miopenConvolutionFwdAlgoGEMM;ConvBinWinogradRxSf3x2:0.441386,0,miopenConvolutionFwdAlgoWinograd;GemmFwd1x1_0_1_hipblaslt:0.159687,0,miopenConvolutionFwdAlgoGEMM;ConvHipImplicitGemmGroupFwdXdlops:0.480893,8192000,miopenConvolutionFwdAlgoImplicitGEMM
1280-32-32-3x3-1280-32-32-2-1x1-1x1-1x1-0-NCHW-FP16-F=GemmFwdRest:2.3008,23592960,miopenConvolutionFwdAlgoGEMM;GemmFwdRest_hipblaslt:3.79612,23592960,miopenConvolutionFwdAlgoGEMM;ConvHipImplicitGemmGroupFwdXdlops:10.3043,39976960,miopenConvolutionFwdAlgoImplicitGEMM;ConvBinWinogradRxSf3x2:5.20921,0,miopenConvolutionFwdAlgoWinograd;ConvBinWinogradRxSf2x3g1:3.45685,0,miopenConvolutionFwdAlgoWinograd
1920-32-32-3x3-640-32-32-2-1x1-1x1-1x1-0-NCHW-FP16-F=GemmFwdRest:1.998,35389440,miopenConvolutionFwdAlgoGEMM;GemmFwdRest_hipblaslt:2.82807,35389440,miopenConvolutionFwdAlgoGEMM;ConvHipImplicitGemmGroupFwdXdlops:7.24541,32604160,miopenConvolutionFwdAlgoImplicitGEMM;ConvBinWinogradRxSf3x2:3.49877,0,miopenConvolutionFwdAlgoWinograd;ConvBinWinogradRxSf2x3g1:2.48355,0,miopenConvolutionFwdAlgoWinograd
1920-32-32-1x1-640-32-32-2-0x0-1x1-1x1-0-NCHW-FP16-F=ConvBinWinogradRxSf2x3g1:1.61639,0,miopenConvolutionFwdAlgoWinograd;GemmFwd1x1_0_1:0.152427,0,miopenConvolutionFwdAlgoGEMM;ConvBinWinogradRxSf3x2:0.605086,0,miopenConvolutionFwdAlgoWinograd;GemmFwd1x1_0_1_hipblaslt:0.186902,0,miopenConvolutionFwdAlgoGEMM;ConvHipImplicitGemmGroupFwdXdlops:0.754017,12943360,miopenConvolutionFwdAlgoImplicitGEMM
1280-32-32-3x3-640-32-32-2-1x1-1x1-1x1-0-NCHW-FP16-F=GemmFwdRest:1.32065,23592960,miopenConvolutionFwdAlgoGEMM;GemmFwdRest_hipblaslt:1.76665,23592960,miopenConvolutionFwdAlgoGEMM;ConvHipImplicitGemmGroupFwdXdlops:4.86732,22609920,miopenConvolutionFwdAlgoImplicitGEMM;ConvBinWinogradRxSf3x2:2.16407,0,miopenConvolutionFwdAlgoWinograd;ConvBinWinogradRxSf2x3g1:1.56928,0,miopenConvolutionFwdAlgoWinograd
1280-32-32-1x1-640-32-32-2-0x0-1x1-1x1-0-NCHW-FP16-F=ConvBinWinogradRxSf2x3g1:0.943143,0,miopenConvolutionFwdAlgoWinograd;GemmFwd1x1_0_1:0.12346,0,miopenConvolutionFwdAlgoGEMM;ConvBinWinogradRxSf3x2:0.39035,0,miopenConvolutionFwdAlgoWinograd;GemmFwd1x1_0_1_hipblaslt:0.137108,0,miopenConvolutionFwdAlgoGEMM;ConvHipImplicitGemmGroupFwdXdlops:0.620847,9502720,miopenConvolutionFwdAlgoImplicitGEMM
960-32-32-3x3-640-32-32-2-1x1-1x1-1x1-0-NCHW-FP16-F=GemmFwdRest:1.0171,17694720,miopenConvolutionFwdAlgoGEMM;GemmFwdRest_hipblaslt:1.1493,17694720,miopenConvolutionFwdAlgoGEMM;ConvHipImplicitGemmGroupFwdXdlops:3.40746,17612800,miopenConvolutionFwdAlgoImplicitGEMM;ConvBinWinogradRxSf3x2:1.55874,0,miopenConvolutionFwdAlgoWinograd;ConvBinWinogradRxSf2x3g1:1.07336,0,miopenConvolutionFwdAlgoWinograd
960-32-32-1x1-640-32-32-2-0x0-1x1-1x1-0-NCHW-FP16-F=ConvBinWinogradRxSf2x3g1:0.646171,0,miopenConvolutionFwdAlgoWinograd;GemmFwd1x1_0_1:0.111993,0,miopenConvolutionFwdAlgoGEMM;ConvBinWinogradRxSf3x2:0.313483,0,miopenConvolutionFwdAlgoWinograd;GemmFwd1x1_0_1_hipblaslt:0.124033,0,miopenConvolutionFwdAlgoGEMM;ConvHipImplicitGemmGroupFwdXdlops:0.485517,7782400,miopenConvolutionFwdAlgoImplicitGEMM
640-64-64-3x3-640-64-64-2-1x1-1x1-1x1-0-NCHW-FP16-F=GemmFwdRest:2.81413,47185920,miopenConvolutionFwdAlgoGEMM;GemmFwdRest_hipblaslt:4.14477,47185920,miopenConvolutionFwdAlgoGEMM;ConvHipImplicitGemmGroupFwdXdlops:9.29217,28344320,miopenConvolutionFwdAlgoImplicitGEMM;ConvBinWinogradRxSf3x2:4.61874,0,miopenConvolutionFwdAlgoWinograd;ConvBinWinogradRxSf2x3g1:3.1485,0,miopenConvolutionFwdAlgoWinograd
960-64-64-3x3-320-64-64-2-1x1-1x1-1x1-0-NCHW-FP16-F=GemmFwdRest:2.53635,70778880,miopenConvolutionFwdAlgoGEMM;GemmFwdRest_hipblaslt:4.32922,70778880,miopenConvolutionFwdAlgoGEMM;ConvHipImplicitGemmGroupFwdXdlops:7.25124,26501120,miopenConvolutionFwdAlgoImplicitGEMM;ConvBinWinogradRxSf3x2:3.94867,0,miopenConvolutionFwdAlgoWinograd;ConvBinWinogradRxSf2x3g1:2.82671,0,miopenConvolutionFwdAlgoWinograd
960-64-64-1x1-320-64-64-2-0x0-1x1-1x1-0-NCHW-FP16-F=ConvBinWinogradRxSf2x3g1:1.74363,0,miopenConvolutionFwdAlgoWinograd;GemmFwd1x1_0_1:0.152078,0,miopenConvolutionFwdAlgoGEMM;ConvBinWinogradRxSf3x2:0.676786,0,miopenConvolutionFwdAlgoWinograd;GemmFwd1x1_0_1_hipblaslt:0.227483,0,miopenConvolutionFwdAlgoGEMM;ConvHipImplicitGemmGroupFwdXdlops:0.902512,21585920,miopenConvolutionFwdAlgoImplicitGEMM
640-64-64-3x3-320-64-64-2-1x1-1x1-1x1-0-NCHW-FP16-F=GemmFwdRest:1.80798,47185920,miopenConvolutionFwdAlgoGEMM;GemmFwdRest_hipblaslt:2.97378,47185920,miopenConvolutionFwdAlgoGEMM;ConvHipImplicitGemmGroupFwdXdlops:4.70977,19415040,miopenConvolutionFwdAlgoImplicitGEMM;ConvBinWinogradRxSf3x2:2.31153,0,miopenConvolutionFwdAlgoWinograd;ConvBinWinogradRxSf2x3g1:1.70128,0,miopenConvolutionFwdAlgoWinograd
640-64-64-1x1-320-64-64-2-0x0-1x1-1x1-0-NCHW-FP16-F=ConvBinWinogradRxSf2x3g1:0.998271,0,miopenConvolutionFwdAlgoWinograd;GemmFwd1x1_0_1:0.116655,0,miopenConvolutionFwdAlgoGEMM;ConvBinWinogradRxSf3x2:0.415443,0,miopenConvolutionFwdAlgoWinograd;GemmFwd1x1_0_1_hipblaslt:0.166126,0,miopenConvolutionFwdAlgoGEMM;ConvHipImplicitGemmGroupFwdXdlops:0.593516,16138240,miopenConvolutionFwdAlgoImplicitGEMM
320-64-64-3x3-4-64-64-2-1x1-1x1-1x1-0-NCHW-FP16-F=GemmFwdRest:0.638814,23592960,miopenConvolutionFwdAlgoGEMM;GemmFwdRest_hipblaslt:0.54418,23592960,miopenConvolutionFwdAlgoGEMM;ConvHipImplicitGemmGroupFwdXdlops:0.561679,5331456,miopenConvolutionFwdAlgoImplicitGEMM;ConvBinWinogradRxSf3x2:0.141483,0,miopenConvolutionFwdAlgoWinograd;ConvBinWinogradRxSf2x3g1:0.103457,0,miopenConvolutionFwdAlgoWinograd
4-64-64-1x1-4-64-64-1-0x0-1x1-1x1-0-NCHW-FP16-F=ConvBinWinogradRxSf3x2:0.0652333,0,miopenConvolutionFwdAlgoWinograd;GemmFwd1x1_0_1_hipblaslt:0.09044,0,miopenConvolutionFwdAlgoGEMM;ConvHipImplicitGemmGroupFwdXdlops:0.308083,65792,miopenConvolutionFwdAlgoImplicitGEMM;ConvBinWinogradRxSf2x3g1:0.06064,0,miopenConvolutionFwdAlgoWinograd
4-64-64-3x3-512-64-64-1-1x1-1x1-1x1-0-NCHW-FP16-F=GemmFwdRest:0.0793857,294912,miopenConvolutionFwdAlgoGEMM;GemmFwdRest_hipblaslt:0.07866,294912,miopenConvolutionFwdAlgoGEMM;ConvHipImplicitGemmGroupFwdXdlops:0.214586,4263936,miopenConvolutionFwdAlgoImplicitGEMM;ConvBinWinogradRxSf3x2:0.0724333,0,miopenConvolutionFwdAlgoWinograd;ConvBinWinogradRxSf2x3g1:0.06605,0,miopenConvolutionFwdAlgoWinograd
512-64-64-3x3-512-64-64-1-1x1-1x1-1x1-0-NCHW-FP16-F=GemmFwdRest:0.884896,37748736,miopenConvolutionFwdAlgoGEMM;GemmFwdRest_hipblaslt:1.06496,37748736,miopenConvolutionFwdAlgoGEMM;ConvHipImplicitGemmGroupFwdXdlops:2.13419,13107200,miopenConvolutionFwdAlgoImplicitGEMM;ConvBinWinogradRxSf3x2:1.15899,0,miopenConvolutionFwdAlgoWinograd;ConvBinWinogradRxSf2x3g1:0.838729,0,miopenConvolutionFwdAlgoWinograd
512-128-128-3x3-512-128-128-1-1x1-1x1-1x1-0-NCHW-FP16-F=GemmFwdRest:4.43735,150994944,miopenConvolutionFwdAlgoGEMM;GemmFwdRest_hipblaslt:9.37258,150994944,miopenConvolutionFwdAlgoGEMM;ConvHipImplicitGemmGroupFwdXdlops:13.1055,38273024,miopenConvolutionFwdAlgoImplicitGEMM;ConvBinWinogradRxSf3x2:7.78187,0,miopenConvolutionFwdAlgoWinograd;ConvBinWinogradRxSf2x3g1:5.14477,0,miopenConvolutionFwdAlgoWinograd
512-256-256-3x3-512-256-256-1-1x1-1x1-1x1-0-NCHW-FP16-F=GemmFwdRest:29.6458,603979776,miopenConvolutionFwdAlgoGEMM;GemmFwdRest_hipblaslt:46.5084,603979776,miopenConvolutionFwdAlgoGEMM;ConvHipImplicitGemmGroupFwdXdlops:50.5097,138936320,miopenConvolutionFwdAlgoImplicitGEMM;ConvBinWinogradRxSf3x2:33.0968,0,miopenConvolutionFwdAlgoWinograd;ConvBinWinogradRxSf2x3g1:24.489,0,miopenConvolutionFwdAlgoWinograd
512-256-256-3x3-256-256-256-1-1x1-1x1-1x1-0-NCHW-FP16-F=GemmFwdRest:13.9197,603979776,miopenConvolutionFwdAlgoGEMM;GemmFwdRest_hipblaslt:23.1314,603979776,miopenConvolutionFwdAlgoGEMM;ConvHipImplicitGemmGroupFwdXdlops:23.7161,103022592,miopenConvolutionFwdAlgoImplicitGEMM;ConvBinWinogradRxSf3x2:13.655,0,miopenConvolutionFwdAlgoWinograd;ConvBinWinogradRxSf2x3g1:11.3757,0,miopenConvolutionFwdAlgoWinograd
256-256-256-3x3-256-256-256-1-1x1-1x1-1x1-0-NCHW-FP16-F=GemmFwdRest:5.58666,301989888,miopenConvolutionFwdAlgoGEMM;GemmFwdRest_hipblaslt:11.5796,301989888,miopenConvolutionFwdAlgoGEMM;ConvHipImplicitGemmGroupFwdXdlops:12.6703,68288512,miopenConvolutionFwdAlgoImplicitGEMM;ConvBinWinogradRxSf3x2:7.39809,0,miopenConvolutionFwdAlgoWinograd;ConvBinWinogradRxSf2x3g1:6.15506,0,miopenConvolutionFwdAlgoWinograd
512-256-256-1x1-256-256-256-1-0x0-1x1-1x1-0-NCHW-FP16-F=ConvBinWinogradRxSf2x3g1:9.26747,0,miopenConvolutionFwdAlgoWinograd;GemmFwd1x1_0_1:0.791781,0,miopenConvolutionFwdAlgoGEMM;ConvBinWinogradRxSf3x2:4.69505,0,miopenConvolutionFwdAlgoWinograd;GemmFwd1x1_0_1_hipblaslt:1.98111,0,miopenConvolutionFwdAlgoGEMM;ConvHipImplicitGemmGroupFwdXdlops:4.81799,100925440,miopenConvolutionFwdAlgoImplicitGEMM
256-512-512-3x3-256-512-512-1-1x1-1x1-1x1-0-NCHW-FP16-F=GemmFwdRest:30.9242,1207959552,miopenConvolutionFwdAlgoGEMM;GemmFwdRest_hipblaslt:44.2235,1207959552,miopenConvolutionFwdAlgoGEMM;ConvHipImplicitGemmGroupFwdXdlops:49.7064,269615104,miopenConvolutionFwdAlgoImplicitGEMM;ConvBinWinogradRxSf3x2:33.2677,0,miopenConvolutionFwdAlgoWinograd;ConvBinWinogradRxSf2x3g1:24.7957,0,miopenConvolutionFwdAlgoWinograd
256-512-512-3x3-128-512-512-1-1x1-1x1-1x1-0-NCHW-FP16-F=GemmFwdRest:17.2806,1207959552,miopenConvolutionFwdAlgoGEMM;GemmFwdRest_hipblaslt:29.9308,1207959552,miopenConvolutionFwdAlgoGEMM;ConvHipImplicitGemmGroupFwdXdlops:24.357,201916416,miopenConvolutionFwdAlgoImplicitGEMM;ConvBinWinogradRxSf3x2:15.7583,0,miopenConvolutionFwdAlgoWinograd;ConvBinWinogradRxSf2x3g1:13.599,0,miopenConvolutionFwdAlgoWinograd
128-512-512-3x3-128-512-512-1-1x1-1x1-1x1-0-NCHW-FP16-F=GemmFwdRest:8.4172,603979776,miopenConvolutionFwdAlgoGEMM;GemmFwdRest_hipblaslt:16.2711,603979776,miopenConvolutionFwdAlgoGEMM;ConvHipImplicitGemmGroupFwdXdlops:12.8931,134512640,miopenConvolutionFwdAlgoImplicitGEMM;ConvBinWinogradRxSf3x2:6.9865,0,miopenConvolutionFwdAlgoWinograd;ConvBinWinogradRxSf2x3g1:6.13207,0,miopenConvolutionFwdAlgoWinograd
256-512-512-1x1-128-512-512-1-0x0-1x1-1x1-0-NCHW-FP16-F=ConvBinWinogradRxSf2x3g1:9.89313,0,miopenConvolutionFwdAlgoWinograd;GemmFwd1x1_0_1:1.24494,0,miopenConvolutionFwdAlgoGEMM;ConvBinWinogradRxSf3x2:4.21684,0,miopenConvolutionFwdAlgoWinograd;GemmFwd1x1_0_1_hipblaslt:2.16947,0,miopenConvolutionFwdAlgoGEMM;ConvHipImplicitGemmGroupFwdXdlops:6.47997,201392128,miopenConvolutionFwdAlgoImplicitGEMM
128-512-512-3x3-3-512-512-1-1x1-1x1-1x1-0-NCHW-FP16-F=GemmFwdRest:7.79621,603979776,miopenConvolutionFwdAlgoGEMM;GemmFwdRest_hipblaslt:9.03179,603979776,miopenConvolutionFwdAlgoGEMM;ConvHipImplicitGemmGroupFwdXdlops:6.04828,68688640,miopenConvolutionFwdAlgoImplicitGEMM;ConvBinWinogradRxSf3x2:1.15697,0,miopenConvolutionFwdAlgoWinograd;ConvBinWinogradRxSf2x3g1:0.851071,0,miopenConvolutionFwdAlgoWinograd
3-224-224-14x14-1024-16-16-1-0x0-14x14-1x1-0-NCHW-FP16-F=GemmFwdRest:0.21594,301056,miopenConvolutionFwdAlgoGEMM;GemmFwdRest_hipblaslt:0.22973,301056,miopenConvolutionFwdAlgoGEMM;ConvHipImplicitGemmGroupFwdXdlops:0.504952,2029568,miopenConvolutionFwdAlgoImplicitGEMM
3-512-512-3x3-64-512-512-1-1x1-1x1-1x1-0-NCHW-FP16-F=GemmFwdRest:0.37635,14155776,miopenConvolutionFwdAlgoGEMM;GemmFwdRest_hipblaslt:0.38385,14155776,miopenConvolutionFwdAlgoGEMM;ConvHipImplicitGemmGroupFwdXdlops:1.12591,35130880,miopenConvolutionFwdAlgoImplicitGEMM;ConvBinWinogradRxSf3x2:0.3135,0,miopenConvolutionFwdAlgoWinograd;ConvBinWinogradRxSf2x3g1:0.3343,0,miopenConvolutionFwdAlgoWinograd
64-512-512-3x3-32-512-512-1-1x1-1x1-1x1-0-NCHW-FP16-F=GemmFwdRest:4.12501,301989888,miopenConvolutionFwdAlgoGEMM;GemmFwdRest_hipblaslt:3.83363,301989888,miopenConvolutionFwdAlgoGEMM;ConvHipImplicitGemmGroupFwdXdlops:3.63232,50368512,miopenConvolutionFwdAlgoImplicitGEMM;ConvBinWinogradRxSf3x2:0.83775,0,miopenConvolutionFwdAlgoWinograd;ConvBinWinogradRxSf2x3g1:0.721929,0,miopenConvolutionFwdAlgoWinograd
96-512-512-3x3-32-512-512-1-1x1-1x1-1x1-0-NCHW-FP16-F=GemmFwdRest:5.3076,452984832,miopenConvolutionFwdAlgoGEMM;GemmFwdRest_hipblaslt:6.308,452984832,miopenConvolutionFwdAlgoGEMM;ConvHipImplicitGemmGroupFwdXdlops:5.9221,67164160,miopenConvolutionFwdAlgoImplicitGEMM;ConvBinWinogradRxSf3x2:1.15712,0,miopenConvolutionFwdAlgoWinograd;ConvBinWinogradRxSf2x3g1:0.909183,0,miopenConvolutionFwdAlgoWinograd
128-512-512-3x3-32-512-512-1-1x1-1x1-1x1-0-NCHW-FP16-F=GemmFwdRest:7.70457,603979776,miopenConvolutionFwdAlgoGEMM;GemmFwdRest_hipblaslt:9.82613,603979776,miopenConvolutionFwdAlgoGEMM;ConvHipImplicitGemmGroupFwdXdlops:6.97413,83959808,miopenConvolutionFwdAlgoImplicitGEMM;ConvBinWinogradRxSf3x2:1.428,0,miopenConvolutionFwdAlgoWinograd;ConvBinWinogradRxSf2x3g1:1.1682,0,miopenConvolutionFwdAlgoWinograd
160-512-512-3x3-32-512-512-1-1x1-1x1-1x1-0-NCHW-FP16-F=GemmFwdRest:9.88434,754974720,miopenConvolutionFwdAlgoGEMM;GemmFwdRest_hipblaslt:12.2005,754974720,miopenConvolutionFwdAlgoGEMM;ConvHipImplicitGemmGroupFwdXdlops:8.87845,100755456,miopenConvolutionFwdAlgoImplicitGEMM;ConvBinWinogradRxSf3x2:1.79766,0,miopenConvolutionFwdAlgoWinograd;ConvBinWinogradRxSf2x3g1:1.50636,0,miopenConvolutionFwdAlgoWinograd
192-512-512-3x3-64-512-512-1-1x1-1x1-1x1-0-NCHW-FP16-F=GemmFwdRest:12.5301,905969664,miopenConvolutionFwdAlgoGEMM;GemmFwdRest_hipblaslt:15.109,905969664,miopenConvolutionFwdAlgoGEMM;ConvHipImplicitGemmGroupFwdXdlops:10.9026,134438912,miopenConvolutionFwdAlgoImplicitGEMM;ConvBinWinogradRxSf3x2:4.94786,0,miopenConvolutionFwdAlgoWinograd;ConvBinWinogradRxSf2x3g1:4.16911,0,miopenConvolutionFwdAlgoWinograd
64-512-512-3x3-64-512-512-1-1x1-1x1-1x1-0-NCHW-FP16-F=GemmFwdRest:4.24326,301989888,miopenConvolutionFwdAlgoGEMM;GemmFwdRest_hipblaslt:4.25861,301989888,miopenConvolutionFwdAlgoGEMM;ConvHipImplicitGemmGroupFwdXdlops:4.0363,67182592,miopenConvolutionFwdAlgoImplicitGEMM;ConvBinWinogradRxSf3x2:1.17926,0,miopenConvolutionFwdAlgoWinograd;ConvBinWinogradRxSf2x3g1:0.9015,0,miopenConvolutionFwdAlgoWinograd
64-1024-1024-3x3-64-1024-1024-1-1x1-1x1-1x1-0-NCHW-FP16-F=GemmFwdRest:16.9262,1207959552,miopenConvolutionFwdAlgoGEMM;GemmFwdRest_hipblaslt:18.2303,1207959552,miopenConvolutionFwdAlgoGEMM;ConvHipImplicitGemmGroupFwdXdlops:15.8569,268509184,miopenConvolutionFwdAlgoImplicitGEMM;ConvBinWinogradRxSf3x2:6.42843,0,miopenConvolutionFwdAlgoWinograd;ConvBinWinogradRxSf2x3g1:5.06596,0,miopenConvolutionFwdAlgoWinograd
64-2048-2048-3x3-64-2048-2048-1-1x1-1x1-1x1-0-NCHW-FP16-F=GemmFwdRest:78.9872,4831838208,miopenConvolutionFwdAlgoGEMM;GemmFwdRest_hipblaslt:72.9036,4831838208,miopenConvolutionFwdAlgoGEMM;ConvHipImplicitGemmGroupFwdXdlops:62.7753,1073815552,miopenConvolutionFwdAlgoImplicitGEMM;ConvBinWinogradRxSf3x2:38.3841,0,miopenConvolutionFwdAlgoWinograd;ConvBinWinogradRxSf2x3g1:25.5027,0,miopenConvolutionFwdAlgoWinograd
64-2048-2048-3x3-3-2048-2048-1-1x1-1x1-1x1-0-NCHW-FP16-F=GemmFwdRest:65.7009,4831838208,miopenConvolutionFwdAlgoGEMM;GemmFwdRest_hipblaslt:65.5276,4831838208,miopenConvolutionFwdAlgoGEMM;ConvHipImplicitGemmGroupFwdXdlops:46.44,562040320,miopenConvolutionFwdAlgoImplicitGEMM;ConvBinWinogradRxSf3x2:12.78,0,miopenConvolutionFwdAlgoWinograd;ConvBinWinogradRxSf2x3g1:12.7362,0,miopenConvolutionFwdAlgoWinograd
3-512-512-3x3-128-512-512-1-1x1-1x1-1x1-0-NCHW-FP16-F=GemmFwdRest:1.63347,14155776,miopenConvolutionFwdAlgoGEMM;GemmFwdRest_hipblaslt:1.19743,14155776,miopenConvolutionFwdAlgoGEMM;ConvHipImplicitGemmGroupFwdXdlops:2.1886,68688640,miopenConvolutionFwdAlgoImplicitGEMM;ConvBinWinogradRxSf3x2:0.750043,0,miopenConvolutionFwdAlgoWinograd;ConvBinWinogradRxSf2x3g1:0.472383,0,miopenConvolutionFwdAlgoWinograd
128-513-513-3x3-128-256-256-1-0x0-2x2-1x1-0-NCHW-FP16-F=GemmFwdRest:2.27705,150994944,miopenConvolutionFwdAlgoGEMM;GemmFwdRest_hipblaslt:3.04711,150994944,miopenConvolutionFwdAlgoGEMM;ConvHipImplicitGemmGroupFwdXdlops:3.59063,84443392,miopenConvolutionFwdAlgoImplicitGEMM;ConvBinWinogradRxSf3x2:1.80083,0,miopenConvolutionFwdAlgoWinograd;ConvBinWinogradRxSf2x3g1:4.87229,0,miopenConvolutionFwdAlgoWinograd
128-256-256-3x3-256-256-256-1-1x1-1x1-1x1-0-NCHW-FP16-F=GemmFwdRest:2.30262,150994944,miopenConvolutionFwdAlgoGEMM;GemmFwdRest_hipblaslt:5.10694,150994944,miopenConvolutionFwdAlgoGEMM;ConvHipImplicitGemmGroupFwdXdlops:6.72912,50921472,miopenConvolutionFwdAlgoImplicitGEMM;ConvBinWinogradRxSf3x2:3.13749,0,miopenConvolutionFwdAlgoWinograd;ConvBinWinogradRxSf2x3g1:2.71711,0,miopenConvolutionFwdAlgoWinograd
128-256-256-1x1-256-256-256-1-0x0-1x1-1x1-0-NCHW-FP16-F=ConvBinWinogradRxSf2x3g1:1.63564,0,miopenConvolutionFwdAlgoWinograd;GemmFwd1x1_0_1:0.323582,0,miopenConvolutionFwdAlgoGEMM;ConvBinWinogradRxSf3x2:0.680417,0,miopenConvolutionFwdAlgoWinograd;GemmFwd1x1_0_1_hipblaslt:0.386997,0,miopenConvolutionFwdAlgoGEMM;ConvHipImplicitGemmGroupFwdXdlops:1.81826,50397184,miopenConvolutionFwdAlgoImplicitGEMM
256-257-257-3x3-256-128-128-1-0x0-2x2-1x1-0-NCHW-FP16-F=GemmFwdRest:1.38873,75497472,miopenConvolutionFwdAlgoGEMM;GemmFwdRest_hipblaslt:1.90758,75497472,miopenConvolutionFwdAlgoGEMM;ConvHipImplicitGemmGroupFwdXdlops:3.84511,43385344,miopenConvolutionFwdAlgoImplicitGEMM;ConvBinWinogradRxSf3x2:1.51199,0,miopenConvolutionFwdAlgoWinograd;ConvBinWinogradRxSf2x3g1:4.79616,0,miopenConvolutionFwdAlgoWinograd
256-128-128-3x3-512-128-128-1-1x1-1x1-1x1-0-NCHW-FP16-F=GemmFwdRest:1.63083,75497472,miopenConvolutionFwdAlgoGEMM;GemmFwdRest_hipblaslt:3.85845,75497472,miopenConvolutionFwdAlgoGEMM;ConvHipImplicitGemmGroupFwdXdlops:6.34159,27525120,miopenConvolutionFwdAlgoImplicitGEMM;ConvBinWinogradRxSf3x2:3.04556,0,miopenConvolutionFwdAlgoWinograd;ConvBinWinogradRxSf2x3g1:2.51923,0,miopenConvolutionFwdAlgoWinograd
256-128-128-1x1-512-128-128-1-0x0-1x1-1x1-0-NCHW-FP16-F=ConvBinWinogradRxSf2x3g1:1.51424,0,miopenConvolutionFwdAlgoWinograd;GemmFwd1x1_0_1:0.131086,0,miopenConvolutionFwdAlgoGEMM;ConvBinWinogradRxSf3x2:0.552886,0,miopenConvolutionFwdAlgoWinograd;GemmFwd1x1_0_1_hipblaslt:0.223657,0,miopenConvolutionFwdAlgoGEMM;ConvHipImplicitGemmGroupFwdXdlops:1.16735,25427968,miopenConvolutionFwdAlgoImplicitGEMM
512-129-129-3x3-512-64-64-1-0x0-2x2-1x1-0-NCHW-FP16-F=GemmFwdRest:1.07954,37748736,miopenConvolutionFwdAlgoGEMM;GemmFwdRest_hipblaslt:1.50974,37748736,miopenConvolutionFwdAlgoGEMM;ConvHipImplicitGemmGroupFwdXdlops:3.55278,25953280,miopenConvolutionFwdAlgoImplicitGEMM;ConvBinWinogradRxSf3x2:1.68743,0,miopenConvolutionFwdAlgoWinograd;ConvBinWinogradRxSf2x3g1:4.70381,0,miopenConvolutionFwdAlgoWinograd
512-64-64-3x3-8-64-64-1-1x1-1x1-1x1-0-NCHW-FP16-F=GemmFwdRest:0.467012,37748736,miopenConvolutionFwdAlgoGEMM;GemmFwdRest_hipblaslt:0.490779,37748736,miopenConvolutionFwdAlgoGEMM;ConvHipImplicitGemmGroupFwdXdlops:0.512932,4333568,miopenConvolutionFwdAlgoImplicitGEMM;ConvBinWinogradRxSf3x2:0.17965,0,miopenConvolutionFwdAlgoWinograd;ConvBinWinogradRxSf2x3g1:0.0892,0,miopenConvolutionFwdAlgoWinograd
8-64-64-1x1-8-64-64-1-0x0-1x1-1x1-0-NCHW-FP16-F=ConvBinWinogradRxSf2x3g1:0.0380667,0,miopenConvolutionFwdAlgoWinograd;GemmFwd1x1_0_1:0.0390543,0,miopenConvolutionFwdAlgoGEMM;ConvBinWinogradRxSf3x2:0.04086,0,miopenConvolutionFwdAlgoWinograd;GemmFwd1x1_0_1_hipblaslt:0.0193267,0,miopenConvolutionFwdAlgoGEMM;ConvHipImplicitGemmGroupFwdXdlops:0.126057,131328,miopenConvolutionFwdAlgoImplicitGEMM
3-512-512-3x3-16-512-512-2-1x1-1x1-1x1-0-NCHW-FP16-F=GemmFwdRest:0.786657,14155776,miopenConvolutionFwdAlgoGEMM;GemmFwdRest_hipblaslt:0.413173,14155776,miopenConvolutionFwdAlgoGEMM;ConvHipImplicitGemmGroupFwdXdlops:0.739806,19923968,miopenConvolutionFwdAlgoImplicitGEMM;ConvBinWinogradRxSf3x2:0.286043,0,miopenConvolutionFwdAlgoWinograd;ConvBinWinogradRxSf2x3g1:0.264417,0,miopenConvolutionFwdAlgoWinograd
16-512-512-3x3-16-512-512-2-1x1-1x1-1x1-0-NCHW-FP16-F=GemmFwdRest:2.06161,75497472,miopenConvolutionFwdAlgoGEMM;GemmFwdRest_hipblaslt:2.05859,75497472,miopenConvolutionFwdAlgoGEMM;ConvHipImplicitGemmGroupFwdXdlops:1.66578,33559040,miopenConvolutionFwdAlgoImplicitGEMM;ConvBinWinogradRxSf3x2:0.332567,0,miopenConvolutionFwdAlgoWinograd;ConvBinWinogradRxSf2x3g1:0.306167,0,miopenConvolutionFwdAlgoWinograd
16-512-512-3x3-32-256-256-2-1x1-2x2-1x1-0-NCHW-FP16-F=GemmFwdRest:0.733904,18874368,miopenConvolutionFwdAlgoGEMM;GemmFwdRest_hipblaslt:0.53034,18874368,miopenConvolutionFwdAlgoGEMM;ConvHipImplicitGemmGroupFwdXdlops:0.755261,25175040,miopenConvolutionFwdAlgoImplicitGEMM;ConvBinWinogradRxSf3x2:0.14136,0,miopenConvolutionFwdAlgoWinograd;ConvBinWinogradRxSf2x3g1:0.22968,0,miopenConvolutionFwdAlgoWinograd
32-256-256-3x3-32-256-256-2-1x1-1x1-1x1-0-NCHW-FP16-F=GemmFwdRest:1.18688,37748736,miopenConvolutionFwdAlgoGEMM;GemmFwdRest_hipblaslt:1.04648,37748736,miopenConvolutionFwdAlgoGEMM;ConvHipImplicitGemmGroupFwdXdlops:0.746493,16795648,miopenConvolutionFwdAlgoImplicitGEMM;ConvBinWinogradRxSf3x2:0.174683,0,miopenConvolutionFwdAlgoWinograd;ConvBinWinogradRxSf2x3g1:0.13894,0,miopenConvolutionFwdAlgoWinograd
32-256-256-3x3-96-128-128-2-1x1-2x2-1x1-0-NCHW-FP16-F=GemmFwdRest:0.55633,9437184,miopenConvolutionFwdAlgoGEMM;GemmFwdRest_hipblaslt:0.436573,9437184,miopenConvolutionFwdAlgoGEMM;ConvHipImplicitGemmGroupFwdXdlops:0.608834,14735360,miopenConvolutionFwdAlgoImplicitGEMM;ConvBinWinogradRxSf3x2:0.189729,0,miopenConvolutionFwdAlgoWinograd;ConvBinWinogradRxSf2x3g1:0.332229,0,miopenConvolutionFwdAlgoWinograd
96-128-128-3x3-96-128-128-2-1x1-1x1-1x1-0-NCHW-FP16-F=GemmFwdRest:1.00679,28311552,miopenConvolutionFwdAlgoGEMM;GemmFwdRest_hipblaslt:0.749859,28311552,miopenConvolutionFwdAlgoGEMM;ConvHipImplicitGemmGroupFwdXdlops:1.08368,12748800,miopenConvolutionFwdAlgoImplicitGEMM;ConvBinWinogradRxSf3x2:0.296983,0,miopenConvolutionFwdAlgoWinograd;ConvBinWinogradRxSf2x3g1:0.225157,0,miopenConvolutionFwdAlgoWinograd
96-128-128-3x3-256-64-64-2-1x1-2x2-1x1-0-NCHW-FP16-F=GemmFwdRest:0.530584,7077888,miopenConvolutionFwdAlgoGEMM;GemmFwdRest_hipblaslt:0.524359,7077888,miopenConvolutionFwdAlgoGEMM;ConvHipImplicitGemmGroupFwdXdlops:0.782867,10928128,miopenConvolutionFwdAlgoImplicitGEMM;ConvBinWinogradRxSf3x2:0.296157,0,miopenConvolutionFwdAlgoWinograd;ConvBinWinogradRxSf2x3g1:0.51378,0,miopenConvolutionFwdAlgoWinograd
256-64-64-3x3-320-64-64-2-1x1-1x1-1x1-0-NCHW-FP16-F=GemmFwdRest:1.37159,18874368,miopenConvolutionFwdAlgoGEMM;GemmFwdRest_hipblaslt:1.26454,18874368,miopenConvolutionFwdAlgoGEMM;ConvHipImplicitGemmGroupFwdXdlops:1.77621,10911744,miopenConvolutionFwdAlgoImplicitGEMM;ConvBinWinogradRxSf3x2:0.741414,0,miopenConvolutionFwdAlgoWinograd;ConvBinWinogradRxSf2x3g1:0.49838,0,miopenConvolutionFwdAlgoWinograd
320-32-32-1x1-320-32-32-2-0x0-1x1-1x1-0-NCHW-FP16-F=ConvBinWinogradRxSf2x3g1:0.148186,0,miopenConvolutionFwdAlgoWinograd;GemmFwd1x1_0_1:0.0482933,0,miopenConvolutionFwdAlgoGEMM;ConvBinWinogradRxSf3x2:0.101483,0,miopenConvolutionFwdAlgoWinograd;GemmFwd1x1_0_1_hipblaslt:0.0558767,0,miopenConvolutionFwdAlgoGEMM;ConvHipImplicitGemmGroupFwdXdlops:0.212458,2826240,miopenConvolutionFwdAlgoImplicitGEMM
640-16-16-1x1-640-16-16-2-0x0-1x1-1x1-0-NCHW-FP16-F=ConvBinWinogradRxSf2x3g1:0.153743,0,miopenConvolutionFwdAlgoWinograd;GemmFwd1x1_0_1:0.0428483,0,miopenConvolutionFwdAlgoGEMM;ConvBinWinogradRxSf3x2:0.145529,0,miopenConvolutionFwdAlgoWinograd;GemmFwd1x1_0_1_hipblaslt:0.0435883,0,miopenConvolutionFwdAlgoGEMM;ConvHipImplicitGemmGroupFwdXdlops:0.211435,2129920,miopenConvolutionFwdAlgoImplicitGEMM
4-64-64-3x3-320-64-64-1-1x1-1x1-1x1-0-NCHW-FP16-F=GemmFwdRest:0.0808133,294912,miopenConvolutionFwdAlgoGEMM;GemmFwdRest_hipblaslt:0.073272,294912,miopenConvolutionFwdAlgoGEMM;ConvHipImplicitGemmGroupFwdXdlops:0.176254,2677248,miopenConvolutionFwdAlgoImplicitGEMM;ConvBinWinogradRxSf3x2:0.0684286,0,miopenConvolutionFwdAlgoWinograd;ConvBinWinogradRxSf2x3g1:0.0577857,0,miopenConvolutionFwdAlgoWinograd
3-512-512-3x3-16-512-512-1-1x1-1x1-1x1-0-NCHW-FP16-F=GemmFwdRest:0.279827,14155776,miopenConvolutionFwdAlgoGEMM;GemmFwdRest_hipblaslt:0.165984,14155776,miopenConvolutionFwdAlgoGEMM;ConvHipImplicitGemmGroupFwdXdlops:0.334435,9962496,miopenConvolutionFwdAlgoImplicitGEMM;ConvBinWinogradRxSf3x2:0.138857,0,miopenConvolutionFwdAlgoWinograd;ConvBinWinogradRxSf2x3g1:0.136057,0,miopenConvolutionFwdAlgoWinograd
16-512-512-3x3-16-512-512-1-1x1-1x1-1x1-0-NCHW-FP16-F=GemmFwdRest:1.03918,75497472,miopenConvolutionFwdAlgoGEMM;GemmFwdRest_hipblaslt:1.04918,75497472,miopenConvolutionFwdAlgoGEMM;ConvHipImplicitGemmGroupFwdXdlops:0.896293,16781824,miopenConvolutionFwdAlgoImplicitGEMM;ConvBinWinogradRxSf3x2:0.233283,0,miopenConvolutionFwdAlgoWinograd;ConvBinWinogradRxSf2x3g1:0.201233,0,miopenConvolutionFwdAlgoWinograd
16-512-512-3x3-32-256-256-1-1x1-2x2-1x1-0-NCHW-FP16-F=GemmFwdRest:0.210415,18874368,miopenConvolutionFwdAlgoGEMM;GemmFwdRest_hipblaslt:0.204983,18874368,miopenConvolutionFwdAlgoGEMM;ConvHipImplicitGemmGroupFwdXdlops:0.360077,12592128,miopenConvolutionFwdAlgoImplicitGEMM;ConvBinWinogradRxSf3x2:0.114071,0,miopenConvolutionFwdAlgoWinograd;ConvBinWinogradRxSf2x3g1:0.139771,0,miopenConvolutionFwdAlgoWinograd
32-256-256-3x3-32-256-256-1-1x1-1x1-1x1-0-NCHW-FP16-F=GemmFwdRest:0.51673,37748736,miopenConvolutionFwdAlgoGEMM;GemmFwdRest_hipblaslt:0.518856,37748736,miopenConvolutionFwdAlgoGEMM;ConvHipImplicitGemmGroupFwdXdlops:0.450013,8407040,miopenConvolutionFwdAlgoImplicitGEMM;ConvBinWinogradRxSf3x2:0.12004,0,miopenConvolutionFwdAlgoWinograd;ConvBinWinogradRxSf2x3g1:0.0999857,0,miopenConvolutionFwdAlgoWinograd
32-256-256-3x3-96-128-128-1-1x1-2x2-1x1-0-NCHW-FP16-F=GemmFwdRest:0.153538,9437184,miopenConvolutionFwdAlgoGEMM;GemmFwdRest_hipblaslt:0.146819,9437184,miopenConvolutionFwdAlgoGEMM;ConvHipImplicitGemmGroupFwdXdlops:0.301302,7395328,miopenConvolutionFwdAlgoImplicitGEMM;ConvBinWinogradRxSf3x2:0.1112,0,miopenConvolutionFwdAlgoWinograd;ConvBinWinogradRxSf2x3g1:0.163971,0,miopenConvolutionFwdAlgoWinograd
96-128-128-3x3-96-128-128-1-1x1-1x1-1x1-0-NCHW-FP16-F=GemmFwdRest:0.283887,28311552,miopenConvolutionFwdAlgoGEMM;GemmFwdRest_hipblaslt:0.281186,28311552,miopenConvolutionFwdAlgoGEMM;ConvHipImplicitGemmGroupFwdXdlops:0.593701,6457344,miopenConvolutionFwdAlgoImplicitGEMM;ConvBinWinogradRxSf3x2:0.18885,0,miopenConvolutionFwdAlgoWinograd;ConvBinWinogradRxSf2x3g1:0.1322,0,miopenConvolutionFwdAlgoWinograd
96-128-128-3x3-256-64-64-1-1x1-2x2-1x1-0-NCHW-FP16-F=GemmFwdRest:0.154986,7077888,miopenConvolutionFwdAlgoGEMM;GemmFwdRest_hipblaslt:0.15139,7077888,miopenConvolutionFwdAlgoGEMM;ConvHipImplicitGemmGroupFwdXdlops:0.374155,5685248,miopenConvolutionFwdAlgoImplicitGEMM;ConvBinWinogradRxSf3x2:0.167871,0,miopenConvolutionFwdAlgoWinograd;ConvBinWinogradRxSf2x3g1:0.310629,0,miopenConvolutionFwdAlgoWinograd
256-64-64-3x3-320-64-64-1-1x1-1x1-1x1-0-NCHW-FP16-F=GemmFwdRest:0.258038,18874368,miopenConvolutionFwdAlgoGEMM;GemmFwdRest_hipblaslt:0.464779,18874368,miopenConvolutionFwdAlgoGEMM;ConvHipImplicitGemmGroupFwdXdlops:0.91728,6193152,miopenConvolutionFwdAlgoImplicitGEMM;ConvBinWinogradRxSf3x2:0.3717,0,miopenConvolutionFwdAlgoWinograd;ConvBinWinogradRxSf2x3g1:0.264043,0,miopenConvolutionFwdAlgoWinograd
320-64-64-3x3-320-64-64-1-1x1-1x1-1x1-0-NCHW-FP16-F=GemmFwdRest:0.361047,23592960,miopenConvolutionFwdAlgoGEMM;GemmFwdRest_hipblaslt:0.620047,23592960,miopenConvolutionFwdAlgoGEMM;ConvHipImplicitGemmGroupFwdXdlops:1.14601,7086080,miopenConvolutionFwdAlgoImplicitGEMM;ConvBinWinogradRxSf3x2:0.465167,0,miopenConvolutionFwdAlgoWinograd;ConvBinWinogradRxSf2x3g1:0.32776,0,miopenConvolutionFwdAlgoWinograd
320-64-64-1x1-320-64-64-1-0x0-1x1-1x1-0-NCHW-FP16-F=ConvBinWinogradRxSf2x3g1:0.263657,0,miopenConvolutionFwdAlgoWinograd;GemmFwd1x1_0_1:0.035866,0,miopenConvolutionFwdAlgoGEMM;ConvBinWinogradRxSf3x2:0.1371,0,miopenConvolutionFwdAlgoWinograd;GemmFwd1x1_0_1_hipblaslt:0.0675014,0,miopenConvolutionFwdAlgoGEMM;ConvHipImplicitGemmGroupFwdXdlops:0.243528,5447680,miopenConvolutionFwdAlgoImplicitGEMM
320-64-64-3x3-320-32-32-1-1x1-2x2-1x1-0-NCHW-FP16-F=GemmFwdRest:0.215898,5898240,miopenConvolutionFwdAlgoGEMM;GemmFwdRest_hipblaslt:0.219413,5898240,miopenConvolutionFwdAlgoGEMM;ConvHipImplicitGemmGroupFwdXdlops:0.39663,5120000,miopenConvolutionFwdAlgoImplicitGEMM;ConvBinWinogradRxSf3x2:0.15438,0,miopenConvolutionFwdAlgoWinograd;ConvBinWinogradRxSf2x3g1:0.3093,0,miopenConvolutionFwdAlgoWinograd
320-32-32-3x3-640-32-32-1-1x1-1x1-1x1-0-NCHW-FP16-F=GemmFwdRest:0.176094,5898240,miopenConvolutionFwdAlgoGEMM;GemmFwdRest_hipblaslt:0.197467,5898240,miopenConvolutionFwdAlgoGEMM;ConvHipImplicitGemmGroupFwdXdlops:0.584527,5652480,miopenConvolutionFwdAlgoImplicitGEMM;ConvBinWinogradRxSf3x2:0.254,0,miopenConvolutionFwdAlgoWinograd;ConvBinWinogradRxSf2x3g1:0.17345,0,miopenConvolutionFwdAlgoWinograd
640-32-32-3x3-640-32-32-1-1x1-1x1-1x1-0-NCHW-FP16-F=GemmFwdRest:0.270643,11796480,miopenConvolutionFwdAlgoGEMM;GemmFwdRest_hipblaslt:0.395972,11796480,miopenConvolutionFwdAlgoGEMM;ConvHipImplicitGemmGroupFwdXdlops:1.17908,9994240,miopenConvolutionFwdAlgoImplicitGEMM;ConvBinWinogradRxSf3x2:0.469743,0,miopenConvolutionFwdAlgoWinograd;ConvBinWinogradRxSf2x3g1:0.3199,0,miopenConvolutionFwdAlgoWinograd
320-32-32-1x1-640-32-32-1-0x0-1x1-1x1-0-NCHW-FP16-F=ConvBinWinogradRxSf2x3g1:0.13075,0,miopenConvolutionFwdAlgoWinograd;GemmFwd1x1_0_1:0.030212,0,miopenConvolutionFwdAlgoGEMM;ConvBinWinogradRxSf3x2:0.0896333,0,miopenConvolutionFwdAlgoWinograd;GemmFwd1x1_0_1_hipblaslt:0.0471414,0,miopenConvolutionFwdAlgoGEMM;ConvHipImplicitGemmGroupFwdXdlops:0.192014,2375680,miopenConvolutionFwdAlgoImplicitGEMM
640-32-32-1x1-640-32-32-1-0x0-1x1-1x1-0-NCHW-FP16-F=ConvBinWinogradRxSf2x3g1:0.2361,0,miopenConvolutionFwdAlgoWinograd;GemmFwd1x1_0_1:0.107763,0,miopenConvolutionFwdAlgoGEMM;ConvBinWinogradRxSf3x2:0.12345,0,miopenConvolutionFwdAlgoWinograd;GemmFwd1x1_0_1_hipblaslt:0.0458671,0,miopenConvolutionFwdAlgoGEMM;ConvHipImplicitGemmGroupFwdXdlops:0.236838,3440640,miopenConvolutionFwdAlgoImplicitGEMM
640-32-32-3x3-640-16-16-1-1x1-2x2-1x1-0-NCHW-FP16-F=GemmFwdRest:0.236276,2949120,miopenConvolutionFwdAlgoGEMM;GemmFwdRest_hipblaslt:0.210649,2949120,miopenConvolutionFwdAlgoGEMM;ConvHipImplicitGemmGroupFwdXdlops:0.47411,9011200,miopenConvolutionFwdAlgoImplicitGEMM;ConvBinWinogradRxSf3x2:0.250117,0,miopenConvolutionFwdAlgoWinograd;ConvBinWinogradRxSf2x3g1:0.324029,0,miopenConvolutionFwdAlgoWinograd
640-16-16-3x3-1280-16-16-1-1x1-1x1-1x1-0-NCHW-FP16-F=GemmFwdRest:0.196155,2949120,miopenConvolutionFwdAlgoGEMM;GemmFwdRest_hipblaslt:0.224258,2949120,miopenConvolutionFwdAlgoGEMM;ConvHipImplicitGemmGroupFwdXdlops:0.717534,15728640,miopenConvolutionFwdAlgoImplicitGEMM;ConvBinWinogradRxSf3x2:0.449886,0,miopenConvolutionFwdAlgoWinograd;ConvBinWinogradRxSf2x3g1:0.1769,0,miopenConvolutionFwdAlgoWinograd
1280-16-16-3x3-1280-16-16-1-1x1-1x1-1x1-0-NCHW-FP16-F=GemmFwdRest:0.398667,5898240,miopenConvolutionFwdAlgoGEMM;GemmFwdRest_hipblaslt:0.432634,5898240,miopenConvolutionFwdAlgoGEMM;ConvHipImplicitGemmGroupFwdXdlops:1.37853,30801920,miopenConvolutionFwdAlgoImplicitGEMM;ConvBinWinogradRxSf3x2:0.844729,0,miopenConvolutionFwdAlgoWinograd;ConvBinWinogradRxSf2x3g1:0.293617,0,miopenConvolutionFwdAlgoWinograd
640-16-16-1x1-1280-16-16-1-0x0-1x1-1x1-0-NCHW-FP16-F=ConvBinWinogradRxSf2x3g1:0.155971,0,miopenConvolutionFwdAlgoWinograd;GemmFwd1x1_0_1:0.0583929,0,miopenConvolutionFwdAlgoGEMM;ConvBinWinogradRxSf3x2:0.148871,0,miopenConvolutionFwdAlgoWinograd;GemmFwd1x1_0_1_hipblaslt:0.0453833,0,miopenConvolutionFwdAlgoGEMM;ConvHipImplicitGemmGroupFwdXdlops:0.244828,2621440,miopenConvolutionFwdAlgoImplicitGEMM
1280-16-16-1x1-1280-16-16-1-0x0-1x1-1x1-0-NCHW-FP16-F=ConvBinWinogradRxSf2x3g1:0.236857,0,miopenConvolutionFwdAlgoWinograd;GemmFwd1x1_0_1:0.120754,0,miopenConvolutionFwdAlgoGEMM;ConvBinWinogradRxSf3x2:0.1888,0,miopenConvolutionFwdAlgoWinograd;GemmFwd1x1_0_1_hipblaslt:0.04523,0,miopenConvolutionFwdAlgoGEMM;ConvHipImplicitGemmGroupFwdXdlops:0.305469,4587520,miopenConvolutionFwdAlgoImplicitGEMM
1280-16-16-3x3-1280-8-8-1-1x1-2x2-1x1-0-NCHW-FP16-F=GemmFwdRest:0.417078,1474560,miopenConvolutionFwdAlgoGEMM;GemmFwdRest_hipblaslt:0.271744,1474560,miopenConvolutionFwdAlgoGEMM;ConvHipImplicitGemmGroupFwdXdlops:0.836923,30310400,miopenConvolutionFwdAlgoImplicitGEMM;ConvBinWinogradRxSf3x2:0.48798,0,miopenConvolutionFwdAlgoWinograd;ConvBinWinogradRxSf2x3g1:0.619043,0,miopenConvolutionFwdAlgoWinograd
1280-8-8-3x3-1280-8-8-1-1x1-1x1-1x1-0-NCHW-FP16-F=GemmFwdRest:0.329652,1474560,miopenConvolutionFwdAlgoGEMM;GemmFwdRest_hipblaslt:0.220283,1474560,miopenConvolutionFwdAlgoGEMM;ConvHipImplicitGemmGroupFwdXdlops:0.7576,29818880,miopenConvolutionFwdAlgoImplicitGEMM;ConvBinWinogradRxSf3x2:0.3895,0,miopenConvolutionFwdAlgoWinograd;ConvBinWinogradRxSf2x3g1:0.154714,0,miopenConvolutionFwdAlgoWinograd
1280-8-8-1x1-1280-8-8-1-0x0-1x1-1x1-0-NCHW-FP16-F=ConvBinWinogradRxSf2x3g1:0.13295,0,miopenConvolutionFwdAlgoWinograd;GemmFwd1x1_0_1:0.0547217,0,miopenConvolutionFwdAlgoGEMM;ConvBinWinogradRxSf3x2:0.118129,0,miopenConvolutionFwdAlgoWinograd;GemmFwd1x1_0_1_hipblaslt:0.0380514,0,miopenConvolutionFwdAlgoGEMM;ConvHipImplicitGemmGroupFwdXdlops:0.214812,3604480,miopenConvolutionFwdAlgoImplicitGEMM
320-32-32-1x1-320-32-32-1-0x0-1x1-1x1-0-NCHW-FP16-F=ConvBinWinogradRxSf2x3g1:0.0895429,0,miopenConvolutionFwdAlgoWinograd;GemmFwd1x1_0_1:0.02268,0,miopenConvolutionFwdAlgoGEMM;ConvBinWinogradRxSf3x2:0.0718833,0,miopenConvolutionFwdAlgoWinograd;GemmFwd1x1_0_1_hipblaslt:0.0301433,0,miopenConvolutionFwdAlgoGEMM;ConvHipImplicitGemmGroupFwdXdlops:0.169355,1515520,miopenConvolutionFwdAlgoImplicitGEMM
640-16-16-1x1-640-16-16-1-0x0-1x1-1x1-0-NCHW-FP16-F=ConvBinWinogradRxSf2x3g1:0.084675,0,miopenConvolutionFwdAlgoWinograd;GemmFwd1x1_0_1:0.0299033,0,miopenConvolutionFwdAlgoGEMM;ConvBinWinogradRxSf3x2:0.0829429,0,miopenConvolutionFwdAlgoWinograd;GemmFwd1x1_0_1_hipblaslt:0.0251267,0,miopenConvolutionFwdAlgoGEMM;ConvHipImplicitGemmGroupFwdXdlops:0.17347,1474560,miopenConvolutionFwdAlgoImplicitGEMM
3-384-384-16x16-1024-24-24-1-0x0-16x16-1x1-0-NCHW-FP16-F=GemmFwdRest:0.155078,884736,miopenConvolutionFwdAlgoGEMM;GemmFwdRest_hipblaslt:0.124438,884736,miopenConvolutionFwdAlgoGEMM;ConvHipImplicitGemmGroupFwdXdlops:0.237486,3637248,miopenConvolutionFwdAlgoImplicitGEMM
48-23-44-80-3x3x3-512-21-44-80-1-0x1x1-1x1x1-1x1x1-0-NCDHW-FP16-F=GemmFwdRest:6.84769,191600640,miopenConvolutionFwdAlgoGEMM;ConvHipImplicitGemm3DGroupFwdXdlops:20.8225,84793344,miopenConvolutionFwdAlgoImplicitGEMM;GemmFwdRest_hipblaslt:7.58396,191600640,miopenConvolutionFwdAlgoGEMM
512-25-44-80-5x5x5-512-21-44-80-1-0x2x2-1x1x1-1x1x1-0-NCDHW-FP16-F_g512=ConvHipImplicitGemm3DGroupFwdXdlops:770.075,165934080,miopenConvolutionFwdAlgoImplicitGEMM
512-21-44-80-1x1x1-512-21-44-80-1-0x0x0-1x1x1-1x1x1-0-NCDHW-FP16-F=GemmFwd1x1_0_1:1.2295,0,miopenConvolutionFwdAlgoGEMM;GemmFwd1x1_0_1_hipblaslt:2.0076,0,miopenConvolutionFwdAlgoGEMM;ConvHipImplicitGemm3DGroupFwdXdlops:11.5953,151912448,miopenConvolutionFwdAlgoImplicitGEMM
512-23-44-80-3x3x3-256-21-44-80-1-0x1x1-1x1x1-1x1x1-0-NCDHW-FP16-F=GemmFwdRest:111.96,2043740160,miopenConvolutionFwdAlgoGEMM;ConvHipImplicitGemm3DGroupFwdXdlops:102.211,127827968,miopenConvolutionFwdAlgoImplicitGEMM;GemmFwdRest_hipblaslt:139.556,2043740160,miopenConvolutionFwdAlgoGEMM
256-23-44-80-3x3x3-256-21-44-80-1-0x1x1-1x1x1-1x1x1-0-NCDHW-FP16-F=GemmFwdRest:54.5756,1021870080,miopenConvolutionFwdAlgoGEMM;ConvHipImplicitGemm3DGroupFwdXdlops:50.2013,82837504,miopenConvolutionFwdAlgoImplicitGEMM;GemmFwdRest_hipblaslt:76.7083,1021870080,miopenConvolutionFwdAlgoGEMM
512-21-44-80-1x1x1-256-21-44-80-1-0x0x0-1x1x1-1x1x1-0-NCDHW-FP16-F=GemmFwd1x1_0_1:0.661207,0,miopenConvolutionFwdAlgoGEMM;GemmFwd1x1_0_1_hipblaslt:0.90864,0,miopenConvolutionFwdAlgoGEMM;ConvHipImplicitGemm3DGroupFwdXdlops:6.1892,113803264,miopenConvolutionFwdAlgoImplicitGEMM
256-23-44-80-3x3x3-2048-21-44-80-1-0x1x1-1x1x1-1x1x1-0-NCDHW-FP16-F=GemmFwdRest:274.776,1021870080,miopenConvolutionFwdAlgoGEMM;ConvHipImplicitGemm3DGroupFwdXdlops:445.995,372539392,miopenConvolutionFwdAlgoImplicitGEMM;GemmFwdRest_hipblaslt:379.091,1021870080,miopenConvolutionFwdAlgoGEMM
256-43-88-160-3x3x3-256-41-88-160-1-0x1x1-1x1x1-1x1x1-0-NCDHW-FP16-F=ConvHipImplicitGemm3DGroupFwdXdlops:394.246,609091584,miopenConvolutionFwdAlgoImplicitGEMM
256-43-88-160-3x3x3-64-41-88-160-1-0x1x1-1x1x1-1x1x1-0-NCDHW-FP16-F=ConvHipImplicitGemm3DGroupFwdXdlops:110.689,384761856,miopenConvolutionFwdAlgoImplicitGEMM
64-43-88-160-3x3x3-64-41-88-160-1-0x1x1-1x1x1-1x1x1-0-NCDHW-FP16-F=GemmFwdRest:80.6708,1995079680,miopenConvolutionFwdAlgoGEMM;ConvHipImplicitGemm3DGroupFwdXdlops:26.8052,151609344,miopenConvolutionFwdAlgoImplicitGEMM;GemmFwdRest_hipblaslt:75.6501,1995079680,miopenConvolutionFwdAlgoGEMM
256-41-88-160-1x1x1-64-41-88-160-1-0x0x0-1x1x1-1x1x1-0-NCDHW-FP16-F=GemmFwd1x1_0_1:1.79241,0,miopenConvolutionFwdAlgoGEMM;GemmFwd1x1_0_1_hipblaslt:1.96107,0,miopenConvolutionFwdAlgoGEMM;ConvHipImplicitGemm3DGroupFwdXdlops:9.78588,369491968,miopenConvolutionFwdAlgoImplicitGEMM
64-43-88-160-3x3x3-512-41-88-160-1-0x1x1-1x1x1-1x1x1-0-NCDHW-FP16-F=GemmFwdRest:120.032,1995079680,miopenConvolutionFwdAlgoGEMM;ConvHipImplicitGemm3DGroupFwdXdlops:212.914,670400512,miopenConvolutionFwdAlgoImplicitGEMM;GemmFwdRest_hipblaslt:139.509,1995079680,miopenConvolutionFwdAlgoGEMM
64-83-176-320-3x3x3-64-81-176-320-1-0x1x1-1x1x1-1x1x1-0-NCDHW-FP16-F=ConvHipImplicitGemm3DGroupFwdXdlops:198.553,1182490624,miopenConvolutionFwdAlgoImplicitGEMM
64-83-176-320-3x3x3-32-81-176-320-1-0x1x1-1x1x1-1x1x1-0-NCDHW-FP16-F=ConvHipImplicitGemm3DGroupFwdXdlops:192.934,890417152,miopenConvolutionFwdAlgoImplicitGEMM
32-83-176-320-3x3x3-32-81-176-320-1-0x1x1-1x1x1-1x1x1-0-NCDHW-FP16-F=ConvHipImplicitGemm3DGroupFwdXdlops:101.385,591190016,miopenConvolutionFwdAlgoImplicitGEMM
64-81-176-320-1x1x1-32-81-176-320-1-0x0x0-1x1x1-1x1x1-0-NCDHW-FP16-F=GemmFwd1x1_0_1:6.14831,0,miopenConvolutionFwdAlgoGEMM;GemmFwd1x1_0_1_hipblaslt:5.0032,0,miopenConvolutionFwdAlgoGEMM;ConvHipImplicitGemm3DGroupFwdXdlops:22.417,875892736,miopenConvolutionFwdAlgoImplicitGEMM
32-83-176-320-3x3x3-128-81-176-320-1-0x1x1-1x1x1-1x1x1-0-NCDHW-FP16-F=ConvHipImplicitGemm3DGroupFwdXdlops:231.056,1467244544,miopenConvolutionFwdAlgoImplicitGEMM
32-83-352-640-3x3x3-32-81-352-640-1-0x1x1-1x1x1-1x1x1-0-NCDHW-FP16-F=ConvHipImplicitGemm3DGroupFwdXdlops:413.618,2364594176,miopenConvolutionFwdAlgoImplicitGEMM
32-352-640-3x3-32-352-640-1-1x1-1x1-1x1-0-NCHW-FP16-F=GemmFwdRest:2.04388,129761280,miopenConvolutionFwdAlgoGEMM;GemmFwdRest_hipblaslt:2.04763,129761280,miopenConvolutionFwdAlgoGEMM;ConvHipImplicitGemmGroupFwdXdlops:1.51766,28854272,miopenConvolutionFwdAlgoImplicitGEMM;ConvBinWinogradRxSf3x2:0.338843,0,miopenConvolutionFwdAlgoWinograd;ConvBinWinogradRxSf2x3g1:0.27064,0,miopenConvolutionFwdAlgoWinograd
8-83-704-1280-3x3x3-3-81-704-1280-1-0x1x1-1x1x1-1x1x1-0-NCDHW-FP16-F=ConvHipImplicitGemm3DGroupFwdXdlops:451.411,1634633216,miopenConvolutionFwdAlgoImplicitGEMM
48-23-30-52-3x3x3-512-21-30-52-1-0x1x1-1x1x1-1x1x1-0-NCDHW-FP16-F=GemmFwdRest:3.52937,84913920,miopenConvolutionFwdAlgoGEMM;ConvHipImplicitGemm3DGroupFwdXdlops:9.02583,38317824,miopenConvolutionFwdAlgoImplicitGEMM;GemmFwdRest_hipblaslt:4.42107,84913920,miopenConvolutionFwdAlgoGEMM
512-25-30-52-5x5x5-512-21-30-52-1-0x2x2-1x1x1-1x1x1-0-NCDHW-FP16-F_g512=GemmFwdRest:190.834,4193280000,miopenConvolutionFwdAlgoGEMM;ConvHipImplicitGemm3DGroupFwdXdlops:299.069,73610240,miopenConvolutionFwdAlgoImplicitGEMM;GemmFwdRest_hipblaslt:174.196,4193280000,miopenConvolutionFwdAlgoGEMM
512-21-30-52-1x1x1-512-21-30-52-1-0x0x0-1x1x1-1x1x1-0-NCDHW-FP16-F=GemmFwd1x1_0_1:0.685197,0,miopenConvolutionFwdAlgoGEMM;GemmFwd1x1_0_1_hipblaslt:0.903929,0,miopenConvolutionFwdAlgoGEMM;ConvHipImplicitGemm3DGroupFwdXdlops:4.86685,67616768,miopenConvolutionFwdAlgoImplicitGEMM
512-23-30-52-3x3x3-256-21-30-52-1-0x1x1-1x1x1-1x1x1-0-NCDHW-FP16-F=GemmFwdRest:36.7198,905748480,miopenConvolutionFwdAlgoGEMM;ConvHipImplicitGemm3DGroupFwdXdlops:44.2751,60592128,miopenConvolutionFwdAlgoImplicitGEMM;GemmFwdRest_hipblaslt:40.27,905748480,miopenConvolutionFwdAlgoGEMM
256-23-30-52-3x3x3-256-21-30-52-1-0x1x1-1x1x1-1x1x1-0-NCDHW-FP16-F=GemmFwdRest:19.3177,452874240,miopenConvolutionFwdAlgoGEMM;ConvHipImplicitGemm3DGroupFwdXdlops:23.8286,38682624,miopenConvolutionFwdAlgoImplicitGEMM;GemmFwdRest_hipblaslt:24.6407,452874240,miopenConvolutionFwdAlgoGEMM
512-21-30-52-1x1x1-256-21-30-52-1-0x0x0-1x1x1-1x1x1-0-NCDHW-FP16-F=GemmFwd1x1_0_1:0.351862,0,miopenConvolutionFwdAlgoGEMM;GemmFwd1x1_0_1_hipblaslt:0.455907,0,miopenConvolutionFwdAlgoGEMM;ConvHipImplicitGemm3DGroupFwdXdlops:2.51697,50581504,miopenConvolutionFwdAlgoImplicitGEMM
256-23-30-52-3x3x3-2048-21-30-52-1-0x1x1-1x1x1-1x1x1-0-NCDHW-FP16-F=GemmFwdRest:102.995,452874240,miopenConvolutionFwdAlgoGEMM;ConvHipImplicitGemm3DGroupFwdXdlops:181.989,180867072,miopenConvolutionFwdAlgoImplicitGEMM;GemmFwdRest_hipblaslt:117.2,452874240,miopenConvolutionFwdAlgoGEMM
256-43-60-104-3x3x3-256-41-60-104-1-0x1x1-1x1x1-1x1x1-0-NCDHW-FP16-F=GemmFwdRest:223.399,3536732160,miopenConvolutionFwdAlgoGEMM;ConvHipImplicitGemm3DGroupFwdXdlops:236.233,271908864,miopenConvolutionFwdAlgoImplicitGEMM;GemmFwdRest_hipblaslt:273.149,3536732160,miopenConvolutionFwdAlgoGEMM
256-43-60-104-3x3x3-64-41-60-104-1-0x1x1-1x1x1-1x1x1-0-NCDHW-FP16-F=GemmFwdRest:160.855,3536732160,miopenConvolutionFwdAlgoGEMM;ConvHipImplicitGemm3DGroupFwdXdlops:45.6491,171012096,miopenConvolutionFwdAlgoImplicitGEMM;GemmFwdRest_hipblaslt:153.349,3536732160,miopenConvolutionFwdAlgoGEMM
64-43-60-104-3x3x3-64-41-60-104-1-0x1x1-1x1x1-1x1x1-0-NCDHW-FP16-F=GemmFwdRest:26.1869,884183040,miopenConvolutionFwdAlgoGEMM;ConvHipImplicitGemm3DGroupFwdXdlops:11.7366,67313664,miopenConvolutionFwdAlgoImplicitGEMM;GemmFwdRest_hipblaslt:25.2748,884183040,miopenConvolutionFwdAlgoGEMM
256-41-60-104-1x1x1-64-41-60-104-1-0x0x0-1x1x1-1x1x1-0-NCDHW-FP16-F=GemmFwd1x1_0_1:0.864355,0,miopenConvolutionFwdAlgoGEMM;GemmFwd1x1_0_1_hipblaslt:0.893426,0,miopenConvolutionFwdAlgoGEMM;ConvHipImplicitGemm3DGroupFwdXdlops:7.78266,163770368,miopenConvolutionFwdAlgoImplicitGEMM
64-43-60-104-3x3x3-512-41-60-104-1-0x1x1-1x1x1-1x1x1-0-NCDHW-FP16-F=GemmFwdRest:50.7102,884183040,miopenConvolutionFwdAlgoGEMM;ConvHipImplicitGemm3DGroupFwdXdlops:92.3759,298094592,miopenConvolutionFwdAlgoImplicitGEMM;GemmFwdRest_hipblaslt:52.7944,884183040,miopenConvolutionFwdAlgoGEMM
64-83-120-208-3x3x3-64-81-120-208-1-0x1x1-1x1x1-1x1x1-0-NCDHW-FP16-F=GemmFwdRest:375.672,6987202560,miopenConvolutionFwdAlgoGEMM;ConvHipImplicitGemm3DGroupFwdXdlops:89.0325,524181504,miopenConvolutionFwdAlgoImplicitGEMM;GemmFwdRest_hipblaslt:378.867,6987202560,miopenConvolutionFwdAlgoGEMM
64-83-120-208-3x3x3-32-81-120-208-1-0x1x1-1x1x1-1x1x1-0-NCDHW-FP16-F=GemmFwdRest:358.569,6987202560,miopenConvolutionFwdAlgoGEMM;ConvHipImplicitGemm3DGroupFwdXdlops:83.6909,394678272,miopenConvolutionFwdAlgoImplicitGEMM;GemmFwdRest_hipblaslt:376.927,6987202560,miopenConvolutionFwdAlgoGEMM
32-83-120-208-3x3x3-32-81-120-208-1-0x1x1-1x1x1-1x1x1-0-NCDHW-FP16-F=GemmFwdRest:121.753,3493601280,miopenConvolutionFwdAlgoGEMM;ConvHipImplicitGemm3DGroupFwdXdlops:42.8477,262035456,miopenConvolutionFwdAlgoImplicitGEMM;GemmFwdRest_hipblaslt:116.738,3493601280,miopenConvolutionFwdAlgoGEMM
64-81-120-208-1x1x1-32-81-120-208-1-0x0x0-1x1x1-1x1x1-0-NCDHW-FP16-F=GemmFwd1x1_0_1:1.97882,0,miopenConvolutionFwdAlgoGEMM;GemmFwd1x1_0_1_hipblaslt:1.85494,0,miopenConvolutionFwdAlgoGEMM;ConvHipImplicitGemm3DGroupFwdXdlops:8.59622,388182016,miopenConvolutionFwdAlgoImplicitGEMM
32-83-120-208-3x3x3-128-81-120-208-1-0x1x1-1x1x1-1x1x1-0-NCDHW-FP16-F=GemmFwdRest:128.68,3493601280,miopenConvolutionFwdAlgoGEMM;ConvHipImplicitGemm3DGroupFwdXdlops:90.9804,650379264,miopenConvolutionFwdAlgoImplicitGEMM;GemmFwdRest_hipblaslt:129.134,3493601280,miopenConvolutionFwdAlgoGEMM
32-83-240-416-3x3x3-32-81-240-416-1-0x1x1-1x1x1-1x1x1-0-NCDHW-FP16-F=ConvHipImplicitGemm3DGroupFwdXdlops:182.361,1047975936,miopenConvolutionFwdAlgoImplicitGEMM
32-240-416-3x3-32-240-416-1-1x1-1x1-1x1-0-NCHW-FP16-F=GemmFwdRest:0.797513,57507840,miopenConvolutionFwdAlgoGEMM;GemmFwdRest_hipblaslt:0.788424,57507840,miopenConvolutionFwdAlgoGEMM;ConvHipImplicitGemmGroupFwdXdlops:0.689781,12797952,miopenConvolutionFwdAlgoImplicitGEMM;ConvBinWinogradRxSf3x2:0.169883,0,miopenConvolutionFwdAlgoWinograd;ConvBinWinogradRxSf2x3g1:0.14135,0,miopenConvolutionFwdAlgoWinograd
8-83-480-832-3x3x3-3-81-480-832-1-0x1x1-1x1x1-1x1x1-0-NCDHW-FP16-F=ConvHipImplicitGemm3DGroupFwdXdlops:192.158,724440576,miopenConvolutionFwdAlgoImplicitGEMM
12-3-242-418-3x3x3-160-1-240-416-1-0x0x0-1x1x1-1x1x1-0-NCDHW-FP16-F=GemmFwdRest:2.14273,64696320,miopenConvolutionFwdAlgoGEMM;ConvHipImplicitGemm3DGroupFwdXdlops:3.13247,39335936,miopenConvolutionFwdAlgoImplicitGEMM;GemmFwdRest_hipblaslt:2.18227,64696320,miopenConvolutionFwdAlgoGEMM
160-3-242-418-3x3x3-160-1-240-416-1-0x0x0-1x1x1-1x1x1-0-NCDHW-FP16-F=GemmFwdRest:34.6928,862617600,miopenConvolutionFwdAlgoGEMM;ConvHipImplicitGemm3DGroupFwdXdlops:33.7426,130440960,miopenConvolutionFwdAlgoImplicitGEMM;GemmFwdRest_hipblaslt:38.66,862617600,miopenConvolutionFwdAlgoGEMM
160-241-417-3x3-160-120-208-1-0x0-2x2-1x1-0-NCHW-FP16-F=GemmFwdRest:1.52729,71884800,miopenConvolutionFwdAlgoGEMM;GemmFwdRest_hipblaslt:1.47909,71884800,miopenConvolutionFwdAlgoGEMM;ConvHipImplicitGemmGroupFwdXdlops:2.43283,40607232,miopenConvolutionFwdAlgoImplicitGEMM;ConvBinWinogradRxSf3x2:0.75714,0,miopenConvolutionFwdAlgoWinograd;ConvBinWinogradRxSf2x3g1:2.26029,0,miopenConvolutionFwdAlgoWinograd
160-1-120-208-1x1x1-320-1-120-208-1-0x0x0-1x1x1-1x1x1-0-NCDHW-FP16-F=GemmFwd1x1_0_1:0.0968157,0,miopenConvolutionFwdAlgoGEMM;GemmFwd1x1_0_1_hipblaslt:0.134433,0,miopenConvolutionFwdAlgoGEMM;ConvHipImplicitGemm3DGroupFwdXdlops:0.80906,24064000,miopenConvolutionFwdAlgoImplicitGEMM
160-3-122-210-3x3x3-320-1-120-208-1-0x0x0-1x1x1-1x1x1-0-NCDHW-FP16-F=GemmFwdRest:8.93495,215654400,miopenConvolutionFwdAlgoGEMM;ConvHipImplicitGemm3DGroupFwdXdlops:13.7658,43334400,miopenConvolutionFwdAlgoImplicitGEMM;GemmFwdRest_hipblaslt:12.7509,215654400,miopenConvolutionFwdAlgoGEMM
320-3-122-210-3x3x3-320-1-120-208-1-0x0x0-1x1x1-1x1x1-0-NCDHW-FP16-F=GemmFwdRest:22.9916,431308800,miopenConvolutionFwdAlgoGEMM;ConvHipImplicitGemm3DGroupFwdXdlops:27.1573,70694400,miopenConvolutionFwdAlgoImplicitGEMM;GemmFwdRest_hipblaslt:28.0687,431308800,miopenConvolutionFwdAlgoGEMM
320-121-209-3x3-320-60-104-1-0x0-2x2-1x1-0-NCHW-FP16-F=GemmFwdRest:1.03645,35942400,miopenConvolutionFwdAlgoGEMM;GemmFwdRest_hipblaslt:1.07613,35942400,miopenConvolutionFwdAlgoGEMM;ConvHipImplicitGemmGroupFwdXdlops:2.07209,22021888,miopenConvolutionFwdAlgoImplicitGEMM;ConvBinWinogradRxSf3x2:0.8487,0,miopenConvolutionFwdAlgoWinograd;ConvBinWinogradRxSf2x3g1:2.28016,0,miopenConvolutionFwdAlgoWinograd
320-1-60-104-1x1x1-640-1-60-104-1-0x0x0-1x1x1-1x1x1-0-NCDHW-FP16-F=GemmFwd1x1_0_1:0.0844057,0,miopenConvolutionFwdAlgoGEMM;GemmFwd1x1_0_1_hipblaslt:0.131147,0,miopenConvolutionFwdAlgoGEMM;ConvHipImplicitGemm3DGroupFwdXdlops:0.54489,12390400,miopenConvolutionFwdAlgoImplicitGEMM
320-3-62-106-3x3x3-640-1-60-104-1-0x0x0-1x1x1-1x1x1-0-NCDHW-FP16-F=GemmFwdRest:5.71093,107827200,miopenConvolutionFwdAlgoGEMM;ConvHipImplicitGemm3DGroupFwdXdlops:13.7011,31664640,miopenConvolutionFwdAlgoImplicitGEMM;GemmFwdRest_hipblaslt:9.31961,107827200,miopenConvolutionFwdAlgoGEMM
640-3-62-106-3x3x3-640-1-60-104-1-0x0x0-1x1x1-1x1x1-0-NCDHW-FP16-F=GemmFwdRest:14.6437,215654400,miopenConvolutionFwdAlgoGEMM;ConvHipImplicitGemm3DGroupFwdXdlops:27.6933,55342080,miopenConvolutionFwdAlgoImplicitGEMM;GemmFwdRest_hipblaslt:21.6259,215654400,miopenConvolutionFwdAlgoGEMM
640-61-105-3x3-640-30-52-1-0x0-2x2-1x1-0-NCHW-FP16-F=GemmFwdRest:0.69903,17971200,miopenConvolutionFwdAlgoGEMM;GemmFwdRest_hipblaslt:0.882267,17971200,miopenConvolutionFwdAlgoGEMM;ConvHipImplicitGemmGroupFwdXdlops:1.97733,17568000,miopenConvolutionFwdAlgoImplicitGEMM;ConvBinWinogradRxSf3x2:0.852657,0,miopenConvolutionFwdAlgoWinograd;ConvBinWinogradRxSf2x3g1:2.62821,0,miopenConvolutionFwdAlgoWinograd
640-3-32-54-3x3x3-640-1-30-52-1-0x0x0-1x1x1-1x1x1-0-NCDHW-FP16-F=GemmFwdRest:2.89107,53913600,miopenConvolutionFwdAlgoGEMM;ConvHipImplicitGemm3DGroupFwdXdlops:7.37408,30750720,miopenConvolutionFwdAlgoImplicitGEMM;GemmFwdRest_hipblaslt:3.58355,53913600,miopenConvolutionFwdAlgoGEMM
640-30-52-1x1-1920-30-52-1-0x0-1x1-1x1-0-NCHW-FP16-F=ConvBinWinogradRxSf2x3g1:1.3463,0,miopenConvolutionFwdAlgoWinograd;GemmFwd1x1_0_1:0.143244,0,miopenConvolutionFwdAlgoGEMM;ConvBinWinogradRxSf3x2:0.5005,0,miopenConvolutionFwdAlgoWinograd;GemmFwd1x1_0_1_hipblaslt:0.174917,0,miopenConvolutionFwdAlgoGEMM;ConvHipImplicitGemmGroupFwdXdlops:0.698157,10444800,miopenConvolutionFwdAlgoImplicitGEMM
640-30-52-1x1-640-30-52-1-0x0-1x1-1x1-0-NCHW-FP16-F=ConvBinWinogradRxSf2x3g1:0.568343,0,miopenConvolutionFwdAlgoWinograd;GemmFwd1x1_0_1:0.0948383,0,miopenConvolutionFwdAlgoGEMM;ConvBinWinogradRxSf3x2:0.300514,0,miopenConvolutionFwdAlgoWinograd;GemmFwd1x1_0_1_hipblaslt:0.113605,0,miopenConvolutionFwdAlgoGEMM;ConvHipImplicitGemmGroupFwdXdlops:0.554078,4812800,miopenConvolutionFwdAlgoImplicitGEMM
640-3-32-54-3x3x3-96-1-30-52-1-0x0x0-1x1x1-1x1x1-0-NCDHW-FP16-F=GemmFwdRest:1.88312,53913600,miopenConvolutionFwdAlgoGEMM;ConvHipImplicitGemm3DGroupFwdXdlops:1.62286,10252800,miopenConvolutionFwdAlgoImplicitGEMM;GemmFwdRest_hipblaslt:1.35688,53913600,miopenConvolutionFwdAlgoGEMM
12-6-242-418-3x3x3-160-4-240-416-1-0x0x0-1x1x1-1x1x1-0-NCDHW-FP16-F=GemmFwdRest:8.64471,258785280,miopenConvolutionFwdAlgoGEMM;ConvHipImplicitGemm3DGroupFwdXdlops:13.064,142465536,miopenConvolutionFwdAlgoImplicitGEMM;GemmFwdRest_hipblaslt:10.4684,258785280,miopenConvolutionFwdAlgoGEMM
160-6-242-418-3x3x3-160-4-240-416-1-0x0x0-1x1x1-1x1x1-0-NCDHW-FP16-F=GemmFwdRest:173.041,3450470400,miopenConvolutionFwdAlgoGEMM;ConvHipImplicitGemm3DGroupFwdXdlops:123.859,323397120,miopenConvolutionFwdAlgoImplicitGEMM;GemmFwdRest_hipblaslt:174.939,3450470400,miopenConvolutionFwdAlgoGEMM
160-241-417-3x3-160-120-208-4-0x0-2x2-1x1-0-NCHW-FP16-F=GemmFwdRest:6.44839,71884800,miopenConvolutionFwdAlgoGEMM;GemmFwdRest_hipblaslt:6.20393,71884800,miopenConvolutionFwdAlgoGEMM;ConvHipImplicitGemmGroupFwdXdlops:10.5747,161045760,miopenConvolutionFwdAlgoImplicitGEMM;ConvBinWinogradRxSf3x2:3.84286,0,miopenConvolutionFwdAlgoWinograd;ConvBinWinogradRxSf2x3g1:10.9906,0,miopenConvolutionFwdAlgoWinograd
160-4-120-208-1x1x1-320-4-120-208-1-0x0x0-1x1x1-1x1x1-0-NCDHW-FP16-F=GemmFwd1x1_0_1:0.551577,0,miopenConvolutionFwdAlgoGEMM;GemmFwd1x1_0_1_hipblaslt:0.731766,0,miopenConvolutionFwdAlgoGEMM;ConvHipImplicitGemm3DGroupFwdXdlops:3.76982,95948800,miopenConvolutionFwdAlgoImplicitGEMM
160-6-122-210-3x3x3-320-4-120-208-1-0x0x0-1x1x1-1x1x1-0-NCDHW-FP16-F=GemmFwdRest:46.948,862617600,miopenConvolutionFwdAlgoGEMM;ConvHipImplicitGemm3DGroupFwdXdlops:56.6065,115852800,miopenConvolutionFwdAlgoImplicitGEMM;GemmFwdRest_hipblaslt:56.5997,862617600,miopenConvolutionFwdAlgoGEMM
320-6-122-210-3x3x3-320-4-120-208-1-0x0x0-1x1x1-1x1x1-0-NCDHW-FP16-F=GemmFwdRest:108.711,1725235200,miopenConvolutionFwdAlgoGEMM;ConvHipImplicitGemm3DGroupFwdXdlops:106.363,167808000,miopenConvolutionFwdAlgoImplicitGEMM;GemmFwdRest_hipblaslt:137.351,1725235200,miopenConvolutionFwdAlgoGEMM
320-121-209-3x3-320-60-104-4-0x0-2x2-1x1-0-NCHW-FP16-F=GemmFwdRest:4.27204,35942400,miopenConvolutionFwdAlgoGEMM;GemmFwdRest_hipblaslt:4.3462,35942400,miopenConvolutionFwdAlgoGEMM;ConvHipImplicitGemmGroupFwdXdlops:7.32508,82557440,miopenConvolutionFwdAlgoImplicitGEMM;ConvBinWinogradRxSf3x2:3.49445,0,miopenConvolutionFwdAlgoWinograd;ConvBinWinogradRxSf2x3g1:10.9329,0,miopenConvolutionFwdAlgoWinograd
320-5-60-104-3x1x1-320-2-60-104-1-0x0x0-2x1x1-1x1x1-0-NCDHW-FP16-F=GemmFwdRest:0.614563,23961600,miopenConvolutionFwdAlgoGEMM;ConvHipImplicitGemm3DGroupFwdXdlops:1.81412,28569600,miopenConvolutionFwdAlgoImplicitGEMM;GemmFwdRest_hipblaslt:0.788613,23961600,miopenConvolutionFwdAlgoGEMM
320-2-60-104-1x1x1-640-2-60-104-1-0x0x0-1x1x1-1x1x1-0-NCDHW-FP16-F=GemmFwd1x1_0_1:0.172194,0,miopenConvolutionFwdAlgoGEMM;GemmFwd1x1_0_1_hipblaslt:0.280157,0,miopenConvolutionFwdAlgoGEMM;ConvHipImplicitGemm3DGroupFwdXdlops:1.16734,24371200,miopenConvolutionFwdAlgoImplicitGEMM
320-4-62-106-3x3x3-640-2-60-104-1-0x0x0-1x1x1-1x1x1-0-NCDHW-FP16-F=GemmFwdRest:16.4599,215654400,miopenConvolutionFwdAlgoGEMM;ConvHipImplicitGemm3DGroupFwdXdlops:27.1636,43857920,miopenConvolutionFwdAlgoImplicitGEMM;GemmFwdRest_hipblaslt:20.877,215654400,miopenConvolutionFwdAlgoGEMM
640-4-62-106-3x3x3-640-2-60-104-1-0x0x0-1x1x1-1x1x1-0-NCDHW-FP16-F=GemmFwdRest:41.1,431308800,miopenConvolutionFwdAlgoGEMM;ConvHipImplicitGemm3DGroupFwdXdlops:53.7267,71741440,miopenConvolutionFwdAlgoImplicitGEMM;GemmFwdRest_hipblaslt:50.7318,431308800,miopenConvolutionFwdAlgoGEMM
640-61-105-3x3-640-30-52-2-0x0-2x2-1x1-0-NCHW-FP16-F=GemmFwdRest:1.70947,17971200,miopenConvolutionFwdAlgoGEMM;GemmFwdRest_hipblaslt:1.8681,17971200,miopenConvolutionFwdAlgoGEMM;ConvHipImplicitGemmGroupFwdXdlops:3.78353,27763200,miopenConvolutionFwdAlgoImplicitGEMM;ConvBinWinogradRxSf3x2:1.72116,0,miopenConvolutionFwdAlgoWinograd;ConvBinWinogradRxSf2x3g1:5.43477,0,miopenConvolutionFwdAlgoWinograd
640-3-30-52-3x1x1-640-1-30-52-1-0x0x0-2x1x1-1x1x1-0-NCDHW-FP16-F=GemmFwdRest:0.23472,5990400,miopenConvolutionFwdAlgoGEMM;ConvHipImplicitGemm3DGroupFwdXdlops:0.798347,10444800,miopenConvolutionFwdAlgoImplicitGEMM;GemmFwdRest_hipblaslt:0.29816,5990400,miopenConvolutionFwdAlgoGEMM
96-21-30-52-1x1x1-96-21-30-52-1-0x0x0-1x1x1-1x1x1-0-NCDHW-FP16-F=GemmFwd1x1_0_1:0.111786,0,miopenConvolutionFwdAlgoGEMM;GemmFwd1x1_0_1_hipblaslt:0.098092,0,miopenConvolutionFwdAlgoGEMM;ConvHipImplicitGemm3DGroupFwdXdlops:0.450165,12598272,miopenConvolutionFwdAlgoImplicitGEMM
48-21-44-80-1x2x2-3072-21-22-40-1-0x0x0-1x2x2-1x1x1-0-NCDHW-FP16-F=GemmFwdRest:1.03918,7096320,miopenConvolutionFwdAlgoGEMM;ConvHipImplicitGemm3DGroupFwdXdlops:7.09314,121817088,miopenConvolutionFwdAlgoImplicitGEMM;GemmFwdRest_hipblaslt:1.86347,7096320,miopenConvolutionFwdAlgoGEMM
96-1-30-52-1x1x1-96-1-30-52-1-0x0x0-1x1x1-1x1x1-0-NCDHW-FP16-F=GemmFwd1x1_0_1:0.0321743,0,miopenConvolutionFwdAlgoGEMM;GemmFwd1x1_0_1_hipblaslt:0.02373,0,miopenConvolutionFwdAlgoGEMM;ConvHipImplicitGemm3DGroupFwdXdlops:0.172935,617472,miopenConvolutionFwdAlgoImplicitGEMM
48-1-30-52-1x2x2-3072-1-15-26-1-0x0x0-1x2x2-1x1x1-0-NCDHW-FP16-F=GemmFwdRest:0.09482,149760,miopenConvolutionFwdAlgoGEMM;ConvHipImplicitGemm3DGroupFwdXdlops:0.248365,3725568,miopenConvolutionFwdAlgoImplicitGEMM;GemmFwdRest_hipblaslt:0.08569,149760,miopenConvolutionFwdAlgoGEMM
48-3-30-52-3x3x3-512-1-30-52-1-0x1x1-1x1x1-1x1x1-0-NCDHW-FP16-F=GemmFwdRest:0.192708,4043520,miopenConvolutionFwdAlgoGEMM;ConvHipImplicitGemm3DGroupFwdXdlops:0.449581,3373824,miopenConvolutionFwdAlgoImplicitGEMM;GemmFwdRest_hipblaslt:0.212117,4043520,miopenConvolutionFwdAlgoGEMM
512-5-30-52-5x5x5-512-1-30-52-1-0x2x2-1x1x1-1x1x1-0-NCDHW-FP16-F_g512=GemmFwdRest:4.50264,199680000,miopenConvolutionFwdAlgoGEMM;ConvHipImplicitGemm3DGroupFwdXdlops:15.7405,9712640,miopenConvolutionFwdAlgoImplicitGEMM;GemmFwdRest_hipblaslt:4.27157,199680000,miopenConvolutionFwdAlgoGEMM
512-1-30-52-1x1x1-512-1-30-52-1-0x0x0-1x1x1-1x1x1-0-NCDHW-FP16-F=GemmFwd1x1_0_1:0.0460383,0,miopenConvolutionFwdAlgoGEMM;GemmFwd1x1_0_1_hipblaslt:0.0634,0,miopenConvolutionFwdAlgoGEMM;ConvHipImplicitGemm3DGroupFwdXdlops:0.250548,3719168,miopenConvolutionFwdAlgoImplicitGEMM
512-3-30-52-3x3x3-256-1-30-52-1-0x1x1-1x1x1-1x1x1-0-NCDHW-FP16-F=GemmFwdRest:1.63048,43130880,miopenConvolutionFwdAlgoGEMM;ConvHipImplicitGemm3DGroupFwdXdlops:2.45954,12668928,miopenConvolutionFwdAlgoImplicitGEMM;GemmFwdRest_hipblaslt:1.63793,43130880,miopenConvolutionFwdAlgoGEMM
256-3-30-52-3x3x3-256-1-30-52-1-0x1x1-1x1x1-1x1x1-0-NCDHW-FP16-F=GemmFwdRest:0.539777,21565440,miopenConvolutionFwdAlgoGEMM;ConvHipImplicitGemm3DGroupFwdXdlops:1.00438,6733824,miopenConvolutionFwdAlgoImplicitGEMM;GemmFwdRest_hipblaslt:0.600427,21565440,miopenConvolutionFwdAlgoGEMM
512-1-30-52-1x1x1-256-1-30-52-1-0x0x0-1x1x1-1x1x1-0-NCDHW-FP16-F=GemmFwd1x1_0_1:0.0707017,0,miopenConvolutionFwdAlgoGEMM;GemmFwd1x1_0_1_hipblaslt:0.0534043,0,miopenConvolutionFwdAlgoGEMM;ConvHipImplicitGemm3DGroupFwdXdlops:0.263945,2658304,miopenConvolutionFwdAlgoImplicitGEMM
256-3-30-52-3x3x3-2048-1-30-52-1-0x1x1-1x1x1-1x1x1-0-NCDHW-FP16-F=GemmFwdRest:2.0916,21565440,miopenConvolutionFwdAlgoGEMM;ConvHipImplicitGemm3DGroupFwdXdlops:9.65704,37097472,miopenConvolutionFwdAlgoImplicitGEMM;GemmFwdRest_hipblaslt:2.27261,21565440,miopenConvolutionFwdAlgoGEMM
256-3-60-104-3x3x3-256-1-60-104-1-0x1x1-1x1x1-1x1x1-0-NCDHW-FP16-F=GemmFwdRest:2.31827,86261760,miopenConvolutionFwdAlgoGEMM;ConvHipImplicitGemm3DGroupFwdXdlops:4.42534,16318464,miopenConvolutionFwdAlgoImplicitGEMM;GemmFwdRest_hipblaslt:2.3056,86261760,miopenConvolutionFwdAlgoGEMM
256-3-60-104-3x3x3-64-1-60-104-1-0x1x1-1x1x1-1x1x1-0-NCDHW-FP16-F=GemmFwdRest:2.33242,86261760,miopenConvolutionFwdAlgoGEMM;ConvHipImplicitGemm3DGroupFwdXdlops:1.45372,11268096,miopenConvolutionFwdAlgoImplicitGEMM;GemmFwdRest_hipblaslt:2.5358,86261760,miopenConvolutionFwdAlgoGEMM
64-3-60-104-3x3x3-64-1-60-104-1-0x1x1-1x1x1-1x1x1-0-NCDHW-FP16-F=GemmFwdRest:0.474025,21565440,miopenConvolutionFwdAlgoGEMM;ConvHipImplicitGemm3DGroupFwdXdlops:0.365548,3416064,miopenConvolutionFwdAlgoImplicitGEMM;GemmFwdRest_hipblaslt:0.451139,21565440,miopenConvolutionFwdAlgoGEMM
256-1-60-104-1x1x1-64-1-60-104-1-0x0x0-1x1x1-1x1x1-0-NCDHW-FP16-F=GemmFwd1x1_0_1:0.0592817,0,miopenConvolutionFwdAlgoGEMM;GemmFwd1x1_0_1_hipblaslt:0.063968,0,miopenConvolutionFwdAlgoGEMM;ConvHipImplicitGemm3DGroupFwdXdlops:0.233113,4026368,miopenConvolutionFwdAlgoImplicitGEMM
64-3-60-104-3x3x3-512-1-60-104-1-0x1x1-1x1x1-1x1x1-0-NCDHW-FP16-F=GemmFwdRest:1.11726,21565440,miopenConvolutionFwdAlgoGEMM;ConvHipImplicitGemm3DGroupFwdXdlops:1.86425,10555392,miopenConvolutionFwdAlgoImplicitGEMM;GemmFwdRest_hipblaslt:1.07854,21565440,miopenConvolutionFwdAlgoGEMM
64-3-120-208-3x3x3-64-1-120-208-1-0x1x1-1x1x1-1x1x1-0-NCDHW-FP16-F=GemmFwdRest:2.33731,86261760,miopenConvolutionFwdAlgoGEMM;ConvHipImplicitGemm3DGroupFwdXdlops:1.22576,13000704,miopenConvolutionFwdAlgoImplicitGEMM;GemmFwdRest_hipblaslt:2.1769,86261760,miopenConvolutionFwdAlgoGEMM
64-3-120-208-3x3x3-32-1-120-208-1-0x1x1-1x1x1-1x1x1-0-NCDHW-FP16-F=GemmFwdRest:1.99622,86261760,miopenConvolutionFwdAlgoGEMM;ConvHipImplicitGemm3DGroupFwdXdlops:1.29515,11292672,miopenConvolutionFwdAlgoImplicitGEMM;GemmFwdRest_hipblaslt:2.40418,86261760,miopenConvolutionFwdAlgoGEMM
32-3-120-208-3x3x3-32-1-120-208-1-0x1x1-1x1x1-1x1x1-0-NCDHW-FP16-F=GemmFwdRest:1.29568,43130880,miopenConvolutionFwdAlgoGEMM;ConvHipImplicitGemm3DGroupFwdXdlops:0.597369,6445056,miopenConvolutionFwdAlgoImplicitGEMM;GemmFwdRest_hipblaslt:1.11192,43130880,miopenConvolutionFwdAlgoGEMM
64-1-120-208-1x1x1-32-1-120-208-1-0x0x0-1x1x1-1x1x1-0-NCDHW-FP16-F=GemmFwd1x1_0_1:0.0840343,0,miopenConvolutionFwdAlgoGEMM;GemmFwd1x1_0_1_hipblaslt:0.0505471,0,miopenConvolutionFwdAlgoGEMM;ConvHipImplicitGemm3DGroupFwdXdlops:0.27916,4796416,miopenConvolutionFwdAlgoImplicitGEMM
32-3-120-208-3x3x3-128-1-120-208-1-0x1x1-1x1x1-1x1x1-0-NCDHW-FP16-F=GemmFwdRest:2.34403,43130880,miopenConvolutionFwdAlgoGEMM;ConvHipImplicitGemm3DGroupFwdXdlops:1.03897,11403264,miopenConvolutionFwdAlgoImplicitGEMM;GemmFwdRest_hipblaslt:1.30431,43130880,miopenConvolutionFwdAlgoGEMM
32-3-240-416-3x3x3-32-1-240-416-1-0x1x1-1x1x1-1x1x1-0-NCDHW-FP16-F=GemmFwdRest:4.00775,172523520,miopenConvolutionFwdAlgoGEMM;ConvHipImplicitGemm3DGroupFwdXdlops:2.60099,25614336,miopenConvolutionFwdAlgoImplicitGEMM;GemmFwdRest_hipblaslt:4.8759,172523520,miopenConvolutionFwdAlgoGEMM
8-3-480-832-3x3x3-3-1-480-832-1-0x1x1-1x1x1-1x1x1-0-NCDHW-FP16-F=GemmFwdRest:4.62964,172523520,miopenConvolutionFwdAlgoGEMM;ConvHipImplicitGemm3DGroupFwdXdlops:2.62912,21566976,miopenConvolutionFwdAlgoImplicitGEMM;GemmFwdRest_hipblaslt:4.90433,172523520,miopenConvolutionFwdAlgoGEMM
48-31-44-80-1x2x2-3072-31-22-40-1-0x0x0-1x2x2-1x1x1-0-NCDHW-FP16-F=GemmFwdRest:1.6836,10475520,miopenConvolutionFwdAlgoGEMM;ConvHipImplicitGemm3DGroupFwdXdlops:11.75,179263488,miopenConvolutionFwdAlgoImplicitGEMM;GemmFwdRest_hipblaslt:2.77153,10475520,miopenConvolutionFwdAlgoGEMM
48-33-44-80-3x3x3-512-31-44-80-1-0x1x1-1x1x1-1x1x1-0-NCDHW-FP16-F=GemmFwdRest:21.3151,282839040,miopenConvolutionFwdAlgoGEMM;ConvHipImplicitGemm3DGroupFwdXdlops:35.5443,124217344,miopenConvolutionFwdAlgoImplicitGEMM;GemmFwdRest_hipblaslt:24.9829,282839040,miopenConvolutionFwdAlgoGEMM
512-35-44-80-5x5x5-512-31-44-80-1-0x2x2-1x1x1-1x1x1-0-NCDHW-FP16-F_g512=ConvHipImplicitGemm3DGroupFwdXdlops:1350.22,238023680,miopenConvolutionFwdAlgoImplicitGEMM
512-31-44-80-1x1x1-512-31-44-80-1-0x0x0-1x1x1-1x1x1-0-NCDHW-FP16-F=GemmFwd1x1_0_1:1.961,0,miopenConvolutionFwdAlgoGEMM;GemmFwd1x1_0_1_hipblaslt:3.83053,0,miopenConvolutionFwdAlgoGEMM;ConvHipImplicitGemm3DGroupFwdXdlops:16.9488,224002048,miopenConvolutionFwdAlgoImplicitGEMM
512-33-44-80-3x3x3-256-31-44-80-1-0x1x1-1x1x1-1x1x1-0-NCDHW-FP16-F=GemmFwdRest:269.009,3016949760,miopenConvolutionFwdAlgoGEMM;ConvHipImplicitGemm3DGroupFwdXdlops:158.294,181895168,miopenConvolutionFwdAlgoImplicitGEMM;GemmFwdRest_hipblaslt:348.501,3016949760,miopenConvolutionFwdAlgoGEMM
256-33-44-80-3x3x3-256-31-44-80-1-0x1x1-1x1x1-1x1x1-0-NCDHW-FP16-F=GemmFwdRest:115.455,1508474880,miopenConvolutionFwdAlgoGEMM;ConvHipImplicitGemm3DGroupFwdXdlops:78.4873,118882304,miopenConvolutionFwdAlgoImplicitGEMM;GemmFwdRest_hipblaslt:148.684,1508474880,miopenConvolutionFwdAlgoGEMM
512-31-44-80-1x1x1-256-31-44-80-1-0x0x0-1x1x1-1x1x1-0-NCDHW-FP16-F=GemmFwd1x1_0_1:0.930388,0,miopenConvolutionFwdAlgoGEMM;GemmFwd1x1_0_1_hipblaslt:1.66783,0,miopenConvolutionFwdAlgoGEMM;ConvHipImplicitGemm3DGroupFwdXdlops:10.4081,167870464,miopenConvolutionFwdAlgoImplicitGEMM
256-33-44-80-3x3x3-2048-31-44-80-1-0x1x1-1x1x1-1x1x1-0-NCDHW-FP16-F=GemmFwdRest:505.964,1508474880,miopenConvolutionFwdAlgoGEMM;ConvHipImplicitGemm3DGroupFwdXdlops:657.866,534740992,miopenConvolutionFwdAlgoImplicitGEMM;GemmFwdRest_hipblaslt:665.537,1508474880,miopenConvolutionFwdAlgoGEMM
256-63-88-160-3x3x3-256-61-88-160-1-0x1x1-1x1x1-1x1x1-0-NCDHW-FP16-F=ConvHipImplicitGemm3DGroupFwdXdlops:609.804,897449984,miopenConvolutionFwdAlgoImplicitGEMM
256-63-88-160-3x3x3-64-61-88-160-1-0x1x1-1x1x1-1x1x1-0-NCDHW-FP16-F=ConvHipImplicitGemm3DGroupFwdXdlops:161.034,564985856,miopenConvolutionFwdAlgoImplicitGEMM
64-63-88-160-3x3x3-64-61-88-160-1-0x1x1-1x1x1-1x1x1-0-NCDHW-FP16-F=GemmFwdRest:144.747,2968289280,miopenConvolutionFwdAlgoGEMM;ConvHipImplicitGemm3DGroupFwdXdlops:40.6955,223698944,miopenConvolutionFwdAlgoImplicitGEMM;GemmFwdRest_hipblaslt:148.74,2968289280,miopenConvolutionFwdAlgoGEMM
256-61-88-160-1x1x1-64-61-88-160-1-0x0x0-1x1x1-1x1x1-0-NCDHW-FP16-F=GemmFwd1x1_0_1:3.30967,0,miopenConvolutionFwdAlgoGEMM;GemmFwd1x1_0_1_hipblaslt:5.08772,0,miopenConvolutionFwdAlgoGEMM;ConvHipImplicitGemm3DGroupFwdXdlops:15.5878,549715968,miopenConvolutionFwdAlgoImplicitGEMM
64-63-88-160-3x3x3-512-61-88-160-1-0x1x1-1x1x1-1x1x1-0-NCDHW-FP16-F=GemmFwdRest:301.107,2968289280,miopenConvolutionFwdAlgoGEMM;ConvHipImplicitGemm3DGroupFwdXdlops:326.225,994803712,miopenConvolutionFwdAlgoImplicitGEMM;GemmFwdRest_hipblaslt:343.674,2968289280,miopenConvolutionFwdAlgoGEMM
64-123-176-320-3x3x3-64-121-176-320-1-0x1x1-1x1x1-1x1x1-0-NCDHW-FP16-F=ConvHipImplicitGemm3DGroupFwdXdlops:318.042,1759207424,miopenConvolutionFwdAlgoImplicitGEMM
64-123-176-320-3x3x3-32-121-176-320-1-0x1x1-1x1x1-1x1x1-0-NCDHW-FP16-F=ConvHipImplicitGemm3DGroupFwdXdlops:301.24,1322954752,miopenConvolutionFwdAlgoImplicitGEMM
32-123-176-320-3x3x3-32-121-176-320-1-0x1x1-1x1x1-1x1x1-0-NCDHW-FP16-F=ConvHipImplicitGemm3DGroupFwdXdlops:161.295,879548416,miopenConvolutionFwdAlgoImplicitGEMM
64-121-176-320-1x1x1-32-121-176-320-1-0x0x0-1x1x1-1x1x1-0-NCDHW-FP16-F=GemmFwd1x1_0_1:10.1587,0,miopenConvolutionFwdAlgoGEMM;GemmFwd1x1_0_1_hipblaslt:8.89233,0,miopenConvolutionFwdAlgoGEMM;ConvHipImplicitGemm3DGroupFwdXdlops:37.3185,1308430336,miopenConvolutionFwdAlgoImplicitGEMM
32-123-176-320-3x3x3-128-121-176-320-1-0x1x1-1x1x1-1x1x1-0-NCDHW-FP16-F=ConvHipImplicitGemm3DGroupFwdXdlops:346.739,2188140544,miopenConvolutionFwdAlgoImplicitGEMM
32-123-352-640-3x3x3-32-121-352-640-1-0x1x1-1x1x1-1x1x1-0-NCDHW-FP16-F=ConvHipImplicitGemm3DGroupFwdXdlops:612.537,3518027776,miopenConvolutionFwdAlgoImplicitGEMM
8-123-704-1280-3x3x3-3-121-704-1280-1-0x1x1-1x1x1-1x1x1-0-NCDHW-FP16-F=ConvHipImplicitGemm3DGroupFwdXdlops:645.676,2427618816,miopenConvolutionFwdAlgoImplicitGEMM
48-31-30-52-1x2x2-3072-31-15-26-1-0x0x0-1x2x2-1x1x1-0-NCDHW-FP16-F=GemmFwdRest:0.753648,4642560,miopenConvolutionFwdAlgoGEMM;ConvHipImplicitGemm3DGroupFwdXdlops:7.25635,80103168,miopenConvolutionFwdAlgoImplicitGEMM;GemmFwdRest_hipblaslt:0.955812,4642560,miopenConvolutionFwdAlgoGEMM
48-21-30-52-1x1x1-48-21-30-52-1-0x0x0-1x1x1-1x1x1-0-NCDHW-FP16-F=GemmFwd1x1_0_1:0.118461,0,miopenConvolutionFwdAlgoGEMM;GemmFwd1x1_0_1_hipblaslt:0.0357857,0,miopenConvolutionFwdAlgoGEMM;ConvHipImplicitGemm3DGroupFwdXdlops:0.196834,6294528,miopenConvolutionFwdAlgoImplicitGEMM
48-3-32-54-3x3x3-1024-1-30-52-1-0x0x0-1x1x1-1x1x1-0-NCDHW-FP16-F=GemmFwdRest:0.235598,4043520,miopenConvolutionFwdAlgoGEMM;ConvHipImplicitGemm3DGroupFwdXdlops:0.914973,6346752,miopenConvolutionFwdAlgoImplicitGEMM;GemmFwdRest_hipblaslt:0.345118,4043520,miopenConvolutionFwdAlgoGEMM
1024-3-32-54-3x3x3-1024-1-30-52-1-0x0x0-1x1x1-1x1x1-0-NCDHW-FP16-F=GemmFwdRest:6.54406,86261760,miopenConvolutionFwdAlgoGEMM;ConvHipImplicitGemm3DGroupFwdXdlops:16.8575,70434816,miopenConvolutionFwdAlgoImplicitGEMM;GemmFwdRest_hipblaslt:4.97825,86261760,miopenConvolutionFwdAlgoGEMM
1024-30-52-1x1-3072-30-52-1-0x0-1x1-1x1-0-NCHW-FP16-F=ConvBinWinogradRxSf2x3g1:3.68413,0,miopenConvolutionFwdAlgoWinograd;GemmFwd1x1_0_1:0.408549,0,miopenConvolutionFwdAlgoGEMM;ConvBinWinogradRxSf3x2:1.10856,0,miopenConvolutionFwdAlgoWinograd;GemmFwd1x1_0_1_hipblaslt:0.346692,0,miopenConvolutionFwdAlgoGEMM;ConvHipImplicitGemmGroupFwdXdlops:1.36989,19070976,miopenConvolutionFwdAlgoImplicitGEMM
1024-30-52-1x1-1024-30-52-1-0x0-1x1-1x1-0-NCHW-FP16-F=ConvBinWinogradRxSf2x3g1:1.48366,0,miopenConvolutionFwdAlgoWinograd;GemmFwd1x1_0_1:0.176602,0,miopenConvolutionFwdAlgoGEMM;ConvBinWinogradRxSf3x2:0.496214,0,miopenConvolutionFwdAlgoWinograd;GemmFwd1x1_0_1_hipblaslt:0.204961,0,miopenConvolutionFwdAlgoGEMM;ConvHipImplicitGemmGroupFwdXdlops:0.797687,8486912,miopenConvolutionFwdAlgoImplicitGEMM
1024-60-104-3x3-1024-60-104-1-1x1-1x1-1x1-0-NCHW-FP16-F=GemmFwdRest:7.66156,115015680,miopenConvolutionFwdAlgoGEMM;GemmFwdRest_hipblaslt:9.26606,115015680,miopenConvolutionFwdAlgoGEMM;ConvHipImplicitGemmGroupFwdXdlops:21.2163,44433408,miopenConvolutionFwdAlgoImplicitGEMM;ConvBinWinogradRxSf3x2:12.6209,0,miopenConvolutionFwdAlgoWinograd;ConvBinWinogradRxSf2x3g1:7.68703,0,miopenConvolutionFwdAlgoWinograd
1024-3-62-106-3x3x3-1024-1-60-104-1-0x0x0-1x1x1-1x1x1-0-NCDHW-FP16-F=GemmFwdRest:32.5855,345047040,miopenConvolutionFwdAlgoGEMM;ConvHipImplicitGemm3DGroupFwdXdlops:70.4534,109780992,miopenConvolutionFwdAlgoImplicitGEMM;GemmFwdRest_hipblaslt:32.2418,345047040,miopenConvolutionFwdAlgoGEMM
1024-120-208-3x3-1024-120-208-1-1x1-1x1-1x1-0-NCHW-FP16-F=GemmFwdRest:67.2227,460062720,miopenConvolutionFwdAlgoGEMM;GemmFwdRest_hipblaslt:85.7906,460062720,miopenConvolutionFwdAlgoGEMM;ConvHipImplicitGemmGroupFwdXdlops:70.4744,121110528,miopenConvolutionFwdAlgoImplicitGEMM;ConvBinWinogradRxSf3x2:42.7984,0,miopenConvolutionFwdAlgoWinograd;ConvBinWinogradRxSf2x3g1:23.0212,0,miopenConvolutionFwdAlgoWinograd
1024-1-120-208-1x1x1-512-1-120-208-1-0x0x0-1x1x1-1x1x1-0-NCDHW-FP16-F=GemmFwd1x1_0_1:0.77909,0,miopenConvolutionFwdAlgoGEMM;GemmFwd1x1_0_1_hipblaslt:1.28146,0,miopenConvolutionFwdAlgoGEMM;ConvHipImplicitGemm3DGroupFwdXdlops:7.15879,77725696,miopenConvolutionFwdAlgoImplicitGEMM
1024-3-122-210-3x3x3-512-1-120-208-1-0x0x0-1x1x1-1x1x1-0-NCDHW-FP16-F=GemmFwdRest:186.399,1380188160,miopenConvolutionFwdAlgoGEMM;ConvHipImplicitGemm3DGroupFwdXdlops:173.486,211279872,miopenConvolutionFwdAlgoImplicitGEMM;GemmFwdRest_hipblaslt:219.333,1380188160,miopenConvolutionFwdAlgoGEMM
512-3-122-210-3x3x3-512-1-120-208-1-0x0x0-1x1x1-1x1x1-0-NCDHW-FP16-F=GemmFwdRest:74.9684,690094080,miopenConvolutionFwdAlgoGEMM;ConvHipImplicitGemm3DGroupFwdXdlops:67.5017,118419456,miopenConvolutionFwdAlgoImplicitGEMM;GemmFwdRest_hipblaslt:91.9371,690094080,miopenConvolutionFwdAlgoGEMM
512-240-416-3x3-512-240-416-1-1x1-1x1-1x1-0-NCHW-FP16-F=GemmFwdRest:49.6309,920125440,miopenConvolutionFwdAlgoGEMM;GemmFwdRest_hipblaslt:95.0012,920125440,miopenConvolutionFwdAlgoGEMM;ConvHipImplicitGemmGroupFwdXdlops:71.6574,209190912,miopenConvolutionFwdAlgoImplicitGEMM;ConvBinWinogradRxSf3x2:41.4849,0,miopenConvolutionFwdAlgoWinograd;ConvBinWinogradRxSf2x3g1:24.9554,0,miopenConvolutionFwdAlgoWinograd
512-1-240-416-1x1x1-256-1-240-416-1-0x0x0-1x1x1-1x1x1-0-NCDHW-FP16-F=GemmFwd1x1_0_1:0.824462,0,miopenConvolutionFwdAlgoGEMM;GemmFwd1x1_0_1_hipblaslt:1.40773,0,miopenConvolutionFwdAlgoGEMM;ConvHipImplicitGemm3DGroupFwdXdlops:9.12096,153616384,miopenConvolutionFwdAlgoImplicitGEMM
512-3-242-418-3x3x3-256-1-240-416-1-0x0x0-1x1x1-1x1x1-0-NCDHW-FP16-F=GemmFwdRest:178.048,2760376320,miopenConvolutionFwdAlgoGEMM;ConvHipImplicitGemm3DGroupFwdXdlops:146.079,368947200,miopenConvolutionFwdAlgoImplicitGEMM;GemmFwdRest_hipblaslt:245.285,2760376320,miopenConvolutionFwdAlgoGEMM
256-3-242-418-3x3x3-256-1-240-416-1-0x0x0-1x1x1-1x1x1-0-NCDHW-FP16-F=GemmFwdRest:85.0009,1380188160,miopenConvolutionFwdAlgoGEMM;ConvHipImplicitGemm3DGroupFwdXdlops:70.0791,210032640,miopenConvolutionFwdAlgoImplicitGEMM;GemmFwdRest_hipblaslt:126.637,1380188160,miopenConvolutionFwdAlgoGEMM
256-3-242-418-3x3x3-12-1-240-416-1-0x0x0-1x1x1-1x1x1-0-NCDHW-FP16-F=GemmFwdRest:61.5226,1380188160,miopenConvolutionFwdAlgoGEMM;ConvHipImplicitGemm3DGroupFwdXdlops:19.9866,157937664,miopenConvolutionFwdAlgoImplicitGEMM;GemmFwdRest_hipblaslt:63.3389,1380188160,miopenConvolutionFwdAlgoGEMM
1024-3-30-52-3x1x1-2048-1-30-52-1-0x0x0-1x1x1-1x1x1-0-NCDHW-FP16-F=GemmFwdRest:1.54548,9584640,miopenConvolutionFwdAlgoGEMM;ConvHipImplicitGemm3DGroupFwdXdlops:4.77405,28557312,miopenConvolutionFwdAlgoImplicitGEMM;GemmFwdRest_hipblaslt:1.55657,9584640,miopenConvolutionFwdAlgoGEMM
1024-60-104-3x3-1024-60-104-2-1x1-1x1-1x1-0-NCHW-FP16-F=GemmFwdRest:15.8024,115015680,miopenConvolutionFwdAlgoGEMM;GemmFwdRest_hipblaslt:18.0755,115015680,miopenConvolutionFwdAlgoGEMM;ConvHipImplicitGemmGroupFwdXdlops:39.2454,69992448,miopenConvolutionFwdAlgoImplicitGEMM;ConvBinWinogradRxSf3x2:22.9123,0,miopenConvolutionFwdAlgoWinograd;ConvBinWinogradRxSf2x3g1:12.8391,0,miopenConvolutionFwdAlgoWinograd
1024-4-62-106-3x3x3-1024-2-60-104-1-0x0x0-1x1x1-1x1x1-0-NCDHW-FP16-F=GemmFwdRest:154.56,690094080,miopenConvolutionFwdAlgoGEMM;ConvHipImplicitGemm3DGroupFwdXdlops:175.396,136019968,miopenConvolutionFwdAlgoImplicitGEMM;GemmFwdRest_hipblaslt:171.893,690094080,miopenConvolutionFwdAlgoGEMM
1024-4-60-104-3x1x1-2048-2-60-104-1-0x0x0-1x1x1-1x1x1-0-NCDHW-FP16-F=GemmFwdRest:13.8082,76677120,miopenConvolutionFwdAlgoGEMM;ConvHipImplicitGemm3DGroupFwdXdlops:33.2423,114819072,miopenConvolutionFwdAlgoImplicitGEMM;GemmFwdRest_hipblaslt:20.7389,76677120,miopenConvolutionFwdAlgoGEMM
1024-120-208-3x3-1024-120-208-4-1x1-1x1-1x1-0-NCHW-FP16-F=GemmFwdRest:276.079,460062720,miopenConvolutionFwdAlgoGEMM;GemmFwdRest_hipblaslt:348.689,460062720,miopenConvolutionFwdAlgoGEMM;ConvHipImplicitGemmGroupFwdXdlops:290.136,427819008,miopenConvolutionFwdAlgoImplicitGEMM;ConvBinWinogradRxSf3x2:210.222,0,miopenConvolutionFwdAlgoWinograd;ConvBinWinogradRxSf2x3g1:152.694,0,miopenConvolutionFwdAlgoWinograd
1024-4-120-208-1x1x1-512-4-120-208-1-0x0x0-1x1x1-1x1x1-0-NCDHW-FP16-F=GemmFwd1x1_0_1:6.16467,0,miopenConvolutionFwdAlgoGEMM;GemmFwd1x1_0_1_hipblaslt:11.1354,0,miopenConvolutionFwdAlgoGEMM;ConvHipImplicitGemm3DGroupFwdXdlops:31.307,307757056,miopenConvolutionFwdAlgoImplicitGEMM
1024-6-122-210-3x3x3-512-4-120-208-1-0x0x0-1x1x1-1x1x1-0-NCDHW-FP16-F=GemmFwdRest:770.397,5520752640,miopenConvolutionFwdAlgoGEMM;ConvHipImplicitGemm3DGroupFwdXdlops:744.913,445366272,miopenConvolutionFwdAlgoImplicitGEMM;GemmFwdRest_hipblaslt:1160.29,5520752640,miopenConvolutionFwdAlgoGEMM
512-6-122-210-3x3x3-512-4-120-208-1-0x0x0-1x1x1-1x1x1-0-NCDHW-FP16-F=GemmFwdRest:296.428,2760376320,miopenConvolutionFwdAlgoGEMM;ConvHipImplicitGemm3DGroupFwdXdlops:286.104,273801216,miopenConvolutionFwdAlgoImplicitGEMM;GemmFwdRest_hipblaslt:481.958,2760376320,miopenConvolutionFwdAlgoGEMM
512-240-416-3x3-512-240-416-4-1x1-1x1-1x1-0-NCHW-FP16-F=GemmFwdRest:211.871,920125440,miopenConvolutionFwdAlgoGEMM;GemmFwdRest_hipblaslt:397.316,920125440,miopenConvolutionFwdAlgoGEMM;ConvHipImplicitGemmGroupFwdXdlops:331.562,822607872,miopenConvolutionFwdAlgoImplicitGEMM;ConvBinWinogradRxSf3x2:225.077,0,miopenConvolutionFwdAlgoWinograd;ConvBinWinogradRxSf2x3g1:156.243,0,miopenConvolutionFwdAlgoWinograd
512-4-240-416-1x1x1-256-4-240-416-1-0x0x0-1x1x1-1x1x1-0-NCDHW-FP16-F=GemmFwd1x1_0_1:6.04959,0,miopenConvolutionFwdAlgoGEMM;GemmFwd1x1_0_1_hipblaslt:10.8176,0,miopenConvolutionFwdAlgoGEMM;ConvHipImplicitGemm3DGroupFwdXdlops:37.0837,613679104,miopenConvolutionFwdAlgoImplicitGEMM
512-6-242-418-3x3x3-256-4-240-416-1-0x0x0-1x1x1-1x1x1-0-NCDHW-FP16-F=ConvHipImplicitGemm3DGroupFwdXdlops:596.818,833052672,miopenConvolutionFwdAlgoImplicitGEMM
256-6-242-418-3x3x3-256-4-240-416-1-0x0x0-1x1x1-1x1x1-0-NCDHW-FP16-F=GemmFwdRest:413.851,5520752640,miopenConvolutionFwdAlgoGEMM;ConvHipImplicitGemm3DGroupFwdXdlops:290.328,518762496,miopenConvolutionFwdAlgoImplicitGEMM;GemmFwdRest_hipblaslt:599.338,5520752640,miopenConvolutionFwdAlgoGEMM
256-6-242-418-3x3x3-12-4-240-416-1-0x0x0-1x1x1-1x1x1-0-NCDHW-FP16-F=GemmFwdRest:322.433,5520752640,miopenConvolutionFwdAlgoGEMM;ConvHipImplicitGemm3DGroupFwdXdlops:77.8809,320501760,miopenConvolutionFwdAlgoImplicitGEMM;GemmFwdRest_hipblaslt:336.91,5520752640,miopenConvolutionFwdAlgoGEMM
512-23-30-52-3x3x3-4096-21-30-52-1-0x1x1-1x1x1-1x1x1-0-NCDHW-FP16-F=GemmFwdRest:222.225,905748480,miopenConvolutionFwdAlgoGEMM;ConvHipImplicitGemm3DGroupFwdXdlops:724.88,418357248,miopenConvolutionFwdAlgoImplicitGEMM;GemmFwdRest_hipblaslt:255.519,905748480,miopenConvolutionFwdAlgoGEMM
512-45-60-104-5x5x5-512-41-60-104-1-0x2x2-1x1x1-1x1x1-0-NCDHW-FP16-F_g512=ConvHipImplicitGemm3DGroupFwdXdlops:3113.38,549647360,miopenConvolutionFwdAlgoImplicitGEMM
512-41-60-104-1x1x1-512-41-60-104-1-0x0x0-1x1x1-1x1x1-0-NCDHW-FP16-F=GemmFwd1x1_0_1:5.22562,0,miopenConvolutionFwdAlgoGEMM;GemmFwd1x1_0_1_hipblaslt:10.6023,0,miopenConvolutionFwdAlgoGEMM;ConvHipImplicitGemm3DGroupFwdXdlops:42.1592,524484608,miopenConvolutionFwdAlgoImplicitGEMM
512-43-60-104-3x3x3-256-41-60-104-1-0x1x1-1x1x1-1x1x1-0-NCDHW-FP16-F=GemmFwdRest:556.86,7073464320,miopenConvolutionFwdAlgoGEMM;ConvHipImplicitGemm3DGroupFwdXdlops:375.494,412827648,miopenConvolutionFwdAlgoImplicitGEMM;GemmFwdRest_hipblaslt:703.2,7073464320,miopenConvolutionFwdAlgoGEMM
512-41-60-104-1x1x1-256-41-60-104-1-0x0x0-1x1x1-1x1x1-0-NCDHW-FP16-F=GemmFwd1x1_0_1:2.21522,0,miopenConvolutionFwdAlgoGEMM;GemmFwd1x1_0_1_hipblaslt:4.69335,0,miopenConvolutionFwdAlgoGEMM;ConvHipImplicitGemm3DGroupFwdXdlops:24.8221,393232384,miopenConvolutionFwdAlgoImplicitGEMM
256-43-60-104-3x3x3-1024-41-60-104-1-0x1x1-1x1x1-1x1x1-0-NCDHW-FP16-F=GemmFwdRest:728.429,3536732160,miopenConvolutionFwdAlgoGEMM;ConvHipImplicitGemm3DGroupFwdXdlops:763.87,675495936,miopenConvolutionFwdAlgoImplicitGEMM;GemmFwdRest_hipblaslt:825.52,3536732160,miopenConvolutionFwdAlgoGEMM
256-43-120-208-3x3x3-256-41-120-208-1-0x1x1-1x1x1-1x1x1-0-NCDHW-FP16-F=ConvHipImplicitGemm3DGroupFwdXdlops:677.98,1077018624,miopenConvolutionFwdAlgoImplicitGEMM
256-43-120-208-3x3x3-64-41-120-208-1-0x1x1-1x1x1-1x1x1-0-NCDHW-FP16-F=ConvHipImplicitGemm3DGroupFwdXdlops:180.954,681394176,miopenConvolutionFwdAlgoImplicitGEMM
64-43-120-208-3x3x3-64-41-120-208-1-0x1x1-1x1x1-1x1x1-0-NCDHW-FP16-F=GemmFwdRest:132.195,3536732160,miopenConvolutionFwdAlgoGEMM;ConvHipImplicitGemm3DGroupFwdXdlops:45.1057,268591104,miopenConvolutionFwdAlgoImplicitGEMM;GemmFwdRest_hipblaslt:129.935,3536732160,miopenConvolutionFwdAlgoGEMM
256-41-120-208-1x1x1-64-41-120-208-1-0x0x0-1x1x1-1x1x1-0-NCDHW-FP16-F=GemmFwd1x1_0_1:3.69346,0,miopenConvolutionFwdAlgoGEMM;GemmFwd1x1_0_1_hipblaslt:5.80389,0,miopenConvolutionFwdAlgoGEMM;ConvHipImplicitGemm3DGroupFwdXdlops:19.1643,654983168,miopenConvolutionFwdAlgoImplicitGEMM
64-43-120-208-3x3x3-512-41-120-208-1-0x1x1-1x1x1-1x1x1-0-NCDHW-FP16-F=GemmFwdRest:224.034,3536732160,miopenConvolutionFwdAlgoGEMM;ConvHipImplicitGemm3DGroupFwdXdlops:364.056,1187069952,miopenConvolutionFwdAlgoImplicitGEMM;GemmFwdRest_hipblaslt:240.656,3536732160,miopenConvolutionFwdAlgoGEMM
64-83-240-416-3x3x3-64-81-240-416-1-0x1x1-1x1x1-1x1x1-0-NCDHW-FP16-F=ConvHipImplicitGemm3DGroupFwdXdlops:351.117,2096062464,miopenConvolutionFwdAlgoImplicitGEMM
64-83-240-416-3x3x3-32-81-240-416-1-0x1x1-1x1x1-1x1x1-0-NCDHW-FP16-F=ConvHipImplicitGemm3DGroupFwdXdlops:342.845,1578381312,miopenConvolutionFwdAlgoImplicitGEMM
64-81-240-416-1x1x1-32-81-240-416-1-0x0x0-1x1x1-1x1x1-0-NCDHW-FP16-F=GemmFwd1x1_0_1:12.0202,0,miopenConvolutionFwdAlgoGEMM;GemmFwd1x1_0_1_hipblaslt:10.4578,0,miopenConvolutionFwdAlgoGEMM;ConvHipImplicitGemm3DGroupFwdXdlops:44.452,1552715776,miopenConvolutionFwdAlgoImplicitGEMM
48-31-30-52-1x1x1-48-31-30-52-1-0x0x0-1x1x1-1x1x1-0-NCDHW-FP16-F=GemmFwd1x1_0_1:0.13182,0,miopenConvolutionFwdAlgoGEMM;GemmFwd1x1_0_1_hipblaslt:0.0399643,0,miopenConvolutionFwdAlgoGEMM;ConvHipImplicitGemm3DGroupFwdXdlops:0.229208,9289728,miopenConvolutionFwdAlgoImplicitGEMM
48-33-30-52-3x3x3-512-31-30-52-1-0x1x1-1x1x1-1x1x1-0-NCDHW-FP16-F=GemmFwdRest:4.528,125349120,miopenConvolutionFwdAlgoGEMM;ConvHipImplicitGemm3DGroupFwdXdlops:12.0562,55789824,miopenConvolutionFwdAlgoImplicitGEMM;GemmFwdRest_hipblaslt:5.47554,125349120,miopenConvolutionFwdAlgoGEMM
512-35-30-52-5x5x5-512-31-30-52-1-0x2x2-1x1x1-1x1x1-0-NCDHW-FP16-F_g512=GemmFwdRest:196.342,6190080000,miopenConvolutionFwdAlgoGEMM;ConvHipImplicitGemm3DGroupFwdXdlops:438.048,105559040,miopenConvolutionFwdAlgoImplicitGEMM;GemmFwdRest_hipblaslt:160.9,6190080000,miopenConvolutionFwdAlgoGEMM
512-31-30-52-1x1x1-512-31-30-52-1-0x0x0-1x1x1-1x1x1-0-NCDHW-FP16-F=GemmFwd1x1_0_1:1.00896,0,miopenConvolutionFwdAlgoGEMM;GemmFwd1x1_0_1_hipblaslt:1.57548,0,miopenConvolutionFwdAlgoGEMM;ConvHipImplicitGemm3DGroupFwdXdlops:7.34032,99565568,miopenConvolutionFwdAlgoImplicitGEMM
512-33-30-52-3x3x3-256-31-30-52-1-0x1x1-1x1x1-1x1x1-0-NCDHW-FP16-F=GemmFwdRest:49.4738,1337057280,miopenConvolutionFwdAlgoGEMM;ConvHipImplicitGemm3DGroupFwdXdlops:65.4266,84553728,miopenConvolutionFwdAlgoImplicitGEMM;GemmFwdRest_hipblaslt:50.6877,1337057280,miopenConvolutionFwdAlgoGEMM
256-33-30-52-3x3x3-256-31-30-52-1-0x1x1-1x1x1-1x1x1-0-NCDHW-FP16-F=GemmFwdRest:37.2749,668528640,miopenConvolutionFwdAlgoGEMM;ConvHipImplicitGemm3DGroupFwdXdlops:34.3392,54657024,miopenConvolutionFwdAlgoImplicitGEMM;GemmFwdRest_hipblaslt:51.9754,668528640,miopenConvolutionFwdAlgoGEMM
512-31-30-52-1x1x1-256-31-30-52-1-0x0x0-1x1x1-1x1x1-0-NCDHW-FP16-F=GemmFwd1x1_0_1:0.425365,0,miopenConvolutionFwdAlgoGEMM;GemmFwd1x1_0_1_hipblaslt:0.59969,0,miopenConvolutionFwdAlgoGEMM;ConvHipImplicitGemm3DGroupFwdXdlops:4.00754,74543104,miopenConvolutionFwdAlgoImplicitGEMM
256-33-30-52-3x3x3-2048-31-30-52-1-0x1x1-1x1x1-1x1x1-0-NCDHW-FP16-F=GemmFwdRest:200.912,668528640,miopenConvolutionFwdAlgoGEMM;ConvHipImplicitGemm3DGroupFwdXdlops:278.845,252751872,miopenConvolutionFwdAlgoImplicitGEMM;GemmFwdRest_hipblaslt:290.672,668528640,miopenConvolutionFwdAlgoGEMM
256-63-60-104-3x3x3-256-61-60-104-1-0x1x1-1x1x1-1x1x1-0-NCDHW-FP16-F=GemmFwdRest:242.811,5261967360,miopenConvolutionFwdAlgoGEMM;ConvHipImplicitGemm3DGroupFwdXdlops:256.339,399704064,miopenConvolutionFwdAlgoImplicitGEMM;GemmFwdRest_hipblaslt:257.417,5261967360,miopenConvolutionFwdAlgoGEMM
256-63-60-104-3x3x3-64-61-60-104-1-0x1x1-1x1x1-1x1x1-0-NCDHW-FP16-F=GemmFwdRest:190.19,5261967360,miopenConvolutionFwdAlgoGEMM;ConvHipImplicitGemm3DGroupFwdXdlops:68.0088,250884096,miopenConvolutionFwdAlgoImplicitGEMM;GemmFwdRest_hipblaslt:183.504,5261967360,miopenConvolutionFwdAlgoGEMM
64-63-60-104-3x3x3-64-61-60-104-1-0x1x1-1x1x1-1x1x1-0-NCDHW-FP16-F=GemmFwdRest:56.4694,1315491840,miopenConvolutionFwdAlgoGEMM;ConvHipImplicitGemm3DGroupFwdXdlops:18.3891,99262464,miopenConvolutionFwdAlgoImplicitGEMM;GemmFwdRest_hipblaslt:55.9148,1315491840,miopenConvolutionFwdAlgoGEMM
256-61-60-104-1x1x1-64-61-60-104-1-0x0x0-1x1x1-1x1x1-0-NCDHW-FP16-F=GemmFwd1x1_0_1:1.2233,0,miopenConvolutionFwdAlgoGEMM;GemmFwd1x1_0_1_hipblaslt:1.32659,0,miopenConvolutionFwdAlgoGEMM;ConvHipImplicitGemm3DGroupFwdXdlops:13.2846,243642368,miopenConvolutionFwdAlgoImplicitGEMM
64-63-60-104-3x3x3-512-61-60-104-1-0x1x1-1x1x1-1x1x1-0-NCDHW-FP16-F=GemmFwdRest:101.922,1315491840,miopenConvolutionFwdAlgoGEMM;ConvHipImplicitGemm3DGroupFwdXdlops:154.273,441864192,miopenConvolutionFwdAlgoImplicitGEMM;GemmFwdRest_hipblaslt:118.106,1315491840,miopenConvolutionFwdAlgoGEMM
64-123-120-208-3x3x3-64-121-120-208-1-0x1x1-1x1x1-1x1x1-0-NCDHW-FP16-F=ConvHipImplicitGemm3DGroupFwdXdlops:140.156,779771904,miopenConvolutionFwdAlgoImplicitGEMM
64-123-120-208-3x3x3-32-121-120-208-1-0x1x1-1x1x1-1x1x1-0-NCDHW-FP16-F=ConvHipImplicitGemm3DGroupFwdXdlops:127.489,586371072,miopenConvolutionFwdAlgoImplicitGEMM
32-123-120-208-3x3x3-32-121-120-208-1-0x1x1-1x1x1-1x1x1-0-NCDHW-FP16-F=GemmFwdRest:197.434,5218836480,miopenConvolutionFwdAlgoGEMM;ConvHipImplicitGemm3DGroupFwdXdlops:63.6366,389830656,miopenConvolutionFwdAlgoImplicitGEMM;GemmFwdRest_hipblaslt:186.228,5218836480,miopenConvolutionFwdAlgoGEMM
64-121-120-208-1x1x1-32-121-120-208-1-0x0x0-1x1x1-1x1x1-0-NCDHW-FP16-F=GemmFwd1x1_0_1:4.21605,0,miopenConvolutionFwdAlgoGEMM;GemmFwd1x1_0_1_hipblaslt:4.22479,0,miopenConvolutionFwdAlgoGEMM;ConvHipImplicitGemm3DGroupFwdXdlops:14.6866,579874816,miopenConvolutionFwdAlgoImplicitGEMM
32-123-120-208-3x3x3-128-121-120-208-1-0x1x1-1x1x1-1x1x1-0-NCDHW-FP16-F=GemmFwdRest:213.141,5218836480,miopenConvolutionFwdAlgoGEMM;ConvHipImplicitGemm3DGroupFwdXdlops:136.95,969867264,miopenConvolutionFwdAlgoImplicitGEMM;GemmFwdRest_hipblaslt:224.945,5218836480,miopenConvolutionFwdAlgoGEMM
32-123-240-416-3x3x3-32-121-240-416-1-0x1x1-1x1x1-1x1x1-0-NCDHW-FP16-F=ConvHipImplicitGemm3DGroupFwdXdlops:261.536,1559156736,miopenConvolutionFwdAlgoImplicitGEMM
8-123-480-832-3x3x3-3-121-480-832-1-0x1x1-1x1x1-1x1x1-0-NCDHW-FP16-F=ConvHipImplicitGemm3DGroupFwdXdlops:301.188,1075877376,miopenConvolutionFwdAlgoImplicitGEMM
512-33-30-52-3x3x3-4096-31-30-52-1-0x1x1-1x1x1-1x1x1-0-NCDHW-FP16-F=GemmFwdRest:327.587,1337057280,miopenConvolutionFwdAlgoGEMM;ConvHipImplicitGemm3DGroupFwdXdlops:1074.92,562126848,miopenConvolutionFwdAlgoImplicitGEMM;GemmFwdRest_hipblaslt:373.806,1337057280,miopenConvolutionFwdAlgoGEMM
512-65-60-104-5x5x5-512-61-60-104-1-0x2x2-1x1x1-1x1x1-0-NCDHW-FP16-F_g512=ConvHipImplicitGemm3DGroupFwdXdlops:4671.2,805237760,miopenConvolutionFwdAlgoImplicitGEMM
512-61-60-104-1x1x1-512-61-60-104-1-0x0x0-1x1x1-1x1x1-0-NCDHW-FP16-F=GemmFwd1x1_0_1:9.08527,0,miopenConvolutionFwdAlgoGEMM;GemmFwd1x1_0_1_hipblaslt:15.1014,0,miopenConvolutionFwdAlgoGEMM;ConvHipImplicitGemm3DGroupFwdXdlops:64.8343,780075008,miopenConvolutionFwdAlgoImplicitGEMM
512-63-60-104-3x3x3-256-61-60-104-1-0x1x1-1x1x1-1x1x1-0-NCDHW-FP16-F=ConvHipImplicitGemm3DGroupFwdXdlops:527.458,604520448,miopenConvolutionFwdAlgoImplicitGEMM
512-61-60-104-1x1x1-256-61-60-104-1-0x0x0-1x1x1-1x1x1-0-NCDHW-FP16-F=GemmFwd1x1_0_1:3.45673,0,miopenConvolutionFwdAlgoGEMM;GemmFwd1x1_0_1_hipblaslt:7.83514,0,miopenConvolutionFwdAlgoGEMM;ConvHipImplicitGemm3DGroupFwdXdlops:36.2534,584925184,miopenConvolutionFwdAlgoImplicitGEMM
12-3-354-642-3x3x3-160-1-352-640-1-0x0x0-1x1x1-1x1x1-0-NCDHW-BF16-F=GemmFwdRest:4.64189,145981440,miopenConvolutionFwdAlgoGEMM;ConvHipImplicitGemm3DGroupFwdXdlops:6.08916,88556800,miopenConvolutionFwdAlgoImplicitGEMM;GemmFwdRest_hipblaslt:4.88012,145981440,miopenConvolutionFwdAlgoGEMM
160-3-354-642-3x3x3-160-1-352-640-1-0x0x0-1x1x1-1x1x1-0-NCDHW-BF16-F=GemmFwdRest:76.6266,1946419200,miopenConvolutionFwdAlgoGEMM;ConvHipImplicitGemm3DGroupFwdXdlops:67.7362,291649280,miopenConvolutionFwdAlgoImplicitGEMM;GemmFwdRest_hipblaslt:85.7889,1946419200,miopenConvolutionFwdAlgoGEMM
160-353-641-3x3-160-176-320-1-0x0-2x2-1x1-0-NCHW-BF16-F=GemmFwdRest:2.58515,162201600,miopenConvolutionFwdAlgoGEMM;GemmFwdRest_hipblaslt:2.5263,162201600,miopenConvolutionFwdAlgoGEMM;ConvHipImplicitGemmGroupFwdXdlops:4.19387,90890752,miopenConvolutionFwdAlgoImplicitGEMM
160-1-176-320-1x1x1-320-1-176-320-1-0x0x0-1x1x1-1x1x1-0-NCDHW-BF16-F=GemmFwd1x1_0_1:0.30915,0,miopenConvolutionFwdAlgoGEMM;GemmFwd1x1_0_1_hipblaslt:0.38402,0,miopenConvolutionFwdAlgoGEMM;ConvHipImplicitGemm3DGroupFwdXdlops:1.86072,54169600,miopenConvolutionFwdAlgoImplicitGEMM
160-3-178-322-3x3x3-320-1-176-320-1-0x0x0-1x1x1-1x1x1-0-NCDHW-BF16-F=GemmFwdRest:18.216,486604800,miopenConvolutionFwdAlgoGEMM;ConvHipImplicitGemm3DGroupFwdXdlops:30.8908,93832960,miopenConvolutionFwdAlgoImplicitGEMM;GemmFwdRest_hipblaslt:24.6812,486604800,miopenConvolutionFwdAlgoGEMM
320-3-178-322-3x3x3-320-1-176-320-1-0x0x0-1x1x1-1x1x1-0-NCDHW-BF16-F=GemmFwdRest:49.7048,973209600,miopenConvolutionFwdAlgoGEMM;ConvHipImplicitGemm3DGroupFwdXdlops:60.0937,151621120,miopenConvolutionFwdAlgoImplicitGEMM;GemmFwdRest_hipblaslt:61.5847,973209600,miopenConvolutionFwdAlgoGEMM
320-177-321-3x3-320-88-160-1-0x0-2x2-1x1-0-NCHW-BF16-F=GemmFwdRest:2.0301,81100800,miopenConvolutionFwdAlgoGEMM;GemmFwdRest_hipblaslt:2.26262,81100800,miopenConvolutionFwdAlgoGEMM;ConvHipImplicitGemmGroupFwdXdlops:4.3824,47217408,miopenConvolutionFwdAlgoImplicitGEMM
320-1-88-160-1x1x1-640-1-88-160-1-0x0x0-1x1x1-1x1x1-0-NCDHW-BF16-F=GemmFwd1x1_0_1:0.172787,0,miopenConvolutionFwdAlgoGEMM;GemmFwd1x1_0_1_hipblaslt:0.232736,0,miopenConvolutionFwdAlgoGEMM;ConvHipImplicitGemm3DGroupFwdXdlops:1.21886,27443200,miopenConvolutionFwdAlgoImplicitGEMM
320-3-90-162-3x3x3-640-1-88-160-1-0x0x0-1x1x1-1x1x1-0-NCDHW-BF16-F=GemmFwdRest:14.8703,243302400,miopenConvolutionFwdAlgoGEMM;ConvHipImplicitGemm3DGroupFwdXdlops:30.2298,57075200,miopenConvolutionFwdAlgoImplicitGEMM;GemmFwdRest_hipblaslt:20.9496,243302400,miopenConvolutionFwdAlgoGEMM
640-3-90-162-3x3x3-640-1-88-160-1-0x0x0-1x1x1-1x1x1-0-NCDHW-BF16-F=GemmFwdRest:35.4407,486604800,miopenConvolutionFwdAlgoGEMM;ConvHipImplicitGemm3DGroupFwdXdlops:60.3653,96128000,miopenConvolutionFwdAlgoImplicitGEMM;GemmFwdRest_hipblaslt:49.4706,486604800,miopenConvolutionFwdAlgoGEMM
640-89-161-3x3-640-44-80-1-0x0-2x2-1x1-0-NCHW-BF16-F=GemmFwdRest:1.67487,40550400,miopenConvolutionFwdAlgoGEMM;GemmFwdRest_hipblaslt:1.79182,40550400,miopenConvolutionFwdAlgoGEMM;ConvHipImplicitGemmGroupFwdXdlops:4.16988,30219520,miopenConvolutionFwdAlgoImplicitGEMM
640-3-46-82-3x3x3-640-1-44-80-1-0x0x0-1x1x1-1x1x1-0-NCDHW-BF16-F=GemmFwdRest:5.88919,121651200,miopenConvolutionFwdAlgoGEMM;ConvHipImplicitGemm3DGroupFwdXdlops:15.0012,41108480,miopenConvolutionFwdAlgoImplicitGEMM;GemmFwdRest_hipblaslt:7.16133,121651200,miopenConvolutionFwdAlgoGEMM
640-44-80-1x1-1920-44-80-1-0x0-1x1-1x1-0-NCHW-BF16-F=GemmFwd1x1_0_1:0.348962,0,miopenConvolutionFwdAlgoGEMM;GemmFwd1x1_0_1_hipblaslt:0.431502,0,miopenConvolutionFwdAlgoGEMM;ConvHipImplicitGemmGroupFwdXdlops:1.64965,20480000,miopenConvolutionFwdAlgoImplicitGEMM
640-44-80-1x1-640-44-80-1-0x0-1x1-1x1-0-NCHW-BF16-F=GemmFwd1x1_0_1:0.127297,0,miopenConvolutionFwdAlgoGEMM;GemmFwd1x1_0_1_hipblaslt:0.14919,0,miopenConvolutionFwdAlgoGEMM;ConvHipImplicitGemmGroupFwdXdlops:0.551038,9830400,miopenConvolutionFwdAlgoImplicitGEMM
640-3-46-82-3x3x3-96-1-44-80-1-0x0x0-1x1x1-1x1x1-0-NCDHW-BF16-F=GemmFwdRest:2.67185,121651200,miopenConvolutionFwdAlgoGEMM;ConvHipImplicitGemm3DGroupFwdXdlops:3.35655,18478080,miopenConvolutionFwdAlgoImplicitGEMM;GemmFwdRest_hipblaslt:3.15341,121651200,miopenConvolutionFwdAlgoGEMM
12-6-354-642-3x3x3-160-4-352-640-1-0x0x0-1x1x1-1x1x1-0-NCDHW-BF16-F=GemmFwdRest:20.627,583925760,miopenConvolutionFwdAlgoGEMM;ConvHipImplicitGemm3DGroupFwdXdlops:28.633,321188864,miopenConvolutionFwdAlgoImplicitGEMM;GemmFwdRest_hipblaslt:22.4006,583925760,miopenConvolutionFwdAlgoGEMM
160-6-354-642-3x3x3-160-4-352-640-1-0x0x0-1x1x1-1x1x1-0-NCDHW-BF16-F=ConvHipImplicitGemm3DGroupFwdXdlops:288.83,726095360,miopenConvolutionFwdAlgoImplicitGEMM
160-353-641-3x3-160-176-320-4-0x0-2x2-1x1-0-NCHW-BF16-F=GemmFwdRest:12.9717,162201600,miopenConvolutionFwdAlgoGEMM;GemmFwdRest_hipblaslt:12.1742,162201600,miopenConvolutionFwdAlgoGEMM;ConvHipImplicitGemmGroupFwdXdlops:21.5566,362179840,miopenConvolutionFwdAlgoImplicitGEMM
160-4-176-320-1x1x1-320-4-176-320-1-0x0x0-1x1x1-1x1x1-0-NCDHW-BF16-F=GemmFwd1x1_0_1:1.37816,0,miopenConvolutionFwdAlgoGEMM;GemmFwd1x1_0_1_hipblaslt:2.08639,0,miopenConvolutionFwdAlgoGEMM;ConvHipImplicitGemm3DGroupFwdXdlops:8.8217,216371200,miopenConvolutionFwdAlgoImplicitGEMM
160-6-178-322-3x3x3-320-4-176-320-1-0x0x0-1x1x1-1x1x1-0-NCDHW-BF16-F=GemmFwdRest:102.052,1946419200,miopenConvolutionFwdAlgoGEMM;ConvHipImplicitGemm3DGroupFwdXdlops:113.52,256990720,miopenConvolutionFwdAlgoImplicitGEMM;GemmFwdRest_hipblaslt:116.375,1946419200,miopenConvolutionFwdAlgoGEMM
320-6-178-322-3x3x3-320-4-176-320-1-0x0x0-1x1x1-1x1x1-0-NCDHW-BF16-F=GemmFwdRest:232.14,3892838400,miopenConvolutionFwdAlgoGEMM;ConvHipImplicitGemm3DGroupFwdXdlops:231.415,369802240,miopenConvolutionFwdAlgoImplicitGEMM;GemmFwdRest_hipblaslt:288.207,3892838400,miopenConvolutionFwdAlgoGEMM
320-177-321-3x3-320-88-160-4-0x0-2x2-1x1-0-NCHW-BF16-F=GemmFwdRest:8.48499,81100800,miopenConvolutionFwdAlgoGEMM;GemmFwdRest_hipblaslt:9.1113,81100800,miopenConvolutionFwdAlgoGEMM;ConvHipImplicitGemmGroupFwdXdlops:17.2527,183339520,miopenConvolutionFwdAlgoImplicitGEMM
320-5-88-160-3x1x1-320-2-88-160-1-0x0x0-2x1x1-1x1x1-0-NCDHW-BF16-F=GemmFwdRest:1.65438,54067200,miopenConvolutionFwdAlgoGEMM;ConvHipImplicitGemm3DGroupFwdXdlops:3.96901,63692800,miopenConvolutionFwdAlgoImplicitGEMM;GemmFwdRest_hipblaslt:1.67697,54067200,miopenConvolutionFwdAlgoGEMM
320-2-88-160-1x1x1-640-2-88-160-1-0x0x0-1x1x1-1x1x1-0-NCDHW-BF16-F=GemmFwd1x1_0_1:0.368563,0,miopenConvolutionFwdAlgoGEMM;GemmFwd1x1_0_1_hipblaslt:0.558891,0,miopenConvolutionFwdAlgoGEMM;ConvHipImplicitGemm3DGroupFwdXdlops:3.2846,54476800,miopenConvolutionFwdAlgoImplicitGEMM
320-4-90-162-3x3x3-640-2-88-160-1-0x0x0-1x1x1-1x1x1-0-NCDHW-BF16-F=GemmFwdRest:33.6122,486604800,miopenConvolutionFwdAlgoGEMM;ConvHipImplicitGemm3DGroupFwdXdlops:59.8091,84428800,miopenConvolutionFwdAlgoImplicitGEMM;GemmFwdRest_hipblaslt:46.2105,486604800,miopenConvolutionFwdAlgoGEMM
640-4-90-162-3x3x3-640-2-88-160-1-0x0x0-1x1x1-1x1x1-0-NCDHW-BF16-F=GemmFwdRest:76.9774,973209600,miopenConvolutionFwdAlgoGEMM;ConvHipImplicitGemm3DGroupFwdXdlops:115.197,132812800,miopenConvolutionFwdAlgoImplicitGEMM;GemmFwdRest_hipblaslt:108.896,973209600,miopenConvolutionFwdAlgoGEMM
640-89-161-3x3-640-44-80-2-0x0-2x2-1x1-0-NCHW-BF16-F=GemmFwdRest:3.29496,40550400,miopenConvolutionFwdAlgoGEMM;GemmFwdRest_hipblaslt:3.56457,40550400,miopenConvolutionFwdAlgoGEMM;ConvHipImplicitGemmGroupFwdXdlops:7.70735,53066240,miopenConvolutionFwdAlgoImplicitGEMM
640-3-44-80-3x1x1-640-1-44-80-1-0x0x0-2x1x1-1x1x1-0-NCDHW-BF16-F=GemmFwdRest:0.54624,13516800,miopenConvolutionFwdAlgoGEMM;ConvHipImplicitGemm3DGroupFwdXdlops:1.59778,20480000,miopenConvolutionFwdAlgoImplicitGEMM;GemmFwdRest_hipblaslt:0.554457,13516800,miopenConvolutionFwdAlgoGEMM
96-21-44-80-1x1x1-96-21-44-80-1-0x0x0-1x1x1-1x1x1-0-NCDHW-BF16-F=GemmFwd1x1_0_1_hipblaslt:0.14919,0,miopenConvolutionFwdAlgoGEMM;ConvHipImplicitGemm3DGroupFwdXdlops:1.02863,28403712,miopenConvolutionFwdAlgoImplicitGEMM
48-7-44-80-3x3x3-512-5-44-80-1-0x1x1-1x1x1-1x1x1-0-NCDHW-FP32-F=GemmFwdRest:11.6664,91238400,miopenConvolutionFwdAlgoGEMM;GemmFwdRest_hipblaslt:58.291,91238400,miopenConvolutionFwdAlgoGEMM
512-9-44-80-5x5x5-512-5-44-80-1-0x2x2-1x1x1-1x1x1-0-NCDHW-FP32-F_g512=GemmFwdRest:111.684,4505600000,miopenConvolutionFwdAlgoGEMM;GemmFwdRest_hipblaslt:86.064,4505600000,miopenConvolutionFwdAlgoGEMM
512-5-44-80-1x1x1-512-5-44-80-1-0x0x0-1x1x1-1x1x1-0-NCDHW-FP32-F=GemmFwd1x1_0_1:5.45584,0,miopenConvolutionFwdAlgoGEMM;GemmFwd1x1_0_1_hipblaslt:14.1866,0,miopenConvolutionFwdAlgoGEMM
512-7-44-80-3x3x3-256-5-44-80-1-0x1x1-1x1x1-1x1x1-0-NCDHW-FP32-F=GemmFwdRest:81.9745,973209600,miopenConvolutionFwdAlgoGEMM;GemmFwdRest_hipblaslt:332.05,973209600,miopenConvolutionFwdAlgoGEMM
256-7-44-80-3x3x3-256-5-44-80-1-0x1x1-1x1x1-1x1x1-0-NCDHW-FP32-F=GemmFwdRest:45.7577,486604800,miopenConvolutionFwdAlgoGEMM;GemmFwdRest_hipblaslt:153.104,486604800,miopenConvolutionFwdAlgoGEMM
512-5-44-80-1x1x1-256-5-44-80-1-0x0x0-1x1x1-1x1x1-0-NCDHW-FP32-F=GemmFwd1x1_0_1:2.21148,0,miopenConvolutionFwdAlgoGEMM;GemmFwd1x1_0_1_hipblaslt:4.96359,0,miopenConvolutionFwdAlgoGEMM
256-7-44-80-3x3x3-2048-5-44-80-1-0x1x1-1x1x1-1x1x1-0-NCDHW-FP32-F=GemmFwdRest:267.892,486604800,miopenConvolutionFwdAlgoGEMM;GemmFwdRest_hipblaslt:1143.65,486604800,miopenConvolutionFwdAlgoGEMM
256-11-88-160-3x3x3-256-9-88-160-1-0x1x1-1x1x1-1x1x1-0-NCDHW-FP32-F=GemmFwdRest:311.277,3503554560,miopenConvolutionFwdAlgoGEMM;GemmFwdRest_hipblaslt:2445.95,3503554560,miopenConvolutionFwdAlgoGEMM
256-11-88-160-3x3x3-64-9-88-160-1-0x1x1-1x1x1-1x1x1-0-NCDHW-FP32-F=GemmFwdRest:102.757,3503554560,miopenConvolutionFwdAlgoGEMM;GemmFwdRest_hipblaslt:639.762,3503554560,miopenConvolutionFwdAlgoGEMM
64-11-88-160-3x3x3-64-9-88-160-1-0x1x1-1x1x1-1x1x1-0-NCDHW-FP32-F=GemmFwdRest:25.2588,875888640,miopenConvolutionFwdAlgoGEMM;GemmFwdRest_hipblaslt:61.4232,875888640,miopenConvolutionFwdAlgoGEMM
256-9-88-160-1x1x1-64-9-88-160-1-0x0x0-1x1x1-1x1x1-0-NCDHW-FP32-F=GemmFwd1x1_0_1:1.77289,0,miopenConvolutionFwdAlgoGEMM;GemmFwd1x1_0_1_hipblaslt:4.82607,0,miopenConvolutionFwdAlgoGEMM
64-11-88-160-3x3x3-512-9-88-160-1-0x1x1-1x1x1-1x1x1-0-NCDHW-FP32-F=GemmFwdRest:127.75,875888640,miopenConvolutionFwdAlgoGEMM;GemmFwdRest_hipblaslt:795.473,875888640,miopenConvolutionFwdAlgoGEMM
64-19-176-320-3x3x3-64-17-176-320-1-0x1x1-1x1x1-1x1x1-0-NCDHW-FP32-F=GemmFwdRest:210.852,6617825280,miopenConvolutionFwdAlgoGEMM;GemmFwdRest_hipblaslt:804.057,6617825280,miopenConvolutionFwdAlgoGEMM
64-19-176-320-3x3x3-32-17-176-320-1-0x1x1-1x1x1-1x1x1-0-NCDHW-FP32-F=GemmFwdRest:144.988,6617825280,miopenConvolutionFwdAlgoGEMM;GemmFwdRest_hipblaslt:442.242,6617825280,miopenConvolutionFwdAlgoGEMM
32-19-176-320-3x3x3-32-17-176-320-1-0x1x1-1x1x1-1x1x1-0-NCDHW-FP32-F=GemmFwdRest:69.2756,3308912640,miopenConvolutionFwdAlgoGEMM;GemmFwdRest_hipblaslt:139.006,3308912640,miopenConvolutionFwdAlgoGEMM
64-17-176-320-1x1x1-32-17-176-320-1-0x0x0-1x1x1-1x1x1-0-NCDHW-FP32-F=GemmFwd1x1_0_1:2.26247,0,miopenConvolutionFwdAlgoGEMM;GemmFwd1x1_0_1_hipblaslt:6.27799,0,miopenConvolutionFwdAlgoGEMM
32-19-176-320-3x3x3-128-17-176-320-1-0x1x1-1x1x1-1x1x1-0-NCDHW-FP32-F=GemmFwdRest:163.273,3308912640,miopenConvolutionFwdAlgoGEMM;GemmFwdRest_hipblaslt:383.426,3308912640,miopenConvolutionFwdAlgoGEMM
32-19-352-640-3x3x3-32-17-352-640-1-0x1x1-1x1x1-1x1x1-0-NCDHW-FP32-F=GemmFwdRest:358.246,13235650560,miopenConvolutionFwdAlgoGEMM;GemmFwdRest_hipblaslt:522.87,13235650560,miopenConvolutionFwdAlgoGEMM
32-352-640-3x3-32-352-640-1-1x1-1x1-1x1-0-NCHW-FP32-F=GemmFwdRest:3.50822,259522560,miopenConvolutionFwdAlgoGEMM;GemmFwdRest_hipblaslt:4.49142,259522560,miopenConvolutionFwdAlgoGEMM;ConvBinWinogradRxSf3x2:0.518183,0,miopenConvolutionFwdAlgoWinograd;ConvBinWinogradRxSf2x3g1:0.393229,0,miopenConvolutionFwdAlgoWinograd
8-19-704-1280-3x3x3-3-17-704-1280-1-0x1x1-1x1x1-1x1x1-0-NCDHW-FP32-F=GemmFwdRest:312.864,13235650560,miopenConvolutionFwdAlgoGEMM;GemmFwdRest_hipblaslt:231.666,13235650560,miopenConvolutionFwdAlgoGEMM
48-5-44-80-3x3x3-512-3-44-80-1-0x1x1-1x1x1-1x1x1-0-NCDHW-FP32-F=GemmFwdRest:7.26271,54743040,miopenConvolutionFwdAlgoGEMM;GemmFwdRest_hipblaslt:12.3587,54743040,miopenConvolutionFwdAlgoGEMM
512-7-44-80-5x5x5-512-3-44-80-1-0x2x2-1x1x1-1x1x1-0-NCDHW-FP32-F_g512=GemmFwdRest:45.1703,2703360000,miopenConvolutionFwdAlgoGEMM;GemmFwdRest_hipblaslt:47.7289,2703360000,miopenConvolutionFwdAlgoGEMM
512-3-44-80-1x1x1-512-3-44-80-1-0x0x0-1x1x1-1x1x1-0-NCDHW-FP32-F=GemmFwd1x1_0_1:2.90729,0,miopenConvolutionFwdAlgoGEMM;GemmFwd1x1_0_1_hipblaslt:3.36817,0,miopenConvolutionFwdAlgoGEMM
512-5-44-80-3x3x3-256-3-44-80-1-0x1x1-1x1x1-1x1x1-0-NCDHW-FP32-F=GemmFwdRest:44.3926,583925760,miopenConvolutionFwdAlgoGEMM;GemmFwdRest_hipblaslt:79.3224,583925760,miopenConvolutionFwdAlgoGEMM
256-5-44-80-3x3x3-256-3-44-80-1-0x1x1-1x1x1-1x1x1-0-NCDHW-FP32-F=GemmFwdRest:24.8616,291962880,miopenConvolutionFwdAlgoGEMM;GemmFwdRest_hipblaslt:62.3904,291962880,miopenConvolutionFwdAlgoGEMM
512-3-44-80-1x1x1-256-3-44-80-1-0x0x0-1x1x1-1x1x1-0-NCDHW-FP32-F=GemmFwd1x1_0_1:1.07041,0,miopenConvolutionFwdAlgoGEMM;GemmFwd1x1_0_1_hipblaslt:1.41467,0,miopenConvolutionFwdAlgoGEMM
256-5-44-80-3x3x3-2048-3-44-80-1-0x1x1-1x1x1-1x1x1-0-NCDHW-FP32-F=GemmFwdRest:199.668,291962880,miopenConvolutionFwdAlgoGEMM;GemmFwdRest_hipblaslt:487.41,291962880,miopenConvolutionFwdAlgoGEMM
256-7-88-160-3x3x3-256-5-88-160-1-0x1x1-1x1x1-1x1x1-0-NCDHW-FP32-F=GemmFwdRest:147.113,1946419200,miopenConvolutionFwdAlgoGEMM;GemmFwdRest_hipblaslt:269.868,1946419200,miopenConvolutionFwdAlgoGEMM
256-7-88-160-3x3x3-64-5-88-160-1-0x1x1-1x1x1-1x1x1-0-NCDHW-FP32-F=GemmFwdRest:54.7069,1946419200,miopenConvolutionFwdAlgoGEMM;GemmFwdRest_hipblaslt:82.0126,1946419200,miopenConvolutionFwdAlgoGEMM
64-7-88-160-3x3x3-64-5-88-160-1-0x1x1-1x1x1-1x1x1-0-NCDHW-FP32-F=GemmFwdRest:14.706,486604800,miopenConvolutionFwdAlgoGEMM;GemmFwdRest_hipblaslt:17.3041,486604800,miopenConvolutionFwdAlgoGEMM
256-5-88-160-1x1x1-64-5-88-160-1-0x0x0-1x1x1-1x1x1-0-NCDHW-FP32-F=GemmFwd1x1_0_1:0.944081,0,miopenConvolutionFwdAlgoGEMM;GemmFwd1x1_0_1_hipblaslt:1.50038,0,miopenConvolutionFwdAlgoGEMM
64-7-88-160-3x3x3-512-5-88-160-1-0x1x1-1x1x1-1x1x1-0-NCDHW-FP32-F=GemmFwdRest:68.895,486604800,miopenConvolutionFwdAlgoGEMM;GemmFwdRest_hipblaslt:195.121,486604800,miopenConvolutionFwdAlgoGEMM
64-11-176-320-3x3x3-64-9-176-320-1-0x1x1-1x1x1-1x1x1-0-NCDHW-FP32-F=GemmFwdRest:116.74,3503554560,miopenConvolutionFwdAlgoGEMM;GemmFwdRest_hipblaslt:208.395,3503554560,miopenConvolutionFwdAlgoGEMM
64-11-176-320-3x3x3-32-9-176-320-1-0x1x1-1x1x1-1x1x1-0-NCDHW-FP32-F=GemmFwdRest:82.6248,3503554560,miopenConvolutionFwdAlgoGEMM;GemmFwdRest_hipblaslt:124.038,3503554560,miopenConvolutionFwdAlgoGEMM
32-11-176-320-3x3x3-32-9-176-320-1-0x1x1-1x1x1-1x1x1-0-NCDHW-FP32-F=GemmFwdRest:37.7497,1751777280,miopenConvolutionFwdAlgoGEMM;GemmFwdRest_hipblaslt:48.4695,1751777280,miopenConvolutionFwdAlgoGEMM
64-9-176-320-1x1x1-32-9-176-320-1-0x0x0-1x1x1-1x1x1-0-NCDHW-FP32-F=GemmFwd1x1_0_1:1.10049,0,miopenConvolutionFwdAlgoGEMM;GemmFwd1x1_0_1_hipblaslt:1.68083,0,miopenConvolutionFwdAlgoGEMM
32-11-176-320-3x3x3-128-9-176-320-1-0x1x1-1x1x1-1x1x1-0-NCDHW-FP32-F=GemmFwdRest:88.2045,1751777280,miopenConvolutionFwdAlgoGEMM;GemmFwdRest_hipblaslt:224.146,1751777280,miopenConvolutionFwdAlgoGEMM
32-11-352-640-3x3x3-32-9-352-640-1-0x1x1-1x1x1-1x1x1-0-NCDHW-FP32-F=GemmFwdRest:180.271,7007109120,miopenConvolutionFwdAlgoGEMM;GemmFwdRest_hipblaslt:313.041,7007109120,miopenConvolutionFwdAlgoGEMM
8-11-704-1280-3x3x3-3-9-704-1280-1-0x1x1-1x1x1-1x1x1-0-NCDHW-FP32-F=GemmFwdRest:176.292,7007109120,miopenConvolutionFwdAlgoGEMM;GemmFwdRest_hipblaslt:148.153,7007109120,miopenConvolutionFwdAlgoGEMM
96-1-44-80-1x1x1-96-1-44-80-1-0x0x0-1x1x1-1x1x1-0-NCDHW-BF16-F=GemmFwd1x1_0_1:0.0311629,0,miopenConvolutionFwdAlgoGEMM;GemmFwd1x1_0_1_hipblaslt:0.043195,0,miopenConvolutionFwdAlgoGEMM;ConvHipImplicitGemm3DGroupFwdXdlops:0.256768,1370112,miopenConvolutionFwdAlgoImplicitGEMM
48-1-44-80-1x2x2-3072-1-22-40-1-0x0x0-1x2x2-1x1x1-0-NCDHW-FP16-F=GemmFwdRest:0.0884771,337920,miopenConvolutionFwdAlgoGEMM;ConvHipImplicitGemm3DGroupFwdXdlops:0.33688,6924288,miopenConvolutionFwdAlgoImplicitGEMM;GemmFwdRest_hipblaslt:0.105907,337920,miopenConvolutionFwdAlgoGEMM
48-3-44-80-3x3x3-512-1-44-80-1-0x1x1-1x1x1-1x1x1-0-NCDHW-FP32-F=GemmFwdRest:2.2451,18247680,miopenConvolutionFwdAlgoGEMM;GemmFwdRest_hipblaslt:2.5918,18247680,miopenConvolutionFwdAlgoGEMM
512-5-44-80-5x5x5-512-1-44-80-1-0x2x2-1x1x1-1x1x1-0-NCDHW-FP32-F_g512=GemmFwdRest:14.3827,901120000,miopenConvolutionFwdAlgoGEMM;GemmFwdRest_hipblaslt:13.5793,901120000,miopenConvolutionFwdAlgoGEMM
512-1-44-80-1x1x1-512-1-44-80-1-0x0x0-1x1x1-1x1x1-0-NCDHW-FP32-F=GemmFwd1x1_0_1:0.7916,0,miopenConvolutionFwdAlgoGEMM;GemmFwd1x1_0_1_hipblaslt:0.791206,0,miopenConvolutionFwdAlgoGEMM
512-3-44-80-3x3x3-256-1-44-80-1-0x1x1-1x1x1-1x1x1-0-NCDHW-FP32-F=GemmFwdRest:16.6155,194641920,miopenConvolutionFwdAlgoGEMM;GemmFwdRest_hipblaslt:20.3364,194641920,miopenConvolutionFwdAlgoGEMM
256-3-44-80-3x3x3-256-1-44-80-1-0x1x1-1x1x1-1x1x1-0-NCDHW-FP32-F=GemmFwdRest:7.14993,97320960,miopenConvolutionFwdAlgoGEMM;GemmFwdRest_hipblaslt:8.83531,97320960,miopenConvolutionFwdAlgoGEMM
512-1-44-80-1x1x1-256-1-44-80-1-0x0x0-1x1x1-1x1x1-0-NCDHW-FP32-F=GemmFwd1x1_0_1:0.360208,0,miopenConvolutionFwdAlgoGEMM;GemmFwd1x1_0_1_hipblaslt:0.363079,0,miopenConvolutionFwdAlgoGEMM
256-3-44-80-3x3x3-2048-1-44-80-1-0x1x1-1x1x1-1x1x1-0-NCDHW-FP32-F=GemmFwdRest:56.985,97320960,miopenConvolutionFwdAlgoGEMM;GemmFwdRest_hipblaslt:83.2709,97320960,miopenConvolutionFwdAlgoGEMM
256-3-88-160-3x3x3-256-1-88-160-1-0x1x1-1x1x1-1x1x1-0-NCDHW-FP32-F=GemmFwdRest:31.1109,389283840,miopenConvolutionFwdAlgoGEMM;GemmFwdRest_hipblaslt:41.2981,389283840,miopenConvolutionFwdAlgoGEMM
256-3-88-160-3x3x3-64-1-88-160-1-0x1x1-1x1x1-1x1x1-0-NCDHW-FP32-F=GemmFwdRest:11.767,389283840,miopenConvolutionFwdAlgoGEMM;GemmFwdRest_hipblaslt:13.1416,389283840,miopenConvolutionFwdAlgoGEMM
64-3-88-160-3x3x3-64-1-88-160-1-0x1x1-1x1x1-1x1x1-0-NCDHW-FP32-F=GemmFwdRest:2.28191,97320960,miopenConvolutionFwdAlgoGEMM;GemmFwdRest_hipblaslt:2.76072,97320960,miopenConvolutionFwdAlgoGEMM
256-1-88-160-1x1x1-64-1-88-160-1-0x0x0-1x1x1-1x1x1-0-NCDHW-FP32-F=GemmFwd1x1_0_1:0.175559,0,miopenConvolutionFwdAlgoGEMM;GemmFwd1x1_0_1_hipblaslt:0.179243,0,miopenConvolutionFwdAlgoGEMM
64-3-88-160-3x3x3-512-1-88-160-1-0x1x1-1x1x1-1x1x1-0-NCDHW-FP32-F=GemmFwdRest:13.305,97320960,miopenConvolutionFwdAlgoGEMM;GemmFwdRest_hipblaslt:19.9624,97320960,miopenConvolutionFwdAlgoGEMM
64-3-176-320-3x3x3-64-1-176-320-1-0x1x1-1x1x1-1x1x1-0-NCDHW-FP32-F=GemmFwdRest:11.1239,389283840,miopenConvolutionFwdAlgoGEMM;GemmFwdRest_hipblaslt:13.1955,389283840,miopenConvolutionFwdAlgoGEMM
64-3-176-320-3x3x3-32-1-176-320-1-0x1x1-1x1x1-1x1x1-0-NCDHW-FP32-F=GemmFwdRest:8.54357,389283840,miopenConvolutionFwdAlgoGEMM;GemmFwdRest_hipblaslt:9.43144,389283840,miopenConvolutionFwdAlgoGEMM
32-3-176-320-3x3x3-32-1-176-320-1-0x1x1-1x1x1-1x1x1-0-NCDHW-FP32-F=GemmFwdRest:3.40494,194641920,miopenConvolutionFwdAlgoGEMM;GemmFwdRest_hipblaslt:4.26852,194641920,miopenConvolutionFwdAlgoGEMM
64-1-176-320-1x1x1-32-1-176-320-1-0x0x0-1x1x1-1x1x1-0-NCDHW-FP32-F=GemmFwd1x1_0_1:0.096265,0,miopenConvolutionFwdAlgoGEMM;GemmFwd1x1_0_1_hipblaslt:0.106377,0,miopenConvolutionFwdAlgoGEMM
32-3-176-320-3x3x3-128-1-176-320-1-0x1x1-1x1x1-1x1x1-0-NCDHW-FP32-F=GemmFwdRest:7.9092,194641920,miopenConvolutionFwdAlgoGEMM;GemmFwdRest_hipblaslt:10.8423,194641920,miopenConvolutionFwdAlgoGEMM
32-3-352-640-3x3x3-32-1-352-640-1-0x1x1-1x1x1-1x1x1-0-NCDHW-FP32-F=GemmFwdRest:17.3218,778567680,miopenConvolutionFwdAlgoGEMM;GemmFwdRest_hipblaslt:18.4092,778567680,miopenConvolutionFwdAlgoGEMM
8-3-704-1280-3x3x3-3-1-704-1280-1-0x1x1-1x1x1-1x1x1-0-NCDHW-FP32-F=GemmFwdRest:16.1657,778567680,miopenConvolutionFwdAlgoGEMM;GemmFwdRest_hipblaslt:13.2735,778567680,miopenConvolutionFwdAlgoGEMM
96-3-44-80-1x1x1-96-3-44-80-1-0x0x0-1x1x1-1x1x1-0-NCDHW-BF16-F=GemmFwd1x1_0_1:4.42854e-05,0,miopenConvolutionFwdAlgoGEMM;GemmFwd1x1_0_1_hipblaslt:0.0606133,0,miopenConvolutionFwdAlgoGEMM;ConvHipImplicitGemm3DGroupFwdXdlops:0.520355,4073472,miopenConvolutionFwdAlgoImplicitGEMM
48-3-44-80-1x2x2-3072-3-22-40-1-0x0x0-1x2x2-1x1x1-0-NCDHW-FP16-F=GemmFwdRest:0.143273,1013760,miopenConvolutionFwdAlgoGEMM;ConvHipImplicitGemm3DGroupFwdXdlops:0.885941,18413568,miopenConvolutionFwdAlgoImplicitGEMM;GemmFwdRest_hipblaslt:0.194398,1013760,miopenConvolutionFwdAlgoGEMM
48-7-30-52-3x3x3-512-5-30-52-1-0x1x1-1x1x1-1x1x1-0-NCDHW-FP32-F=GemmFwdRest:5.47596,40435200,miopenConvolutionFwdAlgoGEMM;GemmFwdRest_hipblaslt:9.09917,40435200,miopenConvolutionFwdAlgoGEMM
512-9-30-52-5x5x5-512-5-30-52-1-0x2x2-1x1x1-1x1x1-0-NCDHW-FP32-F_g512=GemmFwdRest:45.5007,1996800000,miopenConvolutionFwdAlgoGEMM;GemmFwdRest_hipblaslt:37.2871,1996800000,miopenConvolutionFwdAlgoGEMM
512-5-30-52-1x1x1-512-5-30-52-1-0x0x0-1x1x1-1x1x1-0-NCDHW-FP32-F=GemmFwd1x1_0_1:1.6695,0,miopenConvolutionFwdAlgoGEMM;GemmFwd1x1_0_1_hipblaslt:1.64004,0,miopenConvolutionFwdAlgoGEMM
512-7-30-52-3x3x3-256-5-30-52-1-0x1x1-1x1x1-1x1x1-0-NCDHW-FP32-F=GemmFwdRest:49.6603,431308800,miopenConvolutionFwdAlgoGEMM;GemmFwdRest_hipblaslt:105.756,431308800,miopenConvolutionFwdAlgoGEMM
256-7-30-52-3x3x3-256-5-30-52-1-0x1x1-1x1x1-1x1x1-0-NCDHW-FP32-F=GemmFwdRest:17.7702,215654400,miopenConvolutionFwdAlgoGEMM;GemmFwdRest_hipblaslt:26.5983,215654400,miopenConvolutionFwdAlgoGEMM
512-5-30-52-1x1x1-256-5-30-52-1-0x0x0-1x1x1-1x1x1-0-NCDHW-FP32-F=GemmFwd1x1_0_1:0.767728,0,miopenConvolutionFwdAlgoGEMM;GemmFwd1x1_0_1_hipblaslt:0.986815,0,miopenConvolutionFwdAlgoGEMM
256-7-30-52-3x3x3-2048-5-30-52-1-0x1x1-1x1x1-1x1x1-0-NCDHW-FP32-F=GemmFwdRest:132.535,215654400,miopenConvolutionFwdAlgoGEMM;GemmFwdRest_hipblaslt:178.041,215654400,miopenConvolutionFwdAlgoGEMM
256-11-60-104-3x3x3-256-9-60-104-1-0x1x1-1x1x1-1x1x1-0-NCDHW-FP32-F=GemmFwdRest:170.266,1552711680,miopenConvolutionFwdAlgoGEMM;GemmFwdRest_hipblaslt:355.576,1552711680,miopenConvolutionFwdAlgoGEMM
256-11-60-104-3x3x3-64-9-60-104-1-0x1x1-1x1x1-1x1x1-0-NCDHW-FP32-F=GemmFwdRest:46.7585,1552711680,miopenConvolutionFwdAlgoGEMM;GemmFwdRest_hipblaslt:98.0756,1552711680,miopenConvolutionFwdAlgoGEMM
64-11-60-104-3x3x3-64-9-60-104-1-0x1x1-1x1x1-1x1x1-0-NCDHW-FP32-F=GemmFwdRest:11.629,388177920,miopenConvolutionFwdAlgoGEMM;GemmFwdRest_hipblaslt:18.9584,388177920,miopenConvolutionFwdAlgoGEMM
256-9-60-104-1x1x1-64-9-60-104-1-0x0x0-1x1x1-1x1x1-0-NCDHW-FP32-F=GemmFwd1x1_0_1:0.712724,0,miopenConvolutionFwdAlgoGEMM;GemmFwd1x1_0_1_hipblaslt:1.12201,0,miopenConvolutionFwdAlgoGEMM
64-11-60-104-3x3x3-512-9-60-104-1-0x1x1-1x1x1-1x1x1-0-NCDHW-FP32-F=GemmFwdRest:57.2047,388177920,miopenConvolutionFwdAlgoGEMM;GemmFwdRest_hipblaslt:75.5091,388177920,miopenConvolutionFwdAlgoGEMM
64-19-120-208-3x3x3-64-17-120-208-1-0x1x1-1x1x1-1x1x1-0-NCDHW-FP32-F=GemmFwdRest:87.5544,2932899840,miopenConvolutionFwdAlgoGEMM;GemmFwdRest_hipblaslt:149.929,2932899840,miopenConvolutionFwdAlgoGEMM
64-19-120-208-3x3x3-32-17-120-208-1-0x1x1-1x1x1-1x1x1-0-NCDHW-FP32-F=GemmFwdRest:69.9082,2932899840,miopenConvolutionFwdAlgoGEMM;GemmFwdRest_hipblaslt:99.5384,2932899840,miopenConvolutionFwdAlgoGEMM
32-19-120-208-3x3x3-32-17-120-208-1-0x1x1-1x1x1-1x1x1-0-NCDHW-FP32-F=GemmFwdRest:34.9936,1466449920,miopenConvolutionFwdAlgoGEMM;GemmFwdRest_hipblaslt:36.7906,1466449920,miopenConvolutionFwdAlgoGEMM
64-17-120-208-1x1x1-32-17-120-208-1-0x0x0-1x1x1-1x1x1-0-NCDHW-FP32-F=GemmFwd1x1_0_1:0.970338,0,miopenConvolutionFwdAlgoGEMM;GemmFwd1x1_0_1_hipblaslt:1.39463,0,miopenConvolutionFwdAlgoGEMM
32-19-120-208-3x3x3-128-17-120-208-1-0x1x1-1x1x1-1x1x1-0-NCDHW-FP32-F=GemmFwdRest:77.2301,1466449920,miopenConvolutionFwdAlgoGEMM;GemmFwdRest_hipblaslt:125.283,1466449920,miopenConvolutionFwdAlgoGEMM
32-19-240-416-3x3x3-32-17-240-416-1-0x1x1-1x1x1-1x1x1-0-NCDHW-FP32-F=GemmFwdRest:180.02,5865799680,miopenConvolutionFwdAlgoGEMM;GemmFwdRest_hipblaslt:215.332,5865799680,miopenConvolutionFwdAlgoGEMM
32-240-416-3x3-32-240-416-1-1x1-1x1-1x1-0-NCHW-FP32-F=GemmFwdRest:1.64524,115015680,miopenConvolutionFwdAlgoGEMM;GemmFwdRest_hipblaslt:2.09454,115015680,miopenConvolutionFwdAlgoGEMM;ConvBinWinogradRxSf3x2:0.2879,0,miopenConvolutionFwdAlgoWinograd;ConvBinWinogradRxSf2x3g1:0.211167,0,miopenConvolutionFwdAlgoWinograd
8-19-480-832-3x3x3-3-17-480-832-1-0x1x1-1x1x1-1x1x1-0-NCDHW-FP32-F=GemmFwdRest:140.838,5865799680,miopenConvolutionFwdAlgoGEMM;GemmFwdRest_hipblaslt:110.959,5865799680,miopenConvolutionFwdAlgoGEMM
48-6-30-52-3x3x3-512-4-30-52-1-0x1x1-1x1x1-1x1x1-0-NCDHW-FP32-F=GemmFwdRest:4.15913,32348160,miopenConvolutionFwdAlgoGEMM;GemmFwdRest_hipblaslt:4.2389,32348160,miopenConvolutionFwdAlgoGEMM
512-8-30-52-5x5x5-512-4-30-52-1-0x2x2-1x1x1-1x1x1-0-NCDHW-FP32-F_g512=GemmFwdRest:39.0908,1597440000,miopenConvolutionFwdAlgoGEMM;GemmFwdRest_hipblaslt:32.2204,1597440000,miopenConvolutionFwdAlgoGEMM
512-4-30-52-1x1x1-512-4-30-52-1-0x0x0-1x1x1-1x1x1-0-NCDHW-FP32-F=GemmFwd1x1_0_1:1.58253,0,miopenConvolutionFwdAlgoGEMM;GemmFwd1x1_0_1_hipblaslt:1.6289,0,miopenConvolutionFwdAlgoGEMM
512-6-30-52-3x3x3-256-4-30-52-1-0x1x1-1x1x1-1x1x1-0-NCDHW-FP32-F=GemmFwdRest:56.978,345047040,miopenConvolutionFwdAlgoGEMM;GemmFwdRest_hipblaslt:131.936,345047040,miopenConvolutionFwdAlgoGEMM
256-6-30-52-3x3x3-256-4-30-52-1-0x1x1-1x1x1-1x1x1-0-NCDHW-FP32-F=GemmFwdRest:22.6273,172523520,miopenConvolutionFwdAlgoGEMM;GemmFwdRest_hipblaslt:48.1041,172523520,miopenConvolutionFwdAlgoGEMM
512-4-30-52-1x1x1-256-4-30-52-1-0x0x0-1x1x1-1x1x1-0-NCDHW-FP32-F=GemmFwd1x1_0_1:0.560501,0,miopenConvolutionFwdAlgoGEMM;GemmFwd1x1_0_1_hipblaslt:0.598103,0,miopenConvolutionFwdAlgoGEMM
256-6-30-52-3x3x3-2048-4-30-52-1-0x1x1-1x1x1-1x1x1-0-NCDHW-FP32-F=GemmFwdRest:198.006,172523520,miopenConvolutionFwdAlgoGEMM;GemmFwdRest_hipblaslt:470.564,172523520,miopenConvolutionFwdAlgoGEMM
256-9-60-104-3x3x3-256-7-60-104-1-0x1x1-1x1x1-1x1x1-0-NCDHW-FP32-F=GemmFwdRest:199.916,1207664640,miopenConvolutionFwdAlgoGEMM;GemmFwdRest_hipblaslt:528.541,1207664640,miopenConvolutionFwdAlgoGEMM
256-9-60-104-3x3x3-64-7-60-104-1-0x1x1-1x1x1-1x1x1-0-NCDHW-FP32-F=GemmFwdRest:52.3174,1207664640,miopenConvolutionFwdAlgoGEMM;GemmFwdRest_hipblaslt:133.646,1207664640,miopenConvolutionFwdAlgoGEMM
64-9-60-104-3x3x3-64-7-60-104-1-0x1x1-1x1x1-1x1x1-0-NCDHW-FP32-F=GemmFwdRest:10.9831,301916160,miopenConvolutionFwdAlgoGEMM;GemmFwdRest_hipblaslt:20.3286,301916160,miopenConvolutionFwdAlgoGEMM
256-7-60-104-1x1x1-64-7-60-104-1-0x0x0-1x1x1-1x1x1-0-NCDHW-FP32-F=GemmFwd1x1_0_1:0.538238,0,miopenConvolutionFwdAlgoGEMM;GemmFwd1x1_0_1_hipblaslt:0.81488,0,miopenConvolutionFwdAlgoGEMM
64-9-60-104-3x3x3-512-7-60-104-1-0x1x1-1x1x1-1x1x1-0-NCDHW-FP32-F=GemmFwdRest:54.6197,301916160,miopenConvolutionFwdAlgoGEMM;GemmFwdRest_hipblaslt:164.45,301916160,miopenConvolutionFwdAlgoGEMM
64-15-120-208-3x3x3-64-13-120-208-1-0x1x1-1x1x1-1x1x1-0-NCDHW-FP32-F=GemmFwdRest:85.2938,2242805760,miopenConvolutionFwdAlgoGEMM;GemmFwdRest_hipblaslt:160.753,2242805760,miopenConvolutionFwdAlgoGEMM
64-15-120-208-3x3x3-32-13-120-208-1-0x1x1-1x1x1-1x1x1-0-NCDHW-FP32-F=GemmFwdRest:61.4512,2242805760,miopenConvolutionFwdAlgoGEMM;GemmFwdRest_hipblaslt:98.4911,2242805760,miopenConvolutionFwdAlgoGEMM
32-15-120-208-3x3x3-32-13-120-208-1-0x1x1-1x1x1-1x1x1-0-NCDHW-FP32-F=GemmFwdRest:27.6956,1121402880,miopenConvolutionFwdAlgoGEMM;GemmFwdRest_hipblaslt:36.3972,1121402880,miopenConvolutionFwdAlgoGEMM
64-13-120-208-1x1x1-32-13-120-208-1-0x0x0-1x1x1-1x1x1-0-NCDHW-FP32-F=GemmFwd1x1_0_1:0.782702,0,miopenConvolutionFwdAlgoGEMM;GemmFwd1x1_0_1_hipblaslt:1.21339,0,miopenConvolutionFwdAlgoGEMM
32-15-120-208-3x3x3-128-13-120-208-1-0x1x1-1x1x1-1x1x1-0-NCDHW-FP32-F=GemmFwdRest:57.3612,1121402880,miopenConvolutionFwdAlgoGEMM;GemmFwdRest_hipblaslt:93.8343,1121402880,miopenConvolutionFwdAlgoGEMM
32-15-240-416-3x3x3-32-13-240-416-1-0x1x1-1x1x1-1x1x1-0-NCDHW-FP32-F=GemmFwdRest:130.578,4485611520,miopenConvolutionFwdAlgoGEMM;GemmFwdRest_hipblaslt:160.245,4485611520,miopenConvolutionFwdAlgoGEMM
8-15-480-832-3x3x3-3-13-480-832-1-0x1x1-1x1x1-1x1x1-0-NCDHW-FP32-F=GemmFwdRest:128.089,4485611520,miopenConvolutionFwdAlgoGEMM;GemmFwdRest_hipblaslt:113.84,4485611520,miopenConvolutionFwdAlgoGEMM
48-11-30-52-1x1x1-48-11-30-52-1-0x0x0-1x1x1-1x1x1-0-NCDHW-FP16-F=GemmFwd1x1_0_1_hipblaslt:0.0408057,0,miopenConvolutionFwdAlgoGEMM;ConvHipImplicitGemm3DGroupFwdXdlops:0.179306,3299328,miopenConvolutionFwdAlgoImplicitGEMM
48-13-30-52-3x3x3-512-11-30-52-1-0x1x1-1x1x1-1x1x1-0-NCDHW-FP16-F=GemmFwdRest:1.58578,44478720,miopenConvolutionFwdAlgoGEMM;ConvHipImplicitGemm3DGroupFwdXdlops:4.53169,20845824,miopenConvolutionFwdAlgoImplicitGEMM;GemmFwdRest_hipblaslt:1.99288,44478720,miopenConvolutionFwdAlgoGEMM
512-15-30-52-5x5x5-512-11-30-52-1-0x2x2-1x1x1-1x1x1-0-NCDHW-FP16-F_g512=GemmFwdRest:70.4814,2196480000,miopenConvolutionFwdAlgoGEMM;ConvHipImplicitGemm3DGroupFwdXdlops:332.7,41661440,miopenConvolutionFwdAlgoImplicitGEMM;GemmFwdRest_hipblaslt:66.4773,2196480000,miopenConvolutionFwdAlgoGEMM
512-11-30-52-1x1x1-512-11-30-52-1-0x0x0-1x1x1-1x1x1-0-NCDHW-FP16-F=GemmFwd1x1_0_1:0.343677,0,miopenConvolutionFwdAlgoGEMM;GemmFwd1x1_0_1_hipblaslt:0.470563,0,miopenConvolutionFwdAlgoGEMM;ConvHipImplicitGemm3DGroupFwdXdlops:2.8602,35667968,miopenConvolutionFwdAlgoImplicitGEMM
512-13-30-52-3x3x3-256-11-30-52-1-0x1x1-1x1x1-1x1x1-0-NCDHW-FP16-F=GemmFwdRest:18.686,474439680,miopenConvolutionFwdAlgoGEMM;ConvHipImplicitGemm3DGroupFwdXdlops:25.4183,36630528,miopenConvolutionFwdAlgoImplicitGEMM;GemmFwdRest_hipblaslt:20.0929,474439680,miopenConvolutionFwdAlgoGEMM
256-13-30-52-3x3x3-256-11-30-52-1-0x1x1-1x1x1-1x1x1-0-NCDHW-FP16-F=GemmFwdRest:7.12638,237219840,miopenConvolutionFwdAlgoGEMM;ConvHipImplicitGemm3DGroupFwdXdlops:13.1014,22708224,miopenConvolutionFwdAlgoImplicitGEMM;GemmFwdRest_hipblaslt:10.6121,237219840,miopenConvolutionFwdAlgoGEMM
512-11-30-52-1x1x1-256-11-30-52-1-0x0x0-1x1x1-1x1x1-0-NCDHW-FP16-F=GemmFwd1x1_0_1:0.119692,0,miopenConvolutionFwdAlgoGEMM;GemmFwd1x1_0_1_hipblaslt:0.177494,0,miopenConvolutionFwdAlgoGEMM;ConvHipImplicitGemm3DGroupFwdXdlops:1.22343,26619904,miopenConvolutionFwdAlgoImplicitGEMM
256-13-30-52-3x3x3-2048-11-30-52-1-0x1x1-1x1x1-1x1x1-0-NCDHW-FP16-F=GemmFwdRest:36.6308,237219840,miopenConvolutionFwdAlgoGEMM;ConvHipImplicitGemm3DGroupFwdXdlops:97.5411,108982272,miopenConvolutionFwdAlgoImplicitGEMM;GemmFwdRest_hipblaslt:41.296,237219840,miopenConvolutionFwdAlgoGEMM
256-23-60-104-3x3x3-256-21-60-104-1-0x1x1-1x1x1-1x1x1-0-NCDHW-FP16-F=GemmFwdRest:80.5117,1811496960,miopenConvolutionFwdAlgoGEMM;ConvHipImplicitGemm3DGroupFwdXdlops:87.2443,144113664,miopenConvolutionFwdAlgoImplicitGEMM;GemmFwdRest_hipblaslt:98.3993,1811496960,miopenConvolutionFwdAlgoGEMM
256-23-60-104-3x3x3-64-21-60-104-1-0x1x1-1x1x1-1x1x1-0-NCDHW-FP16-F=GemmFwdRest:61.2322,1811496960,miopenConvolutionFwdAlgoGEMM;ConvHipImplicitGemm3DGroupFwdXdlops:23.5765,91140096,miopenConvolutionFwdAlgoImplicitGEMM;GemmFwdRest_hipblaslt:56.0948,1811496960,miopenConvolutionFwdAlgoGEMM
64-23-60-104-3x3x3-64-21-60-104-1-0x1x1-1x1x1-1x1x1-0-NCDHW-FP16-F=GemmFwdRest:13.1018,452874240,miopenConvolutionFwdAlgoGEMM;ConvHipImplicitGemm3DGroupFwdXdlops:6.69803,35364864,miopenConvolutionFwdAlgoImplicitGEMM;GemmFwdRest_hipblaslt:14.1537,452874240,miopenConvolutionFwdAlgoGEMM
256-21-60-104-1x1x1-64-21-60-104-1-0x0x0-1x1x1-1x1x1-0-NCDHW-FP16-F=GemmFwd1x1_0_1:0.544968,0,miopenConvolutionFwdAlgoGEMM;GemmFwd1x1_0_1_hipblaslt:0.577884,0,miopenConvolutionFwdAlgoGEMM;ConvHipImplicitGemm3DGroupFwdXdlops:2.65662,83898368,miopenConvolutionFwdAlgoImplicitGEMM
64-23-60-104-3x3x3-512-21-60-104-1-0x1x1-1x1x1-1x1x1-0-NCDHW-FP16-F=GemmFwdRest:24.5136,452874240,miopenConvolutionFwdAlgoGEMM;ConvHipImplicitGemm3DGroupFwdXdlops:49.7999,154324992,miopenConvolutionFwdAlgoImplicitGEMM;GemmFwdRest_hipblaslt:29.5437,452874240,miopenConvolutionFwdAlgoGEMM
64-43-120-208-3x3x3-32-41-120-208-1-0x1x1-1x1x1-1x1x1-0-NCDHW-FP16-F=GemmFwdRest:112.283,3536732160,miopenConvolutionFwdAlgoGEMM;ConvHipImplicitGemm3DGroupFwdXdlops:39.5589,202985472,miopenConvolutionFwdAlgoImplicitGEMM;GemmFwdRest_hipblaslt:104.454,3536732160,miopenConvolutionFwdAlgoGEMM
32-43-120-208-3x3x3-32-41-120-208-1-0x1x1-1x1x1-1x1x1-0-NCDHW-FP16-F=GemmFwdRest:60.1199,1768366080,miopenConvolutionFwdAlgoGEMM;ConvHipImplicitGemm3DGroupFwdXdlops:21.4958,134240256,miopenConvolutionFwdAlgoImplicitGEMM;GemmFwdRest_hipblaslt:58.1781,1768366080,miopenConvolutionFwdAlgoGEMM
64-41-120-208-1x1x1-32-41-120-208-1-0x0x0-1x1x1-1x1x1-0-NCDHW-FP16-F=GemmFwd1x1_0_1:1.03038,0,miopenConvolutionFwdAlgoGEMM;GemmFwd1x1_0_1_hipblaslt:0.965807,0,miopenConvolutionFwdAlgoGEMM;ConvHipImplicitGemm3DGroupFwdXdlops:4.81195,196489216,miopenConvolutionFwdAlgoImplicitGEMM
32-43-120-208-3x3x3-128-41-120-208-1-0x1x1-1x1x1-1x1x1-0-NCDHW-FP16-F=GemmFwdRest:65.1391,1768366080,miopenConvolutionFwdAlgoGEMM;ConvHipImplicitGemm3DGroupFwdXdlops:46.6369,330891264,miopenConvolutionFwdAlgoImplicitGEMM;GemmFwdRest_hipblaslt:67.0252,1768366080,miopenConvolutionFwdAlgoGEMM
32-43-240-416-3x3x3-32-41-240-416-1-0x1x1-1x1x1-1x1x1-0-NCDHW-FP16-F=GemmFwdRest:272.253,7073464320,miopenConvolutionFwdAlgoGEMM;ConvHipImplicitGemm3DGroupFwdXdlops:83.5372,536795136,miopenConvolutionFwdAlgoImplicitGEMM;GemmFwdRest_hipblaslt:247.413,7073464320,miopenConvolutionFwdAlgoGEMM
8-43-480-832-3x3x3-3-41-480-832-1-0x1x1-1x1x1-1x1x1-0-NCDHW-FP16-F=GemmFwdRest:261.872,7073464320,miopenConvolutionFwdAlgoGEMM;ConvHipImplicitGemm3DGroupFwdXdlops:91.4881,373003776,miopenConvolutionFwdAlgoImplicitGEMM;GemmFwdRest_hipblaslt:239.448,7073464320,miopenConvolutionFwdAlgoGEMM
512-13-30-52-3x3x3-4096-11-30-52-1-0x1x1-1x1x1-1x1x1-0-NCDHW-FP16-F=GemmFwdRest:157.22,474439680,miopenConvolutionFwdAlgoGEMM;ConvHipImplicitGemm3DGroupFwdXdlops:402.686,274587648,miopenConvolutionFwdAlgoImplicitGEMM;GemmFwdRest_hipblaslt:189.227,474439680,miopenConvolutionFwdAlgoGEMM
512-25-60-104-5x5x5-512-21-60-104-1-0x2x2-1x1x1-1x1x1-0-NCDHW-FP16-F_g512=ConvHipImplicitGemm3DGroupFwdXdlops:1584.77,294056960,miopenConvolutionFwdAlgoImplicitGEMM
512-21-60-104-1x1x1-512-21-60-104-1-0x0x0-1x1x1-1x1x1-0-NCDHW-FP16-F=GemmFwd1x1_0_1:2.24496,0,miopenConvolutionFwdAlgoGEMM;GemmFwd1x1_0_1_hipblaslt:4.55493,0,miopenConvolutionFwdAlgoGEMM;ConvHipImplicitGemm3DGroupFwdXdlops:21.4966,268894208,miopenConvolutionFwdAlgoImplicitGEMM
512-23-60-104-3x3x3-256-21-60-104-1-0x1x1-1x1x1-1x1x1-0-NCDHW-FP16-F=GemmFwdRest:156.471,3622993920,miopenConvolutionFwdAlgoGEMM;ConvHipImplicitGemm3DGroupFwdXdlops:179.554,221134848,miopenConvolutionFwdAlgoImplicitGEMM;GemmFwdRest_hipblaslt:181.673,3622993920,miopenConvolutionFwdAlgoGEMM
512-21-60-104-1x1x1-256-21-60-104-1-0x0x0-1x1x1-1x1x1-0-NCDHW-FP16-F=GemmFwd1x1_0_1:1.19422,0,miopenConvolutionFwdAlgoGEMM;GemmFwd1x1_0_1_hipblaslt:1.9647,0,miopenConvolutionFwdAlgoGEMM;ConvHipImplicitGemm3DGroupFwdXdlops:12.4435,201539584,miopenConvolutionFwdAlgoImplicitGEMM
256-23-60-104-3x3x3-1024-21-60-104-1-0x1x1-1x1x1-1x1x1-0-NCDHW-FP16-F=GemmFwdRest:250.513,1811496960,miopenConvolutionFwdAlgoGEMM;ConvHipImplicitGemm3DGroupFwdXdlops:357.368,356007936,miopenConvolutionFwdAlgoImplicitGEMM;GemmFwdRest_hipblaslt:267.206,1811496960,miopenConvolutionFwdAlgoGEMM
256-23-120-208-3x3x3-256-21-120-208-1-0x1x1-1x1x1-1x1x1-0-NCDHW-FP16-F=GemmFwdRest:464.445,7245987840,miopenConvolutionFwdAlgoGEMM;ConvHipImplicitGemm3DGroupFwdXdlops:352.911,565837824,miopenConvolutionFwdAlgoImplicitGEMM;GemmFwdRest_hipblaslt:648.172,7245987840,miopenConvolutionFwdAlgoGEMM
256-23-120-208-3x3x3-64-21-120-208-1-0x1x1-1x1x1-1x1x1-0-NCDHW-FP16-F=GemmFwdRest:234.601,7245987840,miopenConvolutionFwdAlgoGEMM;ConvHipImplicitGemm3DGroupFwdXdlops:91.728,361906176,miopenConvolutionFwdAlgoImplicitGEMM;GemmFwdRest_hipblaslt:227.38,7245987840,miopenConvolutionFwdAlgoGEMM
64-23-120-208-3x3x3-64-21-120-208-1-0x1x1-1x1x1-1x1x1-0-NCDHW-FP16-F=GemmFwdRest:60.5961,1811496960,miopenConvolutionFwdAlgoGEMM;ConvHipImplicitGemm3DGroupFwdXdlops:25.2803,140795904,miopenConvolutionFwdAlgoImplicitGEMM;GemmFwdRest_hipblaslt:62.1429,1811496960,miopenConvolutionFwdAlgoGEMM
256-21-120-208-1x1x1-64-21-120-208-1-0x0x0-1x1x1-1x1x1-0-NCDHW-FP16-F=GemmFwd1x1_0_1:1.64633,0,miopenConvolutionFwdAlgoGEMM;GemmFwd1x1_0_1_hipblaslt:1.97638,0,miopenConvolutionFwdAlgoGEMM;ConvHipImplicitGemm3DGroupFwdXdlops:9.03881,335495168,miopenConvolutionFwdAlgoImplicitGEMM
64-23-120-208-3x3x3-512-21-120-208-1-0x1x1-1x1x1-1x1x1-0-NCDHW-FP16-F=GemmFwdRest:111.864,1811496960,miopenConvolutionFwdAlgoGEMM;ConvHipImplicitGemm3DGroupFwdXdlops:184.559,611991552,miopenConvolutionFwdAlgoImplicitGEMM;GemmFwdRest_hipblaslt:128.991,1811496960,miopenConvolutionFwdAlgoGEMM
64-43-240-416-3x3x3-64-41-240-416-1-0x1x1-1x1x1-1x1x1-0-NCDHW-FP16-F=ConvHipImplicitGemm3DGroupFwdXdlops:187.214,1073700864,miopenConvolutionFwdAlgoImplicitGEMM
64-43-240-416-3x3x3-32-41-240-416-1-0x1x1-1x1x1-1x1x1-0-NCDHW-FP16-F=ConvHipImplicitGemm3DGroupFwdXdlops:167.539,811610112,miopenConvolutionFwdAlgoImplicitGEMM
64-41-240-416-1x1x1-32-41-240-416-1-0x0x0-1x1x1-1x1x1-0-NCDHW-FP16-F=GemmFwd1x1_0_1:5.54865,0,miopenConvolutionFwdAlgoGEMM;GemmFwd1x1_0_1_hipblaslt:4.5668,0,miopenConvolutionFwdAlgoGEMM;ConvHipImplicitGemm3DGroupFwdXdlops:19.5144,785944576,miopenConvolutionFwdAlgoImplicitGEMM
48-3-30-52-3x3x3-512-1-30-52-1-0x1x1-1x1x1-1x1x1-0-NCDHW-FP32-F=GemmFwdRest:1.26495,8087040,miopenConvolutionFwdAlgoGEMM;GemmFwdRest_hipblaslt:2.07555,8087040,miopenConvolutionFwdAlgoGEMM
512-5-30-52-5x5x5-512-1-30-52-1-0x2x2-1x1x1-1x1x1-0-NCDHW-FP32-F_g512=GemmFwdRest:6.35584,399360000,miopenConvolutionFwdAlgoGEMM;GemmFwdRest_hipblaslt:5.37298,399360000,miopenConvolutionFwdAlgoGEMM
512-1-30-52-1x1x1-512-1-30-52-1-0x0x0-1x1x1-1x1x1-0-NCDHW-FP32-F=GemmFwd1x1_0_1:0.553044,0,miopenConvolutionFwdAlgoGEMM;GemmFwd1x1_0_1_hipblaslt:0.794496,0,miopenConvolutionFwdAlgoGEMM
512-3-30-52-3x3x3-256-1-30-52-1-0x1x1-1x1x1-1x1x1-0-NCDHW-FP32-F=GemmFwdRest:7.55833,86261760,miopenConvolutionFwdAlgoGEMM;GemmFwdRest_hipblaslt:21.5915,86261760,miopenConvolutionFwdAlgoGEMM
256-3-30-52-3x3x3-256-1-30-52-1-0x1x1-1x1x1-1x1x1-0-NCDHW-FP32-F=GemmFwdRest:2.59636,43130880,miopenConvolutionFwdAlgoGEMM;GemmFwdRest_hipblaslt:9.25514,43130880,miopenConvolutionFwdAlgoGEMM
512-1-30-52-1x1x1-256-1-30-52-1-0x0x0-1x1x1-1x1x1-0-NCDHW-FP32-F=GemmFwd1x1_0_1:0.15812,0,miopenConvolutionFwdAlgoGEMM;GemmFwd1x1_0_1_hipblaslt:0.274035,0,miopenConvolutionFwdAlgoGEMM
256-3-30-52-3x3x3-2048-1-30-52-1-0x1x1-1x1x1-1x1x1-0-NCDHW-FP32-F=GemmFwdRest:25.4377,43130880,miopenConvolutionFwdAlgoGEMM;GemmFwdRest_hipblaslt:77.7555,43130880,miopenConvolutionFwdAlgoGEMM
256-3-60-104-3x3x3-256-1-60-104-1-0x1x1-1x1x1-1x1x1-0-NCDHW-FP32-F=GemmFwdRest:13.0201,172523520,miopenConvolutionFwdAlgoGEMM;GemmFwdRest_hipblaslt:48.733,172523520,miopenConvolutionFwdAlgoGEMM
256-3-60-104-3x3x3-64-1-60-104-1-0x1x1-1x1x1-1x1x1-0-NCDHW-FP32-F=GemmFwdRest:5.37009,172523520,miopenConvolutionFwdAlgoGEMM;GemmFwdRest_hipblaslt:10.3474,172523520,miopenConvolutionFwdAlgoGEMM
64-3-60-104-3x3x3-64-1-60-104-1-0x1x1-1x1x1-1x1x1-0-NCDHW-FP32-F=GemmFwdRest:0.909665,43130880,miopenConvolutionFwdAlgoGEMM;GemmFwdRest_hipblaslt:1.54767,43130880,miopenConvolutionFwdAlgoGEMM
256-1-60-104-1x1x1-64-1-60-104-1-0x0x0-1x1x1-1x1x1-0-NCDHW-FP32-F=GemmFwd1x1_0_1:0.107166,0,miopenConvolutionFwdAlgoGEMM;GemmFwd1x1_0_1_hipblaslt:0.162423,0,miopenConvolutionFwdAlgoGEMM
64-3-60-104-3x3x3-512-1-60-104-1-0x1x1-1x1x1-1x1x1-0-NCDHW-FP32-F=GemmFwdRest:5.3637,43130880,miopenConvolutionFwdAlgoGEMM;GemmFwdRest_hipblaslt:16.2976,43130880,miopenConvolutionFwdAlgoGEMM
64-3-120-208-3x3x3-64-1-120-208-1-0x1x1-1x1x1-1x1x1-0-NCDHW-FP32-F=GemmFwdRest:4.34546,172523520,miopenConvolutionFwdAlgoGEMM;GemmFwdRest_hipblaslt:8.51689,172523520,miopenConvolutionFwdAlgoGEMM
64-3-120-208-3x3x3-32-1-120-208-1-0x1x1-1x1x1-1x1x1-0-NCDHW-FP32-F=GemmFwdRest:3.66507,172523520,miopenConvolutionFwdAlgoGEMM;GemmFwdRest_hipblaslt:5.32391,172523520,miopenConvolutionFwdAlgoGEMM
32-3-120-208-3x3x3-32-1-120-208-1-0x1x1-1x1x1-1x1x1-0-NCDHW-FP32-F=GemmFwdRest:1.42406,86261760,miopenConvolutionFwdAlgoGEMM;GemmFwdRest_hipblaslt:2.63367,86261760,miopenConvolutionFwdAlgoGEMM
64-1-120-208-1x1x1-32-1-120-208-1-0x0x0-1x1x1-1x1x1-0-NCDHW-FP32-F=GemmFwd1x1_0_1:0.0814943,0,miopenConvolutionFwdAlgoGEMM;GemmFwd1x1_0_1_hipblaslt:0.124857,0,miopenConvolutionFwdAlgoGEMM
32-3-120-208-3x3x3-128-1-120-208-1-0x1x1-1x1x1-1x1x1-0-NCDHW-FP32-F=GemmFwdRest:3.36256,86261760,miopenConvolutionFwdAlgoGEMM;GemmFwdRest_hipblaslt:7.39192,86261760,miopenConvolutionFwdAlgoGEMM
32-3-240-416-3x3x3-32-1-240-416-1-0x1x1-1x1x1-1x1x1-0-NCDHW-FP32-F=GemmFwdRest:9.43982,345047040,miopenConvolutionFwdAlgoGEMM;GemmFwdRest_hipblaslt:33.1846,345047040,miopenConvolutionFwdAlgoGEMM
8-3-480-832-3x3x3-3-1-480-832-1-0x1x1-1x1x1-1x1x1-0-NCDHW-FP32-F=GemmFwdRest:7.75542,345047040,miopenConvolutionFwdAlgoGEMM;GemmFwdRest_hipblaslt:7.69125,345047040,miopenConvolutionFwdAlgoGEMM
48-5-30-52-3x3x3-512-3-30-52-1-0x1x1-1x1x1-1x1x1-0-NCDHW-FP32-F=GemmFwdRest:3.61803,24261120,miopenConvolutionFwdAlgoGEMM;GemmFwdRest_hipblaslt:3.66009,24261120,miopenConvolutionFwdAlgoGEMM
512-7-30-52-5x5x5-512-3-30-52-1-0x2x2-1x1x1-1x1x1-0-NCDHW-FP32-F_g512=GemmFwdRest:26.8707,1198080000,miopenConvolutionFwdAlgoGEMM;GemmFwdRest_hipblaslt:25.1278,1198080000,miopenConvolutionFwdAlgoGEMM
512-3-30-52-1x1x1-512-3-30-52-1-0x0x0-1x1x1-1x1x1-0-NCDHW-FP32-F=GemmFwd1x1_0_1:0.973777,0,miopenConvolutionFwdAlgoGEMM;GemmFwd1x1_0_1_hipblaslt:1.03393,0,miopenConvolutionFwdAlgoGEMM
512-5-30-52-3x3x3-256-3-30-52-1-0x1x1-1x1x1-1x1x1-0-NCDHW-FP32-F=GemmFwdRest:54.6676,258785280,miopenConvolutionFwdAlgoGEMM;GemmFwdRest_hipblaslt:125.79,258785280,miopenConvolutionFwdAlgoGEMM
256-5-30-52-3x3x3-256-3-30-52-1-0x1x1-1x1x1-1x1x1-0-NCDHW-FP32-F=GemmFwdRest:25.2725,129392640,miopenConvolutionFwdAlgoGEMM;GemmFwdRest_hipblaslt:44.6261,129392640,miopenConvolutionFwdAlgoGEMM
512-3-30-52-1x1x1-256-3-30-52-1-0x0x0-1x1x1-1x1x1-0-NCDHW-FP32-F=GemmFwd1x1_0_1:0.443493,0,miopenConvolutionFwdAlgoGEMM;GemmFwd1x1_0_1_hipblaslt:0.476143,0,miopenConvolutionFwdAlgoGEMM
256-5-30-52-3x3x3-2048-3-30-52-1-0x1x1-1x1x1-1x1x1-0-NCDHW-FP32-F=GemmFwdRest:164.881,129392640,miopenConvolutionFwdAlgoGEMM;GemmFwdRest_hipblaslt:384.9,129392640,miopenConvolutionFwdAlgoGEMM
256-7-60-104-3x3x3-256-5-60-104-1-0x1x1-1x1x1-1x1x1-0-NCDHW-FP32-F=GemmFwdRest:204.249,862617600,miopenConvolutionFwdAlgoGEMM;GemmFwdRest_hipblaslt:571.372,862617600,miopenConvolutionFwdAlgoGEMM
256-7-60-104-3x3x3-64-5-60-104-1-0x1x1-1x1x1-1x1x1-0-NCDHW-FP32-F=GemmFwdRest:77.7286,862617600,miopenConvolutionFwdAlgoGEMM;GemmFwdRest_hipblaslt:128.347,862617600,miopenConvolutionFwdAlgoGEMM
64-7-60-104-3x3x3-64-5-60-104-1-0x1x1-1x1x1-1x1x1-0-NCDHW-FP32-F=GemmFwdRest:6.24706,215654400,miopenConvolutionFwdAlgoGEMM;GemmFwdRest_hipblaslt:11.5707,215654400,miopenConvolutionFwdAlgoGEMM
256-5-60-104-1x1x1-64-5-60-104-1-0x0x0-1x1x1-1x1x1-0-NCDHW-FP32-F=GemmFwd1x1_0_1:0.41099,0,miopenConvolutionFwdAlgoGEMM;GemmFwd1x1_0_1_hipblaslt:0.459121,0,miopenConvolutionFwdAlgoGEMM
64-7-60-104-3x3x3-512-5-60-104-1-0x1x1-1x1x1-1x1x1-0-NCDHW-FP32-F=GemmFwdRest:47.0322,215654400,miopenConvolutionFwdAlgoGEMM;GemmFwdRest_hipblaslt:147.866,215654400,miopenConvolutionFwdAlgoGEMM
64-11-120-208-3x3x3-64-9-120-208-1-0x1x1-1x1x1-1x1x1-0-NCDHW-FP32-F=GemmFwdRest:55.6806,1552711680,miopenConvolutionFwdAlgoGEMM;GemmFwdRest_hipblaslt:105.276,1552711680,miopenConvolutionFwdAlgoGEMM
64-11-120-208-3x3x3-32-9-120-208-1-0x1x1-1x1x1-1x1x1-0-NCDHW-FP32-F=GemmFwdRest:40.0448,1552711680,miopenConvolutionFwdAlgoGEMM;GemmFwdRest_hipblaslt:62.1465,1552711680,miopenConvolutionFwdAlgoGEMM
32-11-120-208-3x3x3-32-9-120-208-1-0x1x1-1x1x1-1x1x1-0-NCDHW-FP32-F=GemmFwdRest:22.4721,776355840,miopenConvolutionFwdAlgoGEMM;GemmFwdRest_hipblaslt:29.2433,776355840,miopenConvolutionFwdAlgoGEMM
64-9-120-208-1x1x1-32-9-120-208-1-0x0x0-1x1x1-1x1x1-0-NCDHW-FP32-F=GemmFwd1x1_0_1:0.509637,0,miopenConvolutionFwdAlgoGEMM;GemmFwd1x1_0_1_hipblaslt:0.929922,0,miopenConvolutionFwdAlgoGEMM
32-11-120-208-3x3x3-128-9-120-208-1-0x1x1-1x1x1-1x1x1-0-NCDHW-FP32-F=GemmFwdRest:41.6637,776355840,miopenConvolutionFwdAlgoGEMM;GemmFwdRest_hipblaslt:77.708,776355840,miopenConvolutionFwdAlgoGEMM
32-11-240-416-3x3x3-32-9-240-416-1-0x1x1-1x1x1-1x1x1-0-NCDHW-FP32-F=GemmFwdRest:83.0081,3105423360,miopenConvolutionFwdAlgoGEMM;GemmFwdRest_hipblaslt:115.421,3105423360,miopenConvolutionFwdAlgoGEMM
8-11-480-832-3x3x3-3-9-480-832-1-0x1x1-1x1x1-1x1x1-0-NCDHW-FP32-F=GemmFwdRest:73.0774,3105423360,miopenConvolutionFwdAlgoGEMM;GemmFwdRest_hipblaslt:58.3472,3105423360,miopenConvolutionFwdAlgoGEMM
48-7-30-52-3x3x3-512-5-30-52-1-0x1x1-1x1x1-1x1x1-0-NCDHW-FP16-F=GemmFwdRest:0.829487,20217600,miopenConvolutionFwdAlgoGEMM;ConvHipImplicitGemm3DGroupFwdXdlops:1.98718,10362624,miopenConvolutionFwdAlgoImplicitGEMM;GemmFwdRest_hipblaslt:0.948761,20217600,miopenConvolutionFwdAlgoGEMM
512-9-30-52-5x5x5-512-5-30-52-1-0x2x2-1x1x1-1x1x1-0-NCDHW-FP16-F_g512=GemmFwdRest:38.103,998400000,miopenConvolutionFwdAlgoGEMM;ConvHipImplicitGemm3DGroupFwdXdlops:119.497,22492160,miopenConvolutionFwdAlgoImplicitGEMM;GemmFwdRest_hipblaslt:34.0207,998400000,miopenConvolutionFwdAlgoGEMM
512-5-30-52-1x1x1-512-5-30-52-1-0x0x0-1x1x1-1x1x1-0-NCDHW-FP16-F=GemmFwd1x1_0_1:0.124287,0,miopenConvolutionFwdAlgoGEMM;GemmFwd1x1_0_1_hipblaslt:0.159536,0,miopenConvolutionFwdAlgoGEMM;ConvHipImplicitGemm3DGroupFwdXdlops:0.82622,16498688,miopenConvolutionFwdAlgoImplicitGEMM
512-7-30-52-3x3x3-256-5-30-52-1-0x1x1-1x1x1-1x1x1-0-NCDHW-FP16-F=GemmFwdRest:12.0218,215654400,miopenConvolutionFwdAlgoGEMM;ConvHipImplicitGemm3DGroupFwdXdlops:11.6346,22253568,miopenConvolutionFwdAlgoImplicitGEMM;GemmFwdRest_hipblaslt:13.0821,215654400,miopenConvolutionFwdAlgoGEMM
256-7-30-52-3x3x3-256-5-30-52-1-0x1x1-1x1x1-1x1x1-0-NCDHW-FP16-F=GemmFwdRest:3.21516,107827200,miopenConvolutionFwdAlgoGEMM;ConvHipImplicitGemm3DGroupFwdXdlops:5.83152,13123584,miopenConvolutionFwdAlgoImplicitGEMM;GemmFwdRest_hipblaslt:4.1834,107827200,miopenConvolutionFwdAlgoGEMM
512-5-30-52-1x1x1-256-5-30-52-1-0x0x0-1x1x1-1x1x1-0-NCDHW-FP16-F=GemmFwd1x1_0_1:0.079494,0,miopenConvolutionFwdAlgoGEMM;GemmFwd1x1_0_1_hipblaslt:0.108994,0,miopenConvolutionFwdAlgoGEMM;ConvHipImplicitGemm3DGroupFwdXdlops:0.56288,12242944,miopenConvolutionFwdAlgoImplicitGEMM
256-7-30-52-3x3x3-2048-5-30-52-1-0x1x1-1x1x1-1x1x1-0-NCDHW-FP16-F=GemmFwdRest:10.0757,107827200,miopenConvolutionFwdAlgoGEMM;ConvHipImplicitGemm3DGroupFwdXdlops:46.0415,65851392,miopenConvolutionFwdAlgoImplicitGEMM;GemmFwdRest_hipblaslt:19.2728,107827200,miopenConvolutionFwdAlgoGEMM
256-11-60-104-3x3x3-256-9-60-104-1-0x1x1-1x1x1-1x1x1-0-NCDHW-FP16-F=GemmFwdRest:49.7744,776355840,miopenConvolutionFwdAlgoGEMM;ConvHipImplicitGemm3DGroupFwdXdlops:38.533,67436544,miopenConvolutionFwdAlgoImplicitGEMM;GemmFwdRest_hipblaslt:71.5748,776355840,miopenConvolutionFwdAlgoGEMM
256-11-60-104-3x3x3-64-9-60-104-1-0x1x1-1x1x1-1x1x1-0-NCDHW-FP16-F=GemmFwdRest:35.4298,776355840,miopenConvolutionFwdAlgoGEMM;ConvHipImplicitGemm3DGroupFwdXdlops:9.82877,43216896,miopenConvolutionFwdAlgoImplicitGEMM;GemmFwdRest_hipblaslt:31.1276,776355840,miopenConvolutionFwdAlgoGEMM
64-11-60-104-3x3x3-64-9-60-104-1-0x1x1-1x1x1-1x1x1-0-NCDHW-FP16-F=GemmFwdRest:4.63251,194088960,miopenConvolutionFwdAlgoGEMM;ConvHipImplicitGemm3DGroupFwdXdlops:2.23571,16195584,miopenConvolutionFwdAlgoImplicitGEMM;GemmFwdRest_hipblaslt:5.47256,194088960,miopenConvolutionFwdAlgoGEMM
256-9-60-104-1x1x1-64-9-60-104-1-0x0x0-1x1x1-1x1x1-0-NCDHW-FP16-F=GemmFwd1x1_0_1:0.172878,0,miopenConvolutionFwdAlgoGEMM;GemmFwd1x1_0_1_hipblaslt:0.166772,0,miopenConvolutionFwdAlgoGEMM;ConvHipImplicitGemm3DGroupFwdXdlops:0.989407,35975168,miopenConvolutionFwdAlgoImplicitGEMM
64-11-60-104-3x3x3-512-9-60-104-1-0x1x1-1x1x1-1x1x1-0-NCDHW-FP16-F=GemmFwdRest:9.12672,194088960,miopenConvolutionFwdAlgoGEMM;ConvHipImplicitGemm3DGroupFwdXdlops:22.1073,68063232,miopenConvolutionFwdAlgoImplicitGEMM;GemmFwdRest_hipblaslt:13.8552,194088960,miopenConvolutionFwdAlgoGEMM
64-19-120-208-3x3x3-64-17-120-208-1-0x1x1-1x1x1-1x1x1-0-NCDHW-FP16-F=GemmFwdRest:44.3265,1466449920,miopenConvolutionFwdAlgoGEMM;ConvHipImplicitGemm3DGroupFwdXdlops:19.5985,115236864,miopenConvolutionFwdAlgoImplicitGEMM;GemmFwdRest_hipblaslt:42.0958,1466449920,miopenConvolutionFwdAlgoGEMM
64-19-120-208-3x3x3-32-17-120-208-1-0x1x1-1x1x1-1x1x1-0-NCDHW-FP16-F=GemmFwdRest:42.0364,1466449920,miopenConvolutionFwdAlgoGEMM;ConvHipImplicitGemm3DGroupFwdXdlops:17.3609,87969792,miopenConvolutionFwdAlgoImplicitGEMM;GemmFwdRest_hipblaslt:39.917,1466449920,miopenConvolutionFwdAlgoGEMM
32-19-120-208-3x3x3-32-17-120-208-1-0x1x1-1x1x1-1x1x1-0-NCDHW-FP16-F=GemmFwdRest:26.9819,733224960,miopenConvolutionFwdAlgoGEMM;ConvHipImplicitGemm3DGroupFwdXdlops:8.99106,57563136,miopenConvolutionFwdAlgoImplicitGEMM;GemmFwdRest_hipblaslt:28.3114,733224960,miopenConvolutionFwdAlgoGEMM
64-17-120-208-1x1x1-32-17-120-208-1-0x0x0-1x1x1-1x1x1-0-NCDHW-FP16-F=GemmFwd1x1_0_1:0.427796,0,miopenConvolutionFwdAlgoGEMM;GemmFwd1x1_0_1_hipblaslt:0.421152,0,miopenConvolutionFwdAlgoGEMM;ConvHipImplicitGemm3DGroupFwdXdlops:1.98721,81473536,miopenConvolutionFwdAlgoImplicitGEMM
32-19-120-208-3x3x3-128-17-120-208-1-0x1x1-1x1x1-1x1x1-0-NCDHW-FP16-F=GemmFwdRest:29.7704,733224960,miopenConvolutionFwdAlgoGEMM;ConvHipImplicitGemm3DGroupFwdXdlops:20.2392,139198464,miopenConvolutionFwdAlgoImplicitGEMM;GemmFwdRest_hipblaslt:37.5134,733224960,miopenConvolutionFwdAlgoGEMM
32-19-240-416-3x3x3-32-17-240-416-1-0x1x1-1x1x1-1x1x1-0-NCDHW-FP16-F=GemmFwdRest:115.214,2932899840,miopenConvolutionFwdAlgoGEMM;ConvHipImplicitGemm3DGroupFwdXdlops:37.1995,230086656,miopenConvolutionFwdAlgoImplicitGEMM;GemmFwdRest_hipblaslt:112.834,2932899840,miopenConvolutionFwdAlgoGEMM
8-19-480-832-3x3x3-3-17-480-832-1-0x1x1-1x1x1-1x1x1-0-NCDHW-FP16-F=GemmFwdRest:119.359,2932899840,miopenConvolutionFwdAlgoGEMM;ConvHipImplicitGemm3DGroupFwdXdlops:38.3282,162141696,miopenConvolutionFwdAlgoImplicitGEMM;GemmFwdRest_hipblaslt:111.06,2932899840,miopenConvolutionFwdAlgoGEMM
48-5-30-52-3x3x3-512-3-30-52-1-0x1x1-1x1x1-1x1x1-0-NCDHW-FP16-F=GemmFwdRest:0.535865,12130560,miopenConvolutionFwdAlgoGEMM;ConvHipImplicitGemm3DGroupFwdXdlops:1.40478,6868224,miopenConvolutionFwdAlgoImplicitGEMM;GemmFwdRest_hipblaslt:0.616786,12130560,miopenConvolutionFwdAlgoGEMM
512-7-30-52-5x5x5-512-3-30-52-1-0x2x2-1x1x1-1x1x1-0-NCDHW-FP16-F_g512=GemmFwdRest:21.9331,599040000,miopenConvolutionFwdAlgoGEMM;ConvHipImplicitGemm3DGroupFwdXdlops:71.3396,16102400,miopenConvolutionFwdAlgoImplicitGEMM;GemmFwdRest_hipblaslt:19.6767,599040000,miopenConvolutionFwdAlgoGEMM
512-3-30-52-1x1x1-512-3-30-52-1-0x0x0-1x1x1-1x1x1-0-NCDHW-FP16-F=GemmFwd1x1_0_1:0.0945857,0,miopenConvolutionFwdAlgoGEMM;GemmFwd1x1_0_1_hipblaslt:0.1223,0,miopenConvolutionFwdAlgoGEMM;ConvHipImplicitGemm3DGroupFwdXdlops:0.640433,10108928,miopenConvolutionFwdAlgoImplicitGEMM
512-5-30-52-3x3x3-256-3-30-52-1-0x1x1-1x1x1-1x1x1-0-NCDHW-FP16-F=GemmFwdRest:5.56746,129392640,miopenConvolutionFwdAlgoGEMM;ConvHipImplicitGemm3DGroupFwdXdlops:6.609,17461248,miopenConvolutionFwdAlgoImplicitGEMM;GemmFwdRest_hipblaslt:6.81338,129392640,miopenConvolutionFwdAlgoGEMM
256-5-30-52-3x3x3-256-3-30-52-1-0x1x1-1x1x1-1x1x1-0-NCDHW-FP16-F=GemmFwdRest:1.5001,64696320,miopenConvolutionFwdAlgoGEMM;ConvHipImplicitGemm3DGroupFwdXdlops:3.4047,9928704,miopenConvolutionFwdAlgoImplicitGEMM;GemmFwdRest_hipblaslt:1.97932,64696320,miopenConvolutionFwdAlgoGEMM
512-3-30-52-1x1x1-256-3-30-52-1-0x0x0-1x1x1-1x1x1-0-NCDHW-FP16-F=GemmFwd1x1_0_1:0.05096,0,miopenConvolutionFwdAlgoGEMM;GemmFwd1x1_0_1_hipblaslt:0.0619929,0,miopenConvolutionFwdAlgoGEMM;ConvHipImplicitGemm3DGroupFwdXdlops:0.35056,7450624,miopenConvolutionFwdAlgoImplicitGEMM
256-5-30-52-3x3x3-2048-3-30-52-1-0x1x1-1x1x1-1x1x1-0-NCDHW-FP16-F=GemmFwdRest:5.4789,64696320,miopenConvolutionFwdAlgoGEMM;ConvHipImplicitGemm3DGroupFwdXdlops:28.0191,51474432,miopenConvolutionFwdAlgoImplicitGEMM;GemmFwdRest_hipblaslt:11.4337,64696320,miopenConvolutionFwdAlgoGEMM
256-7-60-104-3x3x3-256-5-60-104-1-0x1x1-1x1x1-1x1x1-0-NCDHW-FP16-F=GemmFwdRest:16.8996,431308800,miopenConvolutionFwdAlgoGEMM;ConvHipImplicitGemm3DGroupFwdXdlops:22.9176,41877504,miopenConvolutionFwdAlgoImplicitGEMM;GemmFwdRest_hipblaslt:20.4271,431308800,miopenConvolutionFwdAlgoGEMM
256-7-60-104-3x3x3-64-5-60-104-1-0x1x1-1x1x1-1x1x1-0-NCDHW-FP16-F=GemmFwdRest:14.3377,431308800,miopenConvolutionFwdAlgoGEMM;ConvHipImplicitGemm3DGroupFwdXdlops:6.21093,27242496,miopenConvolutionFwdAlgoImplicitGEMM;GemmFwdRest_hipblaslt:12.6446,431308800,miopenConvolutionFwdAlgoGEMM
64-7-60-104-3x3x3-64-5-60-104-1-0x1x1-1x1x1-1x1x1-0-NCDHW-FP16-F=GemmFwdRest:2.38304,107827200,miopenConvolutionFwdAlgoGEMM;ConvHipImplicitGemm3DGroupFwdXdlops:1.73327,9805824,miopenConvolutionFwdAlgoImplicitGEMM;GemmFwdRest_hipblaslt:2.95917,107827200,miopenConvolutionFwdAlgoGEMM
256-5-60-104-1x1x1-64-5-60-104-1-0x0x0-1x1x1-1x1x1-0-NCDHW-FP16-F=GemmFwd1x1_0_1:0.080325,0,miopenConvolutionFwdAlgoGEMM;GemmFwd1x1_0_1_hipblaslt:0.083154,0,miopenConvolutionFwdAlgoGEMM;ConvHipImplicitGemm3DGroupFwdXdlops:0.462344,20000768,miopenConvolutionFwdAlgoImplicitGEMM
64-7-60-104-3x3x3-512-5-60-104-1-0x1x1-1x1x1-1x1x1-0-NCDHW-FP16-F=GemmFwdRest:6.25686,107827200,miopenConvolutionFwdAlgoGEMM;ConvHipImplicitGemm3DGroupFwdXdlops:13.9549,39309312,miopenConvolutionFwdAlgoImplicitGEMM;GemmFwdRest_hipblaslt:5.09576,107827200,miopenConvolutionFwdAlgoGEMM
64-11-120-208-3x3x3-64-9-120-208-1-0x1x1-1x1x1-1x1x1-0-NCDHW-FP16-F=GemmFwdRest:30.1631,776355840,miopenConvolutionFwdAlgoGEMM;ConvHipImplicitGemm3DGroupFwdXdlops:10.758,64118784,miopenConvolutionFwdAlgoImplicitGEMM;GemmFwdRest_hipblaslt:30.4608,776355840,miopenConvolutionFwdAlgoGEMM
64-11-120-208-3x3x3-32-9-120-208-1-0x1x1-1x1x1-1x1x1-0-NCDHW-FP16-F=GemmFwdRest:31.8991,776355840,miopenConvolutionFwdAlgoGEMM;ConvHipImplicitGemm3DGroupFwdXdlops:10.3703,49631232,miopenConvolutionFwdAlgoImplicitGEMM;GemmFwdRest_hipblaslt:34.0348,776355840,miopenConvolutionFwdAlgoGEMM
32-11-120-208-3x3x3-32-9-120-208-1-0x1x1-1x1x1-1x1x1-0-NCDHW-FP16-F=GemmFwdRest:10.3664,388177920,miopenConvolutionFwdAlgoGEMM;ConvHipImplicitGemm3DGroupFwdXdlops:5.321,32004096,miopenConvolutionFwdAlgoImplicitGEMM;GemmFwdRest_hipblaslt:11.1843,388177920,miopenConvolutionFwdAlgoGEMM
64-9-120-208-1x1x1-32-9-120-208-1-0x0x0-1x1x1-1x1x1-0-NCDHW-FP16-F=GemmFwd1x1_0_1:0.242307,0,miopenConvolutionFwdAlgoGEMM;GemmFwd1x1_0_1_hipblaslt:0.226683,0,miopenConvolutionFwdAlgoGEMM;ConvHipImplicitGemm3DGroupFwdXdlops:0.994526,43134976,miopenConvolutionFwdAlgoImplicitGEMM
32-11-120-208-3x3x3-128-9-120-208-1-0x1x1-1x1x1-1x1x1-0-NCDHW-FP16-F=GemmFwdRest:10.8547,388177920,miopenConvolutionFwdAlgoGEMM;ConvHipImplicitGemm3DGroupFwdXdlops:11.1852,75300864,miopenConvolutionFwdAlgoImplicitGEMM;GemmFwdRest_hipblaslt:13.6194,388177920,miopenConvolutionFwdAlgoGEMM
32-11-240-416-3x3x3-32-9-240-416-1-0x1x1-1x1x1-1x1x1-0-NCDHW-FP16-F=GemmFwdRest:59.9804,1552711680,miopenConvolutionFwdAlgoGEMM;ConvHipImplicitGemm3DGroupFwdXdlops:19.447,127850496,miopenConvolutionFwdAlgoImplicitGEMM;GemmFwdRest_hipblaslt:59.798,1552711680,miopenConvolutionFwdAlgoGEMM
8-11-480-832-3x3x3-3-9-480-832-1-0x1x1-1x1x1-1x1x1-0-NCDHW-FP16-F=GemmFwdRest:57.922,1552711680,miopenConvolutionFwdAlgoGEMM;ConvHipImplicitGemm3DGroupFwdXdlops:20.1432,91854336,miopenConvolutionFwdAlgoImplicitGEMM;GemmFwdRest_hipblaslt:56.7481,1552711680,miopenConvolutionFwdAlgoGEMM
48-7-44-80-3x3x3-512-5-44-80-1-0x1x1-1x1x1-1x1x1-0-NCDHW-FP16-F=GemmFwdRest:1.68858,45619200,miopenConvolutionFwdAlgoGEMM;ConvHipImplicitGemm3DGroupFwdXdlops:4.37851,21714944,miopenConvolutionFwdAlgoImplicitGEMM;GemmFwdRest_hipblaslt:2.49321,45619200,miopenConvolutionFwdAlgoGEMM
512-9-44-80-5x5x5-512-5-44-80-1-0x2x2-1x1x1-1x1x1-0-NCDHW-FP16-F_g512=GemmFwdRest:98.0217,2252800000,miopenConvolutionFwdAlgoGEMM;ConvHipImplicitGemm3DGroupFwdXdlops:422.444,50590720,miopenConvolutionFwdAlgoImplicitGEMM;GemmFwdRest_hipblaslt:89.6407,2252800000,miopenConvolutionFwdAlgoGEMM
512-5-44-80-1x1x1-512-5-44-80-1-0x0x0-1x1x1-1x1x1-0-NCDHW-FP16-F=GemmFwd1x1_0_1:0.239784,0,miopenConvolutionFwdAlgoGEMM;GemmFwd1x1_0_1_hipblaslt:0.346985,0,miopenConvolutionFwdAlgoGEMM;ConvHipImplicitGemm3DGroupFwdXdlops:2.2291,36569088,miopenConvolutionFwdAlgoImplicitGEMM
512-7-44-80-3x3x3-256-5-44-80-1-0x1x1-1x1x1-1x1x1-0-NCDHW-FP16-F=GemmFwdRest:25.0978,486604800,miopenConvolutionFwdAlgoGEMM;ConvHipImplicitGemm3DGroupFwdXdlops:23.8211,41320448,miopenConvolutionFwdAlgoImplicitGEMM;GemmFwdRest_hipblaslt:32.5036,486604800,miopenConvolutionFwdAlgoGEMM
256-7-44-80-3x3x3-256-5-44-80-1-0x1x1-1x1x1-1x1x1-0-NCDHW-FP16-F=GemmFwdRest:7.72293,243302400,miopenConvolutionFwdAlgoGEMM;ConvHipImplicitGemm3DGroupFwdXdlops:12.4012,25165824,miopenConvolutionFwdAlgoImplicitGEMM;GemmFwdRest_hipblaslt:9.12014,243302400,miopenConvolutionFwdAlgoGEMM
512-5-44-80-1x1x1-256-5-44-80-1-0x0x0-1x1x1-1x1x1-0-NCDHW-FP16-F=GemmFwd1x1_0_1:0.121805,0,miopenConvolutionFwdAlgoGEMM;GemmFwd1x1_0_1_hipblaslt:0.168657,0,miopenConvolutionFwdAlgoGEMM;ConvHipImplicitGemm3DGroupFwdXdlops:1.20282,27295744,miopenConvolutionFwdAlgoImplicitGEMM
256-7-44-80-3x3x3-2048-5-44-80-1-0x1x1-1x1x1-1x1x1-0-NCDHW-FP16-F=GemmFwdRest:34.1814,243302400,miopenConvolutionFwdAlgoGEMM;ConvHipImplicitGemm3DGroupFwdXdlops:96.7841,113016832,miopenConvolutionFwdAlgoImplicitGEMM;GemmFwdRest_hipblaslt:39.4531,243302400,miopenConvolutionFwdAlgoGEMM
256-11-88-160-3x3x3-256-9-88-160-1-0x1x1-1x1x1-1x1x1-0-NCDHW-FP16-F=GemmFwdRest:100.438,1751777280,miopenConvolutionFwdAlgoGEMM;ConvHipImplicitGemm3DGroupFwdXdlops:89.9367,147718144,miopenConvolutionFwdAlgoImplicitGEMM;GemmFwdRest_hipblaslt:144.849,1751777280,miopenConvolutionFwdAlgoGEMM
256-11-88-160-3x3x3-64-9-88-160-1-0x1x1-1x1x1-1x1x1-0-NCDHW-FP16-F=GemmFwdRest:79.2339,1751777280,miopenConvolutionFwdAlgoGEMM;ConvHipImplicitGemm3DGroupFwdXdlops:22.3252,96403456,miopenConvolutionFwdAlgoImplicitGEMM;GemmFwdRest_hipblaslt:76.6654,1751777280,miopenConvolutionFwdAlgoGEMM
64-11-88-160-3x3x3-64-9-88-160-1-0x1x1-1x1x1-1x1x1-0-NCDHW-FP16-F=GemmFwdRest:12.6848,437944320,miopenConvolutionFwdAlgoGEMM;ConvHipImplicitGemm3DGroupFwdXdlops:6.47827,36265984,miopenConvolutionFwdAlgoImplicitGEMM;GemmFwdRest_hipblaslt:13.5568,437944320,miopenConvolutionFwdAlgoGEMM
256-9-88-160-1x1x1-64-9-88-160-1-0x0x0-1x1x1-1x1x1-0-NCDHW-FP16-F=GemmFwd1x1_0_1:0.425466,0,miopenConvolutionFwdAlgoGEMM;GemmFwd1x1_0_1_hipblaslt:0.428612,0,miopenConvolutionFwdAlgoGEMM;ConvHipImplicitGemm3DGroupFwdXdlops:2.14606,81133568,miopenConvolutionFwdAlgoImplicitGEMM
64-11-88-160-3x3x3-512-9-88-160-1-0x1x1-1x1x1-1x1x1-0-NCDHW-FP16-F=GemmFwdRest:22.9716,437944320,miopenConvolutionFwdAlgoGEMM;ConvHipImplicitGemm3DGroupFwdXdlops:47.2871,151355392,miopenConvolutionFwdAlgoImplicitGEMM;GemmFwdRest_hipblaslt:28.9009,437944320,miopenConvolutionFwdAlgoGEMM
64-19-176-320-3x3x3-64-17-176-320-1-0x1x1-1x1x1-1x1x1-0-NCDHW-FP16-F=GemmFwdRest:106.489,3308912640,miopenConvolutionFwdAlgoGEMM;ConvHipImplicitGemm3DGroupFwdXdlops:40.3999,259743744,miopenConvolutionFwdAlgoImplicitGEMM;GemmFwdRest_hipblaslt:99.2401,3308912640,miopenConvolutionFwdAlgoGEMM
64-19-176-320-3x3x3-32-17-176-320-1-0x1x1-1x1x1-1x1x1-0-NCDHW-FP16-F=GemmFwdRest:101.179,3308912640,miopenConvolutionFwdAlgoGEMM;ConvHipImplicitGemm3DGroupFwdXdlops:38.6431,198356992,miopenConvolutionFwdAlgoImplicitGEMM;GemmFwdRest_hipblaslt:97.9188,3308912640,miopenConvolutionFwdAlgoGEMM
32-19-176-320-3x3x3-32-17-176-320-1-0x1x1-1x1x1-1x1x1-0-NCDHW-FP16-F=GemmFwdRest:74.1377,1654456320,miopenConvolutionFwdAlgoGEMM;ConvHipImplicitGemm3DGroupFwdXdlops:21.847,129816576,miopenConvolutionFwdAlgoImplicitGEMM;GemmFwdRest_hipblaslt:69.9039,1654456320,miopenConvolutionFwdAlgoGEMM
64-17-176-320-1x1x1-32-17-176-320-1-0x0x0-1x1x1-1x1x1-0-NCDHW-FP16-F=GemmFwd1x1_0_1:1.15243,0,miopenConvolutionFwdAlgoGEMM;GemmFwd1x1_0_1_hipblaslt:1.01737,0,miopenConvolutionFwdAlgoGEMM;ConvHipImplicitGemm3DGroupFwdXdlops:4.55777,183832576,miopenConvolutionFwdAlgoImplicitGEMM
32-19-176-320-3x3x3-128-17-176-320-1-0x1x1-1x1x1-1x1x1-0-NCDHW-FP16-F=GemmFwdRest:71.8874,1654456320,miopenConvolutionFwdAlgoGEMM;ConvHipImplicitGemm3DGroupFwdXdlops:45.2491,313810944,miopenConvolutionFwdAlgoImplicitGEMM;GemmFwdRest_hipblaslt:80.1357,1654456320,miopenConvolutionFwdAlgoGEMM
32-19-352-640-3x3x3-32-17-352-640-1-0x1x1-1x1x1-1x1x1-0-NCDHW-FP16-F=GemmFwdRest:248.038,6617825280,miopenConvolutionFwdAlgoGEMM;ConvHipImplicitGemm3DGroupFwdXdlops:79.5387,519100416,miopenConvolutionFwdAlgoImplicitGEMM;GemmFwdRest_hipblaslt:237.443,6617825280,miopenConvolutionFwdAlgoGEMM
8-19-704-1280-3x3x3-3-17-704-1280-1-0x1x1-1x1x1-1x1x1-0-NCDHW-FP16-F=GemmFwdRest:282.443,6617825280,miopenConvolutionFwdAlgoGEMM;ConvHipImplicitGemm3DGroupFwdXdlops:82.9121,365856256,miopenConvolutionFwdAlgoImplicitGEMM;GemmFwdRest_hipblaslt:266.385,6617825280,miopenConvolutionFwdAlgoGEMM
48-5-44-80-3x3x3-512-3-44-80-1-0x1x1-1x1x1-1x1x1-0-NCDHW-FP16-F=GemmFwdRest:1.05458,27371520,miopenConvolutionFwdAlgoGEMM;ConvHipImplicitGemm3DGroupFwdXdlops:2.8375,13830144,miopenConvolutionFwdAlgoImplicitGEMM;GemmFwdRest_hipblaslt:1.26497,27371520,miopenConvolutionFwdAlgoGEMM
512-7-44-80-5x5x5-512-3-44-80-1-0x2x2-1x1x1-1x1x1-0-NCDHW-FP16-F_g512=GemmFwdRest:54.4811,1351680000,miopenConvolutionFwdAlgoGEMM;ConvHipImplicitGemm3DGroupFwdXdlops:198.55,36172800,miopenConvolutionFwdAlgoImplicitGEMM;GemmFwdRest_hipblaslt:51.5342,1351680000,miopenConvolutionFwdAlgoGEMM
512-3-44-80-1x1x1-512-3-44-80-1-0x0x0-1x1x1-1x1x1-0-NCDHW-FP16-F=GemmFwd1x1_0_1:0.204196,0,miopenConvolutionFwdAlgoGEMM;GemmFwd1x1_0_1_hipblaslt:0.270914,0,miopenConvolutionFwdAlgoGEMM;ConvHipImplicitGemm3DGroupFwdXdlops:1.44851,22151168,miopenConvolutionFwdAlgoImplicitGEMM
512-5-44-80-3x3x3-256-3-44-80-1-0x1x1-1x1x1-1x1x1-0-NCDHW-FP16-F=GemmFwdRest:13.5421,291962880,miopenConvolutionFwdAlgoGEMM;ConvHipImplicitGemm3DGroupFwdXdlops:14.0612,30507008,miopenConvolutionFwdAlgoImplicitGEMM;GemmFwdRest_hipblaslt:16.9246,291962880,miopenConvolutionFwdAlgoGEMM
256-5-44-80-3x3x3-256-3-44-80-1-0x1x1-1x1x1-1x1x1-0-NCDHW-FP16-F=GemmFwdRest:5.09602,145981440,miopenConvolutionFwdAlgoGEMM;ConvHipImplicitGemm3DGroupFwdXdlops:7.56414,17956864,miopenConvolutionFwdAlgoImplicitGEMM;GemmFwdRest_hipblaslt:5.37303,145981440,miopenConvolutionFwdAlgoGEMM
512-3-44-80-1x1x1-256-3-44-80-1-0x0x0-1x1x1-1x1x1-0-NCDHW-FP16-F=GemmFwd1x1_0_1:0.0892917,0,miopenConvolutionFwdAlgoGEMM;GemmFwd1x1_0_1_hipblaslt:0.123667,0,miopenConvolutionFwdAlgoGEMM;ConvHipImplicitGemm3DGroupFwdXdlops:0.690792,16482304,miopenConvolutionFwdAlgoImplicitGEMM
256-5-44-80-3x3x3-2048-3-44-80-1-0x1x1-1x1x1-1x1x1-0-NCDHW-FP16-F=GemmFwdRest:18.8574,145981440,miopenConvolutionFwdAlgoGEMM;ConvHipImplicitGemm3DGroupFwdXdlops:57.8809,80576512,miopenConvolutionFwdAlgoImplicitGEMM;GemmFwdRest_hipblaslt:23.5793,145981440,miopenConvolutionFwdAlgoGEMM
256-7-88-160-3x3x3-256-5-88-160-1-0x1x1-1x1x1-1x1x1-0-NCDHW-FP16-F=GemmFwdRest:40.3851,973209600,miopenConvolutionFwdAlgoGEMM;ConvHipImplicitGemm3DGroupFwdXdlops:47.7844,90046464,miopenConvolutionFwdAlgoImplicitGEMM;GemmFwdRest_hipblaslt:49.4729,973209600,miopenConvolutionFwdAlgoGEMM
256-7-88-160-3x3x3-64-5-88-160-1-0x1x1-1x1x1-1x1x1-0-NCDHW-FP16-F=GemmFwdRest:30.9809,973209600,miopenConvolutionFwdAlgoGEMM;ConvHipImplicitGemm3DGroupFwdXdlops:12.7151,60358656,miopenConvolutionFwdAlgoImplicitGEMM;GemmFwdRest_hipblaslt:28.8165,973209600,miopenConvolutionFwdAlgoGEMM
64-7-88-160-3x3x3-64-5-88-160-1-0x1x1-1x1x1-1x1x1-0-NCDHW-FP16-F=GemmFwdRest:6.37284,243302400,miopenConvolutionFwdAlgoGEMM;ConvHipImplicitGemm3DGroupFwdXdlops:3.53644,21848064,miopenConvolutionFwdAlgoImplicitGEMM;GemmFwdRest_hipblaslt:7.25652,243302400,miopenConvolutionFwdAlgoGEMM
256-5-88-160-1x1x1-64-5-88-160-1-0x0x0-1x1x1-1x1x1-0-NCDHW-FP16-F=GemmFwd1x1_0_1:0.265299,0,miopenConvolutionFwdAlgoGEMM;GemmFwd1x1_0_1_hipblaslt:0.240887,0,miopenConvolutionFwdAlgoGEMM;ConvHipImplicitGemm3DGroupFwdXdlops:1.20299,45088768,miopenConvolutionFwdAlgoImplicitGEMM
64-7-88-160-3x3x3-512-5-88-160-1-0x1x1-1x1x1-1x1x1-0-NCDHW-FP16-F=GemmFwdRest:10.8046,243302400,miopenConvolutionFwdAlgoGEMM;ConvHipImplicitGemm3DGroupFwdXdlops:26.7441,86474752,miopenConvolutionFwdAlgoImplicitGEMM;GemmFwdRest_hipblaslt:16.8587,243302400,miopenConvolutionFwdAlgoGEMM
64-11-176-320-3x3x3-64-9-176-320-1-0x1x1-1x1x1-1x1x1-0-NCDHW-FP16-F=GemmFwdRest:75.6833,1751777280,miopenConvolutionFwdAlgoGEMM;ConvHipImplicitGemm3DGroupFwdXdlops:25.6065,144400384,miopenConvolutionFwdAlgoImplicitGEMM;GemmFwdRest_hipblaslt:75.9303,1751777280,miopenConvolutionFwdAlgoGEMM
64-11-176-320-3x3x3-32-9-176-320-1-0x1x1-1x1x1-1x1x1-0-NCDHW-FP16-F=GemmFwdRest:75.8509,1751777280,miopenConvolutionFwdAlgoGEMM;ConvHipImplicitGemm3DGroupFwdXdlops:23.0796,111849472,miopenConvolutionFwdAlgoImplicitGEMM;GemmFwdRest_hipblaslt:77.7877,1751777280,miopenConvolutionFwdAlgoGEMM
32-11-176-320-3x3x3-32-9-176-320-1-0x1x1-1x1x1-1x1x1-0-NCDHW-FP16-F=GemmFwdRest:26.5032,875888640,miopenConvolutionFwdAlgoGEMM;ConvHipImplicitGemm3DGroupFwdXdlops:11.4094,72144896,miopenConvolutionFwdAlgoImplicitGEMM;GemmFwdRest_hipblaslt:25.802,875888640,miopenConvolutionFwdAlgoGEMM
64-9-176-320-1x1x1-32-9-176-320-1-0x0x0-1x1x1-1x1x1-0-NCDHW-FP16-F=GemmFwd1x1_0_1:0.557131,0,miopenConvolutionFwdAlgoGEMM;GemmFwd1x1_0_1_hipblaslt:0.526115,0,miopenConvolutionFwdAlgoGEMM;ConvHipImplicitGemm3DGroupFwdXdlops:2.4894,97325056,miopenConvolutionFwdAlgoImplicitGEMM
32-11-176-320-3x3x3-128-9-176-320-1-0x1x1-1x1x1-1x1x1-0-NCDHW-FP16-F=GemmFwdRest:29.4212,875888640,miopenConvolutionFwdAlgoGEMM;ConvHipImplicitGemm3DGroupFwdXdlops:24.2561,169631744,miopenConvolutionFwdAlgoImplicitGEMM;GemmFwdRest_hipblaslt:31.1182,875888640,miopenConvolutionFwdAlgoGEMM
32-11-352-640-3x3x3-32-9-352-640-1-0x1x1-1x1x1-1x1x1-0-NCDHW-FP16-F=GemmFwdRest:114.742,3503554560,miopenConvolutionFwdAlgoGEMM;ConvHipImplicitGemm3DGroupFwdXdlops:45.9397,288413696,miopenConvolutionFwdAlgoImplicitGEMM;GemmFwdRest_hipblaslt:104.418,3503554560,miopenConvolutionFwdAlgoGEMM
8-11-704-1280-3x3x3-3-9-704-1280-1-0x1x1-1x1x1-1x1x1-0-NCDHW-FP16-F=GemmFwdRest:98.1206,3503554560,miopenConvolutionFwdAlgoGEMM;ConvHipImplicitGemm3DGroupFwdXdlops:43.8633,207259136,miopenConvolutionFwdAlgoImplicitGEMM;GemmFwdRest_hipblaslt:93.3718,3503554560,miopenConvolutionFwdAlgoGEMM
48-31-36-64-1x2x2-3072-31-18-32-1-0x0x0-1x2x2-1x1x1-0-NCDHW-FP16-F=GemmFwdRest:1.06555,6856704,miopenConvolutionFwdAlgoGEMM;ConvHipImplicitGemm3DGroupFwdXdlops:6.72593,117743616,miopenConvolutionFwdAlgoImplicitGEMM;GemmFwdRest_hipblaslt:1.72777,6856704,miopenConvolutionFwdAlgoGEMM
48-7-36-64-3x3x3-512-5-36-64-1-0x1x1-1x1x1-1x1x1-0-NCDHW-FP16-F=GemmFwdRest:1.21992,29859840,miopenConvolutionFwdAlgoGEMM;ConvHipImplicitGemm3DGroupFwdXdlops:2.83952,14671872,miopenConvolutionFwdAlgoImplicitGEMM;GemmFwdRest_hipblaslt:1.67734,29859840,miopenConvolutionFwdAlgoGEMM
512-9-36-64-5x5x5-512-5-36-64-1-0x2x2-1x1x1-1x1x1-0-NCDHW-FP16-F_g512=GemmFwdRest:60.4217,1474560000,miopenConvolutionFwdAlgoGEMM;ConvHipImplicitGemm3DGroupFwdXdlops:213.41,33158144,miopenConvolutionFwdAlgoImplicitGEMM;GemmFwdRest_hipblaslt:53.2112,1474560000,miopenConvolutionFwdAlgoGEMM
512-5-36-64-1x1x1-512-5-36-64-1-0x0x0-1x1x1-1x1x1-0-NCDHW-FP16-F=GemmFwd1x1_0_1:0.231465,0,miopenConvolutionFwdAlgoGEMM;GemmFwd1x1_0_1_hipblaslt:0.279446,0,miopenConvolutionFwdAlgoGEMM;ConvHipImplicitGemm3DGroupFwdXdlops:1.60943,24117248,miopenConvolutionFwdAlgoImplicitGEMM
512-7-36-64-3x3x3-256-5-36-64-1-0x1x1-1x1x1-1x1x1-0-NCDHW-FP16-F=GemmFwdRest:16.3585,318504960,miopenConvolutionFwdAlgoGEMM;ConvHipImplicitGemm3DGroupFwdXdlops:15.521,29491200,miopenConvolutionFwdAlgoImplicitGEMM;GemmFwdRest_hipblaslt:20.5087,318504960,miopenConvolutionFwdAlgoGEMM
256-7-36-64-3x3x3-256-5-36-64-1-0x1x1-1x1x1-1x1x1-0-NCDHW-FP16-F=GemmFwdRest:4.57997,159252480,miopenConvolutionFwdAlgoGEMM;ConvHipImplicitGemm3DGroupFwdXdlops:8.27607,17694720,miopenConvolutionFwdAlgoImplicitGEMM;GemmFwdRest_hipblaslt:5.9871,159252480,miopenConvolutionFwdAlgoGEMM
512-5-36-64-1x1x1-256-5-36-64-1-0x0x0-1x1x1-1x1x1-0-NCDHW-FP16-F=GemmFwd1x1_0_1:0.080475,0,miopenConvolutionFwdAlgoGEMM;GemmFwd1x1_0_1_hipblaslt:0.118174,0,miopenConvolutionFwdAlgoGEMM;ConvHipImplicitGemm3DGroupFwdXdlops:0.674236,17956864,miopenConvolutionFwdAlgoImplicitGEMM
256-7-36-64-3x3x3-2048-5-36-64-1-0x1x1-1x1x1-1x1x1-0-NCDHW-FP16-F=GemmFwdRest:20.6973,159252480,miopenConvolutionFwdAlgoGEMM;ConvHipImplicitGemm3DGroupFwdXdlops:64.313,83755008,miopenConvolutionFwdAlgoImplicitGEMM;GemmFwdRest_hipblaslt:25.4417,159252480,miopenConvolutionFwdAlgoGEMM
256-11-72-128-3x3x3-256-9-72-128-1-0x1x1-1x1x1-1x1x1-0-NCDHW-FP16-F=GemmFwdRest:75.5922,1146617856,miopenConvolutionFwdAlgoGEMM;ConvHipImplicitGemm3DGroupFwdXdlops:55.04,97910784,miopenConvolutionFwdAlgoImplicitGEMM;GemmFwdRest_hipblaslt:101.884,1146617856,miopenConvolutionFwdAlgoGEMM
256-11-72-128-3x3x3-64-9-72-128-1-0x1x1-1x1x1-1x1x1-0-NCDHW-FP16-F=GemmFwdRest:48.3806,1146617856,miopenConvolutionFwdAlgoGEMM;ConvHipImplicitGemm3DGroupFwdXdlops:14.5838,63406080,miopenConvolutionFwdAlgoImplicitGEMM;GemmFwdRest_hipblaslt:47.5318,1146617856,miopenConvolutionFwdAlgoGEMM
64-11-72-128-3x3x3-64-9-72-128-1-0x1x1-1x1x1-1x1x1-0-NCDHW-FP16-F=GemmFwdRest:7.57497,286654464,miopenConvolutionFwdAlgoGEMM;ConvHipImplicitGemm3DGroupFwdXdlops:3.92633,23814144,miopenConvolutionFwdAlgoImplicitGEMM;GemmFwdRest_hipblaslt:8.38447,286654464,miopenConvolutionFwdAlgoGEMM
256-9-72-128-1x1x1-64-9-72-128-1-0x0x0-1x1x1-1x1x1-0-NCDHW-FP16-F=GemmFwd1x1_0_1:0.300916,0,miopenConvolutionFwdAlgoGEMM;GemmFwd1x1_0_1_hipblaslt:0.303152,0,miopenConvolutionFwdAlgoGEMM;ConvHipImplicitGemm3DGroupFwdXdlops:1.56697,53116928,miopenConvolutionFwdAlgoImplicitGEMM
64-11-72-128-3x3x3-512-9-72-128-1-0x1x1-1x1x1-1x1x1-0-NCDHW-FP16-F=GemmFwdRest:17.1479,286654464,miopenConvolutionFwdAlgoGEMM;ConvHipImplicitGemm3DGroupFwdXdlops:30.7132,99680256,miopenConvolutionFwdAlgoImplicitGEMM;GemmFwdRest_hipblaslt:19.6013,286654464,miopenConvolutionFwdAlgoGEMM
64-19-144-256-3x3x3-64-17-144-256-1-0x1x1-1x1x1-1x1x1-0-NCDHW-FP16-F=GemmFwdRest:91.0151,2165833728,miopenConvolutionFwdAlgoGEMM;ConvHipImplicitGemm3DGroupFwdXdlops:26.9277,170090496,miopenConvolutionFwdAlgoImplicitGEMM;GemmFwdRest_hipblaslt:90.6882,2165833728,miopenConvolutionFwdAlgoGEMM
64-19-144-256-3x3x3-32-17-144-256-1-0x1x1-1x1x1-1x1x1-0-NCDHW-FP16-F=GemmFwdRest:92.5141,2165833728,miopenConvolutionFwdAlgoGEMM;ConvHipImplicitGemm3DGroupFwdXdlops:26.732,129871872,miopenConvolutionFwdAlgoImplicitGEMM;GemmFwdRest_hipblaslt:93.2786,2165833728,miopenConvolutionFwdAlgoGEMM
32-19-144-256-3x3x3-32-17-144-256-1-0x1x1-1x1x1-1x1x1-0-NCDHW-FP16-F=GemmFwdRest:40.3849,1082916864,miopenConvolutionFwdAlgoGEMM;ConvHipImplicitGemm3DGroupFwdXdlops:14.6777,84989952,miopenConvolutionFwdAlgoImplicitGEMM;GemmFwdRest_hipblaslt:40.8744,1082916864,miopenConvolutionFwdAlgoGEMM
64-17-144-256-1x1x1-32-17-144-256-1-0x0x0-1x1x1-1x1x1-0-NCDHW-FP16-F=GemmFwd1x1_0_1:0.707313,0,miopenConvolutionFwdAlgoGEMM;GemmFwd1x1_0_1_hipblaslt:0.690986,0,miopenConvolutionFwdAlgoGEMM;ConvHipImplicitGemm3DGroupFwdXdlops:2.98964,120328192,miopenConvolutionFwdAlgoImplicitGEMM
32-19-144-256-3x3x3-128-17-144-256-1-0x1x1-1x1x1-1x1x1-0-NCDHW-FP16-F=GemmFwdRest:41.8892,1082916864,miopenConvolutionFwdAlgoGEMM;ConvHipImplicitGemm3DGroupFwdXdlops:31.5655,205479936,miopenConvolutionFwdAlgoImplicitGEMM;GemmFwdRest_hipblaslt:50.3655,1082916864,miopenConvolutionFwdAlgoGEMM
32-19-288-512-3x3x3-32-17-288-512-1-0x1x1-1x1x1-1x1x1-0-NCDHW-FP16-F=GemmFwdRest:226.6,4331667456,miopenConvolutionFwdAlgoGEMM;ConvHipImplicitGemm3DGroupFwdXdlops:57.2226,339793920,miopenConvolutionFwdAlgoImplicitGEMM;GemmFwdRest_hipblaslt:221.029,4331667456,miopenConvolutionFwdAlgoGEMM
32-288-512-3x3-32-288-512-1-1x1-1x1-1x1-0-NCHW-FP16-F=GemmFwdRest:1.18165,84934656,miopenConvolutionFwdAlgoGEMM;GemmFwdRest_hipblaslt:1.18677,84934656,miopenConvolutionFwdAlgoGEMM;ConvHipImplicitGemmGroupFwdXdlops:0.96145,18892800,miopenConvolutionFwdAlgoImplicitGEMM;ConvBinWinogradRxSf3x2:0.218243,0,miopenConvolutionFwdAlgoWinograd;ConvBinWinogradRxSf2x3g1:0.187483,0,miopenConvolutionFwdAlgoWinograd
8-19-576-1024-3x3x3-3-17-576-1024-1-0x1x1-1x1x1-1x1x1-0-NCDHW-FP16-F=GemmFwdRest:225.919,4331667456,miopenConvolutionFwdAlgoGEMM;ConvHipImplicitGemm3DGroupFwdXdlops:57.7831,239470080,miopenConvolutionFwdAlgoImplicitGEMM;GemmFwdRest_hipblaslt:216.703,4331667456,miopenConvolutionFwdAlgoGEMM
48-6-36-64-3x3x3-512-4-36-64-1-0x1x1-1x1x1-1x1x1-0-NCDHW-FP16-F=GemmFwdRest:0.95065,23887872,miopenConvolutionFwdAlgoGEMM;ConvHipImplicitGemm3DGroupFwdXdlops:2.47183,12091392,miopenConvolutionFwdAlgoImplicitGEMM;GemmFwdRest_hipblaslt:1.19559,23887872,miopenConvolutionFwdAlgoGEMM
512-8-36-64-5x5x5-512-4-36-64-1-0x2x2-1x1x1-1x1x1-0-NCDHW-FP16-F_g512=GemmFwdRest:44.3639,1179648000,miopenConvolutionFwdAlgoGEMM;ConvHipImplicitGemm3DGroupFwdXdlops:110.699,28439552,miopenConvolutionFwdAlgoImplicitGEMM;GemmFwdRest_hipblaslt:39.2253,1179648000,miopenConvolutionFwdAlgoGEMM
512-4-36-64-1x1x1-512-4-36-64-1-0x0x0-1x1x1-1x1x1-0-NCDHW-FP16-F=GemmFwd1x1_0_1:0.149542,0,miopenConvolutionFwdAlgoGEMM;GemmFwd1x1_0_1_hipblaslt:0.228015,0,miopenConvolutionFwdAlgoGEMM;ConvHipImplicitGemm3DGroupFwdXdlops:1.26248,19398656,miopenConvolutionFwdAlgoImplicitGEMM
512-6-36-64-3x3x3-256-4-36-64-1-0x1x1-1x1x1-1x1x1-0-NCDHW-FP16-F=GemmFwdRest:9.9127,254803968,miopenConvolutionFwdAlgoGEMM;ConvHipImplicitGemm3DGroupFwdXdlops:12.411,25952256,miopenConvolutionFwdAlgoImplicitGEMM;GemmFwdRest_hipblaslt:10.2303,254803968,miopenConvolutionFwdAlgoGEMM
256-6-36-64-3x3x3-256-4-36-64-1-0x1x1-1x1x1-1x1x1-0-NCDHW-FP16-F=GemmFwdRest:4.98626,127401984,miopenConvolutionFwdAlgoGEMM;ConvHipImplicitGemm3DGroupFwdXdlops:6.42145,15335424,miopenConvolutionFwdAlgoImplicitGEMM;GemmFwdRest_hipblaslt:7.22522,127401984,miopenConvolutionFwdAlgoGEMM
512-4-36-64-1x1x1-256-4-36-64-1-0x0x0-1x1x1-1x1x1-0-NCDHW-FP16-F=GemmFwd1x1_0_1:0.07859,0,miopenConvolutionFwdAlgoGEMM;GemmFwd1x1_0_1_hipblaslt:0.103344,0,miopenConvolutionFwdAlgoGEMM;ConvHipImplicitGemm3DGroupFwdXdlops:0.590474,14417920,miopenConvolutionFwdAlgoImplicitGEMM
256-6-36-64-3x3x3-2048-4-36-64-1-0x1x1-1x1x1-1x1x1-0-NCDHW-FP16-F=GemmFwdRest:21.5521,127401984,miopenConvolutionFwdAlgoGEMM;ConvHipImplicitGemm3DGroupFwdXdlops:51.117,73138176,miopenConvolutionFwdAlgoImplicitGEMM;GemmFwdRest_hipblaslt:43.7339,127401984,miopenConvolutionFwdAlgoGEMM
256-9-72-128-3x3x3-256-7-72-128-1-0x1x1-1x1x1-1x1x1-0-NCDHW-FP16-F=GemmFwdRest:58.9598,891813888,miopenConvolutionFwdAlgoGEMM;ConvHipImplicitGemm3DGroupFwdXdlops:42.4215,79036416,miopenConvolutionFwdAlgoImplicitGEMM;GemmFwdRest_hipblaslt:78.7061,891813888,miopenConvolutionFwdAlgoGEMM
256-9-72-128-3x3x3-64-7-72-128-1-0x1x1-1x1x1-1x1x1-0-NCDHW-FP16-F=GemmFwdRest:37.7965,891813888,miopenConvolutionFwdAlgoGEMM;ConvHipImplicitGemm3DGroupFwdXdlops:11.1812,51609600,miopenConvolutionFwdAlgoImplicitGEMM;GemmFwdRest_hipblaslt:34.0048,891813888,miopenConvolutionFwdAlgoGEMM
64-9-72-128-3x3x3-64-7-72-128-1-0x1x1-1x1x1-1x1x1-0-NCDHW-FP16-F=GemmFwdRest:5.58747,222953472,miopenConvolutionFwdAlgoGEMM;ConvHipImplicitGemm3DGroupFwdXdlops:3.11491,19095552,miopenConvolutionFwdAlgoImplicitGEMM;GemmFwdRest_hipblaslt:6.40931,222953472,miopenConvolutionFwdAlgoGEMM
256-7-72-128-1x1x1-64-7-72-128-1-0x0x0-1x1x1-1x1x1-0-NCDHW-FP16-F=GemmFwd1x1_0_1:0.240767,0,miopenConvolutionFwdAlgoGEMM;GemmFwd1x1_0_1_hipblaslt:0.203136,0,miopenConvolutionFwdAlgoGEMM;ConvHipImplicitGemm3DGroupFwdXdlops:1.12107,41320448,miopenConvolutionFwdAlgoImplicitGEMM
64-9-72-128-3x3x3-512-7-72-128-1-0x1x1-1x1x1-1x1x1-0-NCDHW-FP16-F=GemmFwdRest:14.014,222953472,miopenConvolutionFwdAlgoGEMM;ConvHipImplicitGemm3DGroupFwdXdlops:23.6179,78446592,miopenConvolutionFwdAlgoImplicitGEMM;GemmFwdRest_hipblaslt:16.0188,222953472,miopenConvolutionFwdAlgoGEMM
64-15-144-256-3x3x3-64-13-144-256-1-0x1x1-1x1x1-1x1x1-0-NCDHW-FP16-F=GemmFwdRest:69.0411,1656225792,miopenConvolutionFwdAlgoGEMM;ConvHipImplicitGemm3DGroupFwdXdlops:22.5945,132341760,miopenConvolutionFwdAlgoImplicitGEMM;GemmFwdRest_hipblaslt:69.5744,1656225792,miopenConvolutionFwdAlgoGEMM
64-15-144-256-3x3x3-32-13-144-256-1-0x1x1-1x1x1-1x1x1-0-NCDHW-FP16-F=GemmFwdRest:67.914,1656225792,miopenConvolutionFwdAlgoGEMM;ConvHipImplicitGemm3DGroupFwdXdlops:20.1574,101560320,miopenConvolutionFwdAlgoImplicitGEMM;GemmFwdRest_hipblaslt:69.0988,1656225792,miopenConvolutionFwdAlgoGEMM
32-15-144-256-3x3x3-32-13-144-256-1-0x1x1-1x1x1-1x1x1-0-NCDHW-FP16-F=GemmFwdRest:29.3154,828112896,miopenConvolutionFwdAlgoGEMM;ConvHipImplicitGemm3DGroupFwdXdlops:10.8581,66115584,miopenConvolutionFwdAlgoImplicitGEMM;GemmFwdRest_hipblaslt:29.9041,828112896,miopenConvolutionFwdAlgoGEMM
64-13-144-256-1x1x1-32-13-144-256-1-0x0x0-1x1x1-1x1x1-0-NCDHW-FP16-F=GemmFwd1x1_0_1:0.506897,0,miopenConvolutionFwdAlgoGEMM;GemmFwd1x1_0_1_hipblaslt:0.534817,0,miopenConvolutionFwdAlgoGEMM;ConvHipImplicitGemm3DGroupFwdXdlops:2.57599,92016640,miopenConvolutionFwdAlgoImplicitGEMM
32-15-144-256-3x3x3-128-13-144-256-1-0x1x1-1x1x1-1x1x1-0-NCDHW-FP16-F=GemmFwdRest:31.0174,828112896,miopenConvolutionFwdAlgoGEMM;ConvHipImplicitGemm3DGroupFwdXdlops:23.4193,158294016,miopenConvolutionFwdAlgoImplicitGEMM;GemmFwdRest_hipblaslt:35.0316,828112896,miopenConvolutionFwdAlgoGEMM
32-15-288-512-3x3x3-32-13-288-512-1-0x1x1-1x1x1-1x1x1-0-NCDHW-FP16-F=GemmFwdRest:148.625,3312451584,miopenConvolutionFwdAlgoGEMM;ConvHipImplicitGemm3DGroupFwdXdlops:40.913,264296448,miopenConvolutionFwdAlgoImplicitGEMM;GemmFwdRest_hipblaslt:149.478,3312451584,miopenConvolutionFwdAlgoGEMM
8-15-576-1024-3x3x3-3-13-576-1024-1-0x1x1-1x1x1-1x1x1-0-NCDHW-FP16-F=GemmFwdRest:143.005,3312451584,miopenConvolutionFwdAlgoGEMM;ConvHipImplicitGemm3DGroupFwdXdlops:42.0707,187565568,miopenConvolutionFwdAlgoImplicitGEMM;GemmFwdRest_hipblaslt:132.286,3312451584,miopenConvolutionFwdAlgoGEMM
48-21-36-64-1x2x2-3072-21-18-32-1-0x0x0-1x2x2-1x1x1-0-NCDHW-FP16-F=GemmFwdRest:0.626153,4644864,miopenConvolutionFwdAlgoGEMM;ConvHipImplicitGemm3DGroupFwdXdlops:5.51978,80142336,miopenConvolutionFwdAlgoImplicitGEMM;GemmFwdRest_hipblaslt:1.09333,4644864,miopenConvolutionFwdAlgoGEMM
48-7-36-64-3x3x3-512-5-36-64-1-0x1x1-1x1x1-1x1x1-0-NCDHW-FP32-F=GemmFwdRest:7.18345,59719680,miopenConvolutionFwdAlgoGEMM;GemmFwdRest_hipblaslt:14.7477,59719680,miopenConvolutionFwdAlgoGEMM
512-9-36-64-5x5x5-512-5-36-64-1-0x2x2-1x1x1-1x1x1-0-NCDHW-FP32-F_g512=GemmFwdRest:62.748,2949120000,miopenConvolutionFwdAlgoGEMM;GemmFwdRest_hipblaslt:51.5845,2949120000,miopenConvolutionFwdAlgoGEMM
512-5-36-64-1x1x1-512-5-36-64-1-0x0x0-1x1x1-1x1x1-0-NCDHW-FP32-F=GemmFwd1x1_0_1:3.24953,0,miopenConvolutionFwdAlgoGEMM;GemmFwd1x1_0_1_hipblaslt:4.23176,0,miopenConvolutionFwdAlgoGEMM
512-7-36-64-3x3x3-256-5-36-64-1-0x1x1-1x1x1-1x1x1-0-NCDHW-FP32-F=GemmFwdRest:83.1211,637009920,miopenConvolutionFwdAlgoGEMM;GemmFwdRest_hipblaslt:176.798,637009920,miopenConvolutionFwdAlgoGEMM
256-7-36-64-3x3x3-256-5-36-64-1-0x1x1-1x1x1-1x1x1-0-NCDHW-FP32-F=GemmFwdRest:28.1871,318504960,miopenConvolutionFwdAlgoGEMM;GemmFwdRest_hipblaslt:74.2498,318504960,miopenConvolutionFwdAlgoGEMM
512-5-36-64-1x1x1-256-5-36-64-1-0x0x0-1x1x1-1x1x1-0-NCDHW-FP32-F=GemmFwd1x1_0_1:1.24579,0,miopenConvolutionFwdAlgoGEMM;GemmFwd1x1_0_1_hipblaslt:1.65215,0,miopenConvolutionFwdAlgoGEMM
256-7-36-64-3x3x3-2048-5-36-64-1-0x1x1-1x1x1-1x1x1-0-NCDHW-FP32-F=GemmFwdRest:214.035,318504960,miopenConvolutionFwdAlgoGEMM;GemmFwdRest_hipblaslt:603.614,318504960,miopenConvolutionFwdAlgoGEMM
256-11-72-128-3x3x3-256-9-72-128-1-0x1x1-1x1x1-1x1x1-0-NCDHW-FP32-F=GemmFwdRest:240.522,2293235712,miopenConvolutionFwdAlgoGEMM;GemmFwdRest_hipblaslt:644.184,2293235712,miopenConvolutionFwdAlgoGEMM
256-11-72-128-3x3x3-64-9-72-128-1-0x1x1-1x1x1-1x1x1-0-NCDHW-FP32-F=GemmFwdRest:73.7474,2293235712,miopenConvolutionFwdAlgoGEMM;GemmFwdRest_hipblaslt:178.842,2293235712,miopenConvolutionFwdAlgoGEMM
64-11-72-128-3x3x3-64-9-72-128-1-0x1x1-1x1x1-1x1x1-0-NCDHW-FP32-F=GemmFwdRest:18.1705,573308928,miopenConvolutionFwdAlgoGEMM;GemmFwdRest_hipblaslt:36.6812,573308928,miopenConvolutionFwdAlgoGEMM
256-9-72-128-1x1x1-64-9-72-128-1-0x0x0-1x1x1-1x1x1-0-NCDHW-FP32-F=GemmFwd1x1_0_1:1.19824,0,miopenConvolutionFwdAlgoGEMM;GemmFwd1x1_0_1_hipblaslt:1.9503,0,miopenConvolutionFwdAlgoGEMM
64-11-72-128-3x3x3-512-9-72-128-1-0x1x1-1x1x1-1x1x1-0-NCDHW-FP32-F=GemmFwdRest:88.097,573308928,miopenConvolutionFwdAlgoGEMM;GemmFwdRest_hipblaslt:232.876,573308928,miopenConvolutionFwdAlgoGEMM
64-19-144-256-3x3x3-64-17-144-256-1-0x1x1-1x1x1-1x1x1-0-NCDHW-FP32-F=GemmFwdRest:135.291,4331667456,miopenConvolutionFwdAlgoGEMM;GemmFwdRest_hipblaslt:300.517,4331667456,miopenConvolutionFwdAlgoGEMM
64-19-144-256-3x3x3-32-17-144-256-1-0x1x1-1x1x1-1x1x1-0-NCDHW-FP32-F=GemmFwdRest:105.717,4331667456,miopenConvolutionFwdAlgoGEMM;GemmFwdRest_hipblaslt:178.899,4331667456,miopenConvolutionFwdAlgoGEMM
32-19-144-256-3x3x3-32-17-144-256-1-0x1x1-1x1x1-1x1x1-0-NCDHW-FP32-F=GemmFwdRest:50.6065,2165833728,miopenConvolutionFwdAlgoGEMM;GemmFwdRest_hipblaslt:68.1365,2165833728,miopenConvolutionFwdAlgoGEMM
64-17-144-256-1x1x1-32-17-144-256-1-0x0x0-1x1x1-1x1x1-0-NCDHW-FP32-F=GemmFwd1x1_0_1:1.41327,0,miopenConvolutionFwdAlgoGEMM;GemmFwd1x1_0_1_hipblaslt:2.16538,0,miopenConvolutionFwdAlgoGEMM
32-19-144-256-3x3x3-128-17-144-256-1-0x1x1-1x1x1-1x1x1-0-NCDHW-FP32-F=GemmFwdRest:107.945,2165833728,miopenConvolutionFwdAlgoGEMM;GemmFwdRest_hipblaslt:209.078,2165833728,miopenConvolutionFwdAlgoGEMM
32-19-288-512-3x3x3-32-17-288-512-1-0x1x1-1x1x1-1x1x1-0-NCDHW-FP32-F=GemmFwdRest:280.992,8663334912,miopenConvolutionFwdAlgoGEMM;GemmFwdRest_hipblaslt:500.968,8663334912,miopenConvolutionFwdAlgoGEMM
32-288-512-3x3-32-288-512-1-1x1-1x1-1x1-0-NCHW-FP32-F=GemmFwdRest:2.35075,169869312,miopenConvolutionFwdAlgoGEMM;GemmFwdRest_hipblaslt:3.02198,169869312,miopenConvolutionFwdAlgoGEMM;ConvBinWinogradRxSf3x2:0.378,0,miopenConvolutionFwdAlgoWinograd;ConvBinWinogradRxSf2x3g1:0.2788,0,miopenConvolutionFwdAlgoWinograd
8-19-576-1024-3x3x3-3-17-576-1024-1-0x1x1-1x1x1-1x1x1-0-NCDHW-FP32-F=GemmFwdRest:258.804,8663334912,miopenConvolutionFwdAlgoGEMM;GemmFwdRest_hipblaslt:222.742,8663334912,miopenConvolutionFwdAlgoGEMM
48-5-36-64-3x3x3-512-3-36-64-1-0x1x1-1x1x1-1x1x1-0-NCDHW-FP32-F=GemmFwdRest:5.10978,35831808,miopenConvolutionFwdAlgoGEMM;GemmFwdRest_hipblaslt:14.3494,35831808,miopenConvolutionFwdAlgoGEMM
512-7-36-64-5x5x5-512-3-36-64-1-0x2x2-1x1x1-1x1x1-0-NCDHW-FP32-F_g512=GemmFwdRest:35.9093,1769472000,miopenConvolutionFwdAlgoGEMM;GemmFwdRest_hipblaslt:34.1716,1769472000,miopenConvolutionFwdAlgoGEMM
512-3-36-64-1x1x1-512-3-36-64-1-0x0x0-1x1x1-1x1x1-0-NCDHW-FP32-F=GemmFwd1x1_0_1:1.4065,0,miopenConvolutionFwdAlgoGEMM;GemmFwd1x1_0_1_hipblaslt:1.62295,0,miopenConvolutionFwdAlgoGEMM
512-5-36-64-3x3x3-256-3-36-64-1-0x1x1-1x1x1-1x1x1-0-NCDHW-FP32-F=GemmFwdRest:63.1721,382205952,miopenConvolutionFwdAlgoGEMM;GemmFwdRest_hipblaslt:175.35,382205952,miopenConvolutionFwdAlgoGEMM
256-5-36-64-3x3x3-256-3-36-64-1-0x1x1-1x1x1-1x1x1-0-NCDHW-FP32-F=GemmFwdRest:16.4638,191102976,miopenConvolutionFwdAlgoGEMM;GemmFwdRest_hipblaslt:38.6258,191102976,miopenConvolutionFwdAlgoGEMM
512-3-36-64-1x1x1-256-3-36-64-1-0x0x0-1x1x1-1x1x1-0-NCDHW-FP32-F=GemmFwd1x1_0_1:0.672148,0,miopenConvolutionFwdAlgoGEMM;GemmFwd1x1_0_1_hipblaslt:1.4076,0,miopenConvolutionFwdAlgoGEMM
256-5-36-64-3x3x3-2048-3-36-64-1-0x1x1-1x1x1-1x1x1-0-NCDHW-FP32-F=GemmFwdRest:124.861,191102976,miopenConvolutionFwdAlgoGEMM;GemmFwdRest_hipblaslt:319.868,191102976,miopenConvolutionFwdAlgoGEMM
256-7-72-128-3x3x3-256-5-72-128-1-0x1x1-1x1x1-1x1x1-0-NCDHW-FP32-F=GemmFwdRest:182.721,1274019840,miopenConvolutionFwdAlgoGEMM;GemmFwdRest_hipblaslt:550.762,1274019840,miopenConvolutionFwdAlgoGEMM
256-7-72-128-3x3x3-64-5-72-128-1-0x1x1-1x1x1-1x1x1-0-NCDHW-FP32-F=GemmFwdRest:48.8821,1274019840,miopenConvolutionFwdAlgoGEMM;GemmFwdRest_hipblaslt:147.008,1274019840,miopenConvolutionFwdAlgoGEMM
64-7-72-128-3x3x3-64-5-72-128-1-0x1x1-1x1x1-1x1x1-0-NCDHW-FP32-F=GemmFwdRest:10.3101,318504960,miopenConvolutionFwdAlgoGEMM;GemmFwdRest_hipblaslt:25.9003,318504960,miopenConvolutionFwdAlgoGEMM
256-5-72-128-1x1x1-64-5-72-128-1-0x0x0-1x1x1-1x1x1-0-NCDHW-FP32-F=GemmFwd1x1_0_1:0.618146,0,miopenConvolutionFwdAlgoGEMM;GemmFwd1x1_0_1_hipblaslt:0.993545,0,miopenConvolutionFwdAlgoGEMM
64-7-72-128-3x3x3-512-5-72-128-1-0x1x1-1x1x1-1x1x1-0-NCDHW-FP32-F=GemmFwdRest:50.3008,318504960,miopenConvolutionFwdAlgoGEMM;GemmFwdRest_hipblaslt:179.976,318504960,miopenConvolutionFwdAlgoGEMM
64-11-144-256-3x3x3-64-9-144-256-1-0x1x1-1x1x1-1x1x1-0-NCDHW-FP32-F=GemmFwdRest:82.3564,2293235712,miopenConvolutionFwdAlgoGEMM;GemmFwdRest_hipblaslt:193.316,2293235712,miopenConvolutionFwdAlgoGEMM
64-11-144-256-3x3x3-32-9-144-256-1-0x1x1-1x1x1-1x1x1-0-NCDHW-FP32-F=GemmFwdRest:58.9349,2293235712,miopenConvolutionFwdAlgoGEMM;GemmFwdRest_hipblaslt:112.988,2293235712,miopenConvolutionFwdAlgoGEMM
32-11-144-256-3x3x3-32-9-144-256-1-0x1x1-1x1x1-1x1x1-0-NCDHW-FP32-F=GemmFwdRest:27.0495,1146617856,miopenConvolutionFwdAlgoGEMM;GemmFwdRest_hipblaslt:46.4362,1146617856,miopenConvolutionFwdAlgoGEMM
64-9-144-256-1x1x1-32-9-144-256-1-0x0x0-1x1x1-1x1x1-0-NCDHW-FP32-F=GemmFwd1x1_0_1:0.772076,0,miopenConvolutionFwdAlgoGEMM;GemmFwd1x1_0_1_hipblaslt:1.14302,0,miopenConvolutionFwdAlgoGEMM
32-11-144-256-3x3x3-128-9-144-256-1-0x1x1-1x1x1-1x1x1-0-NCDHW-FP32-F=GemmFwdRest:56.6395,1146617856,miopenConvolutionFwdAlgoGEMM;GemmFwdRest_hipblaslt:150.379,1146617856,miopenConvolutionFwdAlgoGEMM
32-11-288-512-3x3x3-32-9-288-512-1-0x1x1-1x1x1-1x1x1-0-NCDHW-FP32-F=GemmFwdRest:108.001,4586471424,miopenConvolutionFwdAlgoGEMM;GemmFwdRest_hipblaslt:148.787,4586471424,miopenConvolutionFwdAlgoGEMM
8-11-576-1024-3x3x3-3-9-576-1024-1-0x1x1-1x1x1-1x1x1-0-NCDHW-FP32-F=GemmFwdRest:103.282,4586471424,miopenConvolutionFwdAlgoGEMM;GemmFwdRest_hipblaslt:92.7316,4586471424,miopenConvolutionFwdAlgoGEMM
12-3-290-514-3x3x3-160-1-288-512-1-0x0x0-1x1x1-1x1x1-0-NCDHW-BF16-F=GemmFwdRest:9.42222,95551488,miopenConvolutionFwdAlgoGEMM;ConvHipImplicitGemm3DGroupFwdXdlops:4.63714,58022144,miopenConvolutionFwdAlgoImplicitGEMM;GemmFwdRest_hipblaslt:3.55394,95551488,miopenConvolutionFwdAlgoGEMM
160-3-290-514-3x3x3-160-1-288-512-1-0x0x0-1x1x1-1x1x1-0-NCDHW-BF16-F=GemmFwdRest:75.0802,1274019840,miopenConvolutionFwdAlgoGEMM;ConvHipImplicitGemm3DGroupFwdXdlops:49.813,191665920,miopenConvolutionFwdAlgoImplicitGEMM;GemmFwdRest_hipblaslt:87.2965,1274019840,miopenConvolutionFwdAlgoGEMM
160-289-513-3x3-160-144-256-1-0x0-2x2-1x1-0-NCHW-BF16-F=GemmFwdRest:3.78352,106168320,miopenConvolutionFwdAlgoGEMM;GemmFwdRest_hipblaslt:2.75237,106168320,miopenConvolutionFwdAlgoGEMM;ConvHipImplicitGemmGroupFwdXdlops:4.46341,59699712,miopenConvolutionFwdAlgoImplicitGEMM
160-1-144-256-1x1x1-320-1-144-256-1-0x0x0-1x1x1-1x1x1-0-NCDHW-BF16-F=GemmFwd1x1_0_1:0.209415,0,miopenConvolutionFwdAlgoGEMM;GemmFwd1x1_0_1_hipblaslt:0.310418,0,miopenConvolutionFwdAlgoGEMM;ConvHipImplicitGemm3DGroupFwdXdlops:1.46359,35491840,miopenConvolutionFwdAlgoImplicitGEMM
160-3-146-258-3x3x3-320-1-144-256-1-0x0x0-1x1x1-1x1x1-0-NCDHW-BF16-F=GemmFwdRest:20.8227,318504960,miopenConvolutionFwdAlgoGEMM;ConvHipImplicitGemm3DGroupFwdXdlops:21.4427,62519040,miopenConvolutionFwdAlgoImplicitGEMM;GemmFwdRest_hipblaslt:29.5229,318504960,miopenConvolutionFwdAlgoGEMM
320-3-146-258-3x3x3-320-1-144-256-1-0x0x0-1x1x1-1x1x1-0-NCDHW-BF16-F=GemmFwdRest:48.6954,637009920,miopenConvolutionFwdAlgoGEMM;ConvHipImplicitGemm3DGroupFwdXdlops:41.6699,101445120,miopenConvolutionFwdAlgoImplicitGEMM;GemmFwdRest_hipblaslt:73.5998,637009920,miopenConvolutionFwdAlgoGEMM
320-145-257-3x3-320-72-128-1-0x0-2x2-1x1-0-NCHW-BF16-F=GemmFwdRest:2.00174,53084160,miopenConvolutionFwdAlgoGEMM;GemmFwdRest_hipblaslt:2.78958,53084160,miopenConvolutionFwdAlgoGEMM;ConvHipImplicitGemmGroupFwdXdlops:3.29879,31591168,miopenConvolutionFwdAlgoImplicitGEMM
320-1-72-128-1x1x1-640-1-72-128-1-0x0x0-1x1x1-1x1x1-0-NCDHW-BF16-F=GemmFwd1x1_0_1:0.151967,0,miopenConvolutionFwdAlgoGEMM;GemmFwd1x1_0_1_hipblaslt:0.196193,0,miopenConvolutionFwdAlgoGEMM;ConvHipImplicitGemm3DGroupFwdXdlops:0.88681,18104320,miopenConvolutionFwdAlgoImplicitGEMM
320-3-74-130-3x3x3-640-1-72-128-1-0x0x0-1x1x1-1x1x1-0-NCDHW-BF16-F=GemmFwdRest:19.5806,159252480,miopenConvolutionFwdAlgoGEMM;ConvHipImplicitGemm3DGroupFwdXdlops:20.497,41326080,miopenConvolutionFwdAlgoImplicitGEMM;GemmFwdRest_hipblaslt:30.4201,159252480,miopenConvolutionFwdAlgoGEMM
640-3-74-130-3x3x3-640-1-72-128-1-0x0x0-1x1x1-1x1x1-0-NCDHW-BF16-F=GemmFwdRest:39.697,318504960,miopenConvolutionFwdAlgoGEMM;ConvHipImplicitGemm3DGroupFwdXdlops:40.6326,70855680,miopenConvolutionFwdAlgoImplicitGEMM;GemmFwdRest_hipblaslt:67.8176,318504960,miopenConvolutionFwdAlgoGEMM
640-73-129-3x3-640-36-64-1-0x0-2x2-1x1-0-NCHW-BF16-F=GemmFwdRest:1.7786,26542080,miopenConvolutionFwdAlgoGEMM;GemmFwdRest_hipblaslt:2.1813,26542080,miopenConvolutionFwdAlgoGEMM;ConvHipImplicitGemmGroupFwdXdlops:2.99052,22375680,miopenConvolutionFwdAlgoImplicitGEMM
640-3-38-66-3x3x3-640-1-36-64-1-0x0x0-1x1x1-1x1x1-0-NCDHW-BF16-F=GemmFwdRest:7.43534,79626240,miopenConvolutionFwdAlgoGEMM;ConvHipImplicitGemm3DGroupFwdXdlops:10.3254,34698240,miopenConvolutionFwdAlgoImplicitGEMM;GemmFwdRest_hipblaslt:11.5753,79626240,miopenConvolutionFwdAlgoGEMM
640-36-64-1x1-1920-36-64-1-0x0-1x1-1x1-0-NCHW-BF16-F=GemmFwd1x1_0_1:0.228846,0,miopenConvolutionFwdAlgoGEMM;GemmFwd1x1_0_1_hipblaslt:0.355349,0,miopenConvolutionFwdAlgoGEMM;ConvHipImplicitGemmGroupFwdXdlops:1.27475,14254080,miopenConvolutionFwdAlgoImplicitGEMM
640-36-64-1x1-640-36-64-1-0x0-1x1-1x1-0-NCHW-BF16-F=GemmFwd1x1_0_1:0.0905217,0,miopenConvolutionFwdAlgoGEMM;GemmFwd1x1_0_1_hipblaslt:0.109553,0,miopenConvolutionFwdAlgoGEMM;ConvHipImplicitGemmGroupFwdXdlops:0.46711,6717440,miopenConvolutionFwdAlgoImplicitGEMM
640-3-38-66-3x3x3-96-1-36-64-1-0x0x0-1x1x1-1x1x1-0-NCDHW-BF16-F=GemmFwdRest:2.46945,79626240,miopenConvolutionFwdAlgoGEMM;ConvHipImplicitGemm3DGroupFwdXdlops:2.50362,13390848,miopenConvolutionFwdAlgoImplicitGEMM;GemmFwdRest_hipblaslt:2.55419,79626240,miopenConvolutionFwdAlgoGEMM
12-6-290-514-3x3x3-160-4-288-512-1-0x0x0-1x1x1-1x1x1-0-NCDHW-BF16-F=GemmFwdRest:17.4471,382205952,miopenConvolutionFwdAlgoGEMM;ConvHipImplicitGemm3DGroupFwdXdlops:21.2221,210312192,miopenConvolutionFwdAlgoImplicitGEMM;GemmFwdRest_hipblaslt:18.21,382205952,miopenConvolutionFwdAlgoGEMM
160-6-290-514-3x3x3-160-4-288-512-1-0x0x0-1x1x1-1x1x1-0-NCDHW-BF16-F=GemmFwdRest:371.74,5096079360,miopenConvolutionFwdAlgoGEMM;ConvHipImplicitGemm3DGroupFwdXdlops:192.722,476321280,miopenConvolutionFwdAlgoImplicitGEMM;GemmFwdRest_hipblaslt:423.252,5096079360,miopenConvolutionFwdAlgoGEMM
160-289-513-3x3-160-144-256-4-0x0-2x2-1x1-0-NCHW-BF16-F=GemmFwdRest:13.6518,106168320,miopenConvolutionFwdAlgoGEMM;GemmFwdRest_hipblaslt:10.9281,106168320,miopenConvolutionFwdAlgoGEMM;ConvHipImplicitGemmGroupFwdXdlops:17.8274,237415680,miopenConvolutionFwdAlgoImplicitGEMM
160-4-144-256-1x1x1-320-4-144-256-1-0x0x0-1x1x1-1x1x1-0-NCDHW-BF16-F=GemmFwd1x1_0_1:1.03194,0,miopenConvolutionFwdAlgoGEMM;GemmFwd1x1_0_1_hipblaslt:1.62349,0,miopenConvolutionFwdAlgoGEMM;ConvHipImplicitGemm3DGroupFwdXdlops:7.0619,141660160,miopenConvolutionFwdAlgoImplicitGEMM
160-6-146-258-3x3x3-320-4-144-256-1-0x0x0-1x1x1-1x1x1-0-NCDHW-BF16-F=GemmFwdRest:100.518,1274019840,miopenConvolutionFwdAlgoGEMM;ConvHipImplicitGemm3DGroupFwdXdlops:79.9559,169459200,miopenConvolutionFwdAlgoImplicitGEMM;GemmFwdRest_hipblaslt:129.165,1274019840,miopenConvolutionFwdAlgoGEMM
320-6-146-258-3x3x3-320-4-144-256-1-0x0x0-1x1x1-1x1x1-0-NCDHW-BF16-F=GemmFwdRest:206.656,2548039680,miopenConvolutionFwdAlgoGEMM;ConvHipImplicitGemm3DGroupFwdXdlops:161.328,244546560,miopenConvolutionFwdAlgoImplicitGEMM;GemmFwdRest_hipblaslt:319.013,2548039680,miopenConvolutionFwdAlgoGEMM
320-145-257-3x3-320-72-128-4-0x0-2x2-1x1-0-NCHW-BF16-F=GemmFwdRest:7.2141,53084160,miopenConvolutionFwdAlgoGEMM;GemmFwdRest_hipblaslt:8.73999,53084160,miopenConvolutionFwdAlgoGEMM;ConvHipImplicitGemmGroupFwdXdlops:13.8223,120834560,miopenConvolutionFwdAlgoImplicitGEMM
320-5-72-128-3x1x1-320-2-72-128-1-0x0x0-2x1x1-1x1x1-0-NCDHW-BF16-F=GemmFwdRest:1.22962,35389440,miopenConvolutionFwdAlgoGEMM;ConvHipImplicitGemm3DGroupFwdXdlops:3.23637,41902080,miopenConvolutionFwdAlgoImplicitGEMM;GemmFwdRest_hipblaslt:1.63994,35389440,miopenConvolutionFwdAlgoGEMM
320-2-72-128-1x1x1-640-2-72-128-1-0x0x0-1x1x1-1x1x1-0-NCDHW-BF16-F=GemmFwd1x1_0_1:0.366096,0,miopenConvolutionFwdAlgoGEMM;GemmFwd1x1_0_1_hipblaslt:0.514678,0,miopenConvolutionFwdAlgoGEMM;ConvHipImplicitGemm3DGroupFwdXdlops:2.46233,35799040,miopenConvolutionFwdAlgoImplicitGEMM
320-4-74-130-3x3x3-640-2-72-128-1-0x0x0-1x1x1-1x1x1-0-NCDHW-BF16-F=GemmFwdRest:40.4151,318504960,miopenConvolutionFwdAlgoGEMM;ConvHipImplicitGemm3DGroupFwdXdlops:41.8791,59279360,miopenConvolutionFwdAlgoImplicitGEMM;GemmFwdRest_hipblaslt:64.9887,318504960,miopenConvolutionFwdAlgoGEMM
640-4-74-130-3x3x3-640-2-72-128-1-0x0x0-1x1x1-1x1x1-0-NCDHW-BF16-F=GemmFwdRest:90.1187,637009920,miopenConvolutionFwdAlgoGEMM;ConvHipImplicitGemm3DGroupFwdXdlops:80.259,94965760,miopenConvolutionFwdAlgoImplicitGEMM;GemmFwdRest_hipblaslt:147.822,637009920,miopenConvolutionFwdAlgoGEMM
640-73-129-3x3-640-36-64-2-0x0-2x2-1x1-0-NCHW-BF16-F=GemmFwdRest:2.3715,26542080,miopenConvolutionFwdAlgoGEMM;GemmFwdRest_hipblaslt:3.0818,26542080,miopenConvolutionFwdAlgoGEMM;ConvHipImplicitGemmGroupFwdXdlops:5.49038,37378560,miopenConvolutionFwdAlgoImplicitGEMM
640-3-36-64-3x1x1-640-1-36-64-1-0x0x0-2x1x1-1x1x1-0-NCDHW-BF16-F=GemmFwdRest:0.420007,8847360,miopenConvolutionFwdAlgoGEMM;ConvHipImplicitGemm3DGroupFwdXdlops:1.18524,14254080,miopenConvolutionFwdAlgoImplicitGEMM;GemmFwdRest_hipblaslt:0.605093,8847360,miopenConvolutionFwdAlgoGEMM
96-21-36-64-1x1x1-96-21-36-64-1-0x0x0-1x1x1-1x1x1-0-NCDHW-BF16-F=GemmFwd1x1_0_1:0.137386,0,miopenConvolutionFwdAlgoGEMM;GemmFwd1x1_0_1_hipblaslt:0.132034,0,miopenConvolutionFwdAlgoGEMM;ConvHipImplicitGemm3DGroupFwdXdlops:0.681213,18597888,miopenConvolutionFwdAlgoImplicitGEMM
48-5-36-64-3x3x3-512-3-36-64-1-0x1x1-1x1x1-1x1x1-0-NCDHW-FP16-F=GemmFwdRest:0.778874,17915904,miopenConvolutionFwdAlgoGEMM;ConvHipImplicitGemm3DGroupFwdXdlops:1.93233,9510912,miopenConvolutionFwdAlgoImplicitGEMM;GemmFwdRest_hipblaslt:0.844995,17915904,miopenConvolutionFwdAlgoGEMM
512-7-36-64-5x5x5-512-3-36-64-1-0x2x2-1x1x1-1x1x1-0-NCDHW-FP16-F_g512=GemmFwdRest:28.3309,884736000,miopenConvolutionFwdAlgoGEMM;ConvHipImplicitGemm3DGroupFwdXdlops:101.322,23720960,miopenConvolutionFwdAlgoImplicitGEMM;GemmFwdRest_hipblaslt:24.6668,884736000,miopenConvolutionFwdAlgoGEMM
512-3-36-64-1x1x1-512-3-36-64-1-0x0x0-1x1x1-1x1x1-0-NCDHW-FP16-F=GemmFwd1x1_0_1:0.114446,0,miopenConvolutionFwdAlgoGEMM;GemmFwd1x1_0_1_hipblaslt:0.1548,0,miopenConvolutionFwdAlgoGEMM;ConvHipImplicitGemm3DGroupFwdXdlops:0.874892,14680064,miopenConvolutionFwdAlgoImplicitGEMM
512-5-36-64-3x3x3-256-3-36-64-1-0x1x1-1x1x1-1x1x1-0-NCDHW-FP16-F=GemmFwdRest:7.30281,191102976,miopenConvolutionFwdAlgoGEMM;ConvHipImplicitGemm3DGroupFwdXdlops:10.617,22413312,miopenConvolutionFwdAlgoImplicitGEMM;GemmFwdRest_hipblaslt:7.83514,191102976,miopenConvolutionFwdAlgoGEMM
256-5-36-64-3x3x3-256-3-36-64-1-0x1x1-1x1x1-1x1x1-0-NCDHW-FP16-F=GemmFwdRest:3.1333,95551488,miopenConvolutionFwdAlgoGEMM;ConvHipImplicitGemm3DGroupFwdXdlops:5.38705,12976128,miopenConvolutionFwdAlgoImplicitGEMM;GemmFwdRest_hipblaslt:4.00708,95551488,miopenConvolutionFwdAlgoGEMM
512-3-36-64-1x1x1-256-3-36-64-1-0x0x0-1x1x1-1x1x1-0-NCDHW-FP16-F=GemmFwd1x1_0_1:0.0716986,0,miopenConvolutionFwdAlgoGEMM;GemmFwd1x1_0_1_hipblaslt:0.0777771,0,miopenConvolutionFwdAlgoGEMM;ConvHipImplicitGemm3DGroupFwdXdlops:0.481732,10878976,miopenConvolutionFwdAlgoImplicitGEMM
256-5-36-64-3x3x3-2048-3-36-64-1-0x1x1-1x1x1-1x1x1-0-NCDHW-FP16-F=GemmFwdRest:14.3326,95551488,miopenConvolutionFwdAlgoGEMM;ConvHipImplicitGemm3DGroupFwdXdlops:43.6659,62521344,miopenConvolutionFwdAlgoImplicitGEMM;GemmFwdRest_hipblaslt:20.6333,95551488,miopenConvolutionFwdAlgoGEMM
256-7-72-128-3x3x3-256-5-72-128-1-0x1x1-1x1x1-1x1x1-0-NCDHW-FP16-F=GemmFwdRest:29.5183,637009920,miopenConvolutionFwdAlgoGEMM;ConvHipImplicitGemm3DGroupFwdXdlops:33.6347,60162048,miopenConvolutionFwdAlgoImplicitGEMM;GemmFwdRest_hipblaslt:34.4097,637009920,miopenConvolutionFwdAlgoGEMM
256-7-72-128-3x3x3-64-5-72-128-1-0x1x1-1x1x1-1x1x1-0-NCDHW-FP16-F=GemmFwdRest:20.9471,637009920,miopenConvolutionFwdAlgoGEMM;ConvHipImplicitGemm3DGroupFwdXdlops:8.71496,39813120,miopenConvolutionFwdAlgoImplicitGEMM;GemmFwdRest_hipblaslt:19.4097,637009920,miopenConvolutionFwdAlgoGEMM
64-7-72-128-3x3x3-64-5-72-128-1-0x1x1-1x1x1-1x1x1-0-NCDHW-FP16-F=GemmFwdRest:3.76023,159252480,miopenConvolutionFwdAlgoGEMM;ConvHipImplicitGemm3DGroupFwdXdlops:2.37929,14376960,miopenConvolutionFwdAlgoImplicitGEMM;GemmFwdRest_hipblaslt:4.69194,159252480,miopenConvolutionFwdAlgoGEMM
256-5-72-128-1x1x1-64-5-72-128-1-0x0x0-1x1x1-1x1x1-0-NCDHW-FP16-F=GemmFwd1x1_0_1:0.116058,0,miopenConvolutionFwdAlgoGEMM;GemmFwd1x1_0_1_hipblaslt:0.116778,0,miopenConvolutionFwdAlgoGEMM;ConvHipImplicitGemm3DGroupFwdXdlops:0.780386,29523968,miopenConvolutionFwdAlgoImplicitGEMM
64-7-72-128-3x3x3-512-5-72-128-1-0x1x1-1x1x1-1x1x1-0-NCDHW-FP16-F=GemmFwdRest:7.90791,159252480,miopenConvolutionFwdAlgoGEMM;ConvHipImplicitGemm3DGroupFwdXdlops:18.2933,57212928,miopenConvolutionFwdAlgoImplicitGEMM;GemmFwdRest_hipblaslt:11.2615,159252480,miopenConvolutionFwdAlgoGEMM
64-11-144-256-3x3x3-64-9-144-256-1-0x1x1-1x1x1-1x1x1-0-NCDHW-FP16-F=GemmFwdRest:37.5871,1146617856,miopenConvolutionFwdAlgoGEMM;ConvHipImplicitGemm3DGroupFwdXdlops:16.0601,94593024,miopenConvolutionFwdAlgoImplicitGEMM;GemmFwdRest_hipblaslt:37.5529,1146617856,miopenConvolutionFwdAlgoGEMM
64-11-144-256-3x3x3-32-9-144-256-1-0x1x1-1x1x1-1x1x1-0-NCDHW-FP16-F=GemmFwdRest:37.4166,1146617856,miopenConvolutionFwdAlgoGEMM;ConvHipImplicitGemm3DGroupFwdXdlops:15.2795,73248768,miopenConvolutionFwdAlgoImplicitGEMM;GemmFwdRest_hipblaslt:36.0393,1146617856,miopenConvolutionFwdAlgoGEMM
32-11-144-256-3x3x3-32-9-144-256-1-0x1x1-1x1x1-1x1x1-0-NCDHW-FP16-F=GemmFwdRest:17.6042,573308928,miopenConvolutionFwdAlgoGEMM;ConvHipImplicitGemm3DGroupFwdXdlops:8.09182,47241216,miopenConvolutionFwdAlgoImplicitGEMM;GemmFwdRest_hipblaslt:18.2303,573308928,miopenConvolutionFwdAlgoGEMM
64-9-144-256-1x1x1-32-9-144-256-1-0x0x0-1x1x1-1x1x1-0-NCDHW-FP16-F=GemmFwd1x1_0_1:0.418943,0,miopenConvolutionFwdAlgoGEMM;GemmFwd1x1_0_1_hipblaslt:0.397864,0,miopenConvolutionFwdAlgoGEMM;ConvHipImplicitGemm3DGroupFwdXdlops:1.75802,63705088,miopenConvolutionFwdAlgoImplicitGEMM
32-11-144-256-3x3x3-128-9-144-256-1-0x1x1-1x1x1-1x1x1-0-NCDHW-FP16-F=GemmFwdRest:19.0896,573308928,miopenConvolutionFwdAlgoGEMM;ConvHipImplicitGemm3DGroupFwdXdlops:16.0739,111108096,miopenConvolutionFwdAlgoImplicitGEMM;GemmFwdRest_hipblaslt:21.1907,573308928,miopenConvolutionFwdAlgoGEMM
32-11-288-512-3x3x3-32-9-288-512-1-0x1x1-1x1x1-1x1x1-0-NCDHW-FP16-F=GemmFwdRest:104.08,2293235712,miopenConvolutionFwdAlgoGEMM;ConvHipImplicitGemm3DGroupFwdXdlops:29.3521,188798976,miopenConvolutionFwdAlgoImplicitGEMM;GemmFwdRest_hipblaslt:99.1134,2293235712,miopenConvolutionFwdAlgoGEMM
8-11-576-1024-3x3x3-3-9-576-1024-1-0x1x1-1x1x1-1x1x1-0-NCDHW-FP16-F=GemmFwdRest:107.905,2293235712,miopenConvolutionFwdAlgoGEMM;ConvHipImplicitGemm3DGroupFwdXdlops:30.6393,135661056,miopenConvolutionFwdAlgoImplicitGEMM;GemmFwdRest_hipblaslt:100.778,2293235712,miopenConvolutionFwdAlgoGEMM
12-3-290-514-3x3x3-160-1-288-512-1-0x0x0-1x1x1-1x1x1-0-NCDHW-FP16-F=GemmFwdRest:3.28941,95551488,miopenConvolutionFwdAlgoGEMM;ConvHipImplicitGemm3DGroupFwdXdlops:4.61028,58022144,miopenConvolutionFwdAlgoImplicitGEMM;GemmFwdRest_hipblaslt:3.4317,95551488,miopenConvolutionFwdAlgoGEMM
160-3-290-514-3x3x3-160-1-288-512-1-0x0x0-1x1x1-1x1x1-0-NCDHW-FP16-F=GemmFwdRest:50.4767,1274019840,miopenConvolutionFwdAlgoGEMM;ConvHipImplicitGemm3DGroupFwdXdlops:48.4466,191665920,miopenConvolutionFwdAlgoImplicitGEMM;GemmFwdRest_hipblaslt:57.1604,1274019840,miopenConvolutionFwdAlgoGEMM
160-289-513-3x3-160-144-256-1-0x0-2x2-1x1-0-NCHW-FP16-F=GemmFwdRest:2.20276,106168320,miopenConvolutionFwdAlgoGEMM;GemmFwdRest_hipblaslt:2.16007,106168320,miopenConvolutionFwdAlgoGEMM;ConvHipImplicitGemmGroupFwdXdlops:3.32755,59699712,miopenConvolutionFwdAlgoImplicitGEMM;ConvBinWinogradRxSf3x2:1.2996,0,miopenConvolutionFwdAlgoWinograd;ConvBinWinogradRxSf2x3g1:3.61361,0,miopenConvolutionFwdAlgoWinograd
160-1-144-256-1x1x1-320-1-144-256-1-0x0x0-1x1x1-1x1x1-0-NCDHW-FP16-F=GemmFwd1x1_0_1:0.157703,0,miopenConvolutionFwdAlgoGEMM;GemmFwd1x1_0_1_hipblaslt:0.253829,0,miopenConvolutionFwdAlgoGEMM;ConvHipImplicitGemm3DGroupFwdXdlops:1.43828,35491840,miopenConvolutionFwdAlgoImplicitGEMM
160-3-146-258-3x3x3-320-1-144-256-1-0x0x0-1x1x1-1x1x1-0-NCDHW-FP16-F=GemmFwdRest:13.4025,318504960,miopenConvolutionFwdAlgoGEMM;ConvHipImplicitGemm3DGroupFwdXdlops:19.8853,62519040,miopenConvolutionFwdAlgoImplicitGEMM;GemmFwdRest_hipblaslt:17.43,318504960,miopenConvolutionFwdAlgoGEMM
320-3-146-258-3x3x3-320-1-144-256-1-0x0x0-1x1x1-1x1x1-0-NCDHW-FP16-F=GemmFwdRest:33.2335,637009920,miopenConvolutionFwdAlgoGEMM;ConvHipImplicitGemm3DGroupFwdXdlops:40.8248,101445120,miopenConvolutionFwdAlgoImplicitGEMM;GemmFwdRest_hipblaslt:41.1408,637009920,miopenConvolutionFwdAlgoGEMM
320-145-257-3x3-320-72-128-1-0x0-2x2-1x1-0-NCHW-FP16-F=GemmFwdRest:1.366,53084160,miopenConvolutionFwdAlgoGEMM;GemmFwdRest_hipblaslt:1.567,53084160,miopenConvolutionFwdAlgoGEMM;ConvHipImplicitGemmGroupFwdXdlops:2.94523,31591168,miopenConvolutionFwdAlgoImplicitGEMM;ConvBinWinogradRxSf3x2:1.3417,0,miopenConvolutionFwdAlgoWinograd;ConvBinWinogradRxSf2x3g1:3.57619,0,miopenConvolutionFwdAlgoWinograd
320-1-72-128-1x1x1-640-1-72-128-1-0x0x0-1x1x1-1x1x1-0-NCDHW-FP16-F=GemmFwd1x1_0_1:0.104593,0,miopenConvolutionFwdAlgoGEMM;GemmFwd1x1_0_1_hipblaslt:0.171691,0,miopenConvolutionFwdAlgoGEMM;ConvHipImplicitGemm3DGroupFwdXdlops:0.794676,18104320,miopenConvolutionFwdAlgoImplicitGEMM
320-3-74-130-3x3x3-640-1-72-128-1-0x0x0-1x1x1-1x1x1-0-NCDHW-FP16-F=GemmFwdRest:7.93175,159252480,miopenConvolutionFwdAlgoGEMM;ConvHipImplicitGemm3DGroupFwdXdlops:19.626,41326080,miopenConvolutionFwdAlgoImplicitGEMM;GemmFwdRest_hipblaslt:13.1327,159252480,miopenConvolutionFwdAlgoGEMM
640-3-74-130-3x3x3-640-1-72-128-1-0x0x0-1x1x1-1x1x1-0-NCDHW-FP16-F=GemmFwdRest:21.7659,318504960,miopenConvolutionFwdAlgoGEMM;ConvHipImplicitGemm3DGroupFwdXdlops:39.355,70855680,miopenConvolutionFwdAlgoImplicitGEMM;GemmFwdRest_hipblaslt:31.7311,318504960,miopenConvolutionFwdAlgoGEMM
640-73-129-3x3-640-36-64-1-0x0-2x2-1x1-0-NCHW-FP16-F=GemmFwdRest:0.846282,26542080,miopenConvolutionFwdAlgoGEMM;GemmFwdRest_hipblaslt:1.21616,26542080,miopenConvolutionFwdAlgoGEMM;ConvHipImplicitGemmGroupFwdXdlops:2.81484,22375680,miopenConvolutionFwdAlgoImplicitGEMM;ConvBinWinogradRxSf3x2:1.36494,0,miopenConvolutionFwdAlgoWinograd;ConvBinWinogradRxSf2x3g1:3.34537,0,miopenConvolutionFwdAlgoWinograd
640-3-38-66-3x3x3-640-1-36-64-1-0x0x0-1x1x1-1x1x1-0-NCDHW-FP16-F=GemmFwdRest:3.10863,79626240,miopenConvolutionFwdAlgoGEMM;ConvHipImplicitGemm3DGroupFwdXdlops:10.0013,34698240,miopenConvolutionFwdAlgoImplicitGEMM;GemmFwdRest_hipblaslt:5.06315,79626240,miopenConvolutionFwdAlgoGEMM
640-36-64-1x1-1920-36-64-1-0x0-1x1-1x1-0-NCHW-FP16-F=ConvBinWinogradRxSf2x3g1:1.3861,0,miopenConvolutionFwdAlgoWinograd;GemmFwd1x1_0_1:0.176937,0,miopenConvolutionFwdAlgoGEMM;ConvBinWinogradRxSf3x2:0.615629,0,miopenConvolutionFwdAlgoWinograd;GemmFwd1x1_0_1_hipblaslt:0.220249,0,miopenConvolutionFwdAlgoGEMM;ConvHipImplicitGemmGroupFwdXdlops:0.85242,14254080,miopenConvolutionFwdAlgoImplicitGEMM
640-36-64-1x1-640-36-64-1-0x0-1x1-1x1-0-NCHW-FP16-F=ConvBinWinogradRxSf2x3g1:0.6107,0,miopenConvolutionFwdAlgoWinograd;GemmFwd1x1_0_1:0.0676286,0,miopenConvolutionFwdAlgoGEMM;ConvBinWinogradRxSf3x2:0.315114,0,miopenConvolutionFwdAlgoWinograd;GemmFwd1x1_0_1_hipblaslt:0.124163,0,miopenConvolutionFwdAlgoGEMM;ConvHipImplicitGemmGroupFwdXdlops:0.453727,6717440,miopenConvolutionFwdAlgoImplicitGEMM
640-3-38-66-3x3x3-96-1-36-64-1-0x0x0-1x1x1-1x1x1-0-NCDHW-FP16-F=GemmFwdRest:2.27792,79626240,miopenConvolutionFwdAlgoGEMM;ConvHipImplicitGemm3DGroupFwdXdlops:1.73736,13390848,miopenConvolutionFwdAlgoImplicitGEMM;GemmFwdRest_hipblaslt:1.97815,79626240,miopenConvolutionFwdAlgoGEMM
12-6-290-514-3x3x3-160-4-288-512-1-0x0x0-1x1x1-1x1x1-0-NCDHW-FP16-F=GemmFwdRest:13.2555,382205952,miopenConvolutionFwdAlgoGEMM;ConvHipImplicitGemm3DGroupFwdXdlops:19.1468,210312192,miopenConvolutionFwdAlgoImplicitGEMM;GemmFwdRest_hipblaslt:15.3754,382205952,miopenConvolutionFwdAlgoGEMM
160-6-290-514-3x3x3-160-4-288-512-1-0x0x0-1x1x1-1x1x1-0-NCDHW-FP16-F=GemmFwdRest:232.842,5096079360,miopenConvolutionFwdAlgoGEMM;ConvHipImplicitGemm3DGroupFwdXdlops:181.929,476321280,miopenConvolutionFwdAlgoImplicitGEMM;GemmFwdRest_hipblaslt:262.886,5096079360,miopenConvolutionFwdAlgoGEMM
160-289-513-3x3-160-144-256-4-0x0-2x2-1x1-0-NCHW-FP16-F=GemmFwdRest:9.1494,106168320,miopenConvolutionFwdAlgoGEMM;GemmFwdRest_hipblaslt:8.73106,106168320,miopenConvolutionFwdAlgoGEMM;ConvHipImplicitGemmGroupFwdXdlops:15.3852,237415680,miopenConvolutionFwdAlgoImplicitGEMM;ConvBinWinogradRxSf3x2:6.0517,0,miopenConvolutionFwdAlgoWinograd;ConvBinWinogradRxSf2x3g1:15.9036,0,miopenConvolutionFwdAlgoWinograd
160-4-144-256-1x1x1-320-4-144-256-1-0x0x0-1x1x1-1x1x1-0-NCDHW-FP16-F=GemmFwd1x1_0_1:0.856065,0,miopenConvolutionFwdAlgoGEMM;GemmFwd1x1_0_1_hipblaslt:1.37163,0,miopenConvolutionFwdAlgoGEMM;ConvHipImplicitGemm3DGroupFwdXdlops:5.79582,141660160,miopenConvolutionFwdAlgoImplicitGEMM
160-6-146-258-3x3x3-320-4-144-256-1-0x0x0-1x1x1-1x1x1-0-NCDHW-FP16-F=GemmFwdRest:68.978,1274019840,miopenConvolutionFwdAlgoGEMM;ConvHipImplicitGemm3DGroupFwdXdlops:83.2934,169459200,miopenConvolutionFwdAlgoImplicitGEMM;GemmFwdRest_hipblaslt:81.0556,1274019840,miopenConvolutionFwdAlgoGEMM
320-6-146-258-3x3x3-320-4-144-256-1-0x0x0-1x1x1-1x1x1-0-NCDHW-FP16-F=GemmFwdRest:196.065,2548039680,miopenConvolutionFwdAlgoGEMM;ConvHipImplicitGemm3DGroupFwdXdlops:154.053,244546560,miopenConvolutionFwdAlgoImplicitGEMM;GemmFwdRest_hipblaslt:285.716,2548039680,miopenConvolutionFwdAlgoGEMM
320-145-257-3x3-320-72-128-4-0x0-2x2-1x1-0-NCHW-FP16-F=GemmFwdRest:5.59166,53084160,miopenConvolutionFwdAlgoGEMM;GemmFwdRest_hipblaslt:6.36713,53084160,miopenConvolutionFwdAlgoGEMM;ConvHipImplicitGemmGroupFwdXdlops:11.5707,120834560,miopenConvolutionFwdAlgoImplicitGEMM;ConvBinWinogradRxSf3x2:6.7247,0,miopenConvolutionFwdAlgoWinograd;ConvBinWinogradRxSf2x3g1:15.889,0,miopenConvolutionFwdAlgoWinograd
320-5-72-128-3x1x1-320-2-72-128-1-0x0x0-2x1x1-1x1x1-0-NCDHW-FP16-F=GemmFwdRest:0.947778,35389440,miopenConvolutionFwdAlgoGEMM;ConvHipImplicitGemm3DGroupFwdXdlops:2.73047,41902080,miopenConvolutionFwdAlgoImplicitGEMM;GemmFwdRest_hipblaslt:1.34271,35389440,miopenConvolutionFwdAlgoGEMM
320-2-72-128-1x1x1-640-2-72-128-1-0x0x0-1x1x1-1x1x1-0-NCDHW-FP16-F=GemmFwd1x1_0_1:0.21027,0,miopenConvolutionFwdAlgoGEMM;GemmFwd1x1_0_1_hipblaslt:0.356249,0,miopenConvolutionFwdAlgoGEMM;ConvHipImplicitGemm3DGroupFwdXdlops:2.00513,35799040,miopenConvolutionFwdAlgoImplicitGEMM
320-4-74-130-3x3x3-640-2-72-128-1-0x0x0-1x1x1-1x1x1-0-NCDHW-FP16-F=GemmFwdRest:23.7636,318504960,miopenConvolutionFwdAlgoGEMM;ConvHipImplicitGemm3DGroupFwdXdlops:40.5333,59279360,miopenConvolutionFwdAlgoImplicitGEMM;GemmFwdRest_hipblaslt:31.4022,318504960,miopenConvolutionFwdAlgoGEMM
640-4-74-130-3x3x3-640-2-72-128-1-0x0x0-1x1x1-1x1x1-0-NCDHW-FP16-F=GemmFwdRest:56.0999,637009920,miopenConvolutionFwdAlgoGEMM;ConvHipImplicitGemm3DGroupFwdXdlops:81.3242,94965760,miopenConvolutionFwdAlgoImplicitGEMM;GemmFwdRest_hipblaslt:70.5571,637009920,miopenConvolutionFwdAlgoGEMM
640-73-129-3x3-640-36-64-2-0x0-2x2-1x1-0-NCHW-FP16-F=GemmFwdRest:1.78141,26542080,miopenConvolutionFwdAlgoGEMM;GemmFwdRest_hipblaslt:2.70571,26542080,miopenConvolutionFwdAlgoGEMM;ConvHipImplicitGemmGroupFwdXdlops:5.82146,37378560,miopenConvolutionFwdAlgoImplicitGEMM;ConvBinWinogradRxSf3x2:3.31527,0,miopenConvolutionFwdAlgoWinograd;ConvBinWinogradRxSf2x3g1:9.07253,0,miopenConvolutionFwdAlgoWinograd
640-3-36-64-3x1x1-640-1-36-64-1-0x0x0-2x1x1-1x1x1-0-NCDHW-FP16-F=GemmFwdRest:0.301235,8847360,miopenConvolutionFwdAlgoGEMM;ConvHipImplicitGemm3DGroupFwdXdlops:1.12485,14254080,miopenConvolutionFwdAlgoImplicitGEMM;GemmFwdRest_hipblaslt:0.387266,8847360,miopenConvolutionFwdAlgoGEMM
96-21-36-64-1x1x1-96-21-36-64-1-0x0x0-1x1x1-1x1x1-0-NCDHW-FP16-F=GemmFwd1x1_0_1:0.11264,0,miopenConvolutionFwdAlgoGEMM;GemmFwd1x1_0_1_hipblaslt:0.120397,0,miopenConvolutionFwdAlgoGEMM;ConvHipImplicitGemm3DGroupFwdXdlops:0.62692,18597888,miopenConvolutionFwdAlgoImplicitGEMM
96-31-36-64-1x1x1-96-31-36-64-1-0x0x0-1x1x1-1x1x1-0-NCDHW-FP16-F=GemmFwd1x1_0_1_hipblaslt:0.111604,0,miopenConvolutionFwdAlgoGEMM;ConvHipImplicitGemm3DGroupFwdXdlops:0.773536,27445248,miopenConvolutionFwdAlgoImplicitGEMM
12-3-354-642-3x3x3-160-1-352-640-1-0x0x0-1x1x1-1x1x1-0-NCDHW-FP16-F=GemmFwdRest:4.77553,145981440,miopenConvolutionFwdAlgoGEMM;ConvHipImplicitGemm3DGroupFwdXdlops:6.65625,88556800,miopenConvolutionFwdAlgoImplicitGEMM;GemmFwdRest_hipblaslt:5.04789,145981440,miopenConvolutionFwdAlgoGEMM
160-3-354-642-3x3x3-160-1-352-640-1-0x0x0-1x1x1-1x1x1-0-NCDHW-FP16-F=GemmFwdRest:88.1293,1946419200,miopenConvolutionFwdAlgoGEMM;ConvHipImplicitGemm3DGroupFwdXdlops:69.2156,291649280,miopenConvolutionFwdAlgoImplicitGEMM;GemmFwdRest_hipblaslt:92.2636,1946419200,miopenConvolutionFwdAlgoGEMM
160-353-641-3x3-160-176-320-1-0x0-2x2-1x1-0-NCHW-FP16-F=GemmFwdRest:3.21722,162201600,miopenConvolutionFwdAlgoGEMM;GemmFwdRest_hipblaslt:3.22002,162201600,miopenConvolutionFwdAlgoGEMM;ConvHipImplicitGemmGroupFwdXdlops:5.44803,90890752,miopenConvolutionFwdAlgoImplicitGEMM;ConvBinWinogradRxSf3x2:1.9139,0,miopenConvolutionFwdAlgoWinograd;ConvBinWinogradRxSf2x3g1:5.77149,0,miopenConvolutionFwdAlgoWinograd
160-1-176-320-1x1x1-320-1-176-320-1-0x0x0-1x1x1-1x1x1-0-NCDHW-FP16-F=GemmFwd1x1_0_1:0.337611,0,miopenConvolutionFwdAlgoGEMM;GemmFwd1x1_0_1_hipblaslt:0.46281,0,miopenConvolutionFwdAlgoGEMM;ConvHipImplicitGemm3DGroupFwdXdlops:2.19232,54169600,miopenConvolutionFwdAlgoImplicitGEMM
160-3-178-322-3x3x3-320-1-176-320-1-0x0x0-1x1x1-1x1x1-0-NCDHW-FP16-F=GemmFwdRest:23.0494,486604800,miopenConvolutionFwdAlgoGEMM;ConvHipImplicitGemm3DGroupFwdXdlops:28.4029,93832960,miopenConvolutionFwdAlgoImplicitGEMM;GemmFwdRest_hipblaslt:28.4406,486604800,miopenConvolutionFwdAlgoGEMM
320-3-178-322-3x3x3-320-1-176-320-1-0x0x0-1x1x1-1x1x1-0-NCDHW-FP16-F=GemmFwdRest:54.9189,973209600,miopenConvolutionFwdAlgoGEMM;ConvHipImplicitGemm3DGroupFwdXdlops:55.7576,151621120,miopenConvolutionFwdAlgoImplicitGEMM;GemmFwdRest_hipblaslt:67.9566,973209600,miopenConvolutionFwdAlgoGEMM
320-177-321-3x3-320-88-160-1-0x0-2x2-1x1-0-NCHW-FP16-F=GemmFwdRest:2.56256,81100800,miopenConvolutionFwdAlgoGEMM;GemmFwdRest_hipblaslt:2.8963,81100800,miopenConvolutionFwdAlgoGEMM;ConvHipImplicitGemmGroupFwdXdlops:4.66633,47217408,miopenConvolutionFwdAlgoImplicitGEMM;ConvBinWinogradRxSf3x2:2.22637,0,miopenConvolutionFwdAlgoWinograd;ConvBinWinogradRxSf2x3g1:6.59763,0,miopenConvolutionFwdAlgoWinograd
320-1-88-160-1x1x1-640-1-88-160-1-0x0x0-1x1x1-1x1x1-0-NCDHW-FP16-F=GemmFwd1x1_0_1:0.154016,0,miopenConvolutionFwdAlgoGEMM;GemmFwd1x1_0_1_hipblaslt:0.268525,0,miopenConvolutionFwdAlgoGEMM;ConvHipImplicitGemm3DGroupFwdXdlops:1.39413,27443200,miopenConvolutionFwdAlgoImplicitGEMM
320-3-90-162-3x3x3-640-1-88-160-1-0x0x0-1x1x1-1x1x1-0-NCDHW-FP16-F=GemmFwdRest:17.6169,243302400,miopenConvolutionFwdAlgoGEMM;ConvHipImplicitGemm3DGroupFwdXdlops:30.4556,57075200,miopenConvolutionFwdAlgoImplicitGEMM;GemmFwdRest_hipblaslt:24.9021,243302400,miopenConvolutionFwdAlgoGEMM
640-3-90-162-3x3x3-640-1-88-160-1-0x0x0-1x1x1-1x1x1-0-NCDHW-FP16-F=GemmFwdRest:47.0668,486604800,miopenConvolutionFwdAlgoGEMM;ConvHipImplicitGemm3DGroupFwdXdlops:56.827,96128000,miopenConvolutionFwdAlgoImplicitGEMM;GemmFwdRest_hipblaslt:59.0808,486604800,miopenConvolutionFwdAlgoGEMM
640-89-161-3x3-640-44-80-1-0x0-2x2-1x1-0-NCHW-FP16-F=GemmFwdRest:1.54354,40550400,miopenConvolutionFwdAlgoGEMM;GemmFwdRest_hipblaslt:1.89545,40550400,miopenConvolutionFwdAlgoGEMM;ConvHipImplicitGemmGroupFwdXdlops:4.17964,30219520,miopenConvolutionFwdAlgoImplicitGEMM;ConvBinWinogradRxSf3x2:2.12076,0,miopenConvolutionFwdAlgoWinograd;ConvBinWinogradRxSf2x3g1:5.87909,0,miopenConvolutionFwdAlgoWinograd
640-3-46-82-3x3x3-640-1-44-80-1-0x0x0-1x1x1-1x1x1-0-NCDHW-FP16-F=GemmFwdRest:5.72247,121651200,miopenConvolutionFwdAlgoGEMM;ConvHipImplicitGemm3DGroupFwdXdlops:15.021,41108480,miopenConvolutionFwdAlgoImplicitGEMM;GemmFwdRest_hipblaslt:7.45103,121651200,miopenConvolutionFwdAlgoGEMM
640-44-80-1x1-1920-44-80-1-0x0-1x1-1x1-0-NCHW-FP16-F=ConvBinWinogradRxSf2x3g1:3.45549,0,miopenConvolutionFwdAlgoWinograd;GemmFwd1x1_0_1:0.44019,0,miopenConvolutionFwdAlgoGEMM;ConvBinWinogradRxSf3x2:1.1008,0,miopenConvolutionFwdAlgoWinograd;GemmFwd1x1_0_1_hipblaslt:0.344318,0,miopenConvolutionFwdAlgoGEMM;ConvHipImplicitGemmGroupFwdXdlops:1.26114,20480000,miopenConvolutionFwdAlgoImplicitGEMM
640-44-80-1x1-640-44-80-1-0x0-1x1-1x1-0-NCHW-FP16-F=ConvBinWinogradRxSf2x3g1:0.716314,0,miopenConvolutionFwdAlgoWinograd;GemmFwd1x1_0_1:0.111597,0,miopenConvolutionFwdAlgoGEMM;ConvBinWinogradRxSf3x2:0.324471,0,miopenConvolutionFwdAlgoWinograd;GemmFwd1x1_0_1_hipblaslt:0.13361,0,miopenConvolutionFwdAlgoGEMM;ConvHipImplicitGemmGroupFwdXdlops:0.455824,9830400,miopenConvolutionFwdAlgoImplicitGEMM
640-3-46-82-3x3x3-96-1-44-80-1-0x0x0-1x1x1-1x1x1-0-NCDHW-FP16-F=GemmFwdRest:3.6411,121651200,miopenConvolutionFwdAlgoGEMM;ConvHipImplicitGemm3DGroupFwdXdlops:3.17101,18478080,miopenConvolutionFwdAlgoImplicitGEMM;GemmFwdRest_hipblaslt:3.46582,121651200,miopenConvolutionFwdAlgoGEMM
12-6-354-642-3x3x3-160-4-352-640-1-0x0x0-1x1x1-1x1x1-0-NCDHW-FP16-F=GemmFwdRest:20.1065,583925760,miopenConvolutionFwdAlgoGEMM;ConvHipImplicitGemm3DGroupFwdXdlops:29.0684,321188864,miopenConvolutionFwdAlgoImplicitGEMM;GemmFwdRest_hipblaslt:23.093,583925760,miopenConvolutionFwdAlgoGEMM
160-6-354-642-3x3x3-160-4-352-640-1-0x0x0-1x1x1-1x1x1-0-NCDHW-FP16-F=ConvHipImplicitGemm3DGroupFwdXdlops:293.728,726095360,miopenConvolutionFwdAlgoImplicitGEMM
160-353-641-3x3-160-176-320-4-0x0-2x2-1x1-0-NCHW-FP16-F=GemmFwdRest:13.2538,162201600,miopenConvolutionFwdAlgoGEMM;GemmFwdRest_hipblaslt:13.0654,162201600,miopenConvolutionFwdAlgoGEMM;ConvHipImplicitGemmGroupFwdXdlops:22.9725,362179840,miopenConvolutionFwdAlgoImplicitGEMM;ConvBinWinogradRxSf3x2:10.3835,0,miopenConvolutionFwdAlgoWinograd;ConvBinWinogradRxSf2x3g1:23.7935,0,miopenConvolutionFwdAlgoWinograd
160-4-176-320-1x1x1-320-4-176-320-1-0x0x0-1x1x1-1x1x1-0-NCDHW-FP16-F=GemmFwd1x1_0_1:1.33216,0,miopenConvolutionFwdAlgoGEMM;GemmFwd1x1_0_1_hipblaslt:2.20459,0,miopenConvolutionFwdAlgoGEMM;ConvHipImplicitGemm3DGroupFwdXdlops:8.94309,216371200,miopenConvolutionFwdAlgoImplicitGEMM
160-6-178-322-3x3x3-320-4-176-320-1-0x0x0-1x1x1-1x1x1-0-NCDHW-FP16-F=GemmFwdRest:114.299,1946419200,miopenConvolutionFwdAlgoGEMM;ConvHipImplicitGemm3DGroupFwdXdlops:116.242,256990720,miopenConvolutionFwdAlgoImplicitGEMM;GemmFwdRest_hipblaslt:133.536,1946419200,miopenConvolutionFwdAlgoGEMM
320-6-178-322-3x3x3-320-4-176-320-1-0x0x0-1x1x1-1x1x1-0-NCDHW-FP16-F=GemmFwdRest:255.956,3892838400,miopenConvolutionFwdAlgoGEMM;ConvHipImplicitGemm3DGroupFwdXdlops:238.221,369802240,miopenConvolutionFwdAlgoImplicitGEMM;GemmFwdRest_hipblaslt:321.779,3892838400,miopenConvolutionFwdAlgoGEMM
320-177-321-3x3-320-88-160-4-0x0-2x2-1x1-0-NCHW-FP16-F=GemmFwdRest:10.2706,81100800,miopenConvolutionFwdAlgoGEMM;GemmFwdRest_hipblaslt:11.6605,81100800,miopenConvolutionFwdAlgoGEMM;ConvHipImplicitGemmGroupFwdXdlops:18.0886,183339520,miopenConvolutionFwdAlgoImplicitGEMM;ConvBinWinogradRxSf3x2:10.9651,0,miopenConvolutionFwdAlgoWinograd;ConvBinWinogradRxSf2x3g1:23.8999,0,miopenConvolutionFwdAlgoWinograd
320-5-88-160-3x1x1-320-2-88-160-1-0x0x0-2x1x1-1x1x1-0-NCDHW-FP16-F=GemmFwdRest:1.7742,54067200,miopenConvolutionFwdAlgoGEMM;ConvHipImplicitGemm3DGroupFwdXdlops:3.53194,63692800,miopenConvolutionFwdAlgoImplicitGEMM;GemmFwdRest_hipblaslt:2.043,54067200,miopenConvolutionFwdAlgoGEMM
320-2-88-160-1x1x1-640-2-88-160-1-0x0x0-1x1x1-1x1x1-0-NCDHW-FP16-F=GemmFwd1x1_0_1:0.422639,0,miopenConvolutionFwdAlgoGEMM;GemmFwd1x1_0_1_hipblaslt:0.658401,0,miopenConvolutionFwdAlgoGEMM;ConvHipImplicitGemm3DGroupFwdXdlops:3.30593,54476800,miopenConvolutionFwdAlgoImplicitGEMM
320-4-90-162-3x3x3-640-2-88-160-1-0x0x0-1x1x1-1x1x1-0-NCDHW-FP16-F=GemmFwdRest:43.6494,486604800,miopenConvolutionFwdAlgoGEMM;ConvHipImplicitGemm3DGroupFwdXdlops:59.8505,84428800,miopenConvolutionFwdAlgoImplicitGEMM;GemmFwdRest_hipblaslt:54.27,486604800,miopenConvolutionFwdAlgoGEMM
640-4-90-162-3x3x3-640-2-88-160-1-0x0x0-1x1x1-1x1x1-0-NCDHW-FP16-F=GemmFwdRest:106.917,973209600,miopenConvolutionFwdAlgoGEMM;ConvHipImplicitGemm3DGroupFwdXdlops:122.018,132812800,miopenConvolutionFwdAlgoImplicitGEMM;GemmFwdRest_hipblaslt:131.412,973209600,miopenConvolutionFwdAlgoGEMM
640-89-161-3x3-640-44-80-2-0x0-2x2-1x1-0-NCHW-FP16-F=GemmFwdRest:3.17506,40550400,miopenConvolutionFwdAlgoGEMM;GemmFwdRest_hipblaslt:4.04607,40550400,miopenConvolutionFwdAlgoGEMM;ConvHipImplicitGemmGroupFwdXdlops:8.41482,53066240,miopenConvolutionFwdAlgoImplicitGEMM;ConvBinWinogradRxSf3x2:5.64374,0,miopenConvolutionFwdAlgoWinograd;ConvBinWinogradRxSf2x3g1:12.3733,0,miopenConvolutionFwdAlgoWinograd
640-3-44-80-3x1x1-640-1-44-80-1-0x0x0-2x1x1-1x1x1-0-NCDHW-FP16-F=GemmFwdRest:0.493332,13516800,miopenConvolutionFwdAlgoGEMM;ConvHipImplicitGemm3DGroupFwdXdlops:1.73846,20480000,miopenConvolutionFwdAlgoImplicitGEMM;GemmFwdRest_hipblaslt:0.761837,13516800,miopenConvolutionFwdAlgoGEMM
96-21-44-80-1x1x1-96-21-44-80-1-0x0x0-1x1x1-1x1x1-0-NCDHW-FP16-F=GemmFwd1x1_0_1:0.135638,0,miopenConvolutionFwdAlgoGEMM;GemmFwd1x1_0_1_hipblaslt:0.175125,0,miopenConvolutionFwdAlgoGEMM;ConvHipImplicitGemm3DGroupFwdXdlops:1.01233,28403712,miopenConvolutionFwdAlgoImplicitGEMM
48-23-36-64-3x3x3-512-21-36-64-1-0x1x1-1x1x1-1x1x1-0-NCDHW-FP16-F=GemmFwdRest:4.87748,125411328,miopenConvolutionFwdAlgoGEMM;ConvHipImplicitGemm3DGroupFwdXdlops:11.7608,55959552,miopenConvolutionFwdAlgoImplicitGEMM;GemmFwdRest_hipblaslt:5.69378,125411328,miopenConvolutionFwdAlgoGEMM
512-25-36-64-5x5x5-512-21-36-64-1-0x2x2-1x1x1-1x1x1-0-NCDHW-FP16-F_g512=GemmFwdRest:185.26,6193152000,miopenConvolutionFwdAlgoGEMM;ConvHipImplicitGemm3DGroupFwdXdlops:518.061,108655616,miopenConvolutionFwdAlgoImplicitGEMM;GemmFwdRest_hipblaslt:153.869,6193152000,miopenConvolutionFwdAlgoGEMM
512-21-36-64-1x1x1-512-21-36-64-1-0x0x0-1x1x1-1x1x1-0-NCDHW-FP16-F=GemmFwd1x1_0_1:0.920543,0,miopenConvolutionFwdAlgoGEMM;GemmFwd1x1_0_1_hipblaslt:1.45007,0,miopenConvolutionFwdAlgoGEMM;ConvHipImplicitGemm3DGroupFwdXdlops:7.13346,99614720,miopenConvolutionFwdAlgoImplicitGEMM
512-23-36-64-3x3x3-256-21-36-64-1-0x1x1-1x1x1-1x1x1-0-NCDHW-FP16-F=GemmFwdRest:44.266,1337720832,miopenConvolutionFwdAlgoGEMM;ConvHipImplicitGemm3DGroupFwdXdlops:63.4214,86114304,miopenConvolutionFwdAlgoImplicitGEMM;GemmFwdRest_hipblaslt:46.9399,1337720832,miopenConvolutionFwdAlgoGEMM
256-23-36-64-3x3x3-256-21-36-64-1-0x1x1-1x1x1-1x1x1-0-NCDHW-FP16-F=GemmFwdRest:33.4668,668860416,miopenConvolutionFwdAlgoGEMM;ConvHipImplicitGemm3DGroupFwdXdlops:32.9954,55443456,miopenConvolutionFwdAlgoImplicitGEMM;GemmFwdRest_hipblaslt:46.5582,668860416,miopenConvolutionFwdAlgoGEMM
512-21-36-64-1x1x1-256-21-36-64-1-0x0x0-1x1x1-1x1x1-0-NCDHW-FP16-F=GemmFwd1x1_0_1:0.389457,0,miopenConvolutionFwdAlgoGEMM;GemmFwd1x1_0_1_hipblaslt:0.601056,0,miopenConvolutionFwdAlgoGEMM;ConvHipImplicitGemm3DGroupFwdXdlops:3.82909,74579968,miopenConvolutionFwdAlgoImplicitGEMM
256-23-36-64-3x3x3-2048-21-36-64-1-0x1x1-1x1x1-1x1x1-0-NCDHW-FP16-F=GemmFwdRest:171.528,668860416,miopenConvolutionFwdAlgoGEMM;ConvHipImplicitGemm3DGroupFwdXdlops:269.995,253624320,miopenConvolutionFwdAlgoImplicitGEMM;GemmFwdRest_hipblaslt:262.939,668860416,miopenConvolutionFwdAlgoGEMM
256-43-72-128-3x3x3-256-41-72-128-1-0x1x1-1x1x1-1x1x1-0-NCDHW-FP16-F=GemmFwdRest:242.629,5223481344,miopenConvolutionFwdAlgoGEMM;ConvHipImplicitGemm3DGroupFwdXdlops:244.449,399900672,miopenConvolutionFwdAlgoImplicitGEMM;GemmFwdRest_hipblaslt:290.676,5223481344,miopenConvolutionFwdAlgoGEMM
256-43-72-128-3x3x3-64-41-72-128-1-0x1x1-1x1x1-1x1x1-0-NCDHW-FP16-F=GemmFwdRest:190.923,5223481344,miopenConvolutionFwdAlgoGEMM;ConvHipImplicitGemm3DGroupFwdXdlops:65.3651,252149760,miopenConvolutionFwdAlgoImplicitGEMM;GemmFwdRest_hipblaslt:186.95,5223481344,miopenConvolutionFwdAlgoGEMM
64-43-72-128-3x3x3-64-41-72-128-1-0x1x1-1x1x1-1x1x1-0-NCDHW-FP16-F=GemmFwdRest:55.3556,1305870336,miopenConvolutionFwdAlgoGEMM;ConvHipImplicitGemm3DGroupFwdXdlops:16.4642,99311616,miopenConvolutionFwdAlgoImplicitGEMM;GemmFwdRest_hipblaslt:57.5132,1305870336,miopenConvolutionFwdAlgoGEMM
256-41-72-128-1x1x1-64-41-72-128-1-0x0x0-1x1x1-1x1x1-0-NCDHW-FP16-F=GemmFwd1x1_0_1:1.3168,0,miopenConvolutionFwdAlgoGEMM;GemmFwd1x1_0_1_hipblaslt:1.65993,0,miopenConvolutionFwdAlgoGEMM;ConvHipImplicitGemm3DGroupFwdXdlops:7.19423,241860608,miopenConvolutionFwdAlgoImplicitGEMM
64-43-72-128-3x3x3-512-41-72-128-1-0x1x1-1x1x1-1x1x1-0-NCDHW-FP16-F=GemmFwdRest:94.9662,1305870336,miopenConvolutionFwdAlgoGEMM;ConvHipImplicitGemm3DGroupFwdXdlops:134.367,439418880,miopenConvolutionFwdAlgoImplicitGEMM;GemmFwdRest_hipblaslt:131.948,1305870336,miopenConvolutionFwdAlgoGEMM
64-83-144-256-3x3x3-64-81-144-256-1-0x1x1-1x1x1-1x1x1-0-NCDHW-FP16-F=ConvHipImplicitGemm3DGroupFwdXdlops:138.052,774070272,miopenConvolutionFwdAlgoImplicitGEMM
64-83-144-256-3x3x3-32-81-144-256-1-0x1x1-1x1x1-1x1x1-0-NCDHW-FP16-F=ConvHipImplicitGemm3DGroupFwdXdlops:123.348,582856704,miopenConvolutionFwdAlgoImplicitGEMM
32-83-144-256-3x3x3-32-81-144-256-1-0x1x1-1x1x1-1x1x1-0-NCDHW-FP16-F=GemmFwdRest:180.227,5159780352,miopenConvolutionFwdAlgoGEMM;ConvHipImplicitGemm3DGroupFwdXdlops:66.8097,386979840,miopenConvolutionFwdAlgoImplicitGEMM;GemmFwdRest_hipblaslt:180.619,5159780352,miopenConvolutionFwdAlgoGEMM
64-81-144-256-1x1x1-32-81-144-256-1-0x0x0-1x1x1-1x1x1-0-NCDHW-FP16-F=GemmFwd1x1_0_1:4.56042,0,miopenConvolutionFwdAlgoGEMM;GemmFwd1x1_0_1_hipblaslt:3.73702,0,miopenConvolutionFwdAlgoGEMM;ConvHipImplicitGemm3DGroupFwdXdlops:16.5624,573313024,miopenConvolutionFwdAlgoImplicitGEMM
32-83-144-256-3x3x3-128-81-144-256-1-0x1x1-1x1x1-1x1x1-0-NCDHW-FP16-F=GemmFwdRest:199.469,5159780352,miopenConvolutionFwdAlgoGEMM;ConvHipImplicitGemm3DGroupFwdXdlops:133.866,960454656,miopenConvolutionFwdAlgoImplicitGEMM;GemmFwdRest_hipblaslt:205.188,5159780352,miopenConvolutionFwdAlgoGEMM
32-83-288-512-3x3x3-32-81-288-512-1-0x1x1-1x1x1-1x1x1-0-NCDHW-FP16-F=ConvHipImplicitGemm3DGroupFwdXdlops:260.962,1547753472,miopenConvolutionFwdAlgoImplicitGEMM
8-83-576-1024-3x3x3-3-81-576-1024-1-0x1x1-1x1x1-1x1x1-0-NCDHW-FP16-F=ConvHipImplicitGemm3DGroupFwdXdlops:271.298,1069942272,miopenConvolutionFwdAlgoImplicitGEMM
512-23-36-64-3x3x3-4096-21-36-64-1-0x1x1-1x1x1-1x1x1-0-NCDHW-FP16-F=GemmFwdRest:320.416,1337720832,miopenConvolutionFwdAlgoGEMM;ConvHipImplicitGemm3DGroupFwdXdlops:1048.83,563871744,miopenConvolutionFwdAlgoImplicitGEMM;GemmFwdRest_hipblaslt:386.267,1337720832,miopenConvolutionFwdAlgoGEMM
512-45-72-128-5x5x5-512-41-72-128-1-0x2x2-1x1x1-1x1x1-0-NCDHW-FP16-F_g512=ConvHipImplicitGemm3DGroupFwdXdlops:4760.87,811725824,miopenConvolutionFwdAlgoImplicitGEMM
512-41-72-128-1x1x1-512-41-72-128-1-0x0x0-1x1x1-1x1x1-0-NCDHW-FP16-F=GemmFwd1x1_0_1:9.25011,0,miopenConvolutionFwdAlgoGEMM;GemmFwd1x1_0_1_hipblaslt:14.2155,0,miopenConvolutionFwdAlgoGEMM;ConvHipImplicitGemm3DGroupFwdXdlops:56.79,774373376,miopenConvolutionFwdAlgoImplicitGEMM
512-43-72-128-3x3x3-256-41-72-128-1-0x1x1-1x1x1-1x1x1-0-NCDHW-FP16-F=ConvHipImplicitGemm3DGroupFwdXdlops:511.767,606339072,miopenConvolutionFwdAlgoImplicitGEMM
512-41-72-128-1x1x1-256-41-72-128-1-0x0x0-1x1x1-1x1x1-0-NCDHW-FP16-F=GemmFwd1x1_0_1:3.31415,0,miopenConvolutionFwdAlgoGEMM;GemmFwd1x1_0_1_hipblaslt:7.8406,0,miopenConvolutionFwdAlgoGEMM;ConvHipImplicitGemm3DGroupFwdXdlops:31.5939,580648960,miopenConvolutionFwdAlgoImplicitGEMM
256-43-72-128-3x3x3-1024-41-72-128-1-0x1x1-1x1x1-1x1x1-0-NCDHW-FP16-F=GemmFwdRest:988.419,5223481344,miopenConvolutionFwdAlgoGEMM;ConvHipImplicitGemm3DGroupFwdXdlops:1060.66,990904320,miopenConvolutionFwdAlgoImplicitGEMM;GemmFwdRest_hipblaslt:1469.79,5223481344,miopenConvolutionFwdAlgoGEMM
256-43-144-256-3x3x3-256-41-144-256-1-0x1x1-1x1x1-1x1x1-0-NCDHW-FP16-F=ConvHipImplicitGemm3DGroupFwdXdlops:997.56,1588985856,miopenConvolutionFwdAlgoImplicitGEMM
256-43-144-256-3x3x3-64-41-144-256-1-0x1x1-1x1x1-1x1x1-0-NCDHW-FP16-F=ConvHipImplicitGemm3DGroupFwdXdlops:268.221,1005944832,miopenConvolutionFwdAlgoImplicitGEMM
64-43-144-256-3x3x3-64-41-144-256-1-0x1x1-1x1x1-1x1x1-0-NCDHW-FP16-F=GemmFwdRest:257.085,5223481344,miopenConvolutionFwdAlgoGEMM;ConvHipImplicitGemm3DGroupFwdXdlops:68.4699,396582912,miopenConvolutionFwdAlgoImplicitGEMM;GemmFwdRest_hipblaslt:272.482,5223481344,miopenConvolutionFwdAlgoGEMM
256-41-144-256-1x1x1-64-41-144-256-1-0x0x0-1x1x1-1x1x1-0-NCDHW-FP16-F=GemmFwd1x1_0_1:4.93939,0,miopenConvolutionFwdAlgoGEMM;GemmFwd1x1_0_1_hipblaslt:6.27001,0,miopenConvolutionFwdAlgoGEMM;ConvHipImplicitGemm3DGroupFwdXdlops:26.6149,967344128,miopenConvolutionFwdAlgoImplicitGEMM
64-43-144-256-3x3x3-512-41-144-256-1-0x1x1-1x1x1-1x1x1-0-NCDHW-FP16-F=GemmFwdRest:387.988,5223481344,miopenConvolutionFwdAlgoGEMM;ConvHipImplicitGemm3DGroupFwdXdlops:552.651,1752367104,miopenConvolutionFwdAlgoImplicitGEMM;GemmFwdRest_hipblaslt:476.632,5223481344,miopenConvolutionFwdAlgoGEMM
64-83-288-512-3x3x3-64-81-288-512-1-0x1x1-1x1x1-1x1x1-0-NCDHW-FP16-F=ConvHipImplicitGemm3DGroupFwdXdlops:529.102,3095617536,miopenConvolutionFwdAlgoImplicitGEMM
64-83-288-512-3x3x3-32-81-288-512-1-0x1x1-1x1x1-1x1x1-0-NCDHW-FP16-F=ConvHipImplicitGemm3DGroupFwdXdlops:502.557,2331095040,miopenConvolutionFwdAlgoImplicitGEMM
64-81-288-512-1x1x1-32-81-288-512-1-0x0x0-1x1x1-1x1x1-0-NCDHW-FP16-F=GemmFwd1x1_0_1:17.785,0,miopenConvolutionFwdAlgoGEMM;GemmFwd1x1_0_1_hipblaslt:14.1927,0,miopenConvolutionFwdAlgoGEMM;ConvHipImplicitGemm3DGroupFwdXdlops:65.1448,2293239808,miopenConvolutionFwdAlgoImplicitGEMM
48-33-36-64-3x3x3-512-31-36-64-1-0x1x1-1x1x1-1x1x1-0-NCDHW-FP16-F=GemmFwdRest:9.21839,185131008,miopenConvolutionFwdAlgoGEMM;ConvHipImplicitGemm3DGroupFwdXdlops:22.532,81764352,miopenConvolutionFwdAlgoImplicitGEMM;GemmFwdRest_hipblaslt:8.79803,185131008,miopenConvolutionFwdAlgoGEMM
512-35-36-64-5x5x5-512-31-36-64-1-0x2x2-1x1x1-1x1x1-0-NCDHW-FP16-F_g512=ConvHipImplicitGemm3DGroupFwdXdlops:764.354,155841536,miopenConvolutionFwdAlgoImplicitGEMM
512-31-36-64-1x1x1-512-31-36-64-1-0x0x0-1x1x1-1x1x1-0-NCDHW-FP16-F=GemmFwd1x1_0_1:1.11783,0,miopenConvolutionFwdAlgoGEMM;GemmFwd1x1_0_1_hipblaslt:1.97931,0,miopenConvolutionFwdAlgoGEMM;ConvHipImplicitGemm3DGroupFwdXdlops:10.3755,146800640,miopenConvolutionFwdAlgoImplicitGEMM
512-33-36-64-3x3x3-4096-31-36-64-1-0x1x1-1x1x1-1x1x1-0-NCDHW-FP16-F=GemmFwdRest:970.663,1974730752,miopenConvolutionFwdAlgoGEMM;ConvHipImplicitGemm3DGroupFwdXdlops:1739.77,776208384,miopenConvolutionFwdAlgoImplicitGEMM;GemmFwdRest_hipblaslt:1732.41,1974730752,miopenConvolutionFwdAlgoGEMM
512-65-72-128-5x5x5-512-61-72-128-1-0x2x2-1x1x1-1x1x1-0-NCDHW-FP16-F_g512=ConvHipImplicitGemm3DGroupFwdXdlops:17575.4,1189213184,miopenConvolutionFwdAlgoImplicitGEMM
512-61-72-128-1x1x1-512-61-72-128-1-0x0x0-1x1x1-1x1x1-0-NCDHW-FP16-F=GemmFwd1x1_0_1:16.5639,0,miopenConvolutionFwdAlgoGEMM;GemmFwd1x1_0_1_hipblaslt:21.9851,0,miopenConvolutionFwdAlgoGEMM;ConvHipImplicitGemm3DGroupFwdXdlops:90.2984,1151860736,miopenConvolutionFwdAlgoImplicitGEMM
512-63-72-128-3x3x3-256-61-72-128-1-0x1x1-1x1x1-1x1x1-0-NCDHW-FP16-F=ConvHipImplicitGemm3DGroupFwdXdlops:791.881,889454592,miopenConvolutionFwdAlgoImplicitGEMM
256-63-72-128-3x3x3-256-61-72-128-1-0x1x1-1x1x1-1x1x1-0-NCDHW-FP16-F=ConvHipImplicitGemm3DGroupFwdXdlops:384.157,588644352,miopenConvolutionFwdAlgoImplicitGEMM
512-61-72-128-1x1x1-256-61-72-128-1-0x0x0-1x1x1-1x1x1-0-NCDHW-FP16-F=GemmFwd1x1_0_1:6.86888,0,miopenConvolutionFwdAlgoGEMM;GemmFwd1x1_0_1_hipblaslt:12.0679,0,miopenConvolutionFwdAlgoGEMM;ConvHipImplicitGemm3DGroupFwdXdlops:48.3049,863764480,miopenConvolutionFwdAlgoImplicitGEMM
256-63-72-128-3x3x3-1024-61-72-128-1-0x1x1-1x1x1-1x1x1-0-NCDHW-FP16-F=ConvHipImplicitGemm3DGroupFwdXdlops:1572.08,1462763520,miopenConvolutionFwdAlgoImplicitGEMM
256-63-144-256-3x3x3-256-61-144-256-1-0x1x1-1x1x1-1x1x1-0-NCDHW-FP16-F=ConvHipImplicitGemm3DGroupFwdXdlops:1511.17,2343960576,miopenConvolutionFwdAlgoImplicitGEMM
256-63-144-256-3x3x3-64-61-144-256-1-0x1x1-1x1x1-1x1x1-0-NCDHW-FP16-F=ConvHipImplicitGemm3DGroupFwdXdlops:405.231,1477804032,miopenConvolutionFwdAlgoImplicitGEMM
64-63-144-256-3x3x3-64-61-144-256-1-0x1x1-1x1x1-1x1x1-0-NCDHW-FP16-F=ConvHipImplicitGemm3DGroupFwdXdlops:105.025,585326592,miopenConvolutionFwdAlgoImplicitGEMM
256-61-144-256-1x1x1-64-61-144-256-1-0x0x0-1x1x1-1x1x1-0-NCDHW-FP16-F=GemmFwd1x1_0_1:8.86279,0,miopenConvolutionFwdAlgoGEMM;GemmFwd1x1_0_1_hipblaslt:12.6127,0,miopenConvolutionFwdAlgoGEMM;ConvHipImplicitGemm3DGroupFwdXdlops:41.6202,1439203328,miopenConvolutionFwdAlgoImplicitGEMM
256-63-60-104-3x3x3-1024-61-60-104-1-0x1x1-1x1x1-1x1x1-0-NCDHW-FP16-F=GemmFwdRest:1118.61,5261967360,miopenConvolutionFwdAlgoGEMM;ConvHipImplicitGemm3DGroupFwdXdlops:1161,994983936,miopenConvolutionFwdAlgoImplicitGEMM;GemmFwdRest_hipblaslt:1276.98,5261967360,miopenConvolutionFwdAlgoGEMM
256-63-120-208-3x3x3-256-61-120-208-1-0x1x1-1x1x1-1x1x1-0-NCDHW-FP16-F=ConvHipImplicitGemm3DGroupFwdXdlops:1051.7,1588199424,miopenConvolutionFwdAlgoImplicitGEMM
256-63-120-208-3x3x3-64-61-120-208-1-0x1x1-1x1x1-1x1x1-0-NCDHW-FP16-F=ConvHipImplicitGemm3DGroupFwdXdlops:278.825,1000882176,miopenConvolutionFwdAlgoImplicitGEMM
64-63-120-208-3x3x3-64-61-120-208-1-0x1x1-1x1x1-1x1x1-0-NCDHW-FP16-F=GemmFwdRest:268.444,5261967360,miopenConvolutionFwdAlgoGEMM;ConvHipImplicitGemm3DGroupFwdXdlops:71.2741,396386304,miopenConvolutionFwdAlgoImplicitGEMM;GemmFwdRest_hipblaslt:276.541,5261967360,miopenConvolutionFwdAlgoGEMM
256-61-120-208-1x1x1-64-61-120-208-1-0x0x0-1x1x1-1x1x1-0-NCDHW-FP16-F=GemmFwd1x1_0_1:5.37411,0,miopenConvolutionFwdAlgoGEMM;GemmFwd1x1_0_1_hipblaslt:6.98569,0,miopenConvolutionFwdAlgoGEMM;ConvHipImplicitGemm3DGroupFwdXdlops:26.9749,974471168,miopenConvolutionFwdAlgoImplicitGEMM
64-63-120-208-3x3x3-512-61-120-208-1-0x1x1-1x1x1-1x1x1-0-NCDHW-FP16-F=GemmFwdRest:404.867,5261967360,miopenConvolutionFwdAlgoGEMM;ConvHipImplicitGemm3DGroupFwdXdlops:578.698,1762148352,miopenConvolutionFwdAlgoImplicitGEMM;GemmFwdRest_hipblaslt:504.014,5261967360,miopenConvolutionFwdAlgoGEMM
64-123-240-416-3x3x3-64-121-240-416-1-0x1x1-1x1x1-1x1x1-0-NCDHW-FP16-F=ConvHipImplicitGemm3DGroupFwdXdlops:550.617,3118424064,miopenConvolutionFwdAlgoImplicitGEMM
64-123-240-416-3x3x3-32-121-240-416-1-0x1x1-1x1x1-1x1x1-0-NCDHW-FP16-F=ConvHipImplicitGemm3DGroupFwdXdlops:525.925,2345152512,miopenConvolutionFwdAlgoImplicitGEMM
64-121-240-416-1x1x1-32-121-240-416-1-0x0x0-1x1x1-1x1x1-0-NCDHW-FP16-F=GemmFwd1x1_0_1:20.7317,0,miopenConvolutionFwdAlgoGEMM;GemmFwd1x1_0_1_hipblaslt:16.3299,0,miopenConvolutionFwdAlgoGEMM;ConvHipImplicitGemm3DGroupFwdXdlops:65.7471,2319486976,miopenConvolutionFwdAlgoImplicitGEMM
48-6-36-64-3x3x3-512-4-36-64-1-0x1x1-1x1x1-1x1x1-0-NCDHW-FP32-F=GemmFwdRest:6.61614,47775744,miopenConvolutionFwdAlgoGEMM;GemmFwdRest_hipblaslt:11.7006,47775744,miopenConvolutionFwdAlgoGEMM
512-8-36-64-5x5x5-512-4-36-64-1-0x2x2-1x1x1-1x1x1-0-NCDHW-FP32-F_g512=GemmFwdRest:50.7483,2359296000,miopenConvolutionFwdAlgoGEMM;GemmFwdRest_hipblaslt:48.4838,2359296000,miopenConvolutionFwdAlgoGEMM
512-4-36-64-1x1x1-512-4-36-64-1-0x0x0-1x1x1-1x1x1-0-NCDHW-FP32-F=GemmFwd1x1_0_1:1.91609,0,miopenConvolutionFwdAlgoGEMM;GemmFwd1x1_0_1_hipblaslt:1.89631,0,miopenConvolutionFwdAlgoGEMM
512-6-36-64-3x3x3-256-4-36-64-1-0x1x1-1x1x1-1x1x1-0-NCDHW-FP32-F=GemmFwdRest:78.057,509607936,miopenConvolutionFwdAlgoGEMM;GemmFwdRest_hipblaslt:228.605,509607936,miopenConvolutionFwdAlgoGEMM
256-6-36-64-3x3x3-256-4-36-64-1-0x1x1-1x1x1-1x1x1-0-NCDHW-FP32-F=GemmFwdRest:26.9494,254803968,miopenConvolutionFwdAlgoGEMM;GemmFwdRest_hipblaslt:80.7801,254803968,miopenConvolutionFwdAlgoGEMM
512-4-36-64-1x1x1-256-4-36-64-1-0x0x0-1x1x1-1x1x1-0-NCDHW-FP32-F=GemmFwd1x1_0_1:0.852993,0,miopenConvolutionFwdAlgoGEMM;GemmFwd1x1_0_1_hipblaslt:1.11034,0,miopenConvolutionFwdAlgoGEMM
256-6-36-64-3x3x3-2048-4-36-64-1-0x1x1-1x1x1-1x1x1-0-NCDHW-FP32-F=GemmFwdRest:230.799,254803968,miopenConvolutionFwdAlgoGEMM;GemmFwdRest_hipblaslt:699.73,254803968,miopenConvolutionFwdAlgoGEMM
256-9-72-128-3x3x3-256-7-72-128-1-0x1x1-1x1x1-1x1x1-0-NCDHW-FP32-F=GemmFwdRest:265.057,1783627776,miopenConvolutionFwdAlgoGEMM;GemmFwdRest_hipblaslt:692.418,1783627776,miopenConvolutionFwdAlgoGEMM
256-9-72-128-3x3x3-64-7-72-128-1-0x1x1-1x1x1-1x1x1-0-NCDHW-FP32-F=GemmFwdRest:69.5173,1783627776,miopenConvolutionFwdAlgoGEMM;GemmFwdRest_hipblaslt:188.015,1783627776,miopenConvolutionFwdAlgoGEMM
64-9-72-128-3x3x3-64-7-72-128-1-0x1x1-1x1x1-1x1x1-0-NCDHW-FP32-F=GemmFwdRest:16.0639,445906944,miopenConvolutionFwdAlgoGEMM;GemmFwdRest_hipblaslt:30.7161,445906944,miopenConvolutionFwdAlgoGEMM
