torch/lib/rocm/.miopen/db/gfx1151_20.HIP.3_5_0_1c3d4a724f-dirty.ufdb.txt
16-13-60-104-1x2x2-1536-13-30-52-1-0x0x0-1x2x2-1x1x1-0-NCDHW-FP16-F=GemmFwdRest:0.532122,2595840,miopenConvolutionFwdAlgoGEMM
16-13-60-104-1x1x1-16-13-60-104-1-0x0x0-1x1x1-1x1x1-0-NCDHW-FP16-F=GemmFwd1x1_0_1:0.0977483,0,miopenConvolutionFwdAlgoGEMM
16-3-62-106-3x3x3-384-1-60-104-1-0x0x0-1x1x1-1x1x1-0-NCDHW-FP16-F=GemmFwdRest:0.273813,5391360,miopenConvolutionFwdAlgoGEMM
384-3-62-106-3x3x3-384-1-60-104-1-0x0x0-1x1x1-1x1x1-0-NCDHW-FP16-F=GemmFwdRest:5.03129,129392640,miopenConvolutionFwdAlgoGEMM
384-60-104-1x1-1152-60-104-1-0x0-1x1-1x1-0-NCHW-FP16-F=ConvBinWinogradRxSf2x3g1:2.32698,0,miopenConvolutionFwdAlgoWinograd;GemmFwd1x1_0_1:0.183959,0,miopenConvolutionFwdAlgoGEMM;ConvBinWinogradRxSf3x2:1.04647,0,miopenConvolutionFwdAlgoWinograd
384-60-104-1x1-384-60-104-1-0x0-1x1-1x1-0-NCHW-FP16-F=ConvBinWinogradRxSf2x3g1:0.820429,0,miopenConvolutionFwdAlgoWinograd;GemmFwd1x1_0_1:0.0849114,0,miopenConvolutionFwdAlgoGEMM;ConvBinWinogradRxSf3x2:0.3985,0,miopenConvolutionFwdAlgoWinograd
384-120-208-3x3-192-120-208-1-1x1-1x1-1x1-0-NCHW-FP16-F=GemmFwdRest:2.84284,172523520,miopenConvolutionFwdAlgoGEMM;ConvBinWinogradRxSf3x2:2.72962,0,miopenConvolutionFwdAlgoWinograd;ConvBinWinogradRxSf2x3g1:1.58382,0,miopenConvolutionFwdAlgoWinograd
192-1-120-208-1x1x1-384-1-120-208-1-0x0x0-1x1x1-1x1x1-0-NCDHW-FP16-F=GemmFwd1x1_0_1:0.12526,0,miopenConvolutionFwdAlgoGEMM
192-3-122-210-3x3x3-384-1-120-208-1-0x0x0-1x1x1-1x1x1-0-NCDHW-FP16-F=GemmFwdRest:9.16922,258785280,miopenConvolutionFwdAlgoGEMM
384-3-122-210-3x3x3-384-1-120-208-1-0x0x0-1x1x1-1x1x1-0-NCDHW-FP16-F=GemmFwdRest:18.2142,517570560,miopenConvolutionFwdAlgoGEMM
384-240-416-3x3-192-240-416-1-1x1-1x1-1x1-0-NCHW-FP16-F=GemmFwdRest:11.1166,690094080,miopenConvolutionFwdAlgoGEMM;ConvBinWinogradRxSf3x2:10.2889,0,miopenConvolutionFwdAlgoWinograd;ConvBinWinogradRxSf2x3g1:6.05212,0,miopenConvolutionFwdAlgoWinograd
192-3-242-418-3x3x3-192-1-240-416-1-0x0x0-1x1x1-1x1x1-0-NCDHW-FP16-F=GemmFwdRest:36.0778,1035141120,miopenConvolutionFwdAlgoGEMM
192-480-832-3x3-96-480-832-1-1x1-1x1-1x1-0-NCHW-FP16-F=GemmFwdRest:15.8228,1380188160,miopenConvolutionFwdAlgoGEMM;ConvBinWinogradRxSf3x2:10.1469,0,miopenConvolutionFwdAlgoWinograd;ConvBinWinogradRxSf2x3g1:6.0396,0,miopenConvolutionFwdAlgoWinograd
96-3-482-834-3x3x3-96-1-480-832-1-0x0x0-1x1x1-1x1x1-0-NCDHW-FP16-F=GemmFwdRest:65.2869,2070282240,miopenConvolutionFwdAlgoGEMM
96-3-482-834-3x3x3-3-1-480-832-1-0x0x0-1x1x1-1x1x1-0-NCDHW-FP16-F=GemmFwdRest:64.2925,2070282240,miopenConvolutionFwdAlgoGEMM
384-3-60-104-3x1x1-768-1-60-104-1-0x0x0-1x1x1-1x1x1-0-NCDHW-FP16-F=GemmFwdRest:0.71925,14376960,miopenConvolutionFwdAlgoGEMM
384-120-208-3x3-192-120-208-2-1x1-1x1-1x1-0-NCHW-FP16-F=GemmFwdRest:5.86795,172523520,miopenConvolutionFwdAlgoGEMM;ConvBinWinogradRxSf3x2:5.3231,0,miopenConvolutionFwdAlgoWinograd;ConvBinWinogradRxSf2x3g1:3.05898,0,miopenConvolutionFwdAlgoWinograd
192-2-120-208-1x1x1-384-2-120-208-1-0x0x0-1x1x1-1x1x1-0-NCDHW-FP16-F=GemmFwd1x1_0_1:0.388689,0,miopenConvolutionFwdAlgoGEMM
192-4-122-210-3x3x3-384-2-120-208-1-0x0x0-1x1x1-1x1x1-0-NCDHW-FP16-F=GemmFwdRest:18.202,517570560,miopenConvolutionFwdAlgoGEMM
384-4-122-210-3x3x3-384-2-120-208-1-0x0x0-1x1x1-1x1x1-0-NCDHW-FP16-F=GemmFwdRest:37.2712,1035141120,miopenConvolutionFwdAlgoGEMM
384-4-120-208-3x1x1-768-2-120-208-1-0x0x0-1x1x1-1x1x1-0-NCDHW-FP16-F=GemmFwdRest:5.29594,115015680,miopenConvolutionFwdAlgoGEMM
384-240-416-3x3-192-240-416-4-1x1-1x1-1x1-0-NCHW-FP16-F=GemmFwdRest:42.9694,690094080,miopenConvolutionFwdAlgoGEMM;ConvBinWinogradRxSf3x2:41.3376,0,miopenConvolutionFwdAlgoWinograd;ConvBinWinogradRxSf2x3g1:24.6186,0,miopenConvolutionFwdAlgoWinograd
192-6-242-418-3x3x3-192-4-240-416-1-0x0x0-1x1x1-1x1x1-0-NCDHW-FP16-F=GemmFwdRest:154.526,4140564480,miopenConvolutionFwdAlgoGEMM
192-480-832-3x3-96-480-832-4-1x1-1x1-1x1-0-NCHW-FP16-F=GemmFwdRest:62.8467,1380188160,miopenConvolutionFwdAlgoGEMM;ConvBinWinogradRxSf3x2:41.4037,0,miopenConvolutionFwdAlgoWinograd;ConvBinWinogradRxSf2x3g1:25.5522,0,miopenConvolutionFwdAlgoWinograd
96-6-482-834-3x3x3-96-4-480-832-1-0x0x0-1x1x1-1x1x1-0-NCDHW-FP16-F=GemmFwdRest:257.43,8281128960,miopenConvolutionFwdAlgoGEMM
96-6-482-834-3x3x3-3-4-480-832-1-0x0x0-1x1x1-1x1x1-0-NCDHW-FP16-F=GemmFwdRest:252.083,8281128960,miopenConvolutionFwdAlgoGEMM
16-7-60-104-1x2x2-1536-7-30-52-1-0x0x0-1x2x2-1x1x1-0-NCDHW-FP16-F=GemmFwdRest:0.205592,1397760,miopenConvolutionFwdAlgoGEMM
16-7-60-104-1x1x1-16-7-60-104-1-0x0x0-1x1x1-1x1x1-0-NCDHW-FP16-F=GemmFwd1x1_0_1:0.0628243,0,miopenConvolutionFwdAlgoGEMM
4-40-64-3x3-320-40-64-26-1x1-1x1-1x1-0-NCHW-FP16-F=GemmFwdRest:1.92852,184320,miopenConvolutionFwdAlgoGEMM;ConvBinWinogradRxSf3x2:0.346133,0,miopenConvolutionFwdAlgoWinograd;ConvBinWinogradRxSf2x3g1:0.313057,0,miopenConvolutionFwdAlgoWinograd
320-1-26-1x1-512-1-26-2560-0x0-1x1-1x1-0-NCHW-FP16-F=ConvBinWinogradRxSf2x3g1:16.9513,0,miopenConvolutionFwdAlgoWinograd;GemmFwd1x1_0_1:4.26934,0,miopenConvolutionFwdAlgoGEMM;ConvBinWinogradRxSf3x2:11.5146,0,miopenConvolutionFwdAlgoWinograd
512-1-26-1x1-320-1-26-2560-0x0-1x1-1x1-0-NCHW-FP16-F=ConvBinWinogradRxSf2x3g1:16.7795,0,miopenConvolutionFwdAlgoWinograd;GemmFwd1x1_0_1:4.39004,0,miopenConvolutionFwdAlgoGEMM;ConvBinWinogradRxSf3x2:11.3175,0,miopenConvolutionFwdAlgoWinograd
320-40-64-3x3-320-40-64-26-1x1-1x1-1x1-0-NCHW-FP16-F=GemmFwdRest:7.60805,14745600,miopenConvolutionFwdAlgoGEMM;ConvBinWinogradRxSf3x2:9.67933,0,miopenConvolutionFwdAlgoWinograd;ConvBinWinogradRxSf2x3g1:5.23277,0,miopenConvolutionFwdAlgoWinograd
320-26-40-64-3x1x1-320-26-40-64-1-1x0x0-1x1x1-1x1x1-0-NCDHW-FP16-F=GemmFwdRest:4.32821,127795200,miopenConvolutionFwdAlgoGEMM
320-40-64-3x3-320-20-32-26-1x1-2x2-1x1-0-NCHW-FP16-F=GemmFwdRest:4.25578,3686400,miopenConvolutionFwdAlgoGEMM;ConvBinWinogradRxSf3x2:1.67073,0,miopenConvolutionFwdAlgoWinograd;ConvBinWinogradRxSf2x3g1:3.62502,0,miopenConvolutionFwdAlgoWinograd
320-20-32-3x3-640-20-32-26-1x1-1x1-1x1-0-NCHW-FP16-F=GemmFwdRest:5.06665,3686400,miopenConvolutionFwdAlgoGEMM;ConvBinWinogradRxSf3x2:5.0392,0,miopenConvolutionFwdAlgoWinograd;ConvBinWinogradRxSf2x3g1:2.65866,0,miopenConvolutionFwdAlgoWinograd
640-20-32-3x3-640-20-32-26-1x1-1x1-1x1-0-NCHW-FP16-F=GemmFwdRest:8.01664,7372800,miopenConvolutionFwdAlgoGEMM;ConvBinWinogradRxSf3x2:9.89002,0,miopenConvolutionFwdAlgoWinograd;ConvBinWinogradRxSf2x3g1:5.18733,0,miopenConvolutionFwdAlgoWinograd
320-20-32-1x1-640-20-32-26-0x0-1x1-1x1-0-NCHW-FP16-F=ConvBinWinogradRxSf2x3g1:2.69321,0,miopenConvolutionFwdAlgoWinograd;GemmFwd1x1_0_1:0.237245,0,miopenConvolutionFwdAlgoGEMM;ConvBinWinogradRxSf3x2:1.37023,0,miopenConvolutionFwdAlgoWinograd
640-26-20-32-3x1x1-640-26-20-32-1-1x0x0-1x1x1-1x1x1-0-NCDHW-FP16-F=GemmFwdRest:2.93441,63897600,miopenConvolutionFwdAlgoGEMM
640-20-32-3x3-640-10-16-26-1x1-2x2-1x1-0-NCHW-FP16-F=GemmFwdRest:6.31809,1843200,miopenConvolutionFwdAlgoGEMM;ConvBinWinogradRxSf3x2:3.21026,0,miopenConvolutionFwdAlgoWinograd;ConvBinWinogradRxSf2x3g1:5.83538,0,miopenConvolutionFwdAlgoWinograd
640-10-16-3x3-1280-10-16-26-1x1-1x1-1x1-0-NCHW-FP16-F=GemmFwdRest:6.09991,1843200,miopenConvolutionFwdAlgoGEMM;ConvBinWinogradRxSf3x2:6.23826,0,miopenConvolutionFwdAlgoWinograd;ConvBinWinogradRxSf2x3g1:2.6586,0,miopenConvolutionFwdAlgoWinograd
1280-10-16-3x3-1280-10-16-26-1x1-1x1-1x1-0-NCHW-FP16-F=GemmFwdRest:11.2385,3686400,miopenConvolutionFwdAlgoGEMM;ConvBinWinogradRxSf3x2:12.2088,0,miopenConvolutionFwdAlgoWinograd;ConvBinWinogradRxSf2x3g1:5.20207,0,miopenConvolutionFwdAlgoWinograd
640-10-16-1x1-1280-10-16-26-0x0-1x1-1x1-0-NCHW-FP16-F=ConvBinWinogradRxSf2x3g1:2.67106,0,miopenConvolutionFwdAlgoWinograd;GemmFwd1x1_0_1:0.33768,0,miopenConvolutionFwdAlgoGEMM;ConvBinWinogradRxSf3x2:1.63963,0,miopenConvolutionFwdAlgoWinograd
1280-26-10-16-3x1x1-1280-26-10-16-1-1x0x0-1x1x1-1x1x1-0-NCDHW-FP16-F=GemmFwdRest:2.00428,31948800,miopenConvolutionFwdAlgoGEMM
1280-10-16-3x3-1280-5-8-26-1x1-2x2-1x1-0-NCHW-FP16-F=GemmFwdRest:10.2393,921600,miopenConvolutionFwdAlgoGEMM;ConvBinWinogradRxSf3x2:3.1794,0,miopenConvolutionFwdAlgoWinograd;ConvBinWinogradRxSf2x3g1:6.83412,0,miopenConvolutionFwdAlgoWinograd
1280-5-8-3x3-1280-5-8-26-1x1-1x1-1x1-0-NCHW-FP16-F=GemmFwdRest:9.85868,921600,miopenConvolutionFwdAlgoGEMM;ConvBinWinogradRxSf3x2:3.14971,0,miopenConvolutionFwdAlgoWinograd;ConvBinWinogradRxSf2x3g1:1.62677,0,miopenConvolutionFwdAlgoWinograd
1280-26-5-8-3x1x1-1280-26-5-8-1-1x0x0-1x1x1-1x1x1-0-NCDHW-FP16-F=GemmFwdRest:0.584572,7987200,miopenConvolutionFwdAlgoGEMM
2560-5-8-3x3-1280-5-8-26-1x1-1x1-1x1-0-NCHW-FP16-F=GemmFwdRest:30.4961,1843200,miopenConvolutionFwdAlgoGEMM;ConvBinWinogradRxSf3x2:6.24142,0,miopenConvolutionFwdAlgoWinograd;ConvBinWinogradRxSf2x3g1:3.20605,0,miopenConvolutionFwdAlgoWinograd
2560-5-8-1x1-1280-5-8-26-0x0-1x1-1x1-0-NCHW-FP16-F=ConvBinWinogradRxSf2x3g1:3.26891,0,miopenConvolutionFwdAlgoWinograd;GemmFwd1x1_0_1:0.636008,0,miopenConvolutionFwdAlgoGEMM;ConvBinWinogradRxSf3x2:1.6244,0,miopenConvolutionFwdAlgoWinograd
2560-10-16-3x3-1280-10-16-26-1x1-1x1-1x1-0-NCHW-FP16-F=GemmFwdRest:41.7356,7372800,miopenConvolutionFwdAlgoGEMM;ConvBinWinogradRxSf3x2:24.4256,0,miopenConvolutionFwdAlgoWinograd;ConvBinWinogradRxSf2x3g1:10.9658,0,miopenConvolutionFwdAlgoWinograd
2560-10-16-1x1-1280-10-16-26-0x0-1x1-1x1-0-NCHW-FP16-F=ConvBinWinogradRxSf2x3g1:10.4528,0,miopenConvolutionFwdAlgoWinograd;GemmFwd1x1_0_1:1.2498,0,miopenConvolutionFwdAlgoGEMM;ConvBinWinogradRxSf3x2:6.25583,0,miopenConvolutionFwdAlgoWinograd
1920-10-16-3x3-1280-10-16-26-1x1-1x1-1x1-0-NCHW-FP16-F=GemmFwdRest:17.5054,5529600,miopenConvolutionFwdAlgoGEMM;ConvBinWinogradRxSf3x2:18.2544,0,miopenConvolutionFwdAlgoWinograd;ConvBinWinogradRxSf2x3g1:7.98867,0,miopenConvolutionFwdAlgoWinograd
1920-10-16-1x1-1280-10-16-26-0x0-1x1-1x1-0-NCHW-FP16-F=ConvBinWinogradRxSf2x3g1:7.85424,0,miopenConvolutionFwdAlgoWinograd;GemmFwd1x1_0_1:0.89674,0,miopenConvolutionFwdAlgoGEMM;ConvBinWinogradRxSf3x2:4.70486,0,miopenConvolutionFwdAlgoWinograd
1280-20-32-3x3-1280-20-32-26-1x1-1x1-1x1-0-NCHW-FP16-F=GemmFwdRest:21.016,14745600,miopenConvolutionFwdAlgoGEMM;ConvBinWinogradRxSf3x2:38.4292,0,miopenConvolutionFwdAlgoWinograd;ConvBinWinogradRxSf2x3g1:20.5019,0,miopenConvolutionFwdAlgoWinograd
1920-20-32-3x3-640-20-32-26-1x1-1x1-1x1-0-NCHW-FP16-F=GemmFwdRest:23.7423,22118400,miopenConvolutionFwdAlgoGEMM;ConvBinWinogradRxSf3x2:29.0008,0,miopenConvolutionFwdAlgoWinograd;ConvBinWinogradRxSf2x3g1:15.1917,0,miopenConvolutionFwdAlgoWinograd
1920-20-32-1x1-640-20-32-26-0x0-1x1-1x1-0-NCHW-FP16-F=ConvBinWinogradRxSf2x3g1:15.4081,0,miopenConvolutionFwdAlgoWinograd;GemmFwd1x1_0_1:1.24754,0,miopenConvolutionFwdAlgoGEMM;ConvBinWinogradRxSf3x2:7.41552,0,miopenConvolutionFwdAlgoWinograd
960-20-32-3x3-640-20-32-26-1x1-1x1-1x1-0-NCHW-FP16-F=GemmFwdRest:10.6098,11059200,miopenConvolutionFwdAlgoGEMM;ConvBinWinogradRxSf3x2:14.6368,0,miopenConvolutionFwdAlgoWinograd;ConvBinWinogradRxSf2x3g1:7.64537,0,miopenConvolutionFwdAlgoWinograd
960-20-32-1x1-640-20-32-26-0x0-1x1-1x1-0-NCHW-FP16-F=ConvBinWinogradRxSf2x3g1:7.7351,0,miopenConvolutionFwdAlgoWinograd;GemmFwd1x1_0_1:0.637107,0,miopenConvolutionFwdAlgoGEMM;ConvBinWinogradRxSf3x2:3.80883,0,miopenConvolutionFwdAlgoWinograd
640-40-64-3x3-640-40-64-26-1x1-1x1-1x1-0-NCHW-FP16-F=GemmFwdRest:17.8303,29491200,miopenConvolutionFwdAlgoGEMM;ConvBinWinogradRxSf3x2:38.4955,0,miopenConvolutionFwdAlgoWinograd;ConvBinWinogradRxSf2x3g1:20.6999,0,miopenConvolutionFwdAlgoWinograd
960-40-64-3x3-320-40-64-26-1x1-1x1-1x1-0-NCHW-FP16-F=GemmFwdRest:23.365,44236800,miopenConvolutionFwdAlgoGEMM;ConvBinWinogradRxSf3x2:29.031,0,miopenConvolutionFwdAlgoWinograd;ConvBinWinogradRxSf2x3g1:15.2873,0,miopenConvolutionFwdAlgoWinograd
960-40-64-1x1-320-40-64-26-0x0-1x1-1x1-0-NCHW-FP16-F=ConvBinWinogradRxSf2x3g1:15.3588,0,miopenConvolutionFwdAlgoWinograd;GemmFwd1x1_0_1:1.32229,0,miopenConvolutionFwdAlgoGEMM;ConvBinWinogradRxSf3x2:7.4069,0,miopenConvolutionFwdAlgoWinograd
640-40-64-3x3-320-40-64-26-1x1-1x1-1x1-0-NCHW-FP16-F=GemmFwdRest:13.8507,29491200,miopenConvolutionFwdAlgoGEMM;ConvBinWinogradRxSf3x2:19.3891,0,miopenConvolutionFwdAlgoWinograd;ConvBinWinogradRxSf2x3g1:10.278,0,miopenConvolutionFwdAlgoWinograd
640-40-64-1x1-320-40-64-26-0x0-1x1-1x1-0-NCHW-FP16-F=ConvBinWinogradRxSf2x3g1:10.3142,0,miopenConvolutionFwdAlgoWinograd;GemmFwd1x1_0_1:0.907803,0,miopenConvolutionFwdAlgoGEMM;ConvBinWinogradRxSf3x2:5.04963,0,miopenConvolutionFwdAlgoWinograd
320-40-64-3x3-4-40-64-26-1x1-1x1-1x1-0-NCHW-FP16-F=GemmFwdRest:5.89349,14745600,miopenConvolutionFwdAlgoGEMM;ConvBinWinogradRxSf3x2:1.16099,0,miopenConvolutionFwdAlgoWinograd;ConvBinWinogradRxSf2x3g1:0.608717,0,miopenConvolutionFwdAlgoWinograd
4-40-64-1x1-4-40-64-1-0x0-1x1-1x1-0-NCHW-FP16-F=ConvBinWinogradRxSf2x3g1:0.0398,0,miopenConvolutionFwdAlgoWinograd;GemmFwd1x1_0_1:0.0331243,0,miopenConvolutionFwdAlgoGEMM;ConvBinWinogradRxSf3x2:0.0677714,0,miopenConvolutionFwdAlgoWinograd
4-40-64-3x3-512-40-64-1-1x1-1x1-1x1-0-NCHW-FP16-F=GemmFwdRest:0.0603733,184320,miopenConvolutionFwdAlgoGEMM;ConvBinWinogradRxSf3x2:0.0691167,0,miopenConvolutionFwdAlgoWinograd;ConvBinWinogradRxSf2x3g1:0.061,0,miopenConvolutionFwdAlgoWinograd
512-40-64-3x3-512-40-64-1-1x1-1x1-1x1-0-NCHW-FP16-F=GemmFwdRest:0.485289,23592960,miopenConvolutionFwdAlgoGEMM;ConvBinWinogradRxSf3x2:1.06556,0,miopenConvolutionFwdAlgoWinograd;ConvBinWinogradRxSf2x3g1:0.576033,0,miopenConvolutionFwdAlgoWinograd
512-40-64-1x1-512-40-64-1-0x0-1x1-1x1-0-NCHW-FP16-F=ConvBinWinogradRxSf2x3g1:0.588714,0,miopenConvolutionFwdAlgoWinograd;GemmFwd1x1_0_1:0.052935,0,miopenConvolutionFwdAlgoGEMM;ConvBinWinogradRxSf3x2:0.323471,0,miopenConvolutionFwdAlgoWinograd
512-80-128-3x3-512-80-128-1-1x1-1x1-1x1-0-NCHW-FP16-F=GemmFwdRest:2.1894,94371840,miopenConvolutionFwdAlgoGEMM;ConvBinWinogradRxSf3x2:3.81157,0,miopenConvolutionFwdAlgoWinograd;ConvBinWinogradRxSf2x3g1:2.15152,0,miopenConvolutionFwdAlgoWinograd
512-160-256-3x3-512-160-256-1-1x1-1x1-1x1-0-NCHW-FP16-F=GemmFwdRest:7.74627,377487360,miopenConvolutionFwdAlgoGEMM;ConvBinWinogradRxSf3x2:14.841,0,miopenConvolutionFwdAlgoWinograd;ConvBinWinogradRxSf2x3g1:8.42429,0,miopenConvolutionFwdAlgoWinograd
512-160-256-3x3-256-160-256-1-1x1-1x1-1x1-0-NCHW-FP16-F=GemmFwdRest:6.6138,377487360,miopenConvolutionFwdAlgoGEMM;ConvBinWinogradRxSf3x2:7.52327,0,miopenConvolutionFwdAlgoWinograd;ConvBinWinogradRxSf2x3g1:4.15147,0,miopenConvolutionFwdAlgoWinograd
256-160-256-3x3-256-160-256-1-1x1-1x1-1x1-0-NCHW-FP16-F=GemmFwdRest:2.89497,188743680,miopenConvolutionFwdAlgoGEMM;ConvBinWinogradRxSf3x2:3.82169,0,miopenConvolutionFwdAlgoWinograd;ConvBinWinogradRxSf2x3g1:2.15566,0,miopenConvolutionFwdAlgoWinograd
512-160-256-1x1-256-160-256-1-0x0-1x1-1x1-0-NCHW-FP16-F=ConvBinWinogradRxSf2x3g1:4.18333,0,miopenConvolutionFwdAlgoWinograd;GemmFwd1x1_0_1:0.448671,0,miopenConvolutionFwdAlgoGEMM;ConvBinWinogradRxSf3x2:2.02486,0,miopenConvolutionFwdAlgoWinograd
256-320-512-3x3-256-320-512-1-1x1-1x1-1x1-0-NCHW-FP16-F=GemmFwdRest:9.63944,754974720,miopenConvolutionFwdAlgoGEMM;ConvBinWinogradRxSf3x2:14.4389,0,miopenConvolutionFwdAlgoWinograd;ConvBinWinogradRxSf2x3g1:8.4287,0,miopenConvolutionFwdAlgoWinograd
256-320-512-3x3-128-320-512-1-1x1-1x1-1x1-0-NCHW-FP16-F=GemmFwdRest:8.48531,754974720,miopenConvolutionFwdAlgoGEMM;ConvBinWinogradRxSf3x2:7.29102,0,miopenConvolutionFwdAlgoWinograd;ConvBinWinogradRxSf2x3g1:4.25146,0,miopenConvolutionFwdAlgoWinograd
128-320-512-3x3-128-320-512-1-1x1-1x1-1x1-0-NCHW-FP16-F=GemmFwdRest:4.47862,377487360,miopenConvolutionFwdAlgoGEMM;ConvBinWinogradRxSf3x2:3.74428,0,miopenConvolutionFwdAlgoWinograd;ConvBinWinogradRxSf2x3g1:2.24184,0,miopenConvolutionFwdAlgoWinograd
256-320-512-1x1-128-320-512-1-0x0-1x1-1x1-0-NCHW-FP16-F=ConvBinWinogradRxSf2x3g1:4.24292,0,miopenConvolutionFwdAlgoWinograd;GemmFwd1x1_0_1:0.83758,0,miopenConvolutionFwdAlgoGEMM;ConvBinWinogradRxSf3x2:2.04816,0,miopenConvolutionFwdAlgoWinograd
128-320-512-3x3-3-320-512-1-1x1-1x1-1x1-0-NCHW-FP16-F=GemmFwdRest:4.231,377487360,miopenConvolutionFwdAlgoGEMM;ConvBinWinogradRxSf3x2:1.0239,0,miopenConvolutionFwdAlgoWinograd;ConvBinWinogradRxSf2x3g1:0.619517,0,miopenConvolutionFwdAlgoWinograd
