torch/lib/rocm/.miopen/db/gfx1151_20.HIP.3_5_0_134b1a95a9.ufdb.txt
3-2-14-14-2x14x14-1280-1-1-1-748-0x0x0-2x14x14-1x1x1-0-NCDHW-BF16-F=GemmFwdRest:123.82,2352,miopenConvolutionFwdAlgoGEMM;GemmFwdRest_hipblaslt:56.0735,2352,miopenConvolutionFwdAlgoGEMM
3-3-258-258-3x3x3-96-1-256-256-1-0x0x0-1x1x1-1x1x1-0-NCDHW-BF16-F=GemmFwdRest:0.287536,10616832,miopenConvolutionFwdAlgoGEMM;GemmFwdRest_hipblaslt:0.319406,10616832,miopenConvolutionFwdAlgoGEMM
96-3-258-258-3x3x3-96-1-256-256-1-0x0x0-1x1x1-1x1x1-0-NCDHW-BF16-F=GemmFwdRest:15.2399,339738624,miopenConvolutionFwdAlgoGEMM;ConvHipImplicitGemm3DGroupFwdXdlops:7.5568,51421440,miopenConvolutionFwdAlgoImplicitGEMM;GemmFwdRest_hipblaslt:13.652,339738624,miopenConvolutionFwdAlgoGEMM
96-257-257-3x3-96-128-128-1-0x0-2x2-1x1-0-NCHW-BF16-F=GemmFwdRest:0.466957,28311552,miopenConvolutionFwdAlgoGEMM;GemmFwdRest_hipblaslt:0.4437,28311552,miopenConvolutionFwdAlgoGEMM;ConvHipImplicitGemmGroupFwdXdlops:0.668053,15993088,miopenConvolutionFwdAlgoImplicitGEMM
96-1-128-128-1x1x1-192-1-128-128-1-0x0x0-1x1x1-1x1x1-0-NCDHW-BF16-F=GemmFwd1x1_0_1:0.0561629,0,miopenConvolutionFwdAlgoGEMM;GemmFwd1x1_0_1_hipblaslt:0.071598,0,miopenConvolutionFwdAlgoGEMM;ConvHipImplicitGemm3DGroupFwdXdlops:0.279216,9474048,miopenConvolutionFwdAlgoImplicitGEMM
96-3-130-130-3x3x3-192-1-128-128-1-0x0x0-1x1x1-1x1x1-0-NCDHW-BF16-F=GemmFwdRest:4.6345,84934656,miopenConvolutionFwdAlgoGEMM;ConvHipImplicitGemm3DGroupFwdXdlops:2.70093,17021184,miopenConvolutionFwdAlgoImplicitGEMM;GemmFwdRest_hipblaslt:3.26106,84934656,miopenConvolutionFwdAlgoGEMM
192-3-130-130-3x3x3-192-1-128-128-1-0x0x0-1x1x1-1x1x1-0-NCDHW-BF16-F=GemmFwdRest:6.59399,169869312,miopenConvolutionFwdAlgoGEMM;ConvHipImplicitGemm3DGroupFwdXdlops:5.48997,27750912,miopenConvolutionFwdAlgoImplicitGEMM;GemmFwdRest_hipblaslt:7.11134,169869312,miopenConvolutionFwdAlgoGEMM
192-129-129-3x3-192-64-64-1-0x0-2x2-1x1-0-NCHW-BF16-F=GemmFwdRest:0.296431,14155776,miopenConvolutionFwdAlgoGEMM;GemmFwdRest_hipblaslt:0.276362,14155776,miopenConvolutionFwdAlgoGEMM;ConvHipImplicitGemmGroupFwdXdlops:0.543727,8626688,miopenConvolutionFwdAlgoImplicitGEMM
192-1-64-64-1x1x1-384-1-64-64-1-0x0x0-1x1x1-1x1x1-0-NCDHW-BF16-F=GemmFwd1x1_0_1:0.0338171,0,miopenConvolutionFwdAlgoGEMM;GemmFwd1x1_0_1_hipblaslt:0.056192,0,miopenConvolutionFwdAlgoGEMM;ConvHipImplicitGemm3DGroupFwdXdlops:0.243871,4866048,miopenConvolutionFwdAlgoImplicitGEMM
192-3-66-66-3x3x3-384-1-64-64-1-0x0x0-1x1x1-1x1x1-0-NCDHW-BF16-F=GemmFwdRest:2.19738,42467328,miopenConvolutionFwdAlgoGEMM;ConvHipImplicitGemm3DGroupFwdXdlops:2.60403,12145152,miopenConvolutionFwdAlgoImplicitGEMM;GemmFwdRest_hipblaslt:1.85975,42467328,miopenConvolutionFwdAlgoGEMM
384-3-66-66-3x3x3-384-1-64-64-1-0x0x0-1x1x1-1x1x1-0-NCDHW-BF16-F=GemmFwdRest:4.53942,84934656,miopenConvolutionFwdAlgoGEMM;ConvHipImplicitGemm3DGroupFwdXdlops:5.30816,21144576,miopenConvolutionFwdAlgoImplicitGEMM;GemmFwdRest_hipblaslt:5.0955,84934656,miopenConvolutionFwdAlgoGEMM
384-65-65-3x3-384-32-32-1-0x0-2x2-1x1-0-NCHW-BF16-F=GemmFwdRest:0.2209,7077888,miopenConvolutionFwdAlgoGEMM;GemmFwdRest_hipblaslt:0.214769,7077888,miopenConvolutionFwdAlgoGEMM;ConvHipImplicitGemmGroupFwdXdlops:0.483164,6685440,miopenConvolutionFwdAlgoImplicitGEMM
384-3-34-34-3x3x3-384-1-32-32-1-0x0x0-1x1x1-1x1x1-0-NCDHW-BF16-F=GemmFwdRest:0.805027,21233664,miopenConvolutionFwdAlgoGEMM;ConvHipImplicitGemm3DGroupFwdXdlops:1.38621,11412480,miopenConvolutionFwdAlgoImplicitGEMM;GemmFwdRest_hipblaslt:0.850643,21233664,miopenConvolutionFwdAlgoGEMM
384-32-32-1x1-1152-32-32-1-0x0-1x1-1x1-0-NCHW-BF16-F=GemmFwd1x1_0_1:0.0432933,0,miopenConvolutionFwdAlgoGEMM;GemmFwd1x1_0_1_hipblaslt:0.061466,0,miopenConvolutionFwdAlgoGEMM;ConvHipImplicitGemmGroupFwdXdlops:0.256892,4030464,miopenConvolutionFwdAlgoImplicitGEMM
384-32-32-1x1-384-32-32-1-0x0-1x1-1x1-0-NCHW-BF16-F=GemmFwd1x1_0_1:0.036404,0,miopenConvolutionFwdAlgoGEMM;GemmFwd1x1_0_1_hipblaslt:0.0293317,0,miopenConvolutionFwdAlgoGEMM;ConvHipImplicitGemmGroupFwdXdlops:0.159372,1867776,miopenConvolutionFwdAlgoImplicitGEMM
384-3-34-34-3x3x3-32-1-32-32-1-0x0x0-1x1x1-1x1x1-0-NCDHW-BF16-F=GemmFwdRest:0.65324,21233664,miopenConvolutionFwdAlgoGEMM;ConvHipImplicitGemm3DGroupFwdXdlops:0.540356,3392512,miopenConvolutionFwdAlgoImplicitGEMM;GemmFwdRest_hipblaslt:0.546123,21233664,miopenConvolutionFwdAlgoGEMM
32-1-32-32-1x1x1-32-1-32-32-1-0x0x0-1x1x1-1x1x1-0-NCDHW-BF16-F=GemmFwd1x1_0_1:0.0291014,0,miopenConvolutionFwdAlgoGEMM;GemmFwd1x1_0_1_hipblaslt:0.0212457,0,miopenConvolutionFwdAlgoGEMM;ConvHipImplicitGemm3DGroupFwdXdlops:0.139127,133120,miopenConvolutionFwdAlgoImplicitGEMM
3-3-258-98-3x3x3-96-1-256-96-1-0x0x0-1x1x1-1x1x1-0-NCDHW-BF16-F=GemmFwdRest:0.156425,3981312,miopenConvolutionFwdAlgoGEMM;GemmFwdRest_hipblaslt:0.157218,3981312,miopenConvolutionFwdAlgoGEMM
96-3-258-98-3x3x3-96-1-256-96-1-0x0x0-1x1x1-1x1x1-0-NCDHW-BF16-F=GemmFwdRest:4.78774,127401984,miopenConvolutionFwdAlgoGEMM;ConvHipImplicitGemm3DGroupFwdXdlops:2.70475,19779840,miopenConvolutionFwdAlgoImplicitGEMM;GemmFwdRest_hipblaslt:3.66027,127401984,miopenConvolutionFwdAlgoGEMM
96-257-97-3x3-96-128-48-1-0x0-2x2-1x1-0-NCHW-BF16-F=GemmFwdRest:0.189658,10616832,miopenConvolutionFwdAlgoGEMM;GemmFwdRest_hipblaslt:0.16256,10616832,miopenConvolutionFwdAlgoGEMM;ConvHipImplicitGemmGroupFwdXdlops:0.33084,6131968,miopenConvolutionFwdAlgoImplicitGEMM
96-1-128-48-1x1x1-192-1-128-48-1-0x0x0-1x1x1-1x1x1-0-NCDHW-BF16-F=GemmFwd1x1_0_1:0.0310783,0,miopenConvolutionFwdAlgoGEMM;GemmFwd1x1_0_1_hipblaslt:0.0417267,0,miopenConvolutionFwdAlgoGEMM;ConvHipImplicitGemm3DGroupFwdXdlops:0.19822,3575808,miopenConvolutionFwdAlgoImplicitGEMM
96-3-130-50-3x3x3-192-1-128-48-1-0x0x0-1x1x1-1x1x1-0-NCDHW-BF16-F=GemmFwdRest:0.979677,31850496,miopenConvolutionFwdAlgoGEMM;ConvHipImplicitGemm3DGroupFwdXdlops:1.1306,7098624,miopenConvolutionFwdAlgoImplicitGEMM;GemmFwdRest_hipblaslt:0.863858,31850496,miopenConvolutionFwdAlgoGEMM
192-3-130-50-3x3x3-192-1-128-48-1-0x0x0-1x1x1-1x1x1-0-NCDHW-BF16-F=GemmFwdRest:1.864,63700992,miopenConvolutionFwdAlgoGEMM;ConvHipImplicitGemm3DGroupFwdXdlops:2.07811,11837952,miopenConvolutionFwdAlgoImplicitGEMM;GemmFwdRest_hipblaslt:1.86942,63700992,miopenConvolutionFwdAlgoGEMM
192-129-49-3x3-192-64-24-1-0x0-2x2-1x1-0-NCHW-BF16-F=GemmFwdRest:0.18074,5308416,miopenConvolutionFwdAlgoGEMM;GemmFwdRest_hipblaslt:0.128998,5308416,miopenConvolutionFwdAlgoGEMM;ConvHipImplicitGemmGroupFwdXdlops:0.266896,3680768,miopenConvolutionFwdAlgoImplicitGEMM
192-1-64-24-1x1x1-384-1-64-24-1-0x0x0-1x1x1-1x1x1-0-NCDHW-BF16-F=GemmFwd1x1_0_1:0.0628971,0,miopenConvolutionFwdAlgoGEMM;GemmFwd1x1_0_1_hipblaslt:0.0409733,0,miopenConvolutionFwdAlgoGEMM;ConvHipImplicitGemm3DGroupFwdXdlops:0.195348,1916928,miopenConvolutionFwdAlgoImplicitGEMM
192-3-66-26-3x3x3-384-1-64-24-1-0x0x0-1x1x1-1x1x1-0-NCDHW-BF16-F=GemmFwdRest:0.51644,15925248,miopenConvolutionFwdAlgoGEMM;ConvHipImplicitGemm3DGroupFwdXdlops:1.12744,7137792,miopenConvolutionFwdAlgoImplicitGEMM;GemmFwdRest_hipblaslt:0.575433,15925248,miopenConvolutionFwdAlgoGEMM
384-3-66-26-3x3x3-384-1-64-24-1-0x0x0-1x1x1-1x1x1-0-NCDHW-BF16-F=GemmFwdRest:1.18366,31850496,miopenConvolutionFwdAlgoGEMM;ConvHipImplicitGemm3DGroupFwdXdlops:2.13795,13095936,miopenConvolutionFwdAlgoImplicitGEMM;GemmFwdRest_hipblaslt:1.13579,31850496,miopenConvolutionFwdAlgoGEMM
384-65-25-3x3-384-32-12-1-0x0-2x2-1x1-0-NCHW-BF16-F=GemmFwdRest:0.160647,2654208,miopenConvolutionFwdAlgoGEMM;GemmFwdRest_hipblaslt:0.138194,2654208,miopenConvolutionFwdAlgoGEMM;ConvHipImplicitGemmGroupFwdXdlops:0.283908,4197120,miopenConvolutionFwdAlgoImplicitGEMM
384-3-34-14-3x3x3-384-1-32-12-1-0x0x0-1x1x1-1x1x1-0-NCDHW-BF16-F=GemmFwdRest:0.40505,7962624,miopenConvolutionFwdAlgoGEMM;ConvHipImplicitGemm3DGroupFwdXdlops:0.779263,9354240,miopenConvolutionFwdAlgoImplicitGEMM;GemmFwdRest_hipblaslt:0.37681,7962624,miopenConvolutionFwdAlgoGEMM
384-32-12-1x1-1152-32-12-1-0x0-1x1-1x1-0-NCHW-BF16-F=GemmFwd1x1_0_1:0.0291567,0,miopenConvolutionFwdAlgoGEMM;GemmFwd1x1_0_1_hipblaslt:0.03093,0,miopenConvolutionFwdAlgoGEMM;ConvHipImplicitGemmGroupFwdXdlops:0.203718,2064384,miopenConvolutionFwdAlgoImplicitGEMM
384-32-12-1x1-384-32-12-1-0x0-1x1-1x1-0-NCHW-BF16-F=GemmFwd1x1_0_1:0.0211629,0,miopenConvolutionFwdAlgoGEMM;GemmFwd1x1_0_1_hipblaslt:0.02446,0,miopenConvolutionFwdAlgoGEMM;ConvHipImplicitGemmGroupFwdXdlops:0.1873,884736,miopenConvolutionFwdAlgoImplicitGEMM
384-3-34-14-3x3x3-32-1-32-12-1-0x0x0-1x1x1-1x1x1-0-NCDHW-BF16-F=GemmFwdRest:0.421655,7962624,miopenConvolutionFwdAlgoGEMM;ConvHipImplicitGemm3DGroupFwdXdlops:0.520022,1784832,miopenConvolutionFwdAlgoImplicitGEMM;GemmFwdRest_hipblaslt:0.24747,7962624,miopenConvolutionFwdAlgoGEMM
32-1-32-12-1x1x1-32-1-32-12-1-0x0x0-1x1x1-1x1x1-0-NCDHW-BF16-F=GemmFwd1x1_0_1:0.0192486,0,miopenConvolutionFwdAlgoGEMM;GemmFwd1x1_0_1_hipblaslt:0.0239386,0,miopenConvolutionFwdAlgoGEMM;ConvHipImplicitGemm3DGroupFwdXdlops:0.127272,51200,miopenConvolutionFwdAlgoImplicitGEMM
3-3-66-258-3x3x3-96-1-64-256-1-0x0x0-1x1x1-1x1x1-0-NCDHW-BF16-F=GemmFwdRest:0.178939,2654208,miopenConvolutionFwdAlgoGEMM;GemmFwdRest_hipblaslt:0.171288,2654208,miopenConvolutionFwdAlgoGEMM
96-3-66-258-3x3x3-96-1-64-256-1-0x0x0-1x1x1-1x1x1-0-NCDHW-BF16-F=GemmFwdRest:3.05757,84934656,miopenConvolutionFwdAlgoGEMM;ConvHipImplicitGemm3DGroupFwdXdlops:1.77751,13451520,miopenConvolutionFwdAlgoImplicitGEMM;GemmFwdRest_hipblaslt:2.19846,84934656,miopenConvolutionFwdAlgoGEMM
96-65-257-3x3-96-32-128-1-0x0-2x2-1x1-0-NCHW-BF16-F=GemmFwdRest:0.147001,7077888,miopenConvolutionFwdAlgoGEMM;GemmFwdRest_hipblaslt:0.138489,7077888,miopenConvolutionFwdAlgoGEMM;ConvHipImplicitGemmGroupFwdXdlops:0.26423,4159744,miopenConvolutionFwdAlgoImplicitGEMM
96-1-32-128-1x1x1-192-1-32-128-1-0x0x0-1x1x1-1x1x1-0-NCDHW-BF16-F=GemmFwd1x1_0_1:0.0777443,0,miopenConvolutionFwdAlgoGEMM;GemmFwd1x1_0_1_hipblaslt:0.0311129,0,miopenConvolutionFwdAlgoGEMM;ConvHipImplicitGemm3DGroupFwdXdlops:0.186158,2396160,miopenConvolutionFwdAlgoImplicitGEMM
96-3-34-130-3x3x3-192-1-32-128-1-0x0x0-1x1x1-1x1x1-0-NCDHW-BF16-F=GemmFwdRest:0.661004,21233664,miopenConvolutionFwdAlgoGEMM;ConvHipImplicitGemm3DGroupFwdXdlops:0.810926,5114112,miopenConvolutionFwdAlgoImplicitGEMM;GemmFwdRest_hipblaslt:0.60659,21233664,miopenConvolutionFwdAlgoGEMM
192-3-34-130-3x3x3-192-1-32-128-1-0x0x0-1x1x1-1x1x1-0-NCDHW-BF16-F=GemmFwdRest:1.23119,42467328,miopenConvolutionFwdAlgoGEMM;ConvHipImplicitGemm3DGroupFwdXdlops:1.50223,8655360,miopenConvolutionFwdAlgoImplicitGEMM;GemmFwdRest_hipblaslt:1.3139,42467328,miopenConvolutionFwdAlgoGEMM
192-33-129-3x3-192-16-64-1-0x0-2x2-1x1-0-NCHW-BF16-F=GemmFwdRest:0.13742,3538944,miopenConvolutionFwdAlgoGEMM;GemmFwdRest_hipblaslt:0.105513,3538944,miopenConvolutionFwdAlgoGEMM;ConvHipImplicitGemmGroupFwdXdlops:0.240678,2691584,miopenConvolutionFwdAlgoImplicitGEMM
192-1-16-64-1x1x1-384-1-16-64-1-0x0x0-1x1x1-1x1x1-0-NCDHW-BF16-F=GemmFwd1x1_0_1:0.0539171,0,miopenConvolutionFwdAlgoGEMM;GemmFwd1x1_0_1_hipblaslt:0.015095,0,miopenConvolutionFwdAlgoGEMM;ConvHipImplicitGemm3DGroupFwdXdlops:0.188487,1327104,miopenConvolutionFwdAlgoImplicitGEMM
192-3-18-66-3x3x3-384-1-16-64-1-0x0x0-1x1x1-1x1x1-0-NCDHW-BF16-F=GemmFwdRest:0.394785,10616832,miopenConvolutionFwdAlgoGEMM;ConvHipImplicitGemm3DGroupFwdXdlops:0.746427,6136320,miopenConvolutionFwdAlgoImplicitGEMM;GemmFwdRest_hipblaslt:0.423404,10616832,miopenConvolutionFwdAlgoGEMM
384-3-18-66-3x3x3-384-1-16-64-1-0x0x0-1x1x1-1x1x1-0-NCDHW-BF16-F=GemmFwdRest:0.792413,21233664,miopenConvolutionFwdAlgoGEMM;ConvHipImplicitGemm3DGroupFwdXdlops:1.37776,11486208,miopenConvolutionFwdAlgoImplicitGEMM;GemmFwdRest_hipblaslt:0.830139,21233664,miopenConvolutionFwdAlgoGEMM
384-17-65-3x3-384-8-32-1-0x0-2x2-1x1-0-NCHW-BF16-F=GemmFwdRest:0.148774,1769472,miopenConvolutionFwdAlgoGEMM;GemmFwdRest_hipblaslt:0.10622,1769472,miopenConvolutionFwdAlgoGEMM;ConvHipImplicitGemmGroupFwdXdlops:0.277918,3699456,miopenConvolutionFwdAlgoImplicitGEMM
384-3-10-34-3x3x3-384-1-8-32-1-0x0x0-1x1x1-1x1x1-0-NCDHW-BF16-F=GemmFwdRest:0.376028,5308416,miopenConvolutionFwdAlgoGEMM;ConvHipImplicitGemm3DGroupFwdXdlops:0.756847,8942592,miopenConvolutionFwdAlgoImplicitGEMM;GemmFwdRest_hipblaslt:0.267787,5308416,miopenConvolutionFwdAlgoGEMM
384-8-32-1x1-1152-8-32-1-0x0-1x1-1x1-0-NCHW-BF16-F=GemmFwd1x1_0_1:0.0333617,0,miopenConvolutionFwdAlgoGEMM;GemmFwd1x1_0_1_hipblaslt:0.02861,0,miopenConvolutionFwdAlgoGEMM;ConvHipImplicitGemmGroupFwdXdlops:0.190385,1671168,miopenConvolutionFwdAlgoImplicitGEMM
384-8-32-1x1-384-8-32-1-0x0-1x1-1x1-0-NCHW-BF16-F=GemmFwd1x1_0_1:0.0537457,0,miopenConvolutionFwdAlgoGEMM;GemmFwd1x1_0_1_hipblaslt:0.0264171,0,miopenConvolutionFwdAlgoGEMM;ConvHipImplicitGemmGroupFwdXdlops:0.164622,688128,miopenConvolutionFwdAlgoImplicitGEMM
384-3-10-34-3x3x3-32-1-8-32-1-0x0x0-1x1x1-1x1x1-0-NCDHW-BF16-F=GemmFwdRest:0.37835,5308416,miopenConvolutionFwdAlgoGEMM;ConvHipImplicitGemm3DGroupFwdXdlops:0.509152,1463296,miopenConvolutionFwdAlgoImplicitGEMM;GemmFwdRest_hipblaslt:0.181911,5308416,miopenConvolutionFwdAlgoGEMM
32-1-8-32-1x1x1-32-1-8-32-1-0x0x0-1x1x1-1x1x1-0-NCDHW-BF16-F=GemmFwd1x1_0_1:0.0417571,0,miopenConvolutionFwdAlgoGEMM;GemmFwd1x1_0_1_hipblaslt:0.021216,0,miopenConvolutionFwdAlgoGEMM;ConvHipImplicitGemm3DGroupFwdXdlops:0.133403,34816,miopenConvolutionFwdAlgoImplicitGEMM
3-3-66-98-3x3x3-96-1-64-96-1-0x0x0-1x1x1-1x1x1-0-NCDHW-BF16-F=GemmFwdRest:0.091625,995328,miopenConvolutionFwdAlgoGEMM;GemmFwdRest_hipblaslt:0.095155,995328,miopenConvolutionFwdAlgoGEMM
96-3-66-98-3x3x3-96-1-64-96-1-0x0x0-1x1x1-1x1x1-0-NCDHW-BF16-F=GemmFwdRest:0.739589,31850496,miopenConvolutionFwdAlgoGEMM;ConvHipImplicitGemm3DGroupFwdXdlops:0.797142,5402880,miopenConvolutionFwdAlgoImplicitGEMM;GemmFwdRest_hipblaslt:0.759854,31850496,miopenConvolutionFwdAlgoGEMM
96-65-97-3x3-96-32-48-1-0x0-2x2-1x1-0-NCHW-BF16-F=GemmFwdRest:0.111543,2654208,miopenConvolutionFwdAlgoGEMM;GemmFwdRest_hipblaslt:0.0877143,2654208,miopenConvolutionFwdAlgoGEMM;ConvHipImplicitGemmGroupFwdXdlops:0.1929,1671424,miopenConvolutionFwdAlgoImplicitGEMM
96-1-32-48-1x1x1-192-1-32-48-1-0x0x0-1x1x1-1x1x1-0-NCDHW-BF16-F=GemmFwd1x1_0_1:0.0567614,0,miopenConvolutionFwdAlgoGEMM;GemmFwd1x1_0_1_hipblaslt:0.0150414,0,miopenConvolutionFwdAlgoGEMM;ConvHipImplicitGemm3DGroupFwdXdlops:0.17201,921600,miopenConvolutionFwdAlgoImplicitGEMM
96-3-34-50-3x3x3-192-1-32-48-1-0x0x0-1x1x1-1x1x1-0-NCDHW-BF16-F=GemmFwdRest:0.259552,7962624,miopenConvolutionFwdAlgoGEMM;ConvHipImplicitGemm3DGroupFwdXdlops:0.39021,2564352,miopenConvolutionFwdAlgoImplicitGEMM;GemmFwdRest_hipblaslt:0.220093,7962624,miopenConvolutionFwdAlgoGEMM
192-3-34-50-3x3x3-192-1-32-48-1-0x0x0-1x1x1-1x1x1-0-NCDHW-BF16-F=GemmFwdRest:0.466337,15925248,miopenConvolutionFwdAlgoGEMM;ConvHipImplicitGemm3DGroupFwdXdlops:0.634057,4538880,miopenConvolutionFwdAlgoImplicitGEMM;GemmFwdRest_hipblaslt:0.432293,15925248,miopenConvolutionFwdAlgoGEMM
192-33-49-3x3-192-16-24-1-0x0-2x2-1x1-0-NCHW-BF16-F=GemmFwdRest:0.112034,1327104,miopenConvolutionFwdAlgoGEMM;GemmFwdRest_hipblaslt:0.08605,1327104,miopenConvolutionFwdAlgoGEMM;ConvHipImplicitGemmGroupFwdXdlops:0.200072,1432064,miopenConvolutionFwdAlgoImplicitGEMM
192-1-16-24-1x1x1-384-1-16-24-1-0x0x0-1x1x1-1x1x1-0-NCDHW-BF16-F=GemmFwd1x1_0_1:0.0400486,0,miopenConvolutionFwdAlgoGEMM;GemmFwd1x1_0_1_hipblaslt:0.0249483,0,miopenConvolutionFwdAlgoGEMM;ConvHipImplicitGemm3DGroupFwdXdlops:0.162124,589824,miopenConvolutionFwdAlgoImplicitGEMM
192-3-18-26-3x3x3-384-1-16-24-1-0x0x0-1x1x1-1x1x1-0-NCDHW-BF16-F=GemmFwdRest:0.22128,3981312,miopenConvolutionFwdAlgoGEMM;ConvHipImplicitGemm3DGroupFwdXdlops:0.44238,4815360,miopenConvolutionFwdAlgoImplicitGEMM;GemmFwdRest_hipblaslt:0.208223,3981312,miopenConvolutionFwdAlgoGEMM
384-3-18-26-3x3x3-384-1-16-24-1-0x0x0-1x1x1-1x1x1-0-NCDHW-BF16-F=GemmFwdRest:0.403368,7962624,miopenConvolutionFwdAlgoGEMM;ConvHipImplicitGemm3DGroupFwdXdlops:0.780237,9335808,miopenConvolutionFwdAlgoImplicitGEMM;GemmFwdRest_hipblaslt:0.370363,7962624,miopenConvolutionFwdAlgoGEMM
384-17-25-3x3-384-8-12-1-0x0-2x2-1x1-0-NCHW-BF16-F=GemmFwdRest:0.141695,663552,miopenConvolutionFwdAlgoGEMM;GemmFwdRest_hipblaslt:0.0939517,663552,miopenConvolutionFwdAlgoGEMM;ConvHipImplicitGemmGroupFwdXdlops:0.237439,3054336,miopenConvolutionFwdAlgoImplicitGEMM
384-3-10-14-3x3x3-384-1-8-12-1-0x0x0-1x1x1-1x1x1-0-NCDHW-BF16-F=GemmFwdRest:0.303968,1990656,miopenConvolutionFwdAlgoGEMM;ConvHipImplicitGemm3DGroupFwdXdlops:0.555834,8358912,miopenConvolutionFwdAlgoImplicitGEMM;GemmFwdRest_hipblaslt:0.165888,1990656,miopenConvolutionFwdAlgoGEMM
384-8-12-1x1-1152-8-12-1-0x0-1x1-1x1-0-NCHW-BF16-F=GemmFwd1x1_0_1:0.0367929,0,miopenConvolutionFwdAlgoGEMM;GemmFwd1x1_0_1_hipblaslt:0.0296743,0,miopenConvolutionFwdAlgoGEMM;ConvHipImplicitGemmGroupFwdXdlops:0.170812,1179648,miopenConvolutionFwdAlgoImplicitGEMM
384-8-12-1x1-384-8-12-1-0x0-1x1-1x1-0-NCHW-BF16-F=GemmFwd1x1_0_1:0.0838514,0,miopenConvolutionFwdAlgoGEMM;GemmFwd1x1_0_1_hipblaslt:0.0278617,0,miopenConvolutionFwdAlgoGEMM;ConvHipImplicitGemmGroupFwdXdlops:0.146961,442368,miopenConvolutionFwdAlgoImplicitGEMM
384-3-10-14-3x3x3-32-1-8-12-1-0x0x0-1x1x1-1x1x1-0-NCDHW-BF16-F=GemmFwdRest:0.329346,1990656,miopenConvolutionFwdAlgoGEMM;ConvHipImplicitGemm3DGroupFwdXdlops:0.549744,992256,miopenConvolutionFwdAlgoImplicitGEMM;GemmFwdRest_hipblaslt:0.161573,1990656,miopenConvolutionFwdAlgoGEMM
32-1-8-12-1x1x1-32-1-8-12-1-0x0x0-1x1x1-1x1x1-0-NCDHW-BF16-F=GemmFwd1x1_0_1:0.0561514,0,miopenConvolutionFwdAlgoGEMM;GemmFwd1x1_0_1_hipblaslt:0.0186743,0,miopenConvolutionFwdAlgoGEMM;ConvHipImplicitGemm3DGroupFwdXdlops:0.133445,14336,miopenConvolutionFwdAlgoImplicitGEMM
16-1-32-32-1x1x1-16-1-32-32-1-0x0x0-1x1x1-1x1x1-0-NCDHW-BF16-F=GemmFwd1x1_0_1:0.0175029,0,miopenConvolutionFwdAlgoGEMM;GemmFwd1x1_0_1_hipblaslt:0.0219117,0,miopenConvolutionFwdAlgoGEMM;ConvHipImplicitGemm3DGroupFwdXdlops:0.117203,66048,miopenConvolutionFwdAlgoImplicitGEMM
16-3-34-34-3x3x3-384-1-32-32-1-0x0x0-1x1x1-1x1x1-0-NCDHW-BF16-F=GemmFwdRest:0.107923,884736,miopenConvolutionFwdAlgoGEMM;ConvHipImplicitGemm3DGroupFwdXdlops:0.198576,1229312,miopenConvolutionFwdAlgoImplicitGEMM;GemmFwdRest_hipblaslt:0.0859157,884736,miopenConvolutionFwdAlgoGEMM
384-64-64-3x3-192-64-64-1-1x1-1x1-1x1-0-NCHW-BF16-F=GemmFwdRest:0.377288,28311552,miopenConvolutionFwdAlgoGEMM;GemmFwdRest_hipblaslt:0.411522,28311552,miopenConvolutionFwdAlgoGEMM;ConvHipImplicitGemmGroupFwdXdlops:0.786463,6045696,miopenConvolutionFwdAlgoImplicitGEMM
384-128-128-3x3-192-128-128-1-1x1-1x1-1x1-0-NCHW-BF16-F=GemmFwdRest:1.8197,113246208,miopenConvolutionFwdAlgoGEMM;GemmFwdRest_hipblaslt:1.72203,113246208,miopenConvolutionFwdAlgoGEMM;ConvHipImplicitGemmGroupFwdXdlops:2.7722,20201472,miopenConvolutionFwdAlgoImplicitGEMM
192-256-256-3x3-96-256-256-1-1x1-1x1-1x1-0-NCHW-BF16-F=GemmFwdRest:2.81431,226492416,miopenConvolutionFwdAlgoGEMM;GemmFwdRest_hipblaslt:2.9417,226492416,miopenConvolutionFwdAlgoGEMM;ConvHipImplicitGemmGroupFwdXdlops:3.83418,38080512,miopenConvolutionFwdAlgoImplicitGEMM
96-3-258-258-3x3x3-3-1-256-256-1-0x0x0-1x1x1-1x1x1-0-NCDHW-BF16-F=GemmFwdRest:7.75455,339738624,miopenConvolutionFwdAlgoGEMM;ConvHipImplicitGemm3DGroupFwdXdlops:3.71214,38749696,miopenConvolutionFwdAlgoImplicitGEMM;GemmFwdRest_hipblaslt:7.90668,339738624,miopenConvolutionFwdAlgoGEMM
16-1-32-8-1x1x1-16-1-32-8-1-0x0x0-1x1x1-1x1x1-0-NCDHW-BF16-F=GemmFwd1x1_0_1:0.0194029,0,miopenConvolutionFwdAlgoGEMM;GemmFwd1x1_0_1_hipblaslt:0.02195,0,miopenConvolutionFwdAlgoGEMM;ConvHipImplicitGemm3DGroupFwdXdlops:0.135986,16896,miopenConvolutionFwdAlgoImplicitGEMM
16-3-34-10-3x3x3-384-1-32-8-1-0x0x0-1x1x1-1x1x1-0-NCDHW-BF16-F=GemmFwdRest:0.104628,221184,miopenConvolutionFwdAlgoGEMM;ConvHipImplicitGemm3DGroupFwdXdlops:0.176326,561152,miopenConvolutionFwdAlgoImplicitGEMM;GemmFwdRest_hipblaslt:0.0601967,221184,miopenConvolutionFwdAlgoGEMM
384-3-34-10-3x3x3-384-1-32-8-1-0x0x0-1x1x1-1x1x1-0-NCDHW-BF16-F=GemmFwdRest:0.342105,5308416,miopenConvolutionFwdAlgoGEMM;ConvHipImplicitGemm3DGroupFwdXdlops:0.789737,8942592,miopenConvolutionFwdAlgoImplicitGEMM;GemmFwdRest_hipblaslt:0.266213,5308416,miopenConvolutionFwdAlgoGEMM
384-32-8-1x1-1152-32-8-1-0x0-1x1-1x1-0-NCHW-BF16-F=GemmFwd1x1_0_1:0.0304783,0,miopenConvolutionFwdAlgoGEMM;GemmFwd1x1_0_1_hipblaslt:0.02945,0,miopenConvolutionFwdAlgoGEMM;ConvHipImplicitGemmGroupFwdXdlops:0.218314,1671168,miopenConvolutionFwdAlgoImplicitGEMM
384-32-8-1x1-384-32-8-1-0x0-1x1-1x1-0-NCHW-BF16-F=GemmFwd1x1_0_1:0.021984,0,miopenConvolutionFwdAlgoGEMM;GemmFwd1x1_0_1_hipblaslt:0.01301,0,miopenConvolutionFwdAlgoGEMM;ConvHipImplicitGemmGroupFwdXdlops:0.160318,688128,miopenConvolutionFwdAlgoImplicitGEMM
384-64-16-3x3-192-64-16-1-1x1-1x1-1x1-0-NCHW-BF16-F=GemmFwdRest:0.160528,7077888,miopenConvolutionFwdAlgoGEMM;GemmFwdRest_hipblaslt:0.141297,7077888,miopenConvolutionFwdAlgoGEMM;ConvHipImplicitGemmGroupFwdXdlops:0.31061,2506752,miopenConvolutionFwdAlgoImplicitGEMM
192-1-64-16-1x1x1-384-1-64-16-1-0x0x0-1x1x1-1x1x1-0-NCDHW-BF16-F=GemmFwd1x1_0_1:0.0529214,0,miopenConvolutionFwdAlgoGEMM;GemmFwd1x1_0_1_hipblaslt:0.0264871,0,miopenConvolutionFwdAlgoGEMM;ConvHipImplicitGemm3DGroupFwdXdlops:0.167702,1327104,miopenConvolutionFwdAlgoImplicitGEMM
192-3-66-18-3x3x3-384-1-64-16-1-0x0x0-1x1x1-1x1x1-0-NCDHW-BF16-F=GemmFwdRest:0.370604,10616832,miopenConvolutionFwdAlgoGEMM;ConvHipImplicitGemm3DGroupFwdXdlops:0.759355,6136320,miopenConvolutionFwdAlgoImplicitGEMM;GemmFwdRest_hipblaslt:0.422321,10616832,miopenConvolutionFwdAlgoGEMM
384-3-66-18-3x3x3-384-1-64-16-1-0x0x0-1x1x1-1x1x1-0-NCDHW-BF16-F=GemmFwdRest:0.731437,21233664,miopenConvolutionFwdAlgoGEMM;ConvHipImplicitGemm3DGroupFwdXdlops:1.38696,11486208,miopenConvolutionFwdAlgoImplicitGEMM;GemmFwdRest_hipblaslt:0.814212,21233664,miopenConvolutionFwdAlgoGEMM
384-128-32-3x3-192-128-32-1-1x1-1x1-1x1-0-NCHW-BF16-F=GemmFwdRest:0.416647,28311552,miopenConvolutionFwdAlgoGEMM;GemmFwdRest_hipblaslt:0.419504,28311552,miopenConvolutionFwdAlgoGEMM;ConvHipImplicitGemmGroupFwdXdlops:0.818101,6045696,miopenConvolutionFwdAlgoImplicitGEMM
192-3-130-34-3x3x3-192-1-128-32-1-0x0x0-1x1x1-1x1x1-0-NCDHW-BF16-F=GemmFwdRest:1.16663,42467328,miopenConvolutionFwdAlgoGEMM;ConvHipImplicitGemm3DGroupFwdXdlops:1.48398,8655360,miopenConvolutionFwdAlgoImplicitGEMM;GemmFwdRest_hipblaslt:1.23217,42467328,miopenConvolutionFwdAlgoGEMM
192-256-64-3x3-96-256-64-1-1x1-1x1-1x1-0-NCHW-BF16-F=GemmFwdRest:0.848374,56623104,miopenConvolutionFwdAlgoGEMM;GemmFwdRest_hipblaslt:0.81777,56623104,miopenConvolutionFwdAlgoGEMM;ConvHipImplicitGemmGroupFwdXdlops:0.987113,9768960,miopenConvolutionFwdAlgoImplicitGEMM
96-3-258-66-3x3x3-96-1-256-64-1-0x0x0-1x1x1-1x1x1-0-NCDHW-BF16-F=GemmFwdRest:2.13188,84934656,miopenConvolutionFwdAlgoGEMM;ConvHipImplicitGemm3DGroupFwdXdlops:1.81607,13451520,miopenConvolutionFwdAlgoImplicitGEMM;GemmFwdRest_hipblaslt:2.14702,84934656,miopenConvolutionFwdAlgoGEMM
96-3-258-66-3x3x3-3-1-256-64-1-0x0x0-1x1x1-1x1x1-0-NCDHW-BF16-F=GemmFwdRest:2.11803,84934656,miopenConvolutionFwdAlgoGEMM;ConvHipImplicitGemm3DGroupFwdXdlops:0.9711,9922048,miopenConvolutionFwdAlgoImplicitGEMM;GemmFwdRest_hipblaslt:2.07563,84934656,miopenConvolutionFwdAlgoGEMM
16-1-24-32-1x1x1-16-1-24-32-1-0x0x0-1x1x1-1x1x1-0-NCDHW-BF16-F=GemmFwd1x1_0_1_hipblaslt:0.0417267,0,miopenConvolutionFwdAlgoGEMM;ConvHipImplicitGemm3DGroupFwdXdlops:0.187287,49664,miopenConvolutionFwdAlgoImplicitGEMM
16-3-26-34-3x3x3-384-1-24-32-1-0x0x0-1x1x1-1x1x1-0-NCDHW-BF16-F=GemmFwdRest:0.097205,663552,miopenConvolutionFwdAlgoGEMM;ConvHipImplicitGemm3DGroupFwdXdlops:0.183845,1006592,miopenConvolutionFwdAlgoImplicitGEMM;GemmFwdRest_hipblaslt:0.0889214,663552,miopenConvolutionFwdAlgoGEMM
384-3-26-34-3x3x3-384-1-24-32-1-0x0x0-1x1x1-1x1x1-0-NCDHW-BF16-F=GemmFwdRest:0.561093,15925248,miopenConvolutionFwdAlgoGEMM;ConvHipImplicitGemm3DGroupFwdXdlops:1.112,10589184,miopenConvolutionFwdAlgoImplicitGEMM;GemmFwdRest_hipblaslt:0.765109,15925248,miopenConvolutionFwdAlgoGEMM
384-24-32-1x1-1152-24-32-1-0x0-1x1-1x1-0-NCHW-BF16-F=GemmFwd1x1_0_1:0.0374883,0,miopenConvolutionFwdAlgoGEMM;GemmFwd1x1_0_1_hipblaslt:0.0542967,0,miopenConvolutionFwdAlgoGEMM;ConvHipImplicitGemmGroupFwdXdlops:0.239403,3244032,miopenConvolutionFwdAlgoImplicitGEMM
384-24-32-1x1-384-24-32-1-0x0-1x1-1x1-0-NCHW-BF16-F=GemmFwd1x1_0_1:0.0282871,0,miopenConvolutionFwdAlgoGEMM;GemmFwd1x1_0_1_hipblaslt:0.035734,0,miopenConvolutionFwdAlgoGEMM;ConvHipImplicitGemmGroupFwdXdlops:0.17834,1474560,miopenConvolutionFwdAlgoImplicitGEMM
384-48-64-3x3-192-48-64-1-1x1-1x1-1x1-0-NCHW-BF16-F=GemmFwdRest:0.290497,21233664,miopenConvolutionFwdAlgoGEMM;GemmFwdRest_hipblaslt:0.28213,21233664,miopenConvolutionFwdAlgoGEMM;ConvHipImplicitGemmGroupFwdXdlops:0.623496,4866048,miopenConvolutionFwdAlgoImplicitGEMM
192-1-48-64-1x1x1-384-1-48-64-1-0x0x0-1x1x1-1x1x1-0-NCDHW-BF16-F=GemmFwd1x1_0_1:0.0760857,0,miopenConvolutionFwdAlgoGEMM;GemmFwd1x1_0_1_hipblaslt:0.0429,0,miopenConvolutionFwdAlgoGEMM;ConvHipImplicitGemm3DGroupFwdXdlops:0.231025,3686400,miopenConvolutionFwdAlgoImplicitGEMM
192-3-50-66-3x3x3-384-1-48-64-1-0x0x0-1x1x1-1x1x1-0-NCDHW-BF16-F=GemmFwdRest:1.23655,31850496,miopenConvolutionFwdAlgoGEMM;ConvHipImplicitGemm3DGroupFwdXdlops:2.02389,10142208,miopenConvolutionFwdAlgoImplicitGEMM;GemmFwdRest_hipblaslt:1.10818,31850496,miopenConvolutionFwdAlgoGEMM
384-3-50-66-3x3x3-384-1-48-64-1-0x0x0-1x1x1-1x1x1-0-NCDHW-BF16-F=GemmFwdRest:2.15302,63700992,miopenConvolutionFwdAlgoGEMM;ConvHipImplicitGemm3DGroupFwdXdlops:3.97484,17925120,miopenConvolutionFwdAlgoImplicitGEMM;GemmFwdRest_hipblaslt:2.20212,63700992,miopenConvolutionFwdAlgoGEMM
384-96-128-3x3-192-96-128-1-1x1-1x1-1x1-0-NCHW-BF16-F=GemmFwdRest:1.31745,84934656,miopenConvolutionFwdAlgoGEMM;GemmFwdRest_hipblaslt:1.33129,84934656,miopenConvolutionFwdAlgoGEMM;ConvHipImplicitGemmGroupFwdXdlops:2.10448,15482880,miopenConvolutionFwdAlgoImplicitGEMM
192-3-98-130-3x3x3-192-1-96-128-1-0x0x0-1x1x1-1x1x1-0-NCDHW-BF16-F=GemmFwdRest:3.52831,127401984,miopenConvolutionFwdAlgoGEMM;ConvHipImplicitGemm3DGroupFwdXdlops:4.04724,21385728,miopenConvolutionFwdAlgoImplicitGEMM;GemmFwdRest_hipblaslt:3.44124,127401984,miopenConvolutionFwdAlgoGEMM
192-192-256-3x3-96-192-256-1-1x1-1x1-1x1-0-NCHW-BF16-F=GemmFwdRest:2.08713,169869312,miopenConvolutionFwdAlgoGEMM;GemmFwdRest_hipblaslt:2.15933,169869312,miopenConvolutionFwdAlgoGEMM;ConvHipImplicitGemmGroupFwdXdlops:2.85046,28643328,miopenConvolutionFwdAlgoImplicitGEMM
96-3-194-258-3x3x3-96-1-192-256-1-0x0x0-1x1x1-1x1x1-0-NCDHW-BF16-F=GemmFwdRest:6.09443,254803968,miopenConvolutionFwdAlgoGEMM;ConvHipImplicitGemm3DGroupFwdXdlops:5.38875,38764800,miopenConvolutionFwdAlgoImplicitGEMM;GemmFwdRest_hipblaslt:6.23552,254803968,miopenConvolutionFwdAlgoGEMM
96-3-194-258-3x3x3-3-1-192-256-1-0x0x0-1x1x1-1x1x1-0-NCDHW-BF16-F=GemmFwdRest:5.76683,254803968,miopenConvolutionFwdAlgoGEMM;ConvHipImplicitGemm3DGroupFwdXdlops:2.65807,29140480,miopenConvolutionFwdAlgoImplicitGEMM;GemmFwdRest_hipblaslt:5.73794,254803968,miopenConvolutionFwdAlgoGEMM
16-1-24-8-1x1x1-16-1-24-8-1-0x0x0-1x1x1-1x1x1-0-NCDHW-BF16-F=GemmFwd1x1_0_1:0.0281133,0,miopenConvolutionFwdAlgoGEMM;GemmFwd1x1_0_1_hipblaslt:0.035176,0,miopenConvolutionFwdAlgoGEMM;ConvHipImplicitGemm3DGroupFwdXdlops:0.229462,12800,miopenConvolutionFwdAlgoImplicitGEMM
16-3-26-10-3x3x3-384-1-24-8-1-0x0x0-1x1x1-1x1x1-0-NCDHW-BF16-F=GemmFwdRest:0.106579,165888,miopenConvolutionFwdAlgoGEMM;ConvHipImplicitGemm3DGroupFwdXdlops:0.163756,504320,miopenConvolutionFwdAlgoImplicitGEMM;GemmFwdRest_hipblaslt:0.0614167,165888,miopenConvolutionFwdAlgoGEMM
384-3-26-10-3x3x3-384-1-24-8-1-0x0x0-1x1x1-1x1x1-0-NCDHW-BF16-F=GemmFwdRest:0.323894,3981312,miopenConvolutionFwdAlgoGEMM;ConvHipImplicitGemm3DGroupFwdXdlops:0.540938,8709120,miopenConvolutionFwdAlgoImplicitGEMM;GemmFwdRest_hipblaslt:0.237353,3981312,miopenConvolutionFwdAlgoGEMM
384-24-8-1x1-1152-24-8-1-0x0-1x1-1x1-0-NCHW-BF16-F=GemmFwd1x1_0_1:0.0318267,0,miopenConvolutionFwdAlgoGEMM;GemmFwd1x1_0_1_hipblaslt:0.0294617,0,miopenConvolutionFwdAlgoGEMM;ConvHipImplicitGemmGroupFwdXdlops:0.177079,1474560,miopenConvolutionFwdAlgoImplicitGEMM
384-24-8-1x1-384-24-8-1-0x0-1x1-1x1-0-NCHW-BF16-F=GemmFwd1x1_0_1:0.0803714,0,miopenConvolutionFwdAlgoGEMM;GemmFwd1x1_0_1_hipblaslt:0.020755,0,miopenConvolutionFwdAlgoGEMM;ConvHipImplicitGemmGroupFwdXdlops:0.152007,589824,miopenConvolutionFwdAlgoImplicitGEMM
384-48-16-3x3-192-48-16-1-1x1-1x1-1x1-0-NCHW-BF16-F=GemmFwdRest:0.151153,5308416,miopenConvolutionFwdAlgoGEMM;GemmFwdRest_hipblaslt:0.132548,5308416,miopenConvolutionFwdAlgoGEMM;ConvHipImplicitGemmGroupFwdXdlops:0.266295,2211840,miopenConvolutionFwdAlgoImplicitGEMM
192-1-48-16-1x1x1-384-1-48-16-1-0x0x0-1x1x1-1x1x1-0-NCDHW-BF16-F=GemmFwd1x1_0_1:0.0633333,0,miopenConvolutionFwdAlgoGEMM;GemmFwd1x1_0_1_hipblaslt:0.0395686,0,miopenConvolutionFwdAlgoGEMM;ConvHipImplicitGemm3DGroupFwdXdlops:0.172185,1032192,miopenConvolutionFwdAlgoImplicitGEMM
192-3-50-18-3x3x3-384-1-48-16-1-0x0x0-1x1x1-1x1x1-0-NCDHW-BF16-F=GemmFwdRest:0.299081,7962624,miopenConvolutionFwdAlgoGEMM;ConvHipImplicitGemm3DGroupFwdXdlops:0.642752,5607936,miopenConvolutionFwdAlgoImplicitGEMM;GemmFwdRest_hipblaslt:0.390387,7962624,miopenConvolutionFwdAlgoGEMM
384-3-50-18-3x3x3-384-1-48-16-1-0x0x0-1x1x1-1x1x1-0-NCDHW-BF16-F=GemmFwdRest:0.566017,15925248,miopenConvolutionFwdAlgoGEMM;ConvHipImplicitGemm3DGroupFwdXdlops:1.13724,10626048,miopenConvolutionFwdAlgoImplicitGEMM;GemmFwdRest_hipblaslt:0.765791,15925248,miopenConvolutionFwdAlgoGEMM
384-96-32-3x3-192-96-32-1-1x1-1x1-1x1-0-NCHW-BF16-F=GemmFwdRest:0.263282,21233664,miopenConvolutionFwdAlgoGEMM;GemmFwdRest_hipblaslt:0.291315,21233664,miopenConvolutionFwdAlgoGEMM;ConvHipImplicitGemmGroupFwdXdlops:0.631888,4866048,miopenConvolutionFwdAlgoImplicitGEMM
192-3-98-34-3x3x3-192-1-96-32-1-0x0x0-1x1x1-1x1x1-0-NCDHW-BF16-F=GemmFwdRest:0.807214,31850496,miopenConvolutionFwdAlgoGEMM;ConvHipImplicitGemm3DGroupFwdXdlops:1.18953,7008768,miopenConvolutionFwdAlgoImplicitGEMM;GemmFwdRest_hipblaslt:0.85066,31850496,miopenConvolutionFwdAlgoGEMM
192-192-64-3x3-96-192-64-1-1x1-1x1-1x1-0-NCHW-BF16-F=GemmFwdRest:0.601207,42467328,miopenConvolutionFwdAlgoGEMM;GemmFwdRest_hipblaslt:0.61808,42467328,miopenConvolutionFwdAlgoGEMM;ConvHipImplicitGemmGroupFwdXdlops:0.785087,7409664,miopenConvolutionFwdAlgoImplicitGEMM
96-3-194-66-3x3x3-96-1-192-64-1-0x0x0-1x1x1-1x1x1-0-NCDHW-BF16-F=GemmFwdRest:1.52689,63700992,miopenConvolutionFwdAlgoGEMM;ConvHipImplicitGemm3DGroupFwdXdlops:1.51789,10232064,miopenConvolutionFwdAlgoImplicitGEMM;GemmFwdRest_hipblaslt:1.66685,63700992,miopenConvolutionFwdAlgoGEMM
96-3-194-66-3x3x3-3-1-192-64-1-0x0x0-1x1x1-1x1x1-0-NCDHW-BF16-F=GemmFwdRest:1.44143,63700992,miopenConvolutionFwdAlgoGEMM;ConvHipImplicitGemm3DGroupFwdXdlops:0.795673,7464448,miopenConvolutionFwdAlgoImplicitGEMM;GemmFwdRest_hipblaslt:1.54488,63700992,miopenConvolutionFwdAlgoGEMM
16-64-64-2x2-1536-32-32-2-0x0-2x2-1x1-0-NCHW-FP16-F=GemmFwdRest:0.123108,131072,miopenConvolutionFwdAlgoGEMM;GemmFwdRest_hipblaslt:0.159723,131072,miopenConvolutionFwdAlgoGEMM;ConvHipImplicitGemmGroupFwdXdlops:0.26599,6750208,miopenConvolutionFwdAlgoImplicitGEMM;ConvBinWinogradRxSf3x2:0.122917,0,miopenConvolutionFwdAlgoWinograd;ConvBinWinogradRxSf2x3g1:0.165686,0,miopenConvolutionFwdAlgoWinograd
16-64-64-3x3-512-64-64-1-1x1-1x1-1x1-0-NCHW-FP16-F=GemmFwdRest:0.103255,1179648,miopenConvolutionFwdAlgoGEMM;GemmFwdRest_hipblaslt:0.113404,1179648,miopenConvolutionFwdAlgoGEMM;ConvHipImplicitGemmGroupFwdXdlops:0.247604,4472832,miopenConvolutionFwdAlgoImplicitGEMM;ConvBinWinogradRxSf3x2:0.101643,0,miopenConvolutionFwdAlgoWinograd;ConvBinWinogradRxSf2x3g1:0.0827333,0,miopenConvolutionFwdAlgoWinograd
512-64-64-3x3-512-64-64-1-1x1-1x1-1x1-0-NCHW-FP16-F=GemmFwdRest:1.01342,37748736,miopenConvolutionFwdAlgoGEMM;GemmFwdRest_hipblaslt:1.74948,37748736,miopenConvolutionFwdAlgoGEMM;ConvHipImplicitGemmGroupFwdXdlops:2.41274,13107200,miopenConvolutionFwdAlgoImplicitGEMM;ConvBinWinogradRxSf3x2:1.28753,0,miopenConvolutionFwdAlgoWinograd;ConvBinWinogradRxSf2x3g1:0.7279,0,miopenConvolutionFwdAlgoWinograd
512-128-128-3x3-512-128-128-1-1x1-1x1-1x1-0-NCHW-FP16-F=GemmFwdRest:11.7405,150994944,miopenConvolutionFwdAlgoGEMM;GemmFwdRest_hipblaslt:17.5647,150994944,miopenConvolutionFwdAlgoGEMM;ConvHipImplicitGemmGroupFwdXdlops:9.84556,38273024,miopenConvolutionFwdAlgoImplicitGEMM;ConvBinWinogradRxSf3x2:4.69115,0,miopenConvolutionFwdAlgoWinograd;ConvBinWinogradRxSf2x3g1:2.73694,0,miopenConvolutionFwdAlgoWinograd
512-256-256-3x3-512-256-256-1-1x1-1x1-1x1-0-NCHW-FP16-F=GemmFwdRest:53.3099,603979776,miopenConvolutionFwdAlgoGEMM;GemmFwdRest_hipblaslt:80.5993,603979776,miopenConvolutionFwdAlgoGEMM;ConvHipImplicitGemmGroupFwdXdlops:41.2169,138936320,miopenConvolutionFwdAlgoImplicitGEMM;ConvBinWinogradRxSf3x2:29.5339,0,miopenConvolutionFwdAlgoWinograd;ConvBinWinogradRxSf2x3g1:28.1478,0,miopenConvolutionFwdAlgoWinograd
512-256-256-3x3-256-256-256-1-1x1-1x1-1x1-0-NCHW-FP16-F=GemmFwdRest:23.0921,603979776,miopenConvolutionFwdAlgoGEMM;GemmFwdRest_hipblaslt:40.4977,603979776,miopenConvolutionFwdAlgoGEMM;ConvHipImplicitGemmGroupFwdXdlops:21.4849,103022592,miopenConvolutionFwdAlgoImplicitGEMM;ConvBinWinogradRxSf3x2:15.262,0,miopenConvolutionFwdAlgoWinograd;ConvBinWinogradRxSf2x3g1:14.9049,0,miopenConvolutionFwdAlgoWinograd
256-256-256-3x3-256-256-256-1-1x1-1x1-1x1-0-NCHW-FP16-F=GemmFwdRest:6.96972,301989888,miopenConvolutionFwdAlgoGEMM;GemmFwdRest_hipblaslt:13.9148,301989888,miopenConvolutionFwdAlgoGEMM;ConvHipImplicitGemmGroupFwdXdlops:10.5552,68288512,miopenConvolutionFwdAlgoImplicitGEMM;ConvBinWinogradRxSf3x2:4.75413,0,miopenConvolutionFwdAlgoWinograd;ConvBinWinogradRxSf2x3g1:5.02259,0,miopenConvolutionFwdAlgoWinograd
512-256-256-1x1-256-256-256-1-0x0-1x1-1x1-0-NCHW-FP16-F=ConvBinWinogradRxSf2x3g1:9.3432,0,miopenConvolutionFwdAlgoWinograd;GemmFwd1x1_0_1:1.39844,0,miopenConvolutionFwdAlgoGEMM;ConvBinWinogradRxSf3x2:4.90697,0,miopenConvolutionFwdAlgoWinograd;GemmFwd1x1_0_1_hipblaslt:2.7543,0,miopenConvolutionFwdAlgoGEMM;ConvHipImplicitGemmGroupFwdXdlops:4.47126,100925440,miopenConvolutionFwdAlgoImplicitGEMM
256-512-512-3x3-256-512-512-1-1x1-1x1-1x1-0-NCHW-FP16-F=GemmFwdRest:30.3727,1207959552,miopenConvolutionFwdAlgoGEMM;GemmFwdRest_hipblaslt:60.3266,1207959552,miopenConvolutionFwdAlgoGEMM;ConvHipImplicitGemmGroupFwdXdlops:42.5033,269615104,miopenConvolutionFwdAlgoImplicitGEMM;ConvBinWinogradRxSf3x2:25.5737,0,miopenConvolutionFwdAlgoWinograd;ConvBinWinogradRxSf2x3g1:22.2115,0,miopenConvolutionFwdAlgoWinograd
256-512-512-3x3-128-512-512-1-1x1-1x1-1x1-0-NCHW-FP16-F=GemmFwdRest:25.7676,1207959552,miopenConvolutionFwdAlgoGEMM;GemmFwdRest_hipblaslt:48.2486,1207959552,miopenConvolutionFwdAlgoGEMM;ConvHipImplicitGemmGroupFwdXdlops:22.2231,201916416,miopenConvolutionFwdAlgoImplicitGEMM;ConvBinWinogradRxSf3x2:15.6211,0,miopenConvolutionFwdAlgoWinograd;ConvBinWinogradRxSf2x3g1:14.2841,0,miopenConvolutionFwdAlgoWinograd
128-512-512-3x3-128-512-512-1-1x1-1x1-1x1-0-NCHW-FP16-F=GemmFwdRest:12.047,603979776,miopenConvolutionFwdAlgoGEMM;GemmFwdRest_hipblaslt:24.0685,603979776,miopenConvolutionFwdAlgoGEMM;ConvHipImplicitGemmGroupFwdXdlops:11.5141,134512640,miopenConvolutionFwdAlgoImplicitGEMM;ConvBinWinogradRxSf3x2:7.35482,0,miopenConvolutionFwdAlgoWinograd;ConvBinWinogradRxSf2x3g1:6.8487,0,miopenConvolutionFwdAlgoWinograd
256-512-512-1x1-128-512-512-1-0x0-1x1-1x1-0-NCHW-FP16-F=ConvBinWinogradRxSf2x3g1:7.84967,0,miopenConvolutionFwdAlgoWinograd;GemmFwd1x1_0_1:1.50404,0,miopenConvolutionFwdAlgoGEMM;ConvBinWinogradRxSf3x2:4.91686,0,miopenConvolutionFwdAlgoWinograd;GemmFwd1x1_0_1_hipblaslt:2.88277,0,miopenConvolutionFwdAlgoGEMM;ConvHipImplicitGemmGroupFwdXdlops:6.33459,201392128,miopenConvolutionFwdAlgoImplicitGEMM
128-512-512-3x3-3-512-512-1-1x1-1x1-1x1-0-NCHW-FP16-F=GemmFwdRest:8.11545,603979776,miopenConvolutionFwdAlgoGEMM;GemmFwdRest_hipblaslt:10.4964,603979776,miopenConvolutionFwdAlgoGEMM;ConvHipImplicitGemmGroupFwdXdlops:5.28316,68688640,miopenConvolutionFwdAlgoImplicitGEMM;ConvBinWinogradRxSf3x2:1.13549,0,miopenConvolutionFwdAlgoWinograd;ConvBinWinogradRxSf2x3g1:1.124,0,miopenConvolutionFwdAlgoWinograd
16-128-128-2x2-1536-64-64-2-0x0-2x2-1x1-0-NCHW-FP16-F=GemmFwdRest:0.183578,524288,miopenConvolutionFwdAlgoGEMM;GemmFwdRest_hipblaslt:0.28747,524288,miopenConvolutionFwdAlgoGEMM;ConvHipImplicitGemmGroupFwdXdlops:1.163,26411008,miopenConvolutionFwdAlgoImplicitGEMM;ConvBinWinogradRxSf3x2:0.3362,0,miopenConvolutionFwdAlgoWinograd;ConvBinWinogradRxSf2x3g1:0.6969,0,miopenConvolutionFwdAlgoWinograd
16-128-128-3x3-512-128-128-1-1x1-1x1-1x1-0-NCHW-FP16-F=GemmFwdRest:0.165376,4718592,miopenConvolutionFwdAlgoGEMM;GemmFwdRest_hipblaslt:0.263533,4718592,miopenConvolutionFwdAlgoGEMM;ConvHipImplicitGemmGroupFwdXdlops:0.627558,17448960,miopenConvolutionFwdAlgoImplicitGEMM;ConvBinWinogradRxSf3x2:0.216933,0,miopenConvolutionFwdAlgoWinograd;ConvBinWinogradRxSf2x3g1:0.16798,0,miopenConvolutionFwdAlgoWinograd
512-512-512-3x3-512-512-512-1-1x1-1x1-1x1-0-NCHW-FP16-F=GemmFwdRest:263.54,2415919104,miopenConvolutionFwdAlgoGEMM;GemmFwdRest_hipblaslt:401.223,2415919104,miopenConvolutionFwdAlgoGEMM;ConvHipImplicitGemmGroupFwdXdlops:171.159,541589504,miopenConvolutionFwdAlgoImplicitGEMM;ConvBinWinogradRxSf3x2:137.801,0,miopenConvolutionFwdAlgoWinograd;ConvBinWinogradRxSf2x3g1:125.005,0,miopenConvolutionFwdAlgoWinograd
512-512-512-3x3-256-512-512-1-1x1-1x1-1x1-0-NCHW-FP16-F=GemmFwdRest:123.823,2415919104,miopenConvolutionFwdAlgoGEMM;GemmFwdRest_hipblaslt:204.796,2415919104,miopenConvolutionFwdAlgoGEMM;ConvHipImplicitGemmGroupFwdXdlops:89.6819,405012480,miopenConvolutionFwdAlgoImplicitGEMM;ConvBinWinogradRxSf3x2:66.8956,0,miopenConvolutionFwdAlgoWinograd;ConvBinWinogradRxSf2x3g1:62.8597,0,miopenConvolutionFwdAlgoWinograd
512-512-512-1x1-256-512-512-1-0x0-1x1-1x1-0-NCHW-FP16-F=ConvBinWinogradRxSf2x3g1:36.5798,0,miopenConvolutionFwdAlgoWinograd;GemmFwd1x1_0_1:6.59573,0,miopenConvolutionFwdAlgoGEMM;ConvBinWinogradRxSf3x2:24.5129,0,miopenConvolutionFwdAlgoWinograd;GemmFwd1x1_0_1_hipblaslt:13.4857,0,miopenConvolutionFwdAlgoGEMM;ConvHipImplicitGemmGroupFwdXdlops:19.8078,402915328,miopenConvolutionFwdAlgoImplicitGEMM
256-1024-1024-3x3-256-1024-1024-1-1x1-1x1-1x1-0-NCHW-FP16-F=GemmFwdRest:126.268,4831838208,miopenConvolutionFwdAlgoGEMM;GemmFwdRest_hipblaslt:185.955,4831838208,miopenConvolutionFwdAlgoGEMM;ConvHipImplicitGemmGroupFwdXdlops:180.007,1074921472,miopenConvolutionFwdAlgoImplicitGEMM;ConvBinWinogradRxSf3x2:132.303,0,miopenConvolutionFwdAlgoWinograd;ConvBinWinogradRxSf2x3g1:125.593,0,miopenConvolutionFwdAlgoWinograd
256-1024-1024-3x3-128-1024-1024-1-1x1-1x1-1x1-0-NCHW-FP16-F=GemmFwdRest:121.938,4831838208,miopenConvolutionFwdAlgoGEMM;GemmFwdRest_hipblaslt:145.389,4831838208,miopenConvolutionFwdAlgoGEMM;ConvHipImplicitGemmGroupFwdXdlops:91.5984,805896192,miopenConvolutionFwdAlgoImplicitGEMM;ConvBinWinogradRxSf3x2:75.356,0,miopenConvolutionFwdAlgoWinograd;ConvBinWinogradRxSf2x3g1:72.9459,0,miopenConvolutionFwdAlgoWinograd
128-1024-1024-3x3-128-1024-1024-1-1x1-1x1-1x1-0-NCHW-FP16-F=GemmFwdRest:51.2922,2415919104,miopenConvolutionFwdAlgoGEMM;GemmFwdRest_hipblaslt:59.7281,2415919104,miopenConvolutionFwdAlgoGEMM;ConvHipImplicitGemmGroupFwdXdlops:46.9743,537165824,miopenConvolutionFwdAlgoImplicitGEMM;ConvBinWinogradRxSf3x2:34.5173,0,miopenConvolutionFwdAlgoWinograd;ConvBinWinogradRxSf2x3g1:32.9491,0,miopenConvolutionFwdAlgoWinograd
256-1024-1024-1x1-128-1024-1024-1-0x0-1x1-1x1-0-NCHW-FP16-F=ConvBinWinogradRxSf2x3g1:37.425,0,miopenConvolutionFwdAlgoWinograd;GemmFwd1x1_0_1:5.29596,0,miopenConvolutionFwdAlgoGEMM;ConvBinWinogradRxSf3x2:27.6327,0,miopenConvolutionFwdAlgoWinograd;GemmFwd1x1_0_1_hipblaslt:7.19865,0,miopenConvolutionFwdAlgoGEMM;ConvHipImplicitGemmGroupFwdXdlops:28.1847,805371904,miopenConvolutionFwdAlgoImplicitGEMM
128-1024-1024-3x3-3-1024-1024-1-1x1-1x1-1x1-0-NCHW-FP16-F=GemmFwdRest:36.7166,2415919104,miopenConvolutionFwdAlgoGEMM;GemmFwdRest_hipblaslt:39.7463,2415919104,miopenConvolutionFwdAlgoGEMM;ConvHipImplicitGemmGroupFwdXdlops:24.2965,274733824,miopenConvolutionFwdAlgoImplicitGEMM;ConvBinWinogradRxSf3x2:5.24656,0,miopenConvolutionFwdAlgoWinograd;ConvBinWinogradRxSf2x3g1:6.53901,0,miopenConvolutionFwdAlgoWinograd
16-128-128-2x2-1536-64-64-1-0x0-2x2-1x1-0-NCHW-FP16-F=GemmFwdRest:0.09886,524288,miopenConvolutionFwdAlgoGEMM;GemmFwdRest_hipblaslt:0.1453,524288,miopenConvolutionFwdAlgoGEMM;ConvHipImplicitGemmGroupFwdXdlops:0.398812,13303808,miopenConvolutionFwdAlgoImplicitGEMM;ConvBinWinogradRxSf3x2:0.1747,0,miopenConvolutionFwdAlgoWinograd;ConvBinWinogradRxSf2x3g1:0.3231,0,miopenConvolutionFwdAlgoWinograd
16-64-64-2x2-1536-32-32-1-0x0-2x2-1x1-0-NCHW-FP16-F=GemmFwdRest:0.109072,131072,miopenConvolutionFwdAlgoGEMM;GemmFwdRest_hipblaslt:0.091958,131072,miopenConvolutionFwdAlgoGEMM;ConvHipImplicitGemmGroupFwdXdlops:0.186054,3473408,miopenConvolutionFwdAlgoImplicitGEMM;ConvBinWinogradRxSf3x2:0.0887667,0,miopenConvolutionFwdAlgoWinograd;ConvBinWinogradRxSf2x3g1:0.110986,0,miopenConvolutionFwdAlgoWinograd
3-512-512-3x3-128-512-512-1-1x1-1x1-1x1-0-NCHW-FP16-F=GemmFwdRest:0.842131,14155776,miopenConvolutionFwdAlgoGEMM;GemmFwdRest_hipblaslt:0.898603,14155776,miopenConvolutionFwdAlgoGEMM;ConvHipImplicitGemmGroupFwdXdlops:2.43498,68688640,miopenConvolutionFwdAlgoImplicitGEMM;ConvBinWinogradRxSf3x2:0.8919,0,miopenConvolutionFwdAlgoWinograd;ConvBinWinogradRxSf2x3g1:0.4784,0,miopenConvolutionFwdAlgoWinograd
128-513-513-3x3-128-256-256-1-0x0-2x2-1x1-0-NCHW-FP16-F=GemmFwdRest:2.98693,150994944,miopenConvolutionFwdAlgoGEMM;GemmFwdRest_hipblaslt:6.03836,150994944,miopenConvolutionFwdAlgoGEMM;ConvHipImplicitGemmGroupFwdXdlops:4.39948,84443392,miopenConvolutionFwdAlgoImplicitGEMM;ConvBinWinogradRxSf3x2:1.7662,0,miopenConvolutionFwdAlgoWinograd;ConvBinWinogradRxSf2x3g1:3.26783,0,miopenConvolutionFwdAlgoWinograd
128-256-256-3x3-256-256-256-1-1x1-1x1-1x1-0-NCHW-FP16-F=GemmFwdRest:5.55177,150994944,miopenConvolutionFwdAlgoGEMM;GemmFwdRest_hipblaslt:9.42653,150994944,miopenConvolutionFwdAlgoGEMM;ConvHipImplicitGemmGroupFwdXdlops:5.74384,50921472,miopenConvolutionFwdAlgoImplicitGEMM;ConvBinWinogradRxSf3x2:2.62129,0,miopenConvolutionFwdAlgoWinograd;ConvBinWinogradRxSf2x3g1:1.68847,0,miopenConvolutionFwdAlgoWinograd
128-256-256-1x1-256-256-256-1-0x0-1x1-1x1-0-NCHW-FP16-F=ConvBinWinogradRxSf2x3g1:1.51694,0,miopenConvolutionFwdAlgoWinograd;GemmFwd1x1_0_1:0.568134,0,miopenConvolutionFwdAlgoGEMM;ConvBinWinogradRxSf3x2:0.805257,0,miopenConvolutionFwdAlgoWinograd;GemmFwd1x1_0_1_hipblaslt:0.425707,0,miopenConvolutionFwdAlgoGEMM;ConvHipImplicitGemmGroupFwdXdlops:1.84339,50397184,miopenConvolutionFwdAlgoImplicitGEMM
256-257-257-3x3-256-128-128-1-0x0-2x2-1x1-0-NCHW-FP16-F=GemmFwdRest:1.77436,75497472,miopenConvolutionFwdAlgoGEMM;GemmFwdRest_hipblaslt:3.13166,75497472,miopenConvolutionFwdAlgoGEMM;ConvHipImplicitGemmGroupFwdXdlops:3.24818,43385344,miopenConvolutionFwdAlgoImplicitGEMM;ConvBinWinogradRxSf3x2:1.40298,0,miopenConvolutionFwdAlgoWinograd;ConvBinWinogradRxSf2x3g1:3.13147,0,miopenConvolutionFwdAlgoWinograd
256-128-128-3x3-512-128-128-1-1x1-1x1-1x1-0-NCHW-FP16-F=GemmFwdRest:2.46558,75497472,miopenConvolutionFwdAlgoGEMM;GemmFwdRest_hipblaslt:6.11206,75497472,miopenConvolutionFwdAlgoGEMM;ConvHipImplicitGemmGroupFwdXdlops:4.95078,27525120,miopenConvolutionFwdAlgoImplicitGEMM;ConvBinWinogradRxSf3x2:2.57061,0,miopenConvolutionFwdAlgoWinograd;ConvBinWinogradRxSf2x3g1:1.57577,0,miopenConvolutionFwdAlgoWinograd
256-128-128-1x1-512-128-128-1-0x0-1x1-1x1-0-NCHW-FP16-F=ConvBinWinogradRxSf2x3g1:1.44177,0,miopenConvolutionFwdAlgoWinograd;GemmFwd1x1_0_1:0.202431,0,miopenConvolutionFwdAlgoGEMM;ConvBinWinogradRxSf3x2:0.554729,0,miopenConvolutionFwdAlgoWinograd;GemmFwd1x1_0_1_hipblaslt:0.311775,0,miopenConvolutionFwdAlgoGEMM;ConvHipImplicitGemmGroupFwdXdlops:1.13259,25427968,miopenConvolutionFwdAlgoImplicitGEMM
512-129-129-3x3-512-64-64-1-0x0-2x2-1x1-0-NCHW-FP16-F=GemmFwdRest:1.59161,37748736,miopenConvolutionFwdAlgoGEMM;GemmFwdRest_hipblaslt:2.15271,37748736,miopenConvolutionFwdAlgoGEMM;ConvHipImplicitGemmGroupFwdXdlops:2.87173,25953280,miopenConvolutionFwdAlgoImplicitGEMM;ConvBinWinogradRxSf3x2:1.61249,0,miopenConvolutionFwdAlgoWinograd;ConvBinWinogradRxSf2x3g1:3.14948,0,miopenConvolutionFwdAlgoWinograd
512-64-64-3x3-32-64-64-1-1x1-1x1-1x1-0-NCHW-FP16-F=GemmFwdRest:0.607596,37748736,miopenConvolutionFwdAlgoGEMM;GemmFwdRest_hipblaslt:0.511584,37748736,miopenConvolutionFwdAlgoGEMM;ConvHipImplicitGemmGroupFwdXdlops:0.464347,4751360,miopenConvolutionFwdAlgoImplicitGEMM;ConvBinWinogradRxSf3x2:0.18274,0,miopenConvolutionFwdAlgoWinograd;ConvBinWinogradRxSf2x3g1:0.10628,0,miopenConvolutionFwdAlgoWinograd
3-1024-1024-3x3-128-1024-1024-1-1x1-1x1-1x1-0-NCHW-FP16-F=GemmFwdRest:2.78943,56623104,miopenConvolutionFwdAlgoGEMM;GemmFwdRest_hipblaslt:3.47423,56623104,miopenConvolutionFwdAlgoGEMM;ConvHipImplicitGemmGroupFwdXdlops:9.78367,274733824,miopenConvolutionFwdAlgoImplicitGEMM;ConvBinWinogradRxSf3x2:4.55369,0,miopenConvolutionFwdAlgoWinograd;ConvBinWinogradRxSf2x3g1:1.71617,0,miopenConvolutionFwdAlgoWinograd
128-1025-1025-3x3-128-512-512-1-0x0-2x2-1x1-0-NCHW-FP16-F=GemmFwdRest:15.3794,603979776,miopenConvolutionFwdAlgoGEMM;GemmFwdRest_hipblaslt:26.8177,603979776,miopenConvolutionFwdAlgoGEMM;ConvHipImplicitGemmGroupFwdXdlops:19.3181,336363776,miopenConvolutionFwdAlgoImplicitGEMM;ConvBinWinogradRxSf3x2:11.1262,0,miopenConvolutionFwdAlgoWinograd;ConvBinWinogradRxSf2x3g1:19.8396,0,miopenConvolutionFwdAlgoWinograd
128-512-512-3x3-256-512-512-1-1x1-1x1-1x1-0-NCHW-FP16-F=GemmFwdRest:26.0477,603979776,miopenConvolutionFwdAlgoGEMM;GemmFwdRest_hipblaslt:40.5528,603979776,miopenConvolutionFwdAlgoGEMM;ConvHipImplicitGemmGroupFwdXdlops:22.102,201916416,miopenConvolutionFwdAlgoImplicitGEMM;ConvBinWinogradRxSf3x2:15.0935,0,miopenConvolutionFwdAlgoWinograd;ConvBinWinogradRxSf2x3g1:13.4543,0,miopenConvolutionFwdAlgoWinograd
128-512-512-1x1-256-512-512-1-0x0-1x1-1x1-0-NCHW-FP16-F=ConvBinWinogradRxSf2x3g1:7.70067,0,miopenConvolutionFwdAlgoWinograd;GemmFwd1x1_0_1:2.17071,0,miopenConvolutionFwdAlgoGEMM;ConvBinWinogradRxSf3x2:5.69447,0,miopenConvolutionFwdAlgoWinograd;GemmFwd1x1_0_1_hipblaslt:4.06459,0,miopenConvolutionFwdAlgoGEMM;ConvHipImplicitGemmGroupFwdXdlops:7.85239,201392128,miopenConvolutionFwdAlgoImplicitGEMM
256-513-513-3x3-256-256-256-1-0x0-2x2-1x1-0-NCHW-FP16-F=GemmFwdRest:8.77191,301989888,miopenConvolutionFwdAlgoGEMM;GemmFwdRest_hipblaslt:17.378,301989888,miopenConvolutionFwdAlgoGEMM;ConvHipImplicitGemmGroupFwdXdlops:14.333,169476608,miopenConvolutionFwdAlgoImplicitGEMM;ConvBinWinogradRxSf3x2:7.41783,0,miopenConvolutionFwdAlgoWinograd;ConvBinWinogradRxSf2x3g1:11.7034,0,miopenConvolutionFwdAlgoWinograd
256-256-256-3x3-512-256-256-1-1x1-1x1-1x1-0-NCHW-FP16-F=GemmFwdRest:14.3398,301989888,miopenConvolutionFwdAlgoGEMM;GemmFwdRest_hipblaslt:32.638,301989888,miopenConvolutionFwdAlgoGEMM;ConvHipImplicitGemmGroupFwdXdlops:19.6397,103022592,miopenConvolutionFwdAlgoImplicitGEMM;ConvBinWinogradRxSf3x2:10.8172,0,miopenConvolutionFwdAlgoWinograd;ConvBinWinogradRxSf2x3g1:10.6598,0,miopenConvolutionFwdAlgoWinograd
256-256-256-1x1-512-256-256-1-0x0-1x1-1x1-0-NCHW-FP16-F=ConvBinWinogradRxSf2x3g1:7.83964,0,miopenConvolutionFwdAlgoWinograd;GemmFwd1x1_0_1:1.68949,0,miopenConvolutionFwdAlgoGEMM;ConvBinWinogradRxSf3x2:4.26147,0,miopenConvolutionFwdAlgoWinograd;GemmFwd1x1_0_1_hipblaslt:2.63863,0,miopenConvolutionFwdAlgoGEMM;ConvHipImplicitGemmGroupFwdXdlops:5.31359,100925440,miopenConvolutionFwdAlgoImplicitGEMM
512-257-257-3x3-512-128-128-1-0x0-2x2-1x1-0-NCHW-FP16-F=GemmFwdRest:12.7931,150994944,miopenConvolutionFwdAlgoGEMM;GemmFwdRest_hipblaslt:21.0904,150994944,miopenConvolutionFwdAlgoGEMM;ConvHipImplicitGemmGroupFwdXdlops:12.8074,89129984,miopenConvolutionFwdAlgoImplicitGEMM;ConvBinWinogradRxSf3x2:10.389,0,miopenConvolutionFwdAlgoWinograd;ConvBinWinogradRxSf2x3g1:16.9654,0,miopenConvolutionFwdAlgoWinograd
512-128-128-3x3-32-128-128-1-1x1-1x1-1x1-0-NCHW-FP16-F=GemmFwdRest:3.307,150994944,miopenConvolutionFwdAlgoGEMM;GemmFwdRest_hipblaslt:2.44114,150994944,miopenConvolutionFwdAlgoGEMM;ConvHipImplicitGemmGroupFwdXdlops:1.36696,18120704,miopenConvolutionFwdAlgoImplicitGEMM;ConvBinWinogradRxSf3x2:0.375917,0,miopenConvolutionFwdAlgoWinograd;ConvBinWinogradRxSf2x3g1:0.280083,0,miopenConvolutionFwdAlgoWinograd
