torch/lib/rocm/.miopen/db/gfx1151_20.HIP.3_5_0_1c3d4a724f-dirty.ufdb.txt
3-384-384-16x16-1024-24-24-1-0x0-16x16-1x1-0-NCHW-FP16-F=GemmFwdRest:0.11354,884736,miopenConvolutionFwdAlgoGEMM
3-512-512-3x3-128-512-512-1-1x1-1x1-1x1-0-NCHW-FP16-F=GemmFwdRest:0.741582,14155776,miopenConvolutionFwdAlgoGEMM;ConvBinWinogradRxSf3x2:0.923314,0,miopenConvolutionFwdAlgoWinograd;ConvBinWinogradRxSf2x3g1:0.54348,0,miopenConvolutionFwdAlgoWinograd
128-512-512-3x3-128-512-512-1-1x1-1x1-1x1-0-NCHW-FP16-F=GemmFwdRest:8.74341,603979776,miopenConvolutionFwdAlgoGEMM;ConvBinWinogradRxSf3x2:6.31867,0,miopenConvolutionFwdAlgoWinograd;ConvBinWinogradRxSf2x3g1:4.15575,0,miopenConvolutionFwdAlgoWinograd
128-513-513-3x3-128-256-256-1-0x0-2x2-1x1-0-NCHW-FP16-F=GemmFwdRest:2.32151,150994944,miopenConvolutionFwdAlgoGEMM;ConvBinWinogradRxSf3x2:1.85469,0,miopenConvolutionFwdAlgoWinograd;ConvBinWinogradRxSf2x3g1:3.70193,0,miopenConvolutionFwdAlgoWinograd
128-256-256-3x3-256-256-256-1-1x1-1x1-1x1-0-NCHW-FP16-F=GemmFwdRest:2.78508,150994944,miopenConvolutionFwdAlgoGEMM;ConvBinWinogradRxSf3x2:3.07909,0,miopenConvolutionFwdAlgoWinograd;ConvBinWinogradRxSf2x3g1:1.90868,0,miopenConvolutionFwdAlgoWinograd
256-256-256-3x3-256-256-256-1-1x1-1x1-1x1-0-NCHW-FP16-F=GemmFwdRest:5.46604,301989888,miopenConvolutionFwdAlgoGEMM;ConvBinWinogradRxSf3x2:5.95332,0,miopenConvolutionFwdAlgoWinograd;ConvBinWinogradRxSf2x3g1:3.75018,0,miopenConvolutionFwdAlgoWinograd
128-256-256-1x1-256-256-256-1-0x0-1x1-1x1-0-NCHW-FP16-F=ConvBinWinogradRxSf2x3g1:1.85113,0,miopenConvolutionFwdAlgoWinograd;GemmFwd1x1_0_1:0.313878,0,miopenConvolutionFwdAlgoGEMM;ConvBinWinogradRxSf3x2:0.921614,0,miopenConvolutionFwdAlgoWinograd
256-257-257-3x3-256-128-128-1-0x0-2x2-1x1-0-NCHW-FP16-F=GemmFwdRest:1.64658,75497472,miopenConvolutionFwdAlgoGEMM;ConvBinWinogradRxSf3x2:1.73751,0,miopenConvolutionFwdAlgoWinograd;ConvBinWinogradRxSf2x3g1:3.98073,0,miopenConvolutionFwdAlgoWinograd
256-128-128-3x3-512-128-128-1-1x1-1x1-1x1-0-NCHW-FP16-F=GemmFwdRest:1.85389,75497472,miopenConvolutionFwdAlgoGEMM;ConvBinWinogradRxSf3x2:3.02899,0,miopenConvolutionFwdAlgoWinograd;ConvBinWinogradRxSf2x3g1:1.78297,0,miopenConvolutionFwdAlgoWinograd
512-128-128-3x3-512-128-128-1-1x1-1x1-1x1-0-NCHW-FP16-F=GemmFwdRest:4.17318,150994944,miopenConvolutionFwdAlgoGEMM;ConvBinWinogradRxSf3x2:6.0711,0,miopenConvolutionFwdAlgoWinograd;ConvBinWinogradRxSf2x3g1:3.4436,0,miopenConvolutionFwdAlgoWinograd
256-128-128-1x1-512-128-128-1-0x0-1x1-1x1-0-NCHW-FP16-F=ConvBinWinogradRxSf2x3g1:1.70213,0,miopenConvolutionFwdAlgoWinograd;GemmFwd1x1_0_1:0.165065,0,miopenConvolutionFwdAlgoGEMM;ConvBinWinogradRxSf3x2:0.8388,0,miopenConvolutionFwdAlgoWinograd
512-129-129-3x3-512-64-64-1-0x0-2x2-1x1-0-NCHW-FP16-F=GemmFwdRest:1.41311,37748736,miopenConvolutionFwdAlgoGEMM;ConvBinWinogradRxSf3x2:1.79272,0,miopenConvolutionFwdAlgoWinograd;ConvBinWinogradRxSf2x3g1:3.66744,0,miopenConvolutionFwdAlgoWinograd
512-64-64-3x3-512-64-64-1-1x1-1x1-1x1-0-NCHW-FP16-F=GemmFwdRest:1.12374,37748736,miopenConvolutionFwdAlgoGEMM;ConvBinWinogradRxSf3x2:1.71067,0,miopenConvolutionFwdAlgoWinograd;ConvBinWinogradRxSf2x3g1:0.86765,0,miopenConvolutionFwdAlgoWinograd
512-64-64-3x3-8-64-64-1-1x1-1x1-1x1-0-NCHW-FP16-F=GemmFwdRest:0.513556,37748736,miopenConvolutionFwdAlgoGEMM;ConvBinWinogradRxSf3x2:0.297571,0,miopenConvolutionFwdAlgoWinograd;ConvBinWinogradRxSf2x3g1:0.108817,0,miopenConvolutionFwdAlgoWinograd
8-64-64-1x1-8-64-64-1-0x0-1x1-1x1-0-NCHW-FP16-F=ConvBinWinogradRxSf2x3g1:0.035175,0,miopenConvolutionFwdAlgoWinograd;GemmFwd1x1_0_1:0.0217871,0,miopenConvolutionFwdAlgoGEMM;ConvBinWinogradRxSf3x2:0.0497833,0,miopenConvolutionFwdAlgoWinograd
4-64-64-3x3-320-64-64-2-1x1-1x1-1x1-0-NCHW-FP16-F=GemmFwdRest:0.1722,294912,miopenConvolutionFwdAlgoGEMM;ConvBinWinogradRxSf3x2:0.091625,0,miopenConvolutionFwdAlgoWinograd;ConvBinWinogradRxSf2x3g1:0.07896,0,miopenConvolutionFwdAlgoWinograd
3-512-512-3x3-16-512-512-2-1x1-1x1-1x1-0-NCHW-FP16-F=GemmFwdRest:0.6656,14155776,miopenConvolutionFwdAlgoGEMM;ConvBinWinogradRxSf3x2:0.302617,0,miopenConvolutionFwdAlgoWinograd;ConvBinWinogradRxSf2x3g1:0.23802,0,miopenConvolutionFwdAlgoWinograd
16-512-512-3x3-16-512-512-2-1x1-1x1-1x1-0-NCHW-FP16-F=GemmFwdRest:2.47817,75497472,miopenConvolutionFwdAlgoGEMM;ConvBinWinogradRxSf3x2:0.53082,0,miopenConvolutionFwdAlgoWinograd;ConvBinWinogradRxSf2x3g1:0.35195,0,miopenConvolutionFwdAlgoWinograd
16-512-512-3x3-32-256-256-2-1x1-2x2-1x1-0-NCHW-FP16-F=GemmFwdRest:0.618813,18874368,miopenConvolutionFwdAlgoGEMM;ConvBinWinogradRxSf3x2:0.197467,0,miopenConvolutionFwdAlgoWinograd;ConvBinWinogradRxSf2x3g1:0.316414,0,miopenConvolutionFwdAlgoWinograd
32-256-256-3x3-32-256-256-2-1x1-1x1-1x1-0-NCHW-FP16-F=GemmFwdRest:1.32545,37748736,miopenConvolutionFwdAlgoGEMM;ConvBinWinogradRxSf3x2:0.267129,0,miopenConvolutionFwdAlgoWinograd;ConvBinWinogradRxSf2x3g1:0.18212,0,miopenConvolutionFwdAlgoWinograd
32-256-256-3x3-96-128-128-2-1x1-2x2-1x1-0-NCHW-FP16-F=GemmFwdRest:0.400917,9437184,miopenConvolutionFwdAlgoGEMM;ConvBinWinogradRxSf3x2:0.23246,0,miopenConvolutionFwdAlgoWinograd;ConvBinWinogradRxSf2x3g1:0.424267,0,miopenConvolutionFwdAlgoWinograd
96-128-128-3x3-96-128-128-2-1x1-1x1-1x1-0-NCHW-FP16-F=GemmFwdRest:0.717975,28311552,miopenConvolutionFwdAlgoGEMM;ConvBinWinogradRxSf3x2:0.4943,0,miopenConvolutionFwdAlgoWinograd;ConvBinWinogradRxSf2x3g1:0.307314,0,miopenConvolutionFwdAlgoWinograd
96-128-128-3x3-256-64-64-2-1x1-2x2-1x1-0-NCHW-FP16-F=GemmFwdRest:0.325207,7077888,miopenConvolutionFwdAlgoGEMM;ConvBinWinogradRxSf3x2:0.403533,0,miopenConvolutionFwdAlgoWinograd;ConvBinWinogradRxSf2x3g1:0.733067,0,miopenConvolutionFwdAlgoWinograd
256-64-64-3x3-320-64-64-2-1x1-1x1-1x1-0-NCHW-FP16-F=GemmFwdRest:0.665318,18874368,miopenConvolutionFwdAlgoGEMM;ConvBinWinogradRxSf3x2:1.02589,0,miopenConvolutionFwdAlgoWinograd;ConvBinWinogradRxSf2x3g1:0.55322,0,miopenConvolutionFwdAlgoWinograd
320-64-64-3x3-320-64-64-2-1x1-1x1-1x1-0-NCHW-FP16-F=GemmFwdRest:0.818403,23592960,miopenConvolutionFwdAlgoGEMM;ConvBinWinogradRxSf3x2:1.2517,0,miopenConvolutionFwdAlgoWinograd;ConvBinWinogradRxSf2x3g1:0.677114,0,miopenConvolutionFwdAlgoWinograd
320-64-64-1x1-320-64-64-2-0x0-1x1-1x1-0-NCHW-FP16-F=ConvBinWinogradRxSf2x3g1:0.689743,0,miopenConvolutionFwdAlgoWinograd;GemmFwd1x1_0_1:0.0776233,0,miopenConvolutionFwdAlgoGEMM;ConvBinWinogradRxSf3x2:0.378829,0,miopenConvolutionFwdAlgoWinograd
320-64-64-3x3-320-32-32-2-1x1-2x2-1x1-0-NCHW-FP16-F=GemmFwdRest:0.37113,5898240,miopenConvolutionFwdAlgoGEMM;ConvBinWinogradRxSf3x2:0.368433,0,miopenConvolutionFwdAlgoWinograd;ConvBinWinogradRxSf2x3g1:0.74716,0,miopenConvolutionFwdAlgoWinograd
320-32-32-3x3-640-32-32-2-1x1-1x1-1x1-0-NCHW-FP16-F=GemmFwdRest:0.417929,5898240,miopenConvolutionFwdAlgoGEMM;ConvBinWinogradRxSf3x2:0.650729,0,miopenConvolutionFwdAlgoWinograd;ConvBinWinogradRxSf2x3g1:0.36066,0,miopenConvolutionFwdAlgoWinograd
640-32-32-3x3-640-32-32-2-1x1-1x1-1x1-0-NCHW-FP16-F=GemmFwdRest:0.677896,11796480,miopenConvolutionFwdAlgoGEMM;ConvBinWinogradRxSf3x2:1.22262,0,miopenConvolutionFwdAlgoWinograd;ConvBinWinogradRxSf2x3g1:0.671133,0,miopenConvolutionFwdAlgoWinograd
320-32-32-1x1-640-32-32-2-0x0-1x1-1x1-0-NCHW-FP16-F=ConvBinWinogradRxSf2x3g1:0.360733,0,miopenConvolutionFwdAlgoWinograd;GemmFwd1x1_0_1:0.04189,0,miopenConvolutionFwdAlgoGEMM;ConvBinWinogradRxSf3x2:0.207143,0,miopenConvolutionFwdAlgoWinograd
640-32-32-1x1-640-32-32-2-0x0-1x1-1x1-0-NCHW-FP16-F=ConvBinWinogradRxSf2x3g1:0.672967,0,miopenConvolutionFwdAlgoWinograd;GemmFwd1x1_0_1:0.0699367,0,miopenConvolutionFwdAlgoGEMM;ConvBinWinogradRxSf3x2:0.363243,0,miopenConvolutionFwdAlgoWinograd
640-32-32-3x3-640-16-16-2-1x1-2x2-1x1-0-NCHW-FP16-F=GemmFwdRest:0.464396,2949120,miopenConvolutionFwdAlgoGEMM;ConvBinWinogradRxSf3x2:0.67915,0,miopenConvolutionFwdAlgoWinograd;ConvBinWinogradRxSf2x3g1:0.747557,0,miopenConvolutionFwdAlgoWinograd
640-16-16-3x3-1280-16-16-2-1x1-1x1-1x1-0-NCHW-FP16-F=GemmFwdRest:0.463715,2949120,miopenConvolutionFwdAlgoGEMM;ConvBinWinogradRxSf3x2:0.942843,0,miopenConvolutionFwdAlgoWinograd;ConvBinWinogradRxSf2x3g1:0.364633,0,miopenConvolutionFwdAlgoWinograd
1280-16-16-3x3-1280-16-16-2-1x1-1x1-1x1-0-NCHW-FP16-F=GemmFwdRest:0.961005,5898240,miopenConvolutionFwdAlgoGEMM;ConvBinWinogradRxSf3x2:1.83357,0,miopenConvolutionFwdAlgoWinograd;ConvBinWinogradRxSf2x3g1:0.674675,0,miopenConvolutionFwdAlgoWinograd
640-16-16-1x1-1280-16-16-2-0x0-1x1-1x1-0-NCHW-FP16-F=ConvBinWinogradRxSf2x3g1:0.365043,0,miopenConvolutionFwdAlgoWinograd;GemmFwd1x1_0_1:0.0450133,0,miopenConvolutionFwdAlgoGEMM;ConvBinWinogradRxSf3x2:0.2901,0,miopenConvolutionFwdAlgoWinograd
1280-16-16-1x1-1280-16-16-2-0x0-1x1-1x1-0-NCHW-FP16-F=ConvBinWinogradRxSf2x3g1:0.669657,0,miopenConvolutionFwdAlgoWinograd;GemmFwd1x1_0_1:0.0657283,0,miopenConvolutionFwdAlgoGEMM;ConvBinWinogradRxSf3x2:0.51065,0,miopenConvolutionFwdAlgoWinograd
1280-16-16-3x3-1280-8-8-2-1x1-2x2-1x1-0-NCHW-FP16-F=GemmFwdRest:0.783122,1474560,miopenConvolutionFwdAlgoGEMM;ConvBinWinogradRxSf3x2:0.689971,0,miopenConvolutionFwdAlgoWinograd;ConvBinWinogradRxSf2x3g1:0.764986,0,miopenConvolutionFwdAlgoWinograd
1280-8-8-3x3-1280-8-8-2-1x1-1x1-1x1-0-NCHW-FP16-F=GemmFwdRest:0.680232,1474560,miopenConvolutionFwdAlgoGEMM;ConvBinWinogradRxSf3x2:0.649783,0,miopenConvolutionFwdAlgoWinograd;ConvBinWinogradRxSf2x3g1:0.202971,0,miopenConvolutionFwdAlgoWinograd
1280-8-8-1x1-1280-8-8-2-0x0-1x1-1x1-0-NCHW-FP16-F=ConvBinWinogradRxSf2x3g1:0.2118,0,miopenConvolutionFwdAlgoWinograd;GemmFwd1x1_0_1:0.065582,0,miopenConvolutionFwdAlgoGEMM;ConvBinWinogradRxSf3x2:0.211843,0,miopenConvolutionFwdAlgoWinograd
320-32-32-1x1-320-32-32-2-0x0-1x1-1x1-0-NCHW-FP16-F=ConvBinWinogradRxSf2x3g1:0.21364,0,miopenConvolutionFwdAlgoWinograd;GemmFwd1x1_0_1:0.0487517,0,miopenConvolutionFwdAlgoGEMM;ConvBinWinogradRxSf3x2:0.13934,0,miopenConvolutionFwdAlgoWinograd
640-16-16-1x1-640-16-16-2-0x0-1x1-1x1-0-NCHW-FP16-F=ConvBinWinogradRxSf2x3g1:0.21155,0,miopenConvolutionFwdAlgoWinograd;GemmFwd1x1_0_1:0.0387214,0,miopenConvolutionFwdAlgoGEMM;ConvBinWinogradRxSf3x2:0.2146,0,miopenConvolutionFwdAlgoWinograd
2560-8-8-3x3-1280-8-8-2-1x1-1x1-1x1-0-NCHW-FP16-F=GemmFwdRest:2.31133,2949120,miopenConvolutionFwdAlgoGEMM;ConvBinWinogradRxSf3x2:1.27806,0,miopenConvolutionFwdAlgoWinograd;ConvBinWinogradRxSf2x3g1:0.413414,0,miopenConvolutionFwdAlgoWinograd
2560-8-8-1x1-1280-8-8-2-0x0-1x1-1x1-0-NCHW-FP16-F=ConvBinWinogradRxSf2x3g1:0.365383,0,miopenConvolutionFwdAlgoWinograd;GemmFwd1x1_0_1:0.099265,0,miopenConvolutionFwdAlgoGEMM;ConvBinWinogradRxSf3x2:0.368533,0,miopenConvolutionFwdAlgoWinograd
2560-16-16-3x3-1280-16-16-2-1x1-1x1-1x1-0-NCHW-FP16-F=GemmFwdRest:2.73285,11796480,miopenConvolutionFwdAlgoGEMM;ConvBinWinogradRxSf3x2:3.62404,0,miopenConvolutionFwdAlgoWinograd;ConvBinWinogradRxSf2x3g1:1.29202,0,miopenConvolutionFwdAlgoWinograd
2560-16-16-1x1-1280-16-16-2-0x0-1x1-1x1-0-NCHW-FP16-F=ConvBinWinogradRxSf2x3g1:1.2703,0,miopenConvolutionFwdAlgoWinograd;GemmFwd1x1_0_1:0.102188,0,miopenConvolutionFwdAlgoGEMM;ConvBinWinogradRxSf3x2:0.953657,0,miopenConvolutionFwdAlgoWinograd
1920-16-16-3x3-1280-16-16-2-1x1-1x1-1x1-0-NCHW-FP16-F=GemmFwdRest:1.39858,8847360,miopenConvolutionFwdAlgoGEMM;ConvBinWinogradRxSf3x2:2.69472,0,miopenConvolutionFwdAlgoWinograd;ConvBinWinogradRxSf2x3g1:0.98694,0,miopenConvolutionFwdAlgoWinograd
1920-16-16-1x1-1280-16-16-2-0x0-1x1-1x1-0-NCHW-FP16-F=ConvBinWinogradRxSf2x3g1:0.96678,0,miopenConvolutionFwdAlgoWinograd;GemmFwd1x1_0_1:0.0822533,0,miopenConvolutionFwdAlgoGEMM;ConvBinWinogradRxSf3x2:0.730057,0,miopenConvolutionFwdAlgoWinograd
1280-32-32-3x3-1280-32-32-2-1x1-1x1-1x1-0-NCHW-FP16-F=GemmFwdRest:2.36837,23592960,miopenConvolutionFwdAlgoGEMM;ConvBinWinogradRxSf3x2:4.73307,0,miopenConvolutionFwdAlgoWinograd;ConvBinWinogradRxSf2x3g1:2.49801,0,miopenConvolutionFwdAlgoWinograd
1920-32-32-3x3-640-32-32-2-1x1-1x1-1x1-0-NCHW-FP16-F=GemmFwdRest:2.15412,35389440,miopenConvolutionFwdAlgoGEMM;ConvBinWinogradRxSf3x2:3.5787,0,miopenConvolutionFwdAlgoWinograd;ConvBinWinogradRxSf2x3g1:1.91074,0,miopenConvolutionFwdAlgoWinograd
1920-32-32-1x1-640-32-32-2-0x0-1x1-1x1-0-NCHW-FP16-F=ConvBinWinogradRxSf2x3g1:1.98753,0,miopenConvolutionFwdAlgoWinograd;GemmFwd1x1_0_1:0.192923,0,miopenConvolutionFwdAlgoGEMM;ConvBinWinogradRxSf3x2:1.00081,0,miopenConvolutionFwdAlgoWinograd
1280-32-32-3x3-640-32-32-2-1x1-1x1-1x1-0-NCHW-FP16-F=GemmFwdRest:1.46643,23592960,miopenConvolutionFwdAlgoGEMM;ConvBinWinogradRxSf3x2:2.40144,0,miopenConvolutionFwdAlgoWinograd;ConvBinWinogradRxSf2x3g1:1.2958,0,miopenConvolutionFwdAlgoWinograd
1280-32-32-1x1-640-32-32-2-0x0-1x1-1x1-0-NCHW-FP16-F=ConvBinWinogradRxSf2x3g1:1.27557,0,miopenConvolutionFwdAlgoWinograd;GemmFwd1x1_0_1:0.131316,0,miopenConvolutionFwdAlgoGEMM;ConvBinWinogradRxSf3x2:0.666771,0,miopenConvolutionFwdAlgoWinograd
960-32-32-3x3-640-32-32-2-1x1-1x1-1x1-0-NCHW-FP16-F=GemmFwdRest:1.03826,17694720,miopenConvolutionFwdAlgoGEMM;ConvBinWinogradRxSf3x2:1.80951,0,miopenConvolutionFwdAlgoWinograd;ConvBinWinogradRxSf2x3g1:0.9822,0,miopenConvolutionFwdAlgoWinograd
960-32-32-1x1-640-32-32-2-0x0-1x1-1x1-0-NCHW-FP16-F=ConvBinWinogradRxSf2x3g1:0.9705,0,miopenConvolutionFwdAlgoWinograd;GemmFwd1x1_0_1:0.100063,0,miopenConvolutionFwdAlgoGEMM;ConvBinWinogradRxSf3x2:0.506529,0,miopenConvolutionFwdAlgoWinograd
640-64-64-3x3-640-64-64-2-1x1-1x1-1x1-0-NCHW-FP16-F=GemmFwdRest:2.86765,47185920,miopenConvolutionFwdAlgoGEMM;ConvBinWinogradRxSf3x2:4.78147,0,miopenConvolutionFwdAlgoWinograd;ConvBinWinogradRxSf2x3g1:2.52642,0,miopenConvolutionFwdAlgoWinograd
960-64-64-3x3-320-64-64-2-1x1-1x1-1x1-0-NCHW-FP16-F=GemmFwdRest:2.53793,70778880,miopenConvolutionFwdAlgoGEMM;ConvBinWinogradRxSf3x2:3.57083,0,miopenConvolutionFwdAlgoWinograd;ConvBinWinogradRxSf2x3g1:1.9121,0,miopenConvolutionFwdAlgoWinograd
960-64-64-1x1-320-64-64-2-0x0-1x1-1x1-0-NCHW-FP16-F=ConvBinWinogradRxSf2x3g1:1.96736,0,miopenConvolutionFwdAlgoWinograd;GemmFwd1x1_0_1:0.191686,0,miopenConvolutionFwdAlgoGEMM;ConvBinWinogradRxSf3x2:0.985729,0,miopenConvolutionFwdAlgoWinograd
640-64-64-3x3-320-64-64-2-1x1-1x1-1x1-0-NCHW-FP16-F=GemmFwdRest:1.64636,47185920,miopenConvolutionFwdAlgoGEMM;ConvBinWinogradRxSf3x2:2.43463,0,miopenConvolutionFwdAlgoWinograd;ConvBinWinogradRxSf2x3g1:1.2932,0,miopenConvolutionFwdAlgoWinograd
640-64-64-1x1-320-64-64-2-0x0-1x1-1x1-0-NCHW-FP16-F=ConvBinWinogradRxSf2x3g1:1.30613,0,miopenConvolutionFwdAlgoWinograd;GemmFwd1x1_0_1:0.136394,0,miopenConvolutionFwdAlgoGEMM;ConvBinWinogradRxSf3x2:0.67678,0,miopenConvolutionFwdAlgoWinograd
320-64-64-3x3-4-64-64-2-1x1-1x1-1x1-0-NCHW-FP16-F=GemmFwdRest:0.592487,23592960,miopenConvolutionFwdAlgoGEMM;ConvBinWinogradRxSf3x2:0.210843,0,miopenConvolutionFwdAlgoWinograd;ConvBinWinogradRxSf2x3g1:0.1336,0,miopenConvolutionFwdAlgoWinograd
4-64-64-1x1-4-64-64-1-0x0-1x1-1x1-0-NCHW-FP16-F=ConvBinWinogradRxSf2x3g1:0.0525,0,miopenConvolutionFwdAlgoWinograd;GemmFwd1x1_0_1:0.025358,0,miopenConvolutionFwdAlgoGEMM;ConvBinWinogradRxSf3x2:0.0528167,0,miopenConvolutionFwdAlgoWinograd
4-64-64-3x3-512-64-64-1-1x1-1x1-1x1-0-NCHW-FP16-F=GemmFwdRest:0.0866743,294912,miopenConvolutionFwdAlgoGEMM;ConvBinWinogradRxSf3x2:0.0880571,0,miopenConvolutionFwdAlgoWinograd;ConvBinWinogradRxSf2x3g1:0.0734,0,miopenConvolutionFwdAlgoWinograd
512-256-256-3x3-512-256-256-1-1x1-1x1-1x1-0-NCHW-FP16-F=GemmFwdRest:23.9441,603979776,miopenConvolutionFwdAlgoGEMM;ConvBinWinogradRxSf3x2:21.9462,0,miopenConvolutionFwdAlgoWinograd;ConvBinWinogradRxSf2x3g1:12.7662,0,miopenConvolutionFwdAlgoWinograd
512-256-256-3x3-256-256-256-1-1x1-1x1-1x1-0-NCHW-FP16-F=GemmFwdRest:13.8469,603979776,miopenConvolutionFwdAlgoGEMM;ConvBinWinogradRxSf3x2:11.2081,0,miopenConvolutionFwdAlgoWinograd;ConvBinWinogradRxSf2x3g1:6.48303,0,miopenConvolutionFwdAlgoWinograd
512-256-256-1x1-256-256-256-1-0x0-1x1-1x1-0-NCHW-FP16-F=ConvBinWinogradRxSf2x3g1:6.43957,0,miopenConvolutionFwdAlgoWinograd;GemmFwd1x1_0_1:0.811927,0,miopenConvolutionFwdAlgoGEMM;ConvBinWinogradRxSf3x2:3.78886,0,miopenConvolutionFwdAlgoWinograd
256-512-512-3x3-256-512-512-1-1x1-1x1-1x1-0-NCHW-FP16-F=GemmFwdRest:34.7379,1207959552,miopenConvolutionFwdAlgoGEMM;ConvBinWinogradRxSf3x2:23.7763,0,miopenConvolutionFwdAlgoWinograd;ConvBinWinogradRxSf2x3g1:14.2151,0,miopenConvolutionFwdAlgoWinograd
256-512-512-3x3-128-512-512-1-1x1-1x1-1x1-0-NCHW-FP16-F=GemmFwdRest:18.9871,1207959552,miopenConvolutionFwdAlgoGEMM;ConvBinWinogradRxSf3x2:11.3663,0,miopenConvolutionFwdAlgoWinograd;ConvBinWinogradRxSf2x3g1:9.24906,0,miopenConvolutionFwdAlgoWinograd
256-512-512-1x1-128-512-512-1-0x0-1x1-1x1-0-NCHW-FP16-F=ConvBinWinogradRxSf2x3g1:7.00024,0,miopenConvolutionFwdAlgoWinograd;GemmFwd1x1_0_1:1.33637,0,miopenConvolutionFwdAlgoGEMM;ConvBinWinogradRxSf3x2:4.42441,0,miopenConvolutionFwdAlgoWinograd
128-512-512-3x3-3-512-512-1-1x1-1x1-1x1-0-NCHW-FP16-F=GemmFwdRest:7.23008,603979776,miopenConvolutionFwdAlgoGEMM;ConvBinWinogradRxSf3x2:1.50143,0,miopenConvolutionFwdAlgoWinograd;ConvBinWinogradRxSf2x3g1:0.939943,0,miopenConvolutionFwdAlgoWinograd
4-64-64-3x3-320-64-64-1-1x1-1x1-1x1-0-NCHW-FP16-F=GemmFwdRest:0.07183,294912,miopenConvolutionFwdAlgoGEMM;ConvBinWinogradRxSf3x2:0.07638,0,miopenConvolutionFwdAlgoWinograd;ConvBinWinogradRxSf2x3g1:0.0669429,0,miopenConvolutionFwdAlgoWinograd
3-512-512-3x3-16-512-512-1-1x1-1x1-1x1-0-NCHW-FP16-F=GemmFwdRest:0.332316,14155776,miopenConvolutionFwdAlgoGEMM;ConvBinWinogradRxSf3x2:0.166767,0,miopenConvolutionFwdAlgoWinograd;ConvBinWinogradRxSf2x3g1:0.141729,0,miopenConvolutionFwdAlgoWinograd
16-512-512-3x3-16-512-512-1-1x1-1x1-1x1-0-NCHW-FP16-F=GemmFwdRest:1.13398,75497472,miopenConvolutionFwdAlgoGEMM;ConvBinWinogradRxSf3x2:0.302029,0,miopenConvolutionFwdAlgoWinograd;ConvBinWinogradRxSf2x3g1:0.227457,0,miopenConvolutionFwdAlgoWinograd
16-512-512-3x3-32-256-256-1-1x1-2x2-1x1-0-NCHW-FP16-F=GemmFwdRest:0.340279,18874368,miopenConvolutionFwdAlgoGEMM;ConvBinWinogradRxSf3x2:0.12796,0,miopenConvolutionFwdAlgoWinograd;ConvBinWinogradRxSf2x3g1:0.18395,0,miopenConvolutionFwdAlgoWinograd
32-256-256-3x3-32-256-256-1-1x1-1x1-1x1-0-NCHW-FP16-F=GemmFwdRest:0.578007,37748736,miopenConvolutionFwdAlgoGEMM;ConvBinWinogradRxSf3x2:0.168683,0,miopenConvolutionFwdAlgoWinograd;ConvBinWinogradRxSf2x3g1:0.123917,0,miopenConvolutionFwdAlgoWinograd
32-256-256-3x3-96-128-128-1-1x1-2x2-1x1-0-NCHW-FP16-F=GemmFwdRest:0.204377,9437184,miopenConvolutionFwdAlgoGEMM;ConvBinWinogradRxSf3x2:0.154729,0,miopenConvolutionFwdAlgoWinograd;ConvBinWinogradRxSf2x3g1:0.24332,0,miopenConvolutionFwdAlgoWinograd
96-128-128-3x3-96-128-128-1-1x1-1x1-1x1-0-NCHW-FP16-F=GemmFwdRest:0.37795,28311552,miopenConvolutionFwdAlgoGEMM;ConvBinWinogradRxSf3x2:0.307917,0,miopenConvolutionFwdAlgoWinograd;ConvBinWinogradRxSf2x3g1:0.189671,0,miopenConvolutionFwdAlgoWinograd
96-128-128-3x3-256-64-64-1-1x1-2x2-1x1-0-NCHW-FP16-F=GemmFwdRest:0.169851,7077888,miopenConvolutionFwdAlgoGEMM;ConvBinWinogradRxSf3x2:0.265886,0,miopenConvolutionFwdAlgoWinograd;ConvBinWinogradRxSf2x3g1:0.4226,0,miopenConvolutionFwdAlgoWinograd
256-64-64-3x3-320-64-64-1-1x1-1x1-1x1-0-NCHW-FP16-F=GemmFwdRest:0.35661,18874368,miopenConvolutionFwdAlgoGEMM;ConvBinWinogradRxSf3x2:0.5691,0,miopenConvolutionFwdAlgoWinograd;ConvBinWinogradRxSf2x3g1:0.324429,0,miopenConvolutionFwdAlgoWinograd
320-64-64-3x3-320-64-64-1-1x1-1x1-1x1-0-NCHW-FP16-F=GemmFwdRest:0.41145,23592960,miopenConvolutionFwdAlgoGEMM;ConvBinWinogradRxSf3x2:0.686533,0,miopenConvolutionFwdAlgoWinograd;ConvBinWinogradRxSf2x3g1:0.388117,0,miopenConvolutionFwdAlgoWinograd
320-64-64-1x1-320-64-64-1-0x0-1x1-1x1-0-NCHW-FP16-F=ConvBinWinogradRxSf2x3g1:0.413286,0,miopenConvolutionFwdAlgoWinograd;GemmFwd1x1_0_1:0.0510329,0,miopenConvolutionFwdAlgoGEMM;ConvBinWinogradRxSf3x2:0.23742,0,miopenConvolutionFwdAlgoWinograd
320-64-64-3x3-320-32-32-1-1x1-2x2-1x1-0-NCHW-FP16-F=GemmFwdRest:0.200812,5898240,miopenConvolutionFwdAlgoGEMM;ConvBinWinogradRxSf3x2:0.225883,0,miopenConvolutionFwdAlgoWinograd;ConvBinWinogradRxSf2x3g1:0.40454,0,miopenConvolutionFwdAlgoWinograd
320-32-32-3x3-640-32-32-1-1x1-1x1-1x1-0-NCHW-FP16-F=GemmFwdRest:0.234873,5898240,miopenConvolutionFwdAlgoGEMM;ConvBinWinogradRxSf3x2:0.375957,0,miopenConvolutionFwdAlgoWinograd;ConvBinWinogradRxSf2x3g1:0.21802,0,miopenConvolutionFwdAlgoWinograd
640-32-32-3x3-640-32-32-1-1x1-1x1-1x1-0-NCHW-FP16-F=GemmFwdRest:0.387077,11796480,miopenConvolutionFwdAlgoGEMM;ConvBinWinogradRxSf3x2:0.686686,0,miopenConvolutionFwdAlgoWinograd;ConvBinWinogradRxSf2x3g1:0.376286,0,miopenConvolutionFwdAlgoWinograd
320-32-32-1x1-640-32-32-1-0x0-1x1-1x1-0-NCHW-FP16-F=ConvBinWinogradRxSf2x3g1:0.223367,0,miopenConvolutionFwdAlgoWinograd;GemmFwd1x1_0_1:0.039564,0,miopenConvolutionFwdAlgoGEMM;ConvBinWinogradRxSf3x2:0.143,0,miopenConvolutionFwdAlgoWinograd
640-32-32-1x1-640-32-32-1-0x0-1x1-1x1-0-NCHW-FP16-F=ConvBinWinogradRxSf2x3g1:0.381543,0,miopenConvolutionFwdAlgoWinograd;GemmFwd1x1_0_1:0.051685,0,miopenConvolutionFwdAlgoGEMM;ConvBinWinogradRxSf3x2:0.226117,0,miopenConvolutionFwdAlgoWinograd
640-32-32-3x3-640-16-16-1-1x1-2x2-1x1-0-NCHW-FP16-F=GemmFwdRest:0.262922,2949120,miopenConvolutionFwdAlgoGEMM;ConvBinWinogradRxSf3x2:0.379267,0,miopenConvolutionFwdAlgoWinograd;ConvBinWinogradRxSf2x3g1:0.405433,0,miopenConvolutionFwdAlgoWinograd
640-16-16-3x3-1280-16-16-1-1x1-1x1-1x1-0-NCHW-FP16-F=GemmFwdRest:0.268686,2949120,miopenConvolutionFwdAlgoGEMM;ConvBinWinogradRxSf3x2:0.686557,0,miopenConvolutionFwdAlgoWinograd;ConvBinWinogradRxSf2x3g1:0.21478,0,miopenConvolutionFwdAlgoWinograd
1280-16-16-3x3-1280-16-16-1-1x1-1x1-1x1-0-NCHW-FP16-F=GemmFwdRest:0.490648,5898240,miopenConvolutionFwdAlgoGEMM;ConvBinWinogradRxSf3x2:1.30199,0,miopenConvolutionFwdAlgoWinograd;ConvBinWinogradRxSf2x3g1:0.372367,0,miopenConvolutionFwdAlgoWinograd
640-16-16-1x1-1280-16-16-1-0x0-1x1-1x1-0-NCHW-FP16-F=ConvBinWinogradRxSf2x3g1:0.215367,0,miopenConvolutionFwdAlgoWinograd;GemmFwd1x1_0_1:0.0363814,0,miopenConvolutionFwdAlgoGEMM;ConvBinWinogradRxSf3x2:0.223971,0,miopenConvolutionFwdAlgoWinograd
1280-16-16-1x1-1280-16-16-1-0x0-1x1-1x1-0-NCHW-FP16-F=ConvBinWinogradRxSf2x3g1:0.380557,0,miopenConvolutionFwdAlgoWinograd;GemmFwd1x1_0_1:0.05651,0,miopenConvolutionFwdAlgoGEMM;ConvBinWinogradRxSf3x2:0.376057,0,miopenConvolutionFwdAlgoWinograd
1280-16-16-3x3-1280-8-8-1-1x1-2x2-1x1-0-NCHW-FP16-F=GemmFwdRest:0.408301,1474560,miopenConvolutionFwdAlgoGEMM;ConvBinWinogradRxSf3x2:0.718043,0,miopenConvolutionFwdAlgoWinograd;ConvBinWinogradRxSf2x3g1:0.741743,0,miopenConvolutionFwdAlgoWinograd
1280-8-8-3x3-1280-8-8-1-1x1-1x1-1x1-0-NCHW-FP16-F=GemmFwdRest:0.395243,1474560,miopenConvolutionFwdAlgoGEMM;ConvBinWinogradRxSf3x2:0.685517,0,miopenConvolutionFwdAlgoWinograd;ConvBinWinogradRxSf2x3g1:0.227914,0,miopenConvolutionFwdAlgoWinograd
1280-8-8-1x1-1280-8-8-1-0x0-1x1-1x1-0-NCHW-FP16-F=ConvBinWinogradRxSf2x3g1:0.22735,0,miopenConvolutionFwdAlgoWinograd;GemmFwd1x1_0_1:0.060255,0,miopenConvolutionFwdAlgoGEMM;ConvBinWinogradRxSf3x2:0.219743,0,miopenConvolutionFwdAlgoWinograd
320-32-32-1x1-320-32-32-1-0x0-1x1-1x1-0-NCHW-FP16-F=ConvBinWinogradRxSf2x3g1:0.141357,0,miopenConvolutionFwdAlgoWinograd;GemmFwd1x1_0_1:0.0363533,0,miopenConvolutionFwdAlgoGEMM;ConvBinWinogradRxSf3x2:0.105457,0,miopenConvolutionFwdAlgoWinograd
640-16-16-1x1-640-16-16-1-0x0-1x1-1x1-0-NCHW-FP16-F=ConvBinWinogradRxSf2x3g1:0.137586,0,miopenConvolutionFwdAlgoWinograd;GemmFwd1x1_0_1:0.037462,0,miopenConvolutionFwdAlgoGEMM;ConvBinWinogradRxSf3x2:0.141043,0,miopenConvolutionFwdAlgoWinograd
4-40-64-3x3-320-40-64-26-1x1-1x1-1x1-0-NCHW-FP16-F=GemmFwdRest:1.78081,184320,miopenConvolutionFwdAlgoGEMM;ConvBinWinogradRxSf3x2:0.320186,0,miopenConvolutionFwdAlgoWinograd;ConvBinWinogradRxSf2x3g1:0.26075,0,miopenConvolutionFwdAlgoWinograd
320-1-26-1x1-512-1-26-2560-0x0-1x1-1x1-0-NCHW-FP16-F=ConvBinWinogradRxSf2x3g1:16.841,0,miopenConvolutionFwdAlgoWinograd;GemmFwd1x1_0_1:4.28511,0,miopenConvolutionFwdAlgoGEMM;ConvBinWinogradRxSf3x2:11.4749,0,miopenConvolutionFwdAlgoWinograd
512-1-26-1x1-320-1-26-2560-0x0-1x1-1x1-0-NCHW-FP16-F=ConvBinWinogradRxSf2x3g1:16.8302,0,miopenConvolutionFwdAlgoWinograd;GemmFwd1x1_0_1:4.87312,0,miopenConvolutionFwdAlgoGEMM;ConvBinWinogradRxSf3x2:11.5176,0,miopenConvolutionFwdAlgoWinograd
320-40-64-3x3-320-40-64-26-1x1-1x1-1x1-0-NCHW-FP16-F=GemmFwdRest:7.37256,14745600,miopenConvolutionFwdAlgoGEMM;ConvBinWinogradRxSf3x2:9.5696,0,miopenConvolutionFwdAlgoWinograd;ConvBinWinogradRxSf2x3g1:5.32834,0,miopenConvolutionFwdAlgoWinograd
320-26-40-64-3x1x1-320-26-40-64-1-1x0x0-1x1x1-1x1x1-0-NCDHW-FP16-F=GemmFwdRest:4.44673,127795200,miopenConvolutionFwdAlgoGEMM
320-40-64-3x3-320-20-32-26-1x1-2x2-1x1-0-NCHW-FP16-F=GemmFwdRest:4.57262,3686400,miopenConvolutionFwdAlgoGEMM;ConvBinWinogradRxSf3x2:2.5855,0,miopenConvolutionFwdAlgoWinograd;ConvBinWinogradRxSf2x3g1:5.77314,0,miopenConvolutionFwdAlgoWinograd
320-20-32-3x3-640-20-32-26-1x1-1x1-1x1-0-NCHW-FP16-F=GemmFwdRest:4.68094,3686400,miopenConvolutionFwdAlgoGEMM;ConvBinWinogradRxSf3x2:2.8914,0,miopenConvolutionFwdAlgoWinograd;ConvBinWinogradRxSf2x3g1:1.73006,0,miopenConvolutionFwdAlgoWinograd
640-20-32-3x3-640-20-32-26-1x1-1x1-1x1-0-NCHW-FP16-F=GemmFwdRest:7.87251,7372800,miopenConvolutionFwdAlgoGEMM;ConvBinWinogradRxSf3x2:9.85528,0,miopenConvolutionFwdAlgoWinograd;ConvBinWinogradRxSf2x3g1:5.16424,0,miopenConvolutionFwdAlgoWinograd
320-20-32-1x1-640-20-32-26-0x0-1x1-1x1-0-NCHW-FP16-F=ConvBinWinogradRxSf2x3g1:2.71863,0,miopenConvolutionFwdAlgoWinograd;GemmFwd1x1_0_1:0.228822,0,miopenConvolutionFwdAlgoGEMM;ConvBinWinogradRxSf3x2:1.37193,0,miopenConvolutionFwdAlgoWinograd
640-26-20-32-3x1x1-640-26-20-32-1-1x0x0-1x1x1-1x1x1-0-NCDHW-FP16-F=GemmFwdRest:3.81327,63897600,miopenConvolutionFwdAlgoGEMM
640-20-32-3x3-640-10-16-26-1x1-2x2-1x1-0-NCHW-FP16-F=GemmFwdRest:6.15053,1843200,miopenConvolutionFwdAlgoGEMM;ConvBinWinogradRxSf3x2:3.19173,0,miopenConvolutionFwdAlgoWinograd;ConvBinWinogradRxSf2x3g1:5.79299,0,miopenConvolutionFwdAlgoWinograd
640-10-16-3x3-1280-10-16-26-1x1-1x1-1x1-0-NCHW-FP16-F=GemmFwdRest:6.02855,1843200,miopenConvolutionFwdAlgoGEMM;ConvBinWinogradRxSf3x2:6.20641,0,miopenConvolutionFwdAlgoWinograd;ConvBinWinogradRxSf2x3g1:2.65637,0,miopenConvolutionFwdAlgoWinograd
1280-10-16-3x3-1280-10-16-26-1x1-1x1-1x1-0-NCHW-FP16-F=GemmFwdRest:11.5425,3686400,miopenConvolutionFwdAlgoGEMM;ConvBinWinogradRxSf3x2:12.0858,0,miopenConvolutionFwdAlgoWinograd;ConvBinWinogradRxSf2x3g1:5.21418,0,miopenConvolutionFwdAlgoWinograd
640-10-16-1x1-1280-10-16-26-0x0-1x1-1x1-0-NCHW-FP16-F=ConvBinWinogradRxSf2x3g1:2.67353,0,miopenConvolutionFwdAlgoWinograd;GemmFwd1x1_0_1:0.347779,0,miopenConvolutionFwdAlgoGEMM;ConvBinWinogradRxSf3x2:1.63555,0,miopenConvolutionFwdAlgoWinograd
1280-26-10-16-3x1x1-1280-26-10-16-1-1x0x0-1x1x1-1x1x1-0-NCDHW-FP16-F=GemmFwdRest:2.13115,31948800,miopenConvolutionFwdAlgoGEMM
1280-10-16-3x3-1280-5-8-26-1x1-2x2-1x1-0-NCHW-FP16-F=GemmFwdRest:10.2632,921600,miopenConvolutionFwdAlgoGEMM;ConvBinWinogradRxSf3x2:3.55659,0,miopenConvolutionFwdAlgoWinograd;ConvBinWinogradRxSf2x3g1:6.96292,0,miopenConvolutionFwdAlgoWinograd
1280-5-8-3x3-1280-5-8-26-1x1-1x1-1x1-0-NCHW-FP16-F=GemmFwdRest:9.67286,921600,miopenConvolutionFwdAlgoGEMM;ConvBinWinogradRxSf3x2:3.03139,0,miopenConvolutionFwdAlgoWinograd;ConvBinWinogradRxSf2x3g1:1.59683,0,miopenConvolutionFwdAlgoWinograd
1280-26-5-8-3x1x1-1280-26-5-8-1-1x0x0-1x1x1-1x1x1-0-NCDHW-FP16-F=GemmFwdRest:0.616776,7987200,miopenConvolutionFwdAlgoGEMM
2560-5-8-3x3-1280-5-8-26-1x1-1x1-1x1-0-NCHW-FP16-F=GemmFwdRest:29.2586,1843200,miopenConvolutionFwdAlgoGEMM;ConvBinWinogradRxSf3x2:5.9865,0,miopenConvolutionFwdAlgoWinograd;ConvBinWinogradRxSf2x3g1:3.11942,0,miopenConvolutionFwdAlgoWinograd
2560-5-8-1x1-1280-5-8-26-0x0-1x1-1x1-0-NCHW-FP16-F=ConvBinWinogradRxSf2x3g1:3.09497,0,miopenConvolutionFwdAlgoWinograd;GemmFwd1x1_0_1:0.683083,0,miopenConvolutionFwdAlgoGEMM;ConvBinWinogradRxSf3x2:1.55537,0,miopenConvolutionFwdAlgoWinograd
2560-10-16-3x3-1280-10-16-26-1x1-1x1-1x1-0-NCHW-FP16-F=GemmFwdRest:42.5197,7372800,miopenConvolutionFwdAlgoGEMM;ConvBinWinogradRxSf3x2:23.602,0,miopenConvolutionFwdAlgoWinograd;ConvBinWinogradRxSf2x3g1:11.0562,0,miopenConvolutionFwdAlgoWinograd
2560-10-16-1x1-1280-10-16-26-0x0-1x1-1x1-0-NCHW-FP16-F=ConvBinWinogradRxSf2x3g1:10.0996,0,miopenConvolutionFwdAlgoWinograd;GemmFwd1x1_0_1:1.24567,0,miopenConvolutionFwdAlgoGEMM;ConvBinWinogradRxSf3x2:6.05811,0,miopenConvolutionFwdAlgoWinograd
1920-10-16-3x3-1280-10-16-26-1x1-1x1-1x1-0-NCHW-FP16-F=GemmFwdRest:17.9789,5529600,miopenConvolutionFwdAlgoGEMM;ConvBinWinogradRxSf3x2:17.6413,0,miopenConvolutionFwdAlgoWinograd;ConvBinWinogradRxSf2x3g1:7.85014,0,miopenConvolutionFwdAlgoWinograd
1920-10-16-1x1-1280-10-16-26-0x0-1x1-1x1-0-NCHW-FP16-F=ConvBinWinogradRxSf2x3g1:7.61167,0,miopenConvolutionFwdAlgoWinograd;GemmFwd1x1_0_1:0.901413,0,miopenConvolutionFwdAlgoGEMM;ConvBinWinogradRxSf3x2:4.60633,0,miopenConvolutionFwdAlgoWinograd
1280-20-32-3x3-1280-20-32-26-1x1-1x1-1x1-0-NCHW-FP16-F=GemmFwdRest:21.2532,14745600,miopenConvolutionFwdAlgoGEMM;ConvBinWinogradRxSf3x2:37.477,0,miopenConvolutionFwdAlgoWinograd;ConvBinWinogradRxSf2x3g1:20.3106,0,miopenConvolutionFwdAlgoWinograd
1920-20-32-3x3-640-20-32-26-1x1-1x1-1x1-0-NCHW-FP16-F=GemmFwdRest:23.9136,22118400,miopenConvolutionFwdAlgoGEMM;ConvBinWinogradRxSf3x2:28.4074,0,miopenConvolutionFwdAlgoWinograd;ConvBinWinogradRxSf2x3g1:15.0611,0,miopenConvolutionFwdAlgoWinograd
1920-20-32-1x1-640-20-32-26-0x0-1x1-1x1-0-NCHW-FP16-F=ConvBinWinogradRxSf2x3g1:14.8902,0,miopenConvolutionFwdAlgoWinograd;GemmFwd1x1_0_1:1.26014,0,miopenConvolutionFwdAlgoGEMM;ConvBinWinogradRxSf3x2:7.22829,0,miopenConvolutionFwdAlgoWinograd
960-20-32-3x3-640-20-32-26-1x1-1x1-1x1-0-NCHW-FP16-F=GemmFwdRest:10.6419,11059200,miopenConvolutionFwdAlgoGEMM;ConvBinWinogradRxSf3x2:14.1568,0,miopenConvolutionFwdAlgoWinograd;ConvBinWinogradRxSf2x3g1:7.55929,0,miopenConvolutionFwdAlgoWinograd
960-20-32-1x1-640-20-32-26-0x0-1x1-1x1-0-NCHW-FP16-F=ConvBinWinogradRxSf2x3g1:7.67383,0,miopenConvolutionFwdAlgoWinograd;GemmFwd1x1_0_1:0.650975,0,miopenConvolutionFwdAlgoGEMM;ConvBinWinogradRxSf3x2:3.75686,0,miopenConvolutionFwdAlgoWinograd
640-40-64-3x3-640-40-64-26-1x1-1x1-1x1-0-NCHW-FP16-F=GemmFwdRest:18.3174,29491200,miopenConvolutionFwdAlgoGEMM;ConvBinWinogradRxSf3x2:37.9054,0,miopenConvolutionFwdAlgoWinograd;ConvBinWinogradRxSf2x3g1:21.4611,0,miopenConvolutionFwdAlgoWinograd
960-40-64-3x3-320-40-64-26-1x1-1x1-1x1-0-NCHW-FP16-F=GemmFwdRest:30.0215,44236800,miopenConvolutionFwdAlgoGEMM;ConvBinWinogradRxSf3x2:28.4225,0,miopenConvolutionFwdAlgoWinograd;ConvBinWinogradRxSf2x3g1:15.9295,0,miopenConvolutionFwdAlgoWinograd
960-40-64-1x1-320-40-64-26-0x0-1x1-1x1-0-NCHW-FP16-F=ConvBinWinogradRxSf2x3g1:15.6529,0,miopenConvolutionFwdAlgoWinograd;GemmFwd1x1_0_1:1.71673,0,miopenConvolutionFwdAlgoGEMM;ConvBinWinogradRxSf3x2:7.3516,0,miopenConvolutionFwdAlgoWinograd
640-40-64-3x3-320-40-64-26-1x1-1x1-1x1-0-NCHW-FP16-F=GemmFwdRest:12.1676,29491200,miopenConvolutionFwdAlgoGEMM;ConvBinWinogradRxSf3x2:12.6919,0,miopenConvolutionFwdAlgoWinograd;ConvBinWinogradRxSf2x3g1:7.95019,0,miopenConvolutionFwdAlgoWinograd
640-40-64-1x1-320-40-64-26-0x0-1x1-1x1-0-NCHW-FP16-F=ConvBinWinogradRxSf2x3g1:10.5741,0,miopenConvolutionFwdAlgoWinograd;GemmFwd1x1_0_1:1.26736,0,miopenConvolutionFwdAlgoGEMM;ConvBinWinogradRxSf3x2:5.02564,0,miopenConvolutionFwdAlgoWinograd
320-40-64-3x3-4-40-64-26-1x1-1x1-1x1-0-NCHW-FP16-F=GemmFwdRest:5.67759,14745600,miopenConvolutionFwdAlgoGEMM;ConvBinWinogradRxSf3x2:1.15613,0,miopenConvolutionFwdAlgoWinograd;ConvBinWinogradRxSf2x3g1:0.604143,0,miopenConvolutionFwdAlgoWinograd
4-40-64-1x1-4-40-64-1-0x0-1x1-1x1-0-NCHW-FP16-F=ConvBinWinogradRxSf2x3g1:0.0579833,0,miopenConvolutionFwdAlgoWinograd;GemmFwd1x1_0_1:0.0177257,0,miopenConvolutionFwdAlgoGEMM;ConvBinWinogradRxSf3x2:0.064425,0,miopenConvolutionFwdAlgoWinograd
4-40-64-3x3-512-40-64-1-1x1-1x1-1x1-0-NCHW-FP16-F=GemmFwdRest:0.0539617,184320,miopenConvolutionFwdAlgoGEMM;ConvBinWinogradRxSf3x2:0.0775333,0,miopenConvolutionFwdAlgoWinograd;ConvBinWinogradRxSf2x3g1:0.0670667,0,miopenConvolutionFwdAlgoWinograd
512-40-64-3x3-512-40-64-1-1x1-1x1-1x1-0-NCHW-FP16-F=GemmFwdRest:0.482794,23592960,miopenConvolutionFwdAlgoGEMM;ConvBinWinogradRxSf3x2:1.07436,0,miopenConvolutionFwdAlgoWinograd;ConvBinWinogradRxSf2x3g1:0.5916,0,miopenConvolutionFwdAlgoWinograd
512-40-64-1x1-512-40-64-1-0x0-1x1-1x1-0-NCHW-FP16-F=ConvBinWinogradRxSf2x3g1:0.589614,0,miopenConvolutionFwdAlgoWinograd;GemmFwd1x1_0_1:0.05814,0,miopenConvolutionFwdAlgoGEMM;ConvBinWinogradRxSf3x2:0.3322,0,miopenConvolutionFwdAlgoWinograd
512-80-128-3x3-512-80-128-1-1x1-1x1-1x1-0-NCHW-FP16-F=GemmFwdRest:2.20188,94371840,miopenConvolutionFwdAlgoGEMM;ConvBinWinogradRxSf3x2:3.80623,0,miopenConvolutionFwdAlgoWinograd;ConvBinWinogradRxSf2x3g1:2.14607,0,miopenConvolutionFwdAlgoWinograd
512-160-256-3x3-512-160-256-1-1x1-1x1-1x1-0-NCHW-FP16-F=GemmFwdRest:12.1498,377487360,miopenConvolutionFwdAlgoGEMM;ConvBinWinogradRxSf3x2:14.8261,0,miopenConvolutionFwdAlgoWinograd;ConvBinWinogradRxSf2x3g1:8.47691,0,miopenConvolutionFwdAlgoWinograd
512-160-256-3x3-256-160-256-1-1x1-1x1-1x1-0-NCHW-FP16-F=GemmFwdRest:8.50227,377487360,miopenConvolutionFwdAlgoGEMM;ConvBinWinogradRxSf3x2:7.37927,0,miopenConvolutionFwdAlgoWinograd;ConvBinWinogradRxSf2x3g1:4.06314,0,miopenConvolutionFwdAlgoWinograd
256-160-256-3x3-256-160-256-1-1x1-1x1-1x1-0-NCHW-FP16-F=GemmFwdRest:2.92151,188743680,miopenConvolutionFwdAlgoGEMM;ConvBinWinogradRxSf3x2:3.7116,0,miopenConvolutionFwdAlgoWinograd;ConvBinWinogradRxSf2x3g1:2.12,0,miopenConvolutionFwdAlgoWinograd
512-160-256-1x1-256-160-256-1-0x0-1x1-1x1-0-NCHW-FP16-F=ConvBinWinogradRxSf2x3g1:4.07444,0,miopenConvolutionFwdAlgoWinograd;GemmFwd1x1_0_1:0.447557,0,miopenConvolutionFwdAlgoGEMM;ConvBinWinogradRxSf3x2:1.97385,0,miopenConvolutionFwdAlgoWinograd
256-320-512-3x3-256-320-512-1-1x1-1x1-1x1-0-NCHW-FP16-F=GemmFwdRest:11.1092,754974720,miopenConvolutionFwdAlgoGEMM;ConvBinWinogradRxSf3x2:13.9938,0,miopenConvolutionFwdAlgoWinograd;ConvBinWinogradRxSf2x3g1:8.24071,0,miopenConvolutionFwdAlgoWinograd
256-320-512-3x3-128-320-512-1-1x1-1x1-1x1-0-NCHW-FP16-F=GemmFwdRest:9.24116,754974720,miopenConvolutionFwdAlgoGEMM;ConvBinWinogradRxSf3x2:7.44122,0,miopenConvolutionFwdAlgoWinograd;ConvBinWinogradRxSf2x3g1:4.32194,0,miopenConvolutionFwdAlgoWinograd
128-320-512-3x3-128-320-512-1-1x1-1x1-1x1-0-NCHW-FP16-F=GemmFwdRest:4.96855,377487360,miopenConvolutionFwdAlgoGEMM;ConvBinWinogradRxSf3x2:3.71069,0,miopenConvolutionFwdAlgoWinograd;ConvBinWinogradRxSf2x3g1:2.22795,0,miopenConvolutionFwdAlgoWinograd
256-320-512-1x1-128-320-512-1-0x0-1x1-1x1-0-NCHW-FP16-F=ConvBinWinogradRxSf2x3g1:4.15056,0,miopenConvolutionFwdAlgoWinograd;GemmFwd1x1_0_1:0.83177,0,miopenConvolutionFwdAlgoGEMM;ConvBinWinogradRxSf3x2:1.9684,0,miopenConvolutionFwdAlgoWinograd
128-320-512-3x3-3-320-512-1-1x1-1x1-1x1-0-NCHW-FP16-F=GemmFwdRest:4.56268,377487360,miopenConvolutionFwdAlgoGEMM;ConvBinWinogradRxSf3x2:1.01958,0,miopenConvolutionFwdAlgoWinograd;ConvBinWinogradRxSf2x3g1:0.610117,0,miopenConvolutionFwdAlgoWinograd
3-320-514-1x3-3-320-512-1-0x0-1x1-1x1-0-NCHW-FP16-F_g3=GemmFwdRest:0.38651,2949120,miopenConvolutionFwdAlgoGEMM;ConvBinWinogradRxSf2x3:0.25485,0,miopenConvolutionFwdAlgoWinograd;ConvBinWinogradRxSf3x2:0.18195,0,miopenConvolutionFwdAlgoWinograd
3-322-512-3x1-3-320-512-1-0x0-1x1-1x1-0-NCHW-FP16-F_g3=GemmFwdRest:0.395682,2949120,miopenConvolutionFwdAlgoGEMM;ConvBinWinogradRxSf2x3:0.26462,0,miopenConvolutionFwdAlgoWinograd;ConvBinWinogradRxSf3x2:0.197633,0,miopenConvolutionFwdAlgoWinograd
3-224-224-14x14-1280-16-16-1-0x0-14x14-1x1-0-NCHW-FP16-F=GemmFwdRest:0.197029,301056,miopenConvolutionFwdAlgoGEMM
3-320-512-3x3-128-320-512-1-1x1-1x1-1x1-0-NCHW-FP16-F=GemmFwdRest:0.467141,8847360,miopenConvolutionFwdAlgoGEMM;ConvBinWinogradRxSf3x2:0.416983,0,miopenConvolutionFwdAlgoWinograd;ConvBinWinogradRxSf2x3g1:0.290014,0,miopenConvolutionFwdAlgoWinograd
128-321-513-3x3-128-160-256-1-0x0-2x2-1x1-0-NCHW-FP16-F=GemmFwdRest:1.77532,94371840,miopenConvolutionFwdAlgoGEMM;ConvBinWinogradRxSf3x2:1.10618,0,miopenConvolutionFwdAlgoWinograd;ConvBinWinogradRxSf2x3g1:2.4302,0,miopenConvolutionFwdAlgoWinograd
128-160-256-3x3-256-160-256-1-1x1-1x1-1x1-0-NCHW-FP16-F=GemmFwdRest:2.04781,94371840,miopenConvolutionFwdAlgoGEMM;ConvBinWinogradRxSf3x2:2.06006,0,miopenConvolutionFwdAlgoWinograd;ConvBinWinogradRxSf2x3g1:1.13577,0,miopenConvolutionFwdAlgoWinograd
128-160-256-1x1-256-160-256-1-0x0-1x1-1x1-0-NCHW-FP16-F=ConvBinWinogradRxSf2x3g1:1.14602,0,miopenConvolutionFwdAlgoWinograd;GemmFwd1x1_0_1:0.13197,0,miopenConvolutionFwdAlgoGEMM;ConvBinWinogradRxSf3x2:0.58274,0,miopenConvolutionFwdAlgoWinograd
256-161-257-3x3-256-80-128-1-0x0-2x2-1x1-0-NCHW-FP16-F=GemmFwdRest:1.23159,47185920,miopenConvolutionFwdAlgoGEMM;ConvBinWinogradRxSf3x2:1.11925,0,miopenConvolutionFwdAlgoWinograd;ConvBinWinogradRxSf2x3g1:2.22642,0,miopenConvolutionFwdAlgoWinograd
256-80-128-3x3-512-80-128-1-1x1-1x1-1x1-0-NCHW-FP16-F=GemmFwdRest:2.65936,47185920,miopenConvolutionFwdAlgoGEMM;ConvBinWinogradRxSf3x2:1.97957,0,miopenConvolutionFwdAlgoWinograd;ConvBinWinogradRxSf2x3g1:1.16191,0,miopenConvolutionFwdAlgoWinograd
256-80-128-1x1-512-80-128-1-0x0-1x1-1x1-0-NCHW-FP16-F=ConvBinWinogradRxSf2x3g1:1.2035,0,miopenConvolutionFwdAlgoWinograd;GemmFwd1x1_0_1:0.119532,0,miopenConvolutionFwdAlgoGEMM;ConvBinWinogradRxSf3x2:0.565971,0,miopenConvolutionFwdAlgoWinograd
512-81-129-3x3-512-40-64-1-0x0-2x2-1x1-0-NCHW-FP16-F=GemmFwdRest:0.738156,23592960,miopenConvolutionFwdAlgoGEMM;ConvBinWinogradRxSf3x2:1.08839,0,miopenConvolutionFwdAlgoWinograd;ConvBinWinogradRxSf2x3g1:2.25202,0,miopenConvolutionFwdAlgoWinograd
512-40-64-3x3-8-40-64-1-1x1-1x1-1x1-0-NCHW-FP16-F=GemmFwdRest:0.35863,23592960,miopenConvolutionFwdAlgoGEMM;ConvBinWinogradRxSf3x2:0.306617,0,miopenConvolutionFwdAlgoWinograd;ConvBinWinogradRxSf2x3g1:0.122367,0,miopenConvolutionFwdAlgoWinograd
8-40-64-1x1-8-40-64-1-0x0-1x1-1x1-0-NCHW-FP16-F=ConvBinWinogradRxSf2x3g1:0.0613,0,miopenConvolutionFwdAlgoWinograd;GemmFwd1x1_0_1:0.0225843,0,miopenConvolutionFwdAlgoGEMM;ConvBinWinogradRxSf3x2:0.06808,0,miopenConvolutionFwdAlgoWinograd
8-40-64-3x3-320-40-64-16-1x1-1x1-1x1-0-NCHW-FP16-F=GemmFwdRest:0.962537,368640,miopenConvolutionFwdAlgoGEMM;ConvBinWinogradRxSf3x2:0.28316,0,miopenConvolutionFwdAlgoWinograd;ConvBinWinogradRxSf2x3g1:0.188457,0,miopenConvolutionFwdAlgoWinograd
320-1-16-1x1-512-1-16-2560-0x0-1x1-1x1-0-NCHW-FP16-F=ConvBinWinogradRxSf2x3g1:10.6983,0,miopenConvolutionFwdAlgoWinograd;GemmFwd1x1_0_1:4.51517,0,miopenConvolutionFwdAlgoGEMM;ConvBinWinogradRxSf3x2:7.91863,0,miopenConvolutionFwdAlgoWinograd
512-1-16-1x1-320-1-16-2560-0x0-1x1-1x1-0-NCHW-FP16-F=ConvBinWinogradRxSf2x3g1:10.4654,0,miopenConvolutionFwdAlgoWinograd;GemmFwd1x1_0_1:4.74563,0,miopenConvolutionFwdAlgoGEMM;ConvBinWinogradRxSf3x2:7.59778,0,miopenConvolutionFwdAlgoWinograd
320-40-64-3x3-320-40-64-16-1x1-1x1-1x1-0-NCHW-FP16-F=GemmFwdRest:6.00312,14745600,miopenConvolutionFwdAlgoGEMM;ConvBinWinogradRxSf3x2:6.00783,0,miopenConvolutionFwdAlgoWinograd;ConvBinWinogradRxSf2x3g1:3.35056,0,miopenConvolutionFwdAlgoWinograd
320-16-40-64-3x1x1-320-16-40-64-1-1x0x0-1x1x1-1x1x1-0-NCDHW-FP16-F=GemmFwdRest:3.4699,78643200,miopenConvolutionFwdAlgoGEMM
320-40-64-3x3-320-20-32-16-1x1-2x2-1x1-0-NCHW-FP16-F=GemmFwdRest:2.86624,3686400,miopenConvolutionFwdAlgoGEMM;ConvBinWinogradRxSf3x2:2.17763,0,miopenConvolutionFwdAlgoWinograd;ConvBinWinogradRxSf2x3g1:3.51589,0,miopenConvolutionFwdAlgoWinograd
320-20-32-3x3-640-20-32-16-1x1-1x1-1x1-0-NCHW-FP16-F=GemmFwdRest:3.33905,3686400,miopenConvolutionFwdAlgoGEMM;ConvBinWinogradRxSf3x2:3.27515,0,miopenConvolutionFwdAlgoWinograd;ConvBinWinogradRxSf2x3g1:1.73568,0,miopenConvolutionFwdAlgoWinograd
640-20-32-3x3-640-20-32-16-1x1-1x1-1x1-0-NCHW-FP16-F=GemmFwdRest:5.89485,7372800,miopenConvolutionFwdAlgoGEMM;ConvBinWinogradRxSf3x2:6.08469,0,miopenConvolutionFwdAlgoWinograd;ConvBinWinogradRxSf2x3g1:3.1962,0,miopenConvolutionFwdAlgoWinograd
320-20-32-1x1-640-20-32-16-0x0-1x1-1x1-0-NCHW-FP16-F=ConvBinWinogradRxSf2x3g1:1.69495,0,miopenConvolutionFwdAlgoWinograd;GemmFwd1x1_0_1:0.185148,0,miopenConvolutionFwdAlgoGEMM;ConvBinWinogradRxSf3x2:0.865186,0,miopenConvolutionFwdAlgoWinograd
640-16-20-32-3x1x1-640-16-20-32-1-1x0x0-1x1x1-1x1x1-0-NCDHW-FP16-F=GemmFwdRest:2.39266,39321600,miopenConvolutionFwdAlgoGEMM
640-20-32-3x3-640-10-16-16-1x1-2x2-1x1-0-NCHW-FP16-F=GemmFwdRest:4.25404,1843200,miopenConvolutionFwdAlgoGEMM;ConvBinWinogradRxSf3x2:1.93865,0,miopenConvolutionFwdAlgoWinograd;ConvBinWinogradRxSf2x3g1:3.48172,0,miopenConvolutionFwdAlgoWinograd
640-10-16-3x3-1280-10-16-16-1x1-1x1-1x1-0-NCHW-FP16-F=GemmFwdRest:4.83655,1843200,miopenConvolutionFwdAlgoGEMM;ConvBinWinogradRxSf3x2:3.75073,0,miopenConvolutionFwdAlgoWinograd;ConvBinWinogradRxSf2x3g1:1.69871,0,miopenConvolutionFwdAlgoWinograd
1280-10-16-3x3-1280-10-16-16-1x1-1x1-1x1-0-NCHW-FP16-F=GemmFwdRest:10.4114,3686400,miopenConvolutionFwdAlgoGEMM;ConvBinWinogradRxSf3x2:7.27376,0,miopenConvolutionFwdAlgoWinograd;ConvBinWinogradRxSf2x3g1:3.15715,0,miopenConvolutionFwdAlgoWinograd
640-10-16-1x1-1280-10-16-16-0x0-1x1-1x1-0-NCHW-FP16-F=ConvBinWinogradRxSf2x3g1:1.70572,0,miopenConvolutionFwdAlgoWinograd;GemmFwd1x1_0_1:0.251859,0,miopenConvolutionFwdAlgoGEMM;ConvBinWinogradRxSf3x2:1.00816,0,miopenConvolutionFwdAlgoWinograd
1280-16-10-16-3x1x1-1280-16-10-16-1-1x0x0-1x1x1-1x1x1-0-NCDHW-FP16-F=GemmFwdRest:1.95834,19660800,miopenConvolutionFwdAlgoGEMM
1280-10-16-3x3-1280-5-8-16-1x1-2x2-1x1-0-NCHW-FP16-F=GemmFwdRest:7.43306,921600,miopenConvolutionFwdAlgoGEMM;ConvBinWinogradRxSf3x2:1.9858,0,miopenConvolutionFwdAlgoWinograd;ConvBinWinogradRxSf2x3g1:4.15665,0,miopenConvolutionFwdAlgoWinograd
1280-5-8-3x3-1280-5-8-16-1x1-1x1-1x1-0-NCHW-FP16-F=GemmFwdRest:8.04231,921600,miopenConvolutionFwdAlgoGEMM;ConvBinWinogradRxSf3x2:1.89173,0,miopenConvolutionFwdAlgoWinograd;ConvBinWinogradRxSf2x3g1:0.994367,0,miopenConvolutionFwdAlgoWinograd
1280-16-5-8-3x1x1-1280-16-5-8-1-1x0x0-1x1x1-1x1x1-0-NCDHW-FP16-F=GemmFwdRest:0.55044,4915200,miopenConvolutionFwdAlgoGEMM
2560-5-8-3x3-1280-5-8-16-1x1-1x1-1x1-0-NCHW-FP16-F=GemmFwdRest:23.6733,1843200,miopenConvolutionFwdAlgoGEMM;ConvBinWinogradRxSf3x2:4.1506,0,miopenConvolutionFwdAlgoWinograd;ConvBinWinogradRxSf2x3g1:2.30995,0,miopenConvolutionFwdAlgoWinograd
2560-5-8-1x1-1280-5-8-16-0x0-1x1-1x1-0-NCHW-FP16-F=ConvBinWinogradRxSf2x3g1:1.98637,0,miopenConvolutionFwdAlgoWinograd;GemmFwd1x1_0_1:0.451715,0,miopenConvolutionFwdAlgoGEMM;ConvBinWinogradRxSf3x2:1.02171,0,miopenConvolutionFwdAlgoWinograd
2560-10-16-3x3-1280-10-16-16-1x1-1x1-1x1-0-NCHW-FP16-F=GemmFwdRest:33.9155,7372800,miopenConvolutionFwdAlgoGEMM;ConvBinWinogradRxSf3x2:14.939,0,miopenConvolutionFwdAlgoWinograd;ConvBinWinogradRxSf2x3g1:6.25207,0,miopenConvolutionFwdAlgoWinograd
2560-10-16-1x1-1280-10-16-16-0x0-1x1-1x1-0-NCHW-FP16-F=ConvBinWinogradRxSf2x3g1:6.29737,0,miopenConvolutionFwdAlgoWinograd;GemmFwd1x1_0_1:1.03069,0,miopenConvolutionFwdAlgoGEMM;ConvBinWinogradRxSf3x2:3.78223,0,miopenConvolutionFwdAlgoWinograd
1920-10-16-3x3-1280-10-16-16-1x1-1x1-1x1-0-NCHW-FP16-F=GemmFwdRest:15.4023,5529600,miopenConvolutionFwdAlgoGEMM;ConvBinWinogradRxSf3x2:10.9969,0,miopenConvolutionFwdAlgoWinograd;ConvBinWinogradRxSf2x3g1:4.67905,0,miopenConvolutionFwdAlgoWinograd
1920-10-16-1x1-1280-10-16-16-0x0-1x1-1x1-0-NCHW-FP16-F=ConvBinWinogradRxSf2x3g1:4.715,0,miopenConvolutionFwdAlgoWinograd;GemmFwd1x1_0_1:0.683257,0,miopenConvolutionFwdAlgoGEMM;ConvBinWinogradRxSf3x2:2.82749,0,miopenConvolutionFwdAlgoWinograd
1280-20-32-3x3-1280-20-32-16-1x1-1x1-1x1-0-NCHW-FP16-F=GemmFwdRest:18.3146,14745600,miopenConvolutionFwdAlgoGEMM;ConvBinWinogradRxSf3x2:24.1184,0,miopenConvolutionFwdAlgoWinograd;ConvBinWinogradRxSf2x3g1:12.5445,0,miopenConvolutionFwdAlgoWinograd
1920-20-32-3x3-640-20-32-16-1x1-1x1-1x1-0-NCHW-FP16-F=GemmFwdRest:18.4277,22118400,miopenConvolutionFwdAlgoGEMM;ConvBinWinogradRxSf3x2:18.3554,0,miopenConvolutionFwdAlgoWinograd;ConvBinWinogradRxSf2x3g1:9.33368,0,miopenConvolutionFwdAlgoWinograd
1920-20-32-1x1-640-20-32-16-0x0-1x1-1x1-0-NCHW-FP16-F=ConvBinWinogradRxSf2x3g1:9.42421,0,miopenConvolutionFwdAlgoWinograd;GemmFwd1x1_0_1:1.56154,0,miopenConvolutionFwdAlgoGEMM;ConvBinWinogradRxSf3x2:4.67413,0,miopenConvolutionFwdAlgoWinograd
960-20-32-3x3-640-20-32-16-1x1-1x1-1x1-0-NCHW-FP16-F=GemmFwdRest:8.24011,11059200,miopenConvolutionFwdAlgoGEMM;ConvBinWinogradRxSf3x2:9.12342,0,miopenConvolutionFwdAlgoWinograd;ConvBinWinogradRxSf2x3g1:4.70301,0,miopenConvolutionFwdAlgoWinograd
960-20-32-1x1-640-20-32-16-0x0-1x1-1x1-0-NCHW-FP16-F=ConvBinWinogradRxSf2x3g1:4.74526,0,miopenConvolutionFwdAlgoWinograd;GemmFwd1x1_0_1:0.426397,0,miopenConvolutionFwdAlgoGEMM;ConvBinWinogradRxSf3x2:2.40194,0,miopenConvolutionFwdAlgoWinograd
640-40-64-3x3-640-40-64-16-1x1-1x1-1x1-0-NCHW-FP16-F=GemmFwdRest:13.6312,29491200,miopenConvolutionFwdAlgoGEMM;ConvBinWinogradRxSf3x2:23.4489,0,miopenConvolutionFwdAlgoWinograd;ConvBinWinogradRxSf2x3g1:12.877,0,miopenConvolutionFwdAlgoWinograd
960-40-64-3x3-320-40-64-16-1x1-1x1-1x1-0-NCHW-FP16-F=GemmFwdRest:21.438,44236800,miopenConvolutionFwdAlgoGEMM;ConvBinWinogradRxSf3x2:17.7511,0,miopenConvolutionFwdAlgoWinograd;ConvBinWinogradRxSf2x3g1:9.6667,0,miopenConvolutionFwdAlgoWinograd
960-40-64-1x1-320-40-64-16-0x0-1x1-1x1-0-NCHW-FP16-F=ConvBinWinogradRxSf2x3g1:9.47423,0,miopenConvolutionFwdAlgoWinograd;GemmFwd1x1_0_1:1.54974,0,miopenConvolutionFwdAlgoGEMM;ConvBinWinogradRxSf3x2:4.67023,0,miopenConvolutionFwdAlgoWinograd
640-40-64-3x3-320-40-64-16-1x1-1x1-1x1-0-NCHW-FP16-F=GemmFwdRest:11.6214,29491200,miopenConvolutionFwdAlgoGEMM;ConvBinWinogradRxSf3x2:12.7283,0,miopenConvolutionFwdAlgoWinograd;ConvBinWinogradRxSf2x3g1:7.1577,0,miopenConvolutionFwdAlgoWinograd
640-40-64-1x1-320-40-64-16-0x0-1x1-1x1-0-NCHW-FP16-F=ConvBinWinogradRxSf2x3g1:6.39013,0,miopenConvolutionFwdAlgoWinograd;GemmFwd1x1_0_1:1.12648,0,miopenConvolutionFwdAlgoGEMM;ConvBinWinogradRxSf3x2:3.13826,0,miopenConvolutionFwdAlgoWinograd
320-40-64-3x3-4-40-64-16-1x1-1x1-1x1-0-NCHW-FP16-F=GemmFwdRest:3.98511,14745600,miopenConvolutionFwdAlgoGEMM;ConvBinWinogradRxSf3x2:0.687383,0,miopenConvolutionFwdAlgoWinograd;ConvBinWinogradRxSf2x3g1:0.388186,0,miopenConvolutionFwdAlgoWinograd
3-224-224-14x14-1024-16-16-1-0x0-14x14-1x1-0-NCHW-FP16-F=GemmFwdRest:0.101929,301056,miopenConvolutionFwdAlgoGEMM
3-512-512-3x3-64-512-512-1-1x1-1x1-1x1-0-NCHW-FP16-F=GemmFwdRest:0.37406,14155776,miopenConvolutionFwdAlgoGEMM;ConvBinWinogradRxSf3x2:0.248383,0,miopenConvolutionFwdAlgoWinograd;ConvBinWinogradRxSf2x3g1:0.21575,0,miopenConvolutionFwdAlgoWinograd
64-512-512-3x3-32-512-512-1-1x1-1x1-1x1-0-NCHW-FP16-F=GemmFwdRest:3.92143,301989888,miopenConvolutionFwdAlgoGEMM;ConvBinWinogradRxSf3x2:0.831257,0,miopenConvolutionFwdAlgoWinograd;ConvBinWinogradRxSf2x3g1:0.54262,0,miopenConvolutionFwdAlgoWinograd
96-512-512-3x3-32-512-512-1-1x1-1x1-1x1-0-NCHW-FP16-F=GemmFwdRest:5.21877,452984832,miopenConvolutionFwdAlgoGEMM;ConvBinWinogradRxSf3x2:1.18969,0,miopenConvolutionFwdAlgoWinograd;ConvBinWinogradRxSf2x3g1:0.755433,0,miopenConvolutionFwdAlgoWinograd
128-512-512-3x3-32-512-512-1-1x1-1x1-1x1-0-NCHW-FP16-F=GemmFwdRest:6.83204,603979776,miopenConvolutionFwdAlgoGEMM;ConvBinWinogradRxSf3x2:1.53343,0,miopenConvolutionFwdAlgoWinograd;ConvBinWinogradRxSf2x3g1:0.962971,0,miopenConvolutionFwdAlgoWinograd
160-512-512-3x3-32-512-512-1-1x1-1x1-1x1-0-NCHW-FP16-F=GemmFwdRest:9.42592,754974720,miopenConvolutionFwdAlgoGEMM;ConvBinWinogradRxSf3x2:1.89699,0,miopenConvolutionFwdAlgoWinograd;ConvBinWinogradRxSf2x3g1:1.18547,0,miopenConvolutionFwdAlgoWinograd
192-512-512-3x3-64-512-512-1-1x1-1x1-1x1-0-NCHW-FP16-F=GemmFwdRest:10.8744,905969664,miopenConvolutionFwdAlgoGEMM;ConvBinWinogradRxSf3x2:4.4227,0,miopenConvolutionFwdAlgoWinograd;ConvBinWinogradRxSf2x3g1:2.62549,0,miopenConvolutionFwdAlgoWinograd
64-512-512-3x3-64-512-512-1-1x1-1x1-1x1-0-NCHW-FP16-F=GemmFwdRest:3.74036,301989888,miopenConvolutionFwdAlgoGEMM;ConvBinWinogradRxSf3x2:1.56007,0,miopenConvolutionFwdAlgoWinograd;ConvBinWinogradRxSf2x3g1:1.00562,0,miopenConvolutionFwdAlgoWinograd
64-1024-1024-3x3-64-1024-1024-1-1x1-1x1-1x1-0-NCHW-FP16-F=GemmFwdRest:15.5547,1207959552,miopenConvolutionFwdAlgoGEMM;ConvBinWinogradRxSf3x2:6.0283,0,miopenConvolutionFwdAlgoWinograd;ConvBinWinogradRxSf2x3g1:3.81676,0,miopenConvolutionFwdAlgoWinograd
64-2048-2048-3x3-64-2048-2048-1-1x1-1x1-1x1-0-NCHW-FP16-F=GemmFwdRest:73.659,4831838208,miopenConvolutionFwdAlgoGEMM;ConvBinWinogradRxSf3x2:27.462,0,miopenConvolutionFwdAlgoWinograd;ConvBinWinogradRxSf2x3g1:19.0682,0,miopenConvolutionFwdAlgoWinograd
64-2048-2048-3x3-3-2048-2048-1-1x1-1x1-1x1-0-NCHW-FP16-F=GemmFwdRest:65.9343,4831838208,miopenConvolutionFwdAlgoGEMM;ConvBinWinogradRxSf3x2:7.64354,0,miopenConvolutionFwdAlgoWinograd;ConvBinWinogradRxSf2x3g1:5.29834,0,miopenConvolutionFwdAlgoWinograd
16-13-60-104-1x2x2-1536-13-30-52-1-0x0x0-1x2x2-1x1x1-0-NCDHW-FP16-F=GemmFwdRest:0.46891,2595840,miopenConvolutionFwdAlgoGEMM
16-13-60-104-1x1x1-16-13-60-104-1-0x0x0-1x1x1-1x1x1-0-NCDHW-FP16-F=GemmFwd1x1_0_1:0.100683,0,miopenConvolutionFwdAlgoGEMM
16-3-62-106-3x3x3-384-1-60-104-1-0x0x0-1x1x1-1x1x1-0-NCDHW-FP16-F=GemmFwdRest:0.290802,5391360,miopenConvolutionFwdAlgoGEMM
384-3-62-106-3x3x3-384-1-60-104-1-0x0x0-1x1x1-1x1x1-0-NCDHW-FP16-F=GemmFwdRest:5.1443,129392640,miopenConvolutionFwdAlgoGEMM
384-60-104-1x1-1152-60-104-1-0x0-1x1-1x1-0-NCHW-FP16-F=ConvBinWinogradRxSf2x3g1:2.28124,0,miopenConvolutionFwdAlgoWinograd;GemmFwd1x1_0_1:0.277477,0,miopenConvolutionFwdAlgoGEMM;ConvBinWinogradRxSf3x2:1.02493,0,miopenConvolutionFwdAlgoWinograd
384-60-104-1x1-384-60-104-1-0x0-1x1-1x1-0-NCHW-FP16-F=ConvBinWinogradRxSf2x3g1:0.795414,0,miopenConvolutionFwdAlgoWinograd;GemmFwd1x1_0_1:0.081994,0,miopenConvolutionFwdAlgoGEMM;ConvBinWinogradRxSf3x2:0.399943,0,miopenConvolutionFwdAlgoWinograd
384-120-208-3x3-192-120-208-1-1x1-1x1-1x1-0-NCHW-FP16-F=GemmFwdRest:2.8824,172523520,miopenConvolutionFwdAlgoGEMM;ConvBinWinogradRxSf3x2:2.71981,0,miopenConvolutionFwdAlgoWinograd;ConvBinWinogradRxSf2x3g1:1.63493,0,miopenConvolutionFwdAlgoWinograd
192-1-120-208-1x1x1-384-1-120-208-1-0x0x0-1x1x1-1x1x1-0-NCDHW-FP16-F=GemmFwd1x1_0_1:0.179642,0,miopenConvolutionFwdAlgoGEMM
192-3-122-210-3x3x3-384-1-120-208-1-0x0x0-1x1x1-1x1x1-0-NCDHW-FP16-F=GemmFwdRest:13.0283,258785280,miopenConvolutionFwdAlgoGEMM
384-3-122-210-3x3x3-384-1-120-208-1-0x0x0-1x1x1-1x1x1-0-NCDHW-FP16-F=GemmFwdRest:25.8647,517570560,miopenConvolutionFwdAlgoGEMM
384-240-416-3x3-192-240-416-1-1x1-1x1-1x1-0-NCHW-FP16-F=GemmFwdRest:16.34,690094080,miopenConvolutionFwdAlgoGEMM;ConvBinWinogradRxSf3x2:10.0247,0,miopenConvolutionFwdAlgoWinograd;ConvBinWinogradRxSf2x3g1:5.75721,0,miopenConvolutionFwdAlgoWinograd
192-3-242-418-3x3x3-192-1-240-416-1-0x0x0-1x1x1-1x1x1-0-NCDHW-FP16-F=GemmFwdRest:54.3076,1035141120,miopenConvolutionFwdAlgoGEMM
192-480-832-3x3-96-480-832-1-1x1-1x1-1x1-0-NCHW-FP16-F=GemmFwdRest:25.7371,1380188160,miopenConvolutionFwdAlgoGEMM;ConvBinWinogradRxSf3x2:10.059,0,miopenConvolutionFwdAlgoWinograd;ConvBinWinogradRxSf2x3g1:5.9472,0,miopenConvolutionFwdAlgoWinograd
96-3-482-834-3x3x3-96-1-480-832-1-0x0x0-1x1x1-1x1x1-0-NCDHW-FP16-F=GemmFwdRest:110.356,2070282240,miopenConvolutionFwdAlgoGEMM
96-3-482-834-3x3x3-3-1-480-832-1-0x0x0-1x1x1-1x1x1-0-NCDHW-FP16-F=GemmFwdRest:105.351,2070282240,miopenConvolutionFwdAlgoGEMM
384-3-60-104-3x1x1-768-1-60-104-1-0x0x0-1x1x1-1x1x1-0-NCDHW-FP16-F=GemmFwdRest:1.00767,14376960,miopenConvolutionFwdAlgoGEMM
384-120-208-3x3-192-120-208-2-1x1-1x1-1x1-0-NCHW-FP16-F=GemmFwdRest:7.55056,172523520,miopenConvolutionFwdAlgoGEMM;ConvBinWinogradRxSf3x2:5.18629,0,miopenConvolutionFwdAlgoWinograd;ConvBinWinogradRxSf2x3g1:3.0216,0,miopenConvolutionFwdAlgoWinograd
192-2-120-208-1x1x1-384-2-120-208-1-0x0x0-1x1x1-1x1x1-0-NCDHW-FP16-F=GemmFwd1x1_0_1:0.391397,0,miopenConvolutionFwdAlgoGEMM
192-4-122-210-3x3x3-384-2-120-208-1-0x0x0-1x1x1-1x1x1-0-NCDHW-FP16-F=GemmFwdRest:33.181,517570560,miopenConvolutionFwdAlgoGEMM
384-4-122-210-3x3x3-384-2-120-208-1-0x0x0-1x1x1-1x1x1-0-NCDHW-FP16-F=GemmFwdRest:93.7016,1035141120,miopenConvolutionFwdAlgoGEMM
384-4-120-208-3x1x1-768-2-120-208-1-0x0x0-1x1x1-1x1x1-0-NCDHW-FP16-F=GemmFwdRest:11.0732,115015680,miopenConvolutionFwdAlgoGEMM
384-240-416-3x3-192-240-416-4-1x1-1x1-1x1-0-NCHW-FP16-F=GemmFwdRest:84.07,690094080,miopenConvolutionFwdAlgoGEMM;ConvBinWinogradRxSf3x2:40.4184,0,miopenConvolutionFwdAlgoWinograd;ConvBinWinogradRxSf2x3g1:25.8619,0,miopenConvolutionFwdAlgoWinograd
192-6-242-418-3x3x3-192-4-240-416-1-0x0x0-1x1x1-1x1x1-0-NCDHW-FP16-F=GemmFwdRest:267.061,4140564480,miopenConvolutionFwdAlgoGEMM
192-480-832-3x3-96-480-832-4-1x1-1x1-1x1-0-NCHW-FP16-F=GemmFwdRest:71.9534,1380188160,miopenConvolutionFwdAlgoGEMM;ConvBinWinogradRxSf3x2:42.4999,0,miopenConvolutionFwdAlgoWinograd;ConvBinWinogradRxSf2x3g1:49.004,0,miopenConvolutionFwdAlgoWinograd
96-6-482-834-3x3x3-96-4-480-832-1-0x0x0-1x1x1-1x1x1-0-NCDHW-FP16-F=GemmFwdRest:715.075,8281128960,miopenConvolutionFwdAlgoGEMM
96-6-482-834-3x3x3-3-4-480-832-1-0x0x0-1x1x1-1x1x1-0-NCDHW-FP16-F=GemmFwdRest:697.618,8281128960,miopenConvolutionFwdAlgoGEMM
16-7-60-104-1x2x2-1536-7-30-52-1-0x0x0-1x2x2-1x1x1-0-NCDHW-FP16-F=GemmFwdRest:0.202264,1397760,miopenConvolutionFwdAlgoGEMM
16-7-60-104-1x1x1-16-7-60-104-1-0x0x0-1x1x1-1x1x1-0-NCDHW-FP16-F=GemmFwd1x1_0_1:0.0650986,0,miopenConvolutionFwdAlgoGEMM
