torch/lib/rocm/.miopen/db/gfx1151_20.HIP.3_5_0_51067c1abc-dirty.ufdb.txt
16-21-60-104-1x2x2-1536-21-30-52-1-0x0x0-1x2x2-1x1x1-0-NCDHW-FP16-F=GemmFwdRest:1.15223,4193280,miopenConvolutionFwdAlgoGEMM;ConvHipImplicitGemm3DGroupFwdXdlops:7.32285,105028608,miopenConvolutionFwdAlgoImplicitGEMM;GemmFwdRest_hipblaslt:1.02915,4193280,miopenConvolutionFwdAlgoGEMM
16-21-60-104-1x1x1-16-21-60-104-1-0x0x0-1x1x1-1x1x1-0-NCDHW-BF16-F=GemmFwd1x1_0_1:0.123714,0,miopenConvolutionFwdAlgoGEMM;GemmFwd1x1_0_1_hipblaslt:0.103655,0,miopenConvolutionFwdAlgoGEMM;ConvHipImplicitGemm3DGroupFwdXdlops:0.333714,8387072,miopenConvolutionFwdAlgoImplicitGEMM
16-3-62-106-3x3x3-384-1-60-104-1-0x0x0-1x1x1-1x1x1-0-NCDHW-BF16-F=GemmFwdRest:0.221977,5391360,miopenConvolutionFwdAlgoGEMM;ConvHipImplicitGemm3DGroupFwdXdlops:0.50423,5755136,miopenConvolutionFwdAlgoImplicitGEMM;GemmFwdRest_hipblaslt:0.237404,5391360,miopenConvolutionFwdAlgoGEMM
384-3-62-106-3x3x3-384-1-60-104-1-0x0x0-1x1x1-1x1x1-0-NCDHW-BF16-F=GemmFwdRest:5.00736,129392640,miopenConvolutionFwdAlgoGEMM;ConvHipImplicitGemm3DGroupFwdXdlops:8.06748,27896832,miopenConvolutionFwdAlgoImplicitGEMM;GemmFwdRest_hipblaslt:5.18593,129392640,miopenConvolutionFwdAlgoGEMM
384-60-104-1x1-1152-60-104-1-0x0-1x1-1x1-0-NCHW-BF16-F=GemmFwd1x1_0_1:0.189067,0,miopenConvolutionFwdAlgoGEMM;GemmFwd1x1_0_1_hipblaslt:0.242154,0,miopenConvolutionFwdAlgoGEMM;ConvHipImplicitGemmGroupFwdXdlops:1.08448,20054016,miopenConvolutionFwdAlgoImplicitGEMM
384-60-104-1x1-384-60-104-1-0x0-1x1-1x1-0-NCHW-BF16-F=GemmFwd1x1_0_1:0.086475,0,miopenConvolutionFwdAlgoGEMM;GemmFwd1x1_0_1_hipblaslt:0.10779,0,miopenConvolutionFwdAlgoGEMM;ConvHipImplicitGemmGroupFwdXdlops:0.43112,9879552,miopenConvolutionFwdAlgoImplicitGEMM
384-120-208-3x3-192-120-208-1-1x1-1x1-1x1-0-NCHW-BF16-F=GemmFwdRest:2.73806,172523520,miopenConvolutionFwdAlgoGEMM;GemmFwdRest_hipblaslt:2.31051,172523520,miopenConvolutionFwdAlgoGEMM;ConvHipImplicitGemmGroupFwdXdlops:4.62567,30081024,miopenConvolutionFwdAlgoImplicitGEMM
192-1-120-208-1x1x1-384-1-120-208-1-0x0x0-1x1x1-1x1x1-0-NCDHW-BF16-F=GemmFwd1x1_0_1:0.141178,0,miopenConvolutionFwdAlgoGEMM;GemmFwd1x1_0_1_hipblaslt:0.194573,0,miopenConvolutionFwdAlgoGEMM;ConvHipImplicitGemm3DGroupFwdXdlops:1.20718,28901376,miopenConvolutionFwdAlgoImplicitGEMM
192-3-122-210-3x3x3-384-1-120-208-1-0x0x0-1x1x1-1x1x1-0-NCDHW-BF16-F=GemmFwdRest:9.11654,258785280,miopenConvolutionFwdAlgoGEMM;ConvHipImplicitGemm3DGroupFwdXdlops:15.708,52664832,miopenConvolutionFwdAlgoImplicitGEMM;GemmFwdRest_hipblaslt:9.69824,258785280,miopenConvolutionFwdAlgoGEMM
384-3-122-210-3x3x3-384-1-120-208-1-0x0x0-1x1x1-1x1x1-0-NCDHW-BF16-F=GemmFwdRest:19.4545,517570560,miopenConvolutionFwdAlgoGEMM;ConvHipImplicitGemm3DGroupFwdXdlops:31.3959,86160384,miopenConvolutionFwdAlgoImplicitGEMM;GemmFwdRest_hipblaslt:19.2101,517570560,miopenConvolutionFwdAlgoGEMM
384-240-416-3x3-192-240-416-1-1x1-1x1-1x1-0-NCHW-BF16-F=GemmFwdRest:9.64769,690094080,miopenConvolutionFwdAlgoGEMM;GemmFwdRest_hipblaslt:8.53451,690094080,miopenConvolutionFwdAlgoGEMM;ConvHipImplicitGemmGroupFwdXdlops:18.3276,116342784,miopenConvolutionFwdAlgoImplicitGEMM
192-3-242-418-3x3x3-192-1-240-416-1-0x0x0-1x1x1-1x1x1-0-NCDHW-BF16-F=GemmFwdRest:70.1002,1035141120,miopenConvolutionFwdAlgoGEMM;ConvHipImplicitGemm3DGroupFwdXdlops:34.7087,156860928,miopenConvolutionFwdAlgoImplicitGEMM;GemmFwdRest_hipblaslt:77.9422,1035141120,miopenConvolutionFwdAlgoGEMM
192-480-832-3x3-96-480-832-1-1x1-1x1-1x1-0-NCHW-BF16-F=GemmFwdRest:20.4354,1380188160,miopenConvolutionFwdAlgoGEMM;GemmFwdRest_hipblaslt:21.6672,1380188160,miopenConvolutionFwdAlgoGEMM;ConvHipImplicitGemmGroupFwdXdlops:26.9716,230363136,miopenConvolutionFwdAlgoImplicitGEMM
96-3-482-834-3x3x3-96-1-480-832-1-0x0x0-1x1x1-1x1x1-0-NCDHW-BF16-F=GemmFwdRest:77.4714,2070282240,miopenConvolutionFwdAlgoGEMM;ConvHipImplicitGemm3DGroupFwdXdlops:45.4858,308719872,miopenConvolutionFwdAlgoImplicitGEMM;GemmFwdRest_hipblaslt:79.3268,2070282240,miopenConvolutionFwdAlgoGEMM
96-3-482-834-3x3x3-3-1-480-832-1-0x0x0-1x1x1-1x1x1-0-NCDHW-BF16-F=GemmFwdRest:73.6144,2070282240,miopenConvolutionFwdAlgoGEMM;ConvHipImplicitGemm3DGroupFwdXdlops:23.7508,233956864,miopenConvolutionFwdAlgoImplicitGEMM;GemmFwdRest_hipblaslt:74.686,2070282240,miopenConvolutionFwdAlgoGEMM
384-3-60-104-3x1x1-768-1-60-104-1-0x0x0-1x1x1-1x1x1-0-NCDHW-BF16-F=GemmFwdRest:0.985162,14376960,miopenConvolutionFwdAlgoGEMM;ConvHipImplicitGemm3DGroupFwdXdlops:2.1808,25731072,miopenConvolutionFwdAlgoImplicitGEMM;GemmFwdRest_hipblaslt:0.903263,14376960,miopenConvolutionFwdAlgoGEMM
384-120-208-3x3-192-120-208-2-1x1-1x1-1x1-0-NCHW-BF16-F=GemmFwdRest:5.57103,172523520,miopenConvolutionFwdAlgoGEMM;GemmFwdRest_hipblaslt:4.61425,172523520,miopenConvolutionFwdAlgoGEMM;ConvHipImplicitGemmGroupFwdXdlops:9.15344,58834944,miopenConvolutionFwdAlgoImplicitGEMM
192-2-120-208-1x1x1-384-2-120-208-1-0x0x0-1x1x1-1x1x1-0-NCDHW-BF16-F=GemmFwd1x1_0_1:0.397856,0,miopenConvolutionFwdAlgoGEMM;GemmFwd1x1_0_1_hipblaslt:0.441733,0,miopenConvolutionFwdAlgoGEMM;ConvHipImplicitGemm3DGroupFwdXdlops:2.65803,57655296,miopenConvolutionFwdAlgoImplicitGEMM
192-4-122-210-3x3x3-384-2-120-208-1-0x0x0-1x1x1-1x1x1-0-NCDHW-BF16-F=GemmFwdRest:17.9629,517570560,miopenConvolutionFwdAlgoGEMM;ConvHipImplicitGemm3DGroupFwdXdlops:32.3614,81672192,miopenConvolutionFwdAlgoImplicitGEMM;GemmFwdRest_hipblaslt:19.2443,517570560,miopenConvolutionFwdAlgoGEMM
384-4-122-210-3x3x3-384-2-120-208-1-0x0x0-1x1x1-1x1x1-0-NCDHW-BF16-F=GemmFwdRest:100.058,1035141120,miopenConvolutionFwdAlgoGEMM;ConvHipImplicitGemm3DGroupFwdXdlops:64.473,125005824,miopenConvolutionFwdAlgoImplicitGEMM;GemmFwdRest_hipblaslt:116.017,1035141120,miopenConvolutionFwdAlgoGEMM
384-4-120-208-3x1x1-768-2-120-208-1-0x0x0-1x1x1-1x1x1-0-NCDHW-BF16-F=GemmFwdRest:5.50108,115015680,miopenConvolutionFwdAlgoGEMM;ConvHipImplicitGemm3DGroupFwdXdlops:16.4023,155123712,miopenConvolutionFwdAlgoImplicitGEMM;GemmFwdRest_hipblaslt:6.29186,115015680,miopenConvolutionFwdAlgoGEMM
384-240-416-3x3-192-240-416-4-1x1-1x1-1x1-0-NCHW-BF16-F=GemmFwdRest:57.2483,690094080,miopenConvolutionFwdAlgoGEMM;GemmFwdRest_hipblaslt:85.7078,690094080,miopenConvolutionFwdAlgoGEMM;ConvHipImplicitGemmGroupFwdXdlops:72.2651,461389824,miopenConvolutionFwdAlgoImplicitGEMM
192-6-242-418-3x3x3-192-4-240-416-1-0x0x0-1x1x1-1x1x1-0-NCDHW-BF16-F=GemmFwdRest:303.579,4140564480,miopenConvolutionFwdAlgoGEMM;ConvHipImplicitGemm3DGroupFwdXdlops:150.337,388408320,miopenConvolutionFwdAlgoImplicitGEMM;GemmFwdRest_hipblaslt:393.93,4140564480,miopenConvolutionFwdAlgoGEMM
192-480-832-3x3-96-480-832-4-1x1-1x1-1x1-0-NCHW-BF16-F=GemmFwdRest:70.7406,1380188160,miopenConvolutionFwdAlgoGEMM;GemmFwdRest_hipblaslt:74.4736,1380188160,miopenConvolutionFwdAlgoGEMM;ConvHipImplicitGemmGroupFwdXdlops:105.158,920457216,miopenConvolutionFwdAlgoImplicitGEMM
96-6-482-834-3x3x3-96-4-480-832-1-0x0x0-1x1x1-1x1x1-0-NCDHW-BF16-F=ConvHipImplicitGemm3DGroupFwdXdlops:176.202,770296320,miopenConvolutionFwdAlgoImplicitGEMM
96-6-482-834-3x3x3-3-4-480-832-1-0x0x0-1x1x1-1x1x1-0-NCDHW-BF16-F=ConvHipImplicitGemm3DGroupFwdXdlops:93.8512,472690432,miopenConvolutionFwdAlgoImplicitGEMM
16-17-60-104-1x2x2-1536-17-30-52-1-0x0x0-1x2x2-1x1x1-0-NCDHW-FP16-F=GemmFwdRest:0.72088,3394560,miopenConvolutionFwdAlgoGEMM;ConvHipImplicitGemm3DGroupFwdXdlops:5.62049,85060608,miopenConvolutionFwdAlgoImplicitGEMM;GemmFwdRest_hipblaslt:0.822923,3394560,miopenConvolutionFwdAlgoGEMM
16-17-60-104-1x1x1-16-17-60-104-1-0x0x0-1x1x1-1x1x1-0-NCDHW-BF16-F=GemmFwd1x1_0_1:0.101048,0,miopenConvolutionFwdAlgoGEMM;GemmFwd1x1_0_1_hipblaslt:0.0812433,0,miopenConvolutionFwdAlgoGEMM;ConvHipImplicitGemm3DGroupFwdXdlops:0.270186,6789632,miopenConvolutionFwdAlgoImplicitGEMM
16-13-60-104-1x2x2-1536-13-30-52-1-0x0x0-1x2x2-1x1x1-0-NCDHW-FP16-F=GemmFwdRest:0.536657,2595840,miopenConvolutionFwdAlgoGEMM;ConvHipImplicitGemm3DGroupFwdXdlops:3.97718,65092608,miopenConvolutionFwdAlgoImplicitGEMM;GemmFwdRest_hipblaslt:0.651398,2595840,miopenConvolutionFwdAlgoGEMM
16-13-60-104-1x1x1-16-13-60-104-1-0x0x0-1x1x1-1x1x1-0-NCDHW-BF16-F=GemmFwd1x1_0_1:0.0812057,0,miopenConvolutionFwdAlgoGEMM;GemmFwd1x1_0_1_hipblaslt:0.0670717,0,miopenConvolutionFwdAlgoGEMM;ConvHipImplicitGemm3DGroupFwdXdlops:0.236397,5192192,miopenConvolutionFwdAlgoImplicitGEMM
16-9-60-104-1x2x2-1536-9-30-52-1-0x0x0-1x2x2-1x1x1-0-NCDHW-FP16-F=GemmFwdRest:0.356172,1797120,miopenConvolutionFwdAlgoGEMM;ConvHipImplicitGemm3DGroupFwdXdlops:2.65576,45124608,miopenConvolutionFwdAlgoImplicitGEMM;GemmFwdRest_hipblaslt:0.473768,1797120,miopenConvolutionFwdAlgoGEMM
16-9-60-104-1x1x1-16-9-60-104-1-0x0x0-1x1x1-1x1x1-0-NCDHW-BF16-F=GemmFwd1x1_0_1:0.0631875,0,miopenConvolutionFwdAlgoGEMM;GemmFwd1x1_0_1_hipblaslt:0.0383614,0,miopenConvolutionFwdAlgoGEMM;ConvHipImplicitGemm3DGroupFwdXdlops:0.199917,3594752,miopenConvolutionFwdAlgoImplicitGEMM
16-5-60-104-1x2x2-1536-5-30-52-1-0x0x0-1x2x2-1x1x1-0-NCDHW-FP16-F=GemmFwdRest:0.15553,998400,miopenConvolutionFwdAlgoGEMM;ConvHipImplicitGemm3DGroupFwdXdlops:1.17115,25156608,miopenConvolutionFwdAlgoImplicitGEMM;GemmFwdRest_hipblaslt:0.274131,998400,miopenConvolutionFwdAlgoGEMM
16-5-60-104-1x1x1-16-5-60-104-1-0x0x0-1x1x1-1x1x1-0-NCDHW-BF16-F=GemmFwd1x1_0_1:0.0483217,0,miopenConvolutionFwdAlgoGEMM;GemmFwd1x1_0_1_hipblaslt:0.0420357,0,miopenConvolutionFwdAlgoGEMM;ConvHipImplicitGemm3DGroupFwdXdlops:0.161518,1997312,miopenConvolutionFwdAlgoImplicitGEMM
4-40-64-3x3-320-40-64-26-1x1-1x1-1x1-0-NCHW-FP16-F=GemmFwdRest:1.98563,184320,miopenConvolutionFwdAlgoGEMM;GemmFwdRest_hipblaslt:2.06472,184320,miopenConvolutionFwdAlgoGEMM;ConvHipImplicitGemmGroupFwdXdlops:1.73796,43153920,miopenConvolutionFwdAlgoImplicitGEMM;ConvBinWinogradRxSf3x2:0.35336,0,miopenConvolutionFwdAlgoWinograd;ConvBinWinogradRxSf2x3g1:0.322029,0,miopenConvolutionFwdAlgoWinograd
320-1-26-1x1-512-1-26-2560-0x0-1x1-1x1-0-NCHW-FP16-F=ConvBinWinogradRxSf2x3g1:16.4181,0,miopenConvolutionFwdAlgoWinograd;GemmFwd1x1_0_1:4.30305,0,miopenConvolutionFwdAlgoGEMM;ConvBinWinogradRxSf3x2:11.315,0,miopenConvolutionFwdAlgoWinograd;GemmFwd1x1_0_1_hipblaslt:3.11866,0,miopenConvolutionFwdAlgoGEMM;ConvHipImplicitGemmGroupFwdXdlops:4.98198,111083520,miopenConvolutionFwdAlgoImplicitGEMM
512-1-26-1x1-320-1-26-2560-0x0-1x1-1x1-0-NCHW-FP16-F=ConvBinWinogradRxSf2x3g1:16.2825,0,miopenConvolutionFwdAlgoWinograd;GemmFwd1x1_0_1:4.88236,0,miopenConvolutionFwdAlgoGEMM;ConvBinWinogradRxSf3x2:11.29,0,miopenConvolutionFwdAlgoWinograd;GemmFwd1x1_0_1_hipblaslt:5.18643,0,miopenConvolutionFwdAlgoGEMM;ConvHipImplicitGemmGroupFwdXdlops:4.79262,111083520,miopenConvolutionFwdAlgoImplicitGEMM
320-40-64-3x3-320-40-64-26-1x1-1x1-1x1-0-NCHW-FP16-F=GemmFwdRest:8.53653,14745600,miopenConvolutionFwdAlgoGEMM;GemmFwdRest_hipblaslt:10.8618,14745600,miopenConvolutionFwdAlgoGEMM;ConvHipImplicitGemmGroupFwdXdlops:14.8774,87040000,miopenConvolutionFwdAlgoImplicitGEMM;ConvBinWinogradRxSf3x2:9.39116,0,miopenConvolutionFwdAlgoWinograd;ConvBinWinogradRxSf2x3g1:5.28798,0,miopenConvolutionFwdAlgoWinograd
320-26-40-64-3x1x1-320-26-40-64-1-1x0x0-1x1x1-1x1x1-0-NCDHW-FP16-F=GemmFwdRest:4.32658,127795200,miopenConvolutionFwdAlgoGEMM;ConvHipImplicitGemm3DGroupFwdXdlops:8.04219,85811200,miopenConvolutionFwdAlgoImplicitGEMM;GemmFwdRest_hipblaslt:5.12748,127795200,miopenConvolutionFwdAlgoGEMM
320-40-64-3x3-320-20-32-26-1x1-2x2-1x1-0-NCHW-FP16-F=GemmFwdRest:4.61599,3686400,miopenConvolutionFwdAlgoGEMM;GemmFwdRest_hipblaslt:4.57162,3686400,miopenConvolutionFwdAlgoGEMM;ConvHipImplicitGemmGroupFwdXdlops:4.14099,55091200,miopenConvolutionFwdAlgoImplicitGEMM;ConvBinWinogradRxSf3x2:2.62654,0,miopenConvolutionFwdAlgoWinograd;ConvBinWinogradRxSf2x3g1:5.80133,0,miopenConvolutionFwdAlgoWinograd
320-20-32-3x3-640-20-32-26-1x1-1x1-1x1-0-NCHW-FP16-F=GemmFwdRest:5.08553,3686400,miopenConvolutionFwdAlgoGEMM;GemmFwdRest_hipblaslt:5.27572,3686400,miopenConvolutionFwdAlgoGEMM;ConvHipImplicitGemmGroupFwdXdlops:7.3398,35635200,miopenConvolutionFwdAlgoImplicitGEMM;ConvBinWinogradRxSf3x2:4.89203,0,miopenConvolutionFwdAlgoWinograd;ConvBinWinogradRxSf2x3g1:2.64881,0,miopenConvolutionFwdAlgoWinograd
640-20-32-3x3-640-20-32-26-1x1-1x1-1x1-0-NCHW-FP16-F=GemmFwdRest:7.94162,7372800,miopenConvolutionFwdAlgoGEMM;GemmFwdRest_hipblaslt:8.45348,7372800,miopenConvolutionFwdAlgoGEMM;ConvHipImplicitGemmGroupFwdXdlops:13.7619,49971200,miopenConvolutionFwdAlgoImplicitGEMM;ConvBinWinogradRxSf3x2:9.54444,0,miopenConvolutionFwdAlgoWinograd;ConvBinWinogradRxSf2x3g1:5.10819,0,miopenConvolutionFwdAlgoWinograd
320-20-32-1x1-640-20-32-26-0x0-1x1-1x1-0-NCHW-FP16-F=ConvBinWinogradRxSf2x3g1:2.6211,0,miopenConvolutionFwdAlgoWinograd;GemmFwd1x1_0_1:0.246203,0,miopenConvolutionFwdAlgoGEMM;ConvBinWinogradRxSf3x2:1.32642,0,miopenConvolutionFwdAlgoWinograd;GemmFwd1x1_0_1_hipblaslt:0.367786,0,miopenConvolutionFwdAlgoGEMM;ConvHipImplicitGemmGroupFwdXdlops:1.57688,32358400,miopenConvolutionFwdAlgoImplicitGEMM
640-26-20-32-3x1x1-640-26-20-32-1-1x0x0-1x1x1-1x1x1-0-NCDHW-FP16-F=GemmFwdRest:3.75164,63897600,miopenConvolutionFwdAlgoGEMM;ConvHipImplicitGemm3DGroupFwdXdlops:6.89936,45056000,miopenConvolutionFwdAlgoImplicitGEMM;GemmFwdRest_hipblaslt:3.52364,63897600,miopenConvolutionFwdAlgoGEMM
640-20-32-3x3-640-10-16-26-1x1-2x2-1x1-0-NCHW-FP16-F=GemmFwdRest:6.58416,1843200,miopenConvolutionFwdAlgoGEMM;GemmFwdRest_hipblaslt:5.08581,1843200,miopenConvolutionFwdAlgoGEMM;ConvHipImplicitGemmGroupFwdXdlops:3.96003,33996800,miopenConvolutionFwdAlgoImplicitGEMM;ConvBinWinogradRxSf3x2:3.15885,0,miopenConvolutionFwdAlgoWinograd;ConvBinWinogradRxSf2x3g1:5.92987,0,miopenConvolutionFwdAlgoWinograd
640-10-16-3x3-1280-10-16-26-1x1-1x1-1x1-0-NCHW-FP16-F=GemmFwdRest:6.30621,1843200,miopenConvolutionFwdAlgoGEMM;GemmFwdRest_hipblaslt:7.74684,1843200,miopenConvolutionFwdAlgoGEMM;ConvHipImplicitGemmGroupFwdXdlops:7.25595,30720000,miopenConvolutionFwdAlgoImplicitGEMM;ConvBinWinogradRxSf3x2:6.04638,0,miopenConvolutionFwdAlgoWinograd;ConvBinWinogradRxSf2x3g1:2.63602,0,miopenConvolutionFwdAlgoWinograd
1280-10-16-3x3-1280-10-16-26-1x1-1x1-1x1-0-NCHW-FP16-F=GemmFwdRest:11.1885,3686400,miopenConvolutionFwdAlgoGEMM;GemmFwdRest_hipblaslt:13.6564,3686400,miopenConvolutionFwdAlgoGEMM;ConvHipImplicitGemmGroupFwdXdlops:13.8175,50790400,miopenConvolutionFwdAlgoImplicitGEMM;ConvBinWinogradRxSf3x2:11.8963,0,miopenConvolutionFwdAlgoWinograd;ConvBinWinogradRxSf2x3g1:5.17853,0,miopenConvolutionFwdAlgoWinograd
640-10-16-1x1-1280-10-16-26-0x0-1x1-1x1-0-NCHW-FP16-F=ConvBinWinogradRxSf2x3g1:2.63113,0,miopenConvolutionFwdAlgoWinograd;GemmFwd1x1_0_1:0.352762,0,miopenConvolutionFwdAlgoGEMM;ConvBinWinogradRxSf3x2:1.60702,0,miopenConvolutionFwdAlgoWinograd;GemmFwd1x1_0_1_hipblaslt:0.521804,0,miopenConvolutionFwdAlgoGEMM;ConvHipImplicitGemmGroupFwdXdlops:1.06891,17612800,miopenConvolutionFwdAlgoImplicitGEMM
1280-26-10-16-3x1x1-1280-26-10-16-1-1x0x0-1x1x1-1x1x1-0-NCDHW-FP16-F=GemmFwdRest:2.18734,31948800,miopenConvolutionFwdAlgoGEMM;ConvHipImplicitGemm3DGroupFwdXdlops:6.77129,31129600,miopenConvolutionFwdAlgoImplicitGEMM;GemmFwdRest_hipblaslt:2.3974,31948800,miopenConvolutionFwdAlgoGEMM
1280-10-16-3x3-1280-5-8-26-1x1-2x2-1x1-0-NCHW-FP16-F=GemmFwdRest:10.4139,921600,miopenConvolutionFwdAlgoGEMM;GemmFwdRest_hipblaslt:6.71602,921600,miopenConvolutionFwdAlgoGEMM;ConvHipImplicitGemmGroupFwdXdlops:4.23887,42803200,miopenConvolutionFwdAlgoImplicitGEMM;ConvBinWinogradRxSf3x2:3.14125,0,miopenConvolutionFwdAlgoWinograd;ConvBinWinogradRxSf2x3g1:6.90419,0,miopenConvolutionFwdAlgoWinograd
1280-5-8-3x3-1280-5-8-26-1x1-1x1-1x1-0-NCHW-FP16-F=GemmFwdRest:9.96934,921600,miopenConvolutionFwdAlgoGEMM;GemmFwdRest_hipblaslt:6.1631,921600,miopenConvolutionFwdAlgoGEMM;ConvHipImplicitGemmGroupFwdXdlops:4.35191,34816000,miopenConvolutionFwdAlgoImplicitGEMM;ConvBinWinogradRxSf3x2:3.06707,0,miopenConvolutionFwdAlgoWinograd;ConvBinWinogradRxSf2x3g1:1.60429,0,miopenConvolutionFwdAlgoWinograd
1280-26-5-8-3x1x1-1280-26-5-8-1-1x0x0-1x1x1-1x1x1-0-NCDHW-FP16-F=GemmFwdRest:0.633114,7987200,miopenConvolutionFwdAlgoGEMM;ConvHipImplicitGemm3DGroupFwdXdlops:1.91211,15155200,miopenConvolutionFwdAlgoImplicitGEMM;GemmFwdRest_hipblaslt:0.622404,7987200,miopenConvolutionFwdAlgoGEMM
2560-5-8-3x3-1280-5-8-26-1x1-1x1-1x1-0-NCHW-FP16-F=GemmFwdRest:30.7866,1843200,miopenConvolutionFwdAlgoGEMM;GemmFwdRest_hipblaslt:10.9469,1843200,miopenConvolutionFwdAlgoGEMM;ConvHipImplicitGemmGroupFwdXdlops:7.86731,66969600,miopenConvolutionFwdAlgoImplicitGEMM;ConvBinWinogradRxSf3x2:6.02219,0,miopenConvolutionFwdAlgoWinograd;ConvBinWinogradRxSf2x3g1:3.1342,0,miopenConvolutionFwdAlgoWinograd
2560-5-8-1x1-1280-5-8-26-0x0-1x1-1x1-0-NCHW-FP16-F=ConvBinWinogradRxSf2x3g1:3.14137,0,miopenConvolutionFwdAlgoWinograd;GemmFwd1x1_0_1:0.688713,0,miopenConvolutionFwdAlgoGEMM;ConvBinWinogradRxSf3x2:1.57293,0,miopenConvolutionFwdAlgoWinograd;GemmFwd1x1_0_1_hipblaslt:0.991187,0,miopenConvolutionFwdAlgoGEMM;ConvHipImplicitGemmGroupFwdXdlops:1.15737,14540800,miopenConvolutionFwdAlgoImplicitGEMM
2560-10-16-3x3-1280-10-16-26-1x1-1x1-1x1-0-NCHW-FP16-F=GemmFwdRest:41.7362,7372800,miopenConvolutionFwdAlgoGEMM;GemmFwdRest_hipblaslt:25.551,7372800,miopenConvolutionFwdAlgoGEMM;ConvHipImplicitGemmGroupFwdXdlops:27.4491,90931200,miopenConvolutionFwdAlgoImplicitGEMM;ConvBinWinogradRxSf3x2:23.8259,0,miopenConvolutionFwdAlgoWinograd;ConvBinWinogradRxSf2x3g1:10.988,0,miopenConvolutionFwdAlgoWinograd
2560-10-16-1x1-1280-10-16-26-0x0-1x1-1x1-0-NCHW-FP16-F=ConvBinWinogradRxSf2x3g1:9.9739,0,miopenConvolutionFwdAlgoWinograd;GemmFwd1x1_0_1:1.25097,0,miopenConvolutionFwdAlgoGEMM;ConvBinWinogradRxSf3x2:6.00118,0,miopenConvolutionFwdAlgoWinograd;GemmFwd1x1_0_1_hipblaslt:1.95731,0,miopenConvolutionFwdAlgoGEMM;ConvHipImplicitGemmGroupFwdXdlops:3.77409,38502400,miopenConvolutionFwdAlgoImplicitGEMM
1920-10-16-3x3-1280-10-16-26-1x1-1x1-1x1-0-NCHW-FP16-F=GemmFwdRest:17.5665,5529600,miopenConvolutionFwdAlgoGEMM;GemmFwdRest_hipblaslt:19.7454,5529600,miopenConvolutionFwdAlgoGEMM;ConvHipImplicitGemmGroupFwdXdlops:20.6246,70860800,miopenConvolutionFwdAlgoImplicitGEMM;ConvBinWinogradRxSf3x2:17.5943,0,miopenConvolutionFwdAlgoWinograd;ConvBinWinogradRxSf2x3g1:7.78924,0,miopenConvolutionFwdAlgoWinograd
1920-10-16-1x1-1280-10-16-26-0x0-1x1-1x1-0-NCHW-FP16-F=ConvBinWinogradRxSf2x3g1:7.50527,0,miopenConvolutionFwdAlgoWinograd;GemmFwd1x1_0_1:0.910708,0,miopenConvolutionFwdAlgoGEMM;ConvBinWinogradRxSf3x2:4.46968,0,miopenConvolutionFwdAlgoWinograd;GemmFwd1x1_0_1_hipblaslt:1.47723,0,miopenConvolutionFwdAlgoGEMM;ConvHipImplicitGemmGroupFwdXdlops:2.84743,31539200,miopenConvolutionFwdAlgoImplicitGEMM
1280-20-32-3x3-1280-20-32-26-1x1-1x1-1x1-0-NCHW-FP16-F=GemmFwdRest:21.2849,14745600,miopenConvolutionFwdAlgoGEMM;GemmFwdRest_hipblaslt:26.3387,14745600,miopenConvolutionFwdAlgoGEMM;ConvHipImplicitGemmGroupFwdXdlops:56.2191,114688000,miopenConvolutionFwdAlgoImplicitGEMM;ConvBinWinogradRxSf3x2:37.3318,0,miopenConvolutionFwdAlgoWinograd;ConvBinWinogradRxSf2x3g1:19.948,0,miopenConvolutionFwdAlgoWinograd
1920-20-32-3x3-640-20-32-26-1x1-1x1-1x1-0-NCHW-FP16-F=GemmFwdRest:25.3396,22118400,miopenConvolutionFwdAlgoGEMM;GemmFwdRest_hipblaslt:22.0125,22118400,miopenConvolutionFwdAlgoGEMM;ConvHipImplicitGemmGroupFwdXdlops:54.6968,107315200,miopenConvolutionFwdAlgoImplicitGEMM;ConvBinWinogradRxSf3x2:29.049,0,miopenConvolutionFwdAlgoWinograd;ConvBinWinogradRxSf2x3g1:15.1448,0,miopenConvolutionFwdAlgoWinograd
1920-20-32-1x1-640-20-32-26-0x0-1x1-1x1-0-NCHW-FP16-F=ConvBinWinogradRxSf2x3g1:14.7413,0,miopenConvolutionFwdAlgoWinograd;GemmFwd1x1_0_1:1.25053,0,miopenConvolutionFwdAlgoGEMM;ConvBinWinogradRxSf3x2:7.1418,0,miopenConvolutionFwdAlgoWinograd;GemmFwd1x1_0_1_hipblaslt:1.72675,0,miopenConvolutionFwdAlgoGEMM;ConvHipImplicitGemmGroupFwdXdlops:6.30727,87654400,miopenConvolutionFwdAlgoImplicitGEMM
960-20-32-3x3-640-20-32-26-1x1-1x1-1x1-0-NCHW-FP16-F=GemmFwdRest:10.7346,11059200,miopenConvolutionFwdAlgoGEMM;GemmFwdRest_hipblaslt:11.682,11059200,miopenConvolutionFwdAlgoGEMM;ConvHipImplicitGemmGroupFwdXdlops:20.9435,64307200,miopenConvolutionFwdAlgoImplicitGEMM;ConvBinWinogradRxSf3x2:14.0895,0,miopenConvolutionFwdAlgoWinograd;ConvBinWinogradRxSf2x3g1:7.4908,0,miopenConvolutionFwdAlgoWinograd
960-20-32-1x1-640-20-32-26-0x0-1x1-1x1-0-NCHW-FP16-F=ConvBinWinogradRxSf2x3g1:7.4889,0,miopenConvolutionFwdAlgoWinograd;GemmFwd1x1_0_1:0.657852,0,miopenConvolutionFwdAlgoGEMM;ConvBinWinogradRxSf3x2:3.71404,0,miopenConvolutionFwdAlgoWinograd;GemmFwd1x1_0_1_hipblaslt:0.933051,0,miopenConvolutionFwdAlgoGEMM;ConvHipImplicitGemmGroupFwdXdlops:3.22198,54476800,miopenConvolutionFwdAlgoImplicitGEMM
640-40-64-3x3-640-40-64-26-1x1-1x1-1x1-0-NCHW-FP16-F=GemmFwdRest:19.1282,29491200,miopenConvolutionFwdAlgoGEMM;GemmFwdRest_hipblaslt:28.7477,29491200,miopenConvolutionFwdAlgoGEMM;ConvHipImplicitGemmGroupFwdXdlops:57.7093,177766400,miopenConvolutionFwdAlgoImplicitGEMM;ConvBinWinogradRxSf3x2:37.6651,0,miopenConvolutionFwdAlgoWinograd;ConvBinWinogradRxSf2x3g1:21.2464,0,miopenConvolutionFwdAlgoWinograd
960-40-64-3x3-320-40-64-26-1x1-1x1-1x1-0-NCHW-FP16-F=GemmFwdRest:29.7224,44236800,miopenConvolutionFwdAlgoGEMM;GemmFwdRest_hipblaslt:31.1292,44236800,miopenConvolutionFwdAlgoGEMM;ConvHipImplicitGemmGroupFwdXdlops:45.3341,175923200,miopenConvolutionFwdAlgoImplicitGEMM;ConvBinWinogradRxSf3x2:28.6325,0,miopenConvolutionFwdAlgoWinograd;ConvBinWinogradRxSf2x3g1:15.8694,0,miopenConvolutionFwdAlgoWinograd
960-40-64-1x1-320-40-64-26-0x0-1x1-1x1-0-NCHW-FP16-F=ConvBinWinogradRxSf2x3g1:15.4998,0,miopenConvolutionFwdAlgoWinograd;GemmFwd1x1_0_1:1.89427,0,miopenConvolutionFwdAlgoGEMM;ConvBinWinogradRxSf3x2:7.19992,0,miopenConvolutionFwdAlgoWinograd;GemmFwd1x1_0_1_hipblaslt:2.01676,0,miopenConvolutionFwdAlgoGEMM;ConvHipImplicitGemmGroupFwdXdlops:7.52343,171008000,miopenConvolutionFwdAlgoImplicitGEMM
640-40-64-3x3-320-40-64-26-1x1-1x1-1x1-0-NCHW-FP16-F=GemmFwdRest:15.8732,29491200,miopenConvolutionFwdAlgoGEMM;GemmFwdRest_hipblaslt:19.9802,29491200,miopenConvolutionFwdAlgoGEMM;ConvHipImplicitGemmGroupFwdXdlops:29.5524,131481600,miopenConvolutionFwdAlgoImplicitGEMM;ConvBinWinogradRxSf3x2:19.2188,0,miopenConvolutionFwdAlgoWinograd;ConvBinWinogradRxSf2x3g1:10.6114,0,miopenConvolutionFwdAlgoWinograd
640-40-64-1x1-320-40-64-26-0x0-1x1-1x1-0-NCHW-FP16-F=ConvBinWinogradRxSf2x3g1:10.1501,0,miopenConvolutionFwdAlgoWinograd;GemmFwd1x1_0_1:1.00185,0,miopenConvolutionFwdAlgoGEMM;ConvBinWinogradRxSf3x2:4.96967,0,miopenConvolutionFwdAlgoWinograd;GemmFwd1x1_0_1_hipblaslt:1.23056,0,miopenConvolutionFwdAlgoGEMM;ConvHipImplicitGemmGroupFwdXdlops:5.09191,128204800,miopenConvolutionFwdAlgoImplicitGEMM
320-40-64-3x3-4-40-64-26-1x1-1x1-1x1-0-NCHW-FP16-F=GemmFwdRest:5.26473,14745600,miopenConvolutionFwdAlgoGEMM;GemmFwdRest_hipblaslt:4.92941,14745600,miopenConvolutionFwdAlgoGEMM;ConvHipImplicitGemmGroupFwdXdlops:3.00903,43153920,miopenConvolutionFwdAlgoImplicitGEMM;ConvBinWinogradRxSf3x2:0.666714,0,miopenConvolutionFwdAlgoWinograd;ConvBinWinogradRxSf2x3g1:0.37544,0,miopenConvolutionFwdAlgoWinograd
4-40-64-1x1-4-40-64-1-0x0-1x1-1x1-0-NCHW-FP16-F=ConvBinWinogradRxSf2x3g1:0.0596667,0,miopenConvolutionFwdAlgoWinograd;GemmFwd1x1_0_1:0.0226257,0,miopenConvolutionFwdAlgoGEMM;ConvBinWinogradRxSf3x2:0.0630714,0,miopenConvolutionFwdAlgoWinograd;GemmFwd1x1_0_1_hipblaslt:0.0258371,0,miopenConvolutionFwdAlgoGEMM;ConvHipImplicitGemmGroupFwdXdlops:0.12397,41216,miopenConvolutionFwdAlgoImplicitGEMM
4-40-64-3x3-512-40-64-1-1x1-1x1-1x1-0-NCHW-FP16-F=GemmFwdRest:0.06762,184320,miopenConvolutionFwdAlgoGEMM;GemmFwdRest_hipblaslt:0.0912533,184320,miopenConvolutionFwdAlgoGEMM;ConvHipImplicitGemmGroupFwdXdlops:0.192991,2678784,miopenConvolutionFwdAlgoImplicitGEMM;ConvBinWinogradRxSf3x2:0.0797667,0,miopenConvolutionFwdAlgoWinograd;ConvBinWinogradRxSf2x3g1:0.0683167,0,miopenConvolutionFwdAlgoWinograd
512-40-64-3x3-512-40-64-1-1x1-1x1-1x1-0-NCHW-FP16-F=GemmFwdRest:0.477447,23592960,miopenConvolutionFwdAlgoGEMM;GemmFwdRest_hipblaslt:0.731395,23592960,miopenConvolutionFwdAlgoGEMM;ConvHipImplicitGemmGroupFwdXdlops:1.62492,9961472,miopenConvolutionFwdAlgoImplicitGEMM;ConvBinWinogradRxSf3x2:1.0715,0,miopenConvolutionFwdAlgoWinograd;ConvBinWinogradRxSf2x3g1:0.57544,0,miopenConvolutionFwdAlgoWinograd
512-40-64-1x1-512-40-64-1-0x0-1x1-1x1-0-NCHW-FP16-F=ConvBinWinogradRxSf2x3g1:0.585983,0,miopenConvolutionFwdAlgoWinograd;GemmFwd1x1_0_1:0.054418,0,miopenConvolutionFwdAlgoGEMM;ConvBinWinogradRxSf3x2:0.332233,0,miopenConvolutionFwdAlgoWinograd;GemmFwd1x1_0_1_hipblaslt:0.0932814,0,miopenConvolutionFwdAlgoGEMM;ConvHipImplicitGemmGroupFwdXdlops:0.375451,5767168,miopenConvolutionFwdAlgoImplicitGEMM
512-80-128-3x3-512-80-128-1-1x1-1x1-1x1-0-NCHW-FP16-F=GemmFwdRest:2.22105,94371840,miopenConvolutionFwdAlgoGEMM;GemmFwdRest_hipblaslt:2.62172,94371840,miopenConvolutionFwdAlgoGEMM;ConvHipImplicitGemmGroupFwdXdlops:6.12171,25690112,miopenConvolutionFwdAlgoImplicitGEMM;ConvBinWinogradRxSf3x2:3.76304,0,miopenConvolutionFwdAlgoWinograd;ConvBinWinogradRxSf2x3g1:2.10344,0,miopenConvolutionFwdAlgoWinograd
512-160-256-3x3-512-160-256-1-1x1-1x1-1x1-0-NCHW-FP16-F=GemmFwdRest:12.6219,377487360,miopenConvolutionFwdAlgoGEMM;GemmFwdRest_hipblaslt:33.5904,377487360,miopenConvolutionFwdAlgoGEMM;ConvHipImplicitGemmGroupFwdXdlops:25.1049,88604672,miopenConvolutionFwdAlgoImplicitGEMM;ConvBinWinogradRxSf3x2:14.6472,0,miopenConvolutionFwdAlgoWinograd;ConvBinWinogradRxSf2x3g1:8.34632,0,miopenConvolutionFwdAlgoWinograd
512-160-256-3x3-256-160-256-1-1x1-1x1-1x1-0-NCHW-FP16-F=GemmFwdRest:9.21147,377487360,miopenConvolutionFwdAlgoGEMM;GemmFwdRest_hipblaslt:16.4823,377487360,miopenConvolutionFwdAlgoGEMM;ConvHipImplicitGemmGroupFwdXdlops:12.6677,65273856,miopenConvolutionFwdAlgoImplicitGEMM;ConvBinWinogradRxSf3x2:7.4751,0,miopenConvolutionFwdAlgoWinograd;ConvBinWinogradRxSf2x3g1:4.09222,0,miopenConvolutionFwdAlgoWinograd
256-160-256-3x3-256-160-256-1-1x1-1x1-1x1-0-NCHW-FP16-F=GemmFwdRest:3.41526,188743680,miopenConvolutionFwdAlgoGEMM;GemmFwdRest_hipblaslt:4.8686,188743680,miopenConvolutionFwdAlgoGEMM;ConvHipImplicitGemmGroupFwdXdlops:6.6475,43122688,miopenConvolutionFwdAlgoImplicitGEMM;ConvBinWinogradRxSf3x2:3.73852,0,miopenConvolutionFwdAlgoWinograd;ConvBinWinogradRxSf2x3g1:2.11318,0,miopenConvolutionFwdAlgoWinograd
512-160-256-1x1-256-160-256-1-0x0-1x1-1x1-0-NCHW-FP16-F=ConvBinWinogradRxSf2x3g1:4.03661,0,miopenConvolutionFwdAlgoWinograd;GemmFwd1x1_0_1:0.462821,0,miopenConvolutionFwdAlgoGEMM;ConvBinWinogradRxSf3x2:1.98439,0,miopenConvolutionFwdAlgoWinograd;GemmFwd1x1_0_1_hipblaslt:0.834934,0,miopenConvolutionFwdAlgoGEMM;ConvHipImplicitGemmGroupFwdXdlops:3.05315,63176704,miopenConvolutionFwdAlgoImplicitGEMM
256-320-512-3x3-256-320-512-1-1x1-1x1-1x1-0-NCHW-FP16-F=GemmFwdRest:13.8276,754974720,miopenConvolutionFwdAlgoGEMM;GemmFwdRest_hipblaslt:21.7922,754974720,miopenConvolutionFwdAlgoGEMM;ConvHipImplicitGemmGroupFwdXdlops:26.627,168951808,miopenConvolutionFwdAlgoImplicitGEMM;ConvBinWinogradRxSf3x2:13.996,0,miopenConvolutionFwdAlgoWinograd;ConvBinWinogradRxSf2x3g1:8.15628,0,miopenConvolutionFwdAlgoWinograd
256-320-512-3x3-128-320-512-1-1x1-1x1-1x1-0-NCHW-FP16-F=GemmFwdRest:10.103,754974720,miopenConvolutionFwdAlgoGEMM;GemmFwdRest_hipblaslt:17.1253,754974720,miopenConvolutionFwdAlgoGEMM;ConvHipImplicitGemmGroupFwdXdlops:14.1497,126418944,miopenConvolutionFwdAlgoImplicitGEMM;ConvBinWinogradRxSf3x2:7.49106,0,miopenConvolutionFwdAlgoWinograd;ConvBinWinogradRxSf2x3g1:4.3181,0,miopenConvolutionFwdAlgoWinograd
128-320-512-3x3-128-320-512-1-1x1-1x1-1x1-0-NCHW-FP16-F=GemmFwdRest:5.02724,377487360,miopenConvolutionFwdAlgoGEMM;GemmFwdRest_hipblaslt:7.49652,377487360,miopenConvolutionFwdAlgoGEMM;ConvHipImplicitGemmGroupFwdXdlops:7.48781,84180992,miopenConvolutionFwdAlgoImplicitGEMM;ConvBinWinogradRxSf3x2:3.83517,0,miopenConvolutionFwdAlgoWinograd;ConvBinWinogradRxSf2x3g1:2.28132,0,miopenConvolutionFwdAlgoWinograd
256-320-512-1x1-128-320-512-1-0x0-1x1-1x1-0-NCHW-FP16-F=ConvBinWinogradRxSf2x3g1:4.24194,0,miopenConvolutionFwdAlgoWinograd;GemmFwd1x1_0_1:0.852631,0,miopenConvolutionFwdAlgoGEMM;ConvBinWinogradRxSf3x2:2.02922,0,miopenConvolutionFwdAlgoWinograd;GemmFwd1x1_0_1_hipblaslt:1.14971,0,miopenConvolutionFwdAlgoGEMM;ConvHipImplicitGemmGroupFwdXdlops:4.40618,125894656,miopenConvolutionFwdAlgoImplicitGEMM
128-320-512-3x3-3-320-512-1-1x1-1x1-1x1-0-NCHW-FP16-F=GemmFwdRest:4.54696,377487360,miopenConvolutionFwdAlgoGEMM;GemmFwdRest_hipblaslt:4.91944,377487360,miopenConvolutionFwdAlgoGEMM;ConvHipImplicitGemmGroupFwdXdlops:3.49224,42932992,miopenConvolutionFwdAlgoImplicitGEMM;ConvBinWinogradRxSf3x2:1.01864,0,miopenConvolutionFwdAlgoWinograd;ConvBinWinogradRxSf2x3g1:0.6071,0,miopenConvolutionFwdAlgoWinograd
3-320-514-1x3-3-320-512-1-0x0-1x1-1x1-0-NCHW-FP16-F_g3=GemmFwdRest:0.389244,2949120,miopenConvolutionFwdAlgoGEMM;GemmFwdRest_hipblaslt:0.198103,2949120,miopenConvolutionFwdAlgoGEMM;ConvHipImplicitGemmGroupFwdXdlops:0.528963,1970176,miopenConvolutionFwdAlgoImplicitGEMM;ConvBinWinogradRxSf2x3:0.269286,0,miopenConvolutionFwdAlgoWinograd;ConvBinWinogradRxSf3x2:0.195457,0,miopenConvolutionFwdAlgoWinograd
3-322-512-3x1-3-320-512-1-0x0-1x1-1x1-0-NCHW-FP16-F_g3=GemmFwdRest:0.392965,2949120,miopenConvolutionFwdAlgoGEMM;GemmFwdRest_hipblaslt:0.208648,2949120,miopenConvolutionFwdAlgoGEMM;ConvHipImplicitGemmGroupFwdXdlops:0.534677,1972480,miopenConvolutionFwdAlgoImplicitGEMM;ConvBinWinogradRxSf2x3:0.264967,0,miopenConvolutionFwdAlgoWinograd;ConvBinWinogradRxSf3x2:0.2029,0,miopenConvolutionFwdAlgoWinograd
3-224-224-14x14-1280-16-16-1-0x0-14x14-1x1-0-NCHW-FP16-F=GemmFwdRest:0.0974657,301056,miopenConvolutionFwdAlgoGEMM;GemmFwdRest_hipblaslt:0.107523,301056,miopenConvolutionFwdAlgoGEMM;ConvHipImplicitGemmGroupFwdXdlops:0.212814,2461696,miopenConvolutionFwdAlgoImplicitGEMM
3-320-512-3x3-128-320-512-1-1x1-1x1-1x1-0-NCHW-FP16-F=GemmFwdRest:0.427999,8847360,miopenConvolutionFwdAlgoGEMM;GemmFwdRest_hipblaslt:0.492937,8847360,miopenConvolutionFwdAlgoGEMM;ConvHipImplicitGemmGroupFwdXdlops:1.69979,42932992,miopenConvolutionFwdAlgoImplicitGEMM;ConvBinWinogradRxSf3x2:0.385029,0,miopenConvolutionFwdAlgoWinograd;ConvBinWinogradRxSf2x3g1:0.27956,0,miopenConvolutionFwdAlgoWinograd
128-321-513-3x3-128-160-256-1-0x0-2x2-1x1-0-NCHW-FP16-F=GemmFwdRest:1.70175,94371840,miopenConvolutionFwdAlgoGEMM;GemmFwdRest_hipblaslt:1.8856,94371840,miopenConvolutionFwdAlgoGEMM;ConvHipImplicitGemmGroupFwdXdlops:2.46455,52936960,miopenConvolutionFwdAlgoImplicitGEMM;ConvBinWinogradRxSf3x2:1.12057,0,miopenConvolutionFwdAlgoWinograd;ConvBinWinogradRxSf2x3g1:2.4842,0,miopenConvolutionFwdAlgoWinograd
128-160-256-3x3-256-160-256-1-1x1-1x1-1x1-0-NCHW-FP16-F=GemmFwdRest:1.83456,94371840,miopenConvolutionFwdAlgoGEMM;GemmFwdRest_hipblaslt:2.30297,94371840,miopenConvolutionFwdAlgoGEMM;ConvHipImplicitGemmGroupFwdXdlops:3.53556,32047104,miopenConvolutionFwdAlgoImplicitGEMM;ConvBinWinogradRxSf3x2:2.07409,0,miopenConvolutionFwdAlgoWinograd;ConvBinWinogradRxSf2x3g1:1.1309,0,miopenConvolutionFwdAlgoWinograd
128-160-256-1x1-256-160-256-1-0x0-1x1-1x1-0-NCHW-FP16-F=ConvBinWinogradRxSf2x3g1:1.17676,0,miopenConvolutionFwdAlgoWinograd;GemmFwd1x1_0_1:0.161516,0,miopenConvolutionFwdAlgoGEMM;ConvBinWinogradRxSf3x2:0.6103,0,miopenConvolutionFwdAlgoWinograd;GemmFwd1x1_0_1_hipblaslt:0.285499,0,miopenConvolutionFwdAlgoGEMM;ConvHipImplicitGemmGroupFwdXdlops:1.2364,31522816,miopenConvolutionFwdAlgoImplicitGEMM
256-161-257-3x3-256-80-128-1-0x0-2x2-1x1-0-NCHW-FP16-F=GemmFwdRest:1.05985,47185920,miopenConvolutionFwdAlgoGEMM;GemmFwdRest_hipblaslt:1.27888,47185920,miopenConvolutionFwdAlgoGEMM;ConvHipImplicitGemmGroupFwdXdlops:1.93618,27607552,miopenConvolutionFwdAlgoImplicitGEMM;ConvBinWinogradRxSf3x2:1.10886,0,miopenConvolutionFwdAlgoWinograd;ConvBinWinogradRxSf2x3g1:2.2821,0,miopenConvolutionFwdAlgoWinograd
256-80-128-3x3-512-80-128-1-1x1-1x1-1x1-0-NCHW-FP16-F=GemmFwdRest:1.85377,47185920,miopenConvolutionFwdAlgoGEMM;GemmFwdRest_hipblaslt:2.11905,47185920,miopenConvolutionFwdAlgoGEMM;ConvHipImplicitGemmGroupFwdXdlops:3.08455,18087936,miopenConvolutionFwdAlgoImplicitGEMM;ConvBinWinogradRxSf3x2:1.93224,0,miopenConvolutionFwdAlgoWinograd;ConvBinWinogradRxSf2x3g1:1.12418,0,miopenConvolutionFwdAlgoWinograd
256-80-128-1x1-512-80-128-1-0x0-1x1-1x1-0-NCHW-FP16-F=ConvBinWinogradRxSf2x3g1:1.14126,0,miopenConvolutionFwdAlgoWinograd;GemmFwd1x1_0_1:0.118572,0,miopenConvolutionFwdAlgoGEMM;ConvBinWinogradRxSf3x2:0.563957,0,miopenConvolutionFwdAlgoWinograd;GemmFwd1x1_0_1_hipblaslt:0.178288,0,miopenConvolutionFwdAlgoGEMM;ConvHipImplicitGemmGroupFwdXdlops:0.711108,15990784,miopenConvolutionFwdAlgoImplicitGEMM
512-81-129-3x3-512-40-64-1-0x0-2x2-1x1-0-NCHW-FP16-F=GemmFwdRest:0.716403,23592960,miopenConvolutionFwdAlgoGEMM;GemmFwdRest_hipblaslt:1.11454,23592960,miopenConvolutionFwdAlgoGEMM;ConvHipImplicitGemmGroupFwdXdlops:2.12406,18039808,miopenConvolutionFwdAlgoImplicitGEMM;ConvBinWinogradRxSf3x2:1.07443,0,miopenConvolutionFwdAlgoWinograd;ConvBinWinogradRxSf2x3g1:2.26631,0,miopenConvolutionFwdAlgoWinograd
512-40-64-3x3-8-40-64-1-1x1-1x1-1x1-0-NCHW-FP16-F=GemmFwdRest:0.379332,23592960,miopenConvolutionFwdAlgoGEMM;GemmFwdRest_hipblaslt:0.354944,23592960,miopenConvolutionFwdAlgoGEMM;ConvHipImplicitGemmGroupFwdXdlops:0.385693,2736128,miopenConvolutionFwdAlgoImplicitGEMM;ConvBinWinogradRxSf3x2:0.316,0,miopenConvolutionFwdAlgoWinograd;ConvBinWinogradRxSf2x3g1:0.131,0,miopenConvolutionFwdAlgoWinograd
8-40-64-1x1-8-40-64-1-0x0-1x1-1x1-0-NCHW-FP16-F=ConvBinWinogradRxSf2x3g1:0.0615714,0,miopenConvolutionFwdAlgoWinograd;GemmFwd1x1_0_1:0.02515,0,miopenConvolutionFwdAlgoGEMM;ConvBinWinogradRxSf3x2:0.0682333,0,miopenConvolutionFwdAlgoWinograd;GemmFwd1x1_0_1_hipblaslt:0.0276567,0,miopenConvolutionFwdAlgoGEMM;ConvHipImplicitGemmGroupFwdXdlops:0.1269,82176,miopenConvolutionFwdAlgoImplicitGEMM
8-40-64-3x3-320-40-64-16-1x1-1x1-1x1-0-NCHW-FP16-F=GemmFwdRest:0.945192,368640,miopenConvolutionFwdAlgoGEMM;GemmFwdRest_hipblaslt:1.15976,368640,miopenConvolutionFwdAlgoGEMM;ConvHipImplicitGemmGroupFwdXdlops:1.09775,26915840,miopenConvolutionFwdAlgoImplicitGEMM;ConvBinWinogradRxSf3x2:0.309483,0,miopenConvolutionFwdAlgoWinograd;ConvBinWinogradRxSf2x3g1:0.20075,0,miopenConvolutionFwdAlgoWinograd
320-1-16-1x1-512-1-16-2560-0x0-1x1-1x1-0-NCHW-FP16-F=ConvBinWinogradRxSf2x3g1:10.1768,0,miopenConvolutionFwdAlgoWinograd;GemmFwd1x1_0_1:4.3853,0,miopenConvolutionFwdAlgoGEMM;ConvBinWinogradRxSf3x2:7.66084,0,miopenConvolutionFwdAlgoWinograd;GemmFwd1x1_0_1_hipblaslt:1.58025,0,miopenConvolutionFwdAlgoGEMM;ConvHipImplicitGemmGroupFwdXdlops:3.49394,68485120,miopenConvolutionFwdAlgoImplicitGEMM
512-1-16-1x1-320-1-16-2560-0x0-1x1-1x1-0-NCHW-FP16-F=ConvBinWinogradRxSf2x3g1:10.1004,0,miopenConvolutionFwdAlgoWinograd;GemmFwd1x1_0_1:4.68205,0,miopenConvolutionFwdAlgoGEMM;ConvBinWinogradRxSf3x2:7.53697,0,miopenConvolutionFwdAlgoWinograd;GemmFwd1x1_0_1_hipblaslt:5.14624,0,miopenConvolutionFwdAlgoGEMM;ConvHipImplicitGemmGroupFwdXdlops:3.22265,68485120,miopenConvolutionFwdAlgoImplicitGEMM
320-40-64-3x3-320-40-64-16-1x1-1x1-1x1-0-NCHW-FP16-F=GemmFwdRest:5.02208,14745600,miopenConvolutionFwdAlgoGEMM;GemmFwdRest_hipblaslt:6.77527,14745600,miopenConvolutionFwdAlgoGEMM;ConvHipImplicitGemmGroupFwdXdlops:9.15989,54272000,miopenConvolutionFwdAlgoImplicitGEMM;ConvBinWinogradRxSf3x2:5.97175,0,miopenConvolutionFwdAlgoWinograd;ConvBinWinogradRxSf2x3g1:3.3944,0,miopenConvolutionFwdAlgoWinograd
320-16-40-64-3x1x1-320-16-40-64-1-1x0x0-1x1x1-1x1x1-0-NCDHW-FP16-F=GemmFwdRest:3.26129,78643200,miopenConvolutionFwdAlgoGEMM;ConvHipImplicitGemm3DGroupFwdXdlops:5.06405,53043200,miopenConvolutionFwdAlgoImplicitGEMM;GemmFwdRest_hipblaslt:4.16359,78643200,miopenConvolutionFwdAlgoGEMM
320-40-64-3x3-320-20-32-16-1x1-2x2-1x1-0-NCHW-FP16-F=GemmFwdRest:2.72625,3686400,miopenConvolutionFwdAlgoGEMM;GemmFwdRest_hipblaslt:2.79356,3686400,miopenConvolutionFwdAlgoGEMM;ConvHipImplicitGemmGroupFwdXdlops:2.68529,34611200,miopenConvolutionFwdAlgoImplicitGEMM;ConvBinWinogradRxSf3x2:1.62253,0,miopenConvolutionFwdAlgoWinograd;ConvBinWinogradRxSf2x3g1:3.53843,0,miopenConvolutionFwdAlgoWinograd
320-20-32-3x3-640-20-32-16-1x1-1x1-1x1-0-NCHW-FP16-F=GemmFwdRest:3.09779,3686400,miopenConvolutionFwdAlgoGEMM;GemmFwdRest_hipblaslt:3.20957,3686400,miopenConvolutionFwdAlgoGEMM;ConvHipImplicitGemmGroupFwdXdlops:4.60511,23347200,miopenConvolutionFwdAlgoImplicitGEMM;ConvBinWinogradRxSf3x2:3.09012,0,miopenConvolutionFwdAlgoWinograd;ConvBinWinogradRxSf2x3g1:1.66903,0,miopenConvolutionFwdAlgoWinograd
640-20-32-3x3-640-20-32-16-1x1-1x1-1x1-0-NCHW-FP16-F=GemmFwdRest:6.11203,7372800,miopenConvolutionFwdAlgoGEMM;GemmFwdRest_hipblaslt:5.18089,7372800,miopenConvolutionFwdAlgoGEMM;ConvHipImplicitGemmGroupFwdXdlops:8.75225,33587200,miopenConvolutionFwdAlgoImplicitGEMM;ConvBinWinogradRxSf3x2:6.0056,0,miopenConvolutionFwdAlgoWinograd;ConvBinWinogradRxSf2x3g1:3.19617,0,miopenConvolutionFwdAlgoWinograd
320-20-32-1x1-640-20-32-16-0x0-1x1-1x1-0-NCHW-FP16-F=ConvBinWinogradRxSf2x3g1:1.66701,0,miopenConvolutionFwdAlgoWinograd;GemmFwd1x1_0_1:0.158644,0,miopenConvolutionFwdAlgoGEMM;ConvBinWinogradRxSf3x2:0.857843,0,miopenConvolutionFwdAlgoWinograd;GemmFwd1x1_0_1_hipblaslt:0.239837,0,miopenConvolutionFwdAlgoGEMM;ConvHipImplicitGemmGroupFwdXdlops:0.893778,20070400,miopenConvolutionFwdAlgoImplicitGEMM
640-16-20-32-3x1x1-640-16-20-32-1-1x0x0-1x1x1-1x1x1-0-NCDHW-FP16-F=GemmFwdRest:1.81859,39321600,miopenConvolutionFwdAlgoGEMM;ConvHipImplicitGemm3DGroupFwdXdlops:4.33176,28672000,miopenConvolutionFwdAlgoImplicitGEMM;GemmFwdRest_hipblaslt:2.28844,39321600,miopenConvolutionFwdAlgoGEMM
640-20-32-3x3-640-10-16-16-1x1-2x2-1x1-0-NCHW-FP16-F=GemmFwdRest:4.07125,1843200,miopenConvolutionFwdAlgoGEMM;GemmFwdRest_hipblaslt:3.11233,1843200,miopenConvolutionFwdAlgoGEMM;ConvHipImplicitGemmGroupFwdXdlops:2.46091,23756800,miopenConvolutionFwdAlgoImplicitGEMM;ConvBinWinogradRxSf3x2:1.92875,0,miopenConvolutionFwdAlgoWinograd;ConvBinWinogradRxSf2x3g1:3.48077,0,miopenConvolutionFwdAlgoWinograd
640-10-16-3x3-1280-10-16-16-1x1-1x1-1x1-0-NCHW-FP16-F=GemmFwdRest:3.772,1843200,miopenConvolutionFwdAlgoGEMM;GemmFwdRest_hipblaslt:4.85839,1843200,miopenConvolutionFwdAlgoGEMM;ConvHipImplicitGemmGroupFwdXdlops:4.47406,24576000,miopenConvolutionFwdAlgoImplicitGEMM;ConvBinWinogradRxSf3x2:3.64563,0,miopenConvolutionFwdAlgoWinograd;ConvBinWinogradRxSf2x3g1:1.60985,0,miopenConvolutionFwdAlgoWinograd
1280-10-16-3x3-1280-10-16-16-1x1-1x1-1x1-0-NCHW-FP16-F=GemmFwdRest:7.81246,3686400,miopenConvolutionFwdAlgoGEMM;GemmFwdRest_hipblaslt:8.49107,3686400,miopenConvolutionFwdAlgoGEMM;ConvHipImplicitGemmGroupFwdXdlops:9.13964,42598400,miopenConvolutionFwdAlgoImplicitGEMM;ConvBinWinogradRxSf3x2:7.15543,0,miopenConvolutionFwdAlgoWinograd;ConvBinWinogradRxSf2x3g1:3.10884,0,miopenConvolutionFwdAlgoWinograd
640-10-16-1x1-1280-10-16-16-0x0-1x1-1x1-0-NCHW-FP16-F=ConvBinWinogradRxSf2x3g1:1.60364,0,miopenConvolutionFwdAlgoWinograd;GemmFwd1x1_0_1:0.248915,0,miopenConvolutionFwdAlgoGEMM;ConvBinWinogradRxSf3x2:0.9945,0,miopenConvolutionFwdAlgoWinograd;GemmFwd1x1_0_1_hipblaslt:0.34321,0,miopenConvolutionFwdAlgoGEMM;ConvHipImplicitGemmGroupFwdXdlops:0.736422,11468800,miopenConvolutionFwdAlgoImplicitGEMM
1280-16-10-16-3x1x1-1280-16-10-16-1-1x0x0-1x1x1-1x1x1-0-NCDHW-FP16-F=GemmFwdRest:1.18371,19660800,miopenConvolutionFwdAlgoGEMM;ConvHipImplicitGemm3DGroupFwdXdlops:4.11077,22937600,miopenConvolutionFwdAlgoImplicitGEMM;GemmFwdRest_hipblaslt:1.71879,19660800,miopenConvolutionFwdAlgoGEMM
1280-10-16-3x3-1280-5-8-16-1x1-2x2-1x1-0-NCHW-FP16-F=GemmFwdRest:6.36268,921600,miopenConvolutionFwdAlgoGEMM;GemmFwdRest_hipblaslt:4.24227,921600,miopenConvolutionFwdAlgoGEMM;ConvHipImplicitGemmGroupFwdXdlops:2.82483,37683200,miopenConvolutionFwdAlgoImplicitGEMM;ConvBinWinogradRxSf3x2:1.97967,0,miopenConvolutionFwdAlgoWinograd;ConvBinWinogradRxSf2x3g1:4.25438,0,miopenConvolutionFwdAlgoWinograd
1280-5-8-3x3-1280-5-8-16-1x1-1x1-1x1-0-NCHW-FP16-F=GemmFwdRest:6.80613,921600,miopenConvolutionFwdAlgoGEMM;GemmFwdRest_hipblaslt:3.82721,921600,miopenConvolutionFwdAlgoGEMM;ConvHipImplicitGemmGroupFwdXdlops:2.73647,32768000,miopenConvolutionFwdAlgoImplicitGEMM;ConvBinWinogradRxSf3x2:1.8465,0,miopenConvolutionFwdAlgoWinograd;ConvBinWinogradRxSf2x3g1:0.983633,0,miopenConvolutionFwdAlgoWinograd
1280-16-5-8-3x1x1-1280-16-5-8-1-1x0x0-1x1x1-1x1x1-0-NCDHW-FP16-F=GemmFwdRest:0.460247,4915200,miopenConvolutionFwdAlgoGEMM;ConvHipImplicitGemm3DGroupFwdXdlops:1.26685,13107200,miopenConvolutionFwdAlgoImplicitGEMM;GemmFwdRest_hipblaslt:0.483179,4915200,miopenConvolutionFwdAlgoGEMM
2560-5-8-3x3-1280-5-8-16-1x1-1x1-1x1-0-NCHW-FP16-F=GemmFwdRest:18.5027,1843200,miopenConvolutionFwdAlgoGEMM;GemmFwdRest_hipblaslt:7.56322,1843200,miopenConvolutionFwdAlgoGEMM;ConvHipImplicitGemmGroupFwdXdlops:5.58793,63897600,miopenConvolutionFwdAlgoImplicitGEMM;ConvBinWinogradRxSf3x2:3.74894,0,miopenConvolutionFwdAlgoWinograd;ConvBinWinogradRxSf2x3g1:1.91522,0,miopenConvolutionFwdAlgoWinograd
2560-5-8-1x1-1280-5-8-16-0x0-1x1-1x1-0-NCHW-FP16-F=ConvBinWinogradRxSf2x3g1:1.94518,0,miopenConvolutionFwdAlgoWinograd;GemmFwd1x1_0_1:0.54943,0,miopenConvolutionFwdAlgoGEMM;ConvBinWinogradRxSf3x2:1.00123,0,miopenConvolutionFwdAlgoWinograd;GemmFwd1x1_0_1_hipblaslt:0.640475,0,miopenConvolutionFwdAlgoGEMM;ConvHipImplicitGemmGroupFwdXdlops:1.16109,11468800,miopenConvolutionFwdAlgoImplicitGEMM
2560-10-16-3x3-1280-10-16-16-1x1-1x1-1x1-0-NCHW-FP16-F=GemmFwdRest:28.9125,7372800,miopenConvolutionFwdAlgoGEMM;GemmFwdRest_hipblaslt:24.7095,7372800,miopenConvolutionFwdAlgoGEMM;ConvHipImplicitGemmGroupFwdXdlops:19.5875,78643200,miopenConvolutionFwdAlgoImplicitGEMM;ConvBinWinogradRxSf3x2:14.6023,0,miopenConvolutionFwdAlgoWinograd;ConvBinWinogradRxSf2x3g1:6.20481,0,miopenConvolutionFwdAlgoWinograd
2560-10-16-1x1-1280-10-16-16-0x0-1x1-1x1-0-NCHW-FP16-F=ConvBinWinogradRxSf2x3g1:6.2434,0,miopenConvolutionFwdAlgoWinograd;GemmFwd1x1_0_1:0.91704,0,miopenConvolutionFwdAlgoGEMM;ConvBinWinogradRxSf3x2:3.70625,0,miopenConvolutionFwdAlgoWinograd;GemmFwd1x1_0_1_hipblaslt:1.29634,0,miopenConvolutionFwdAlgoGEMM;ConvHipImplicitGemmGroupFwdXdlops:3.27676,26214400,miopenConvolutionFwdAlgoImplicitGEMM
1920-10-16-3x3-1280-10-16-16-1x1-1x1-1x1-0-NCHW-FP16-F=GemmFwdRest:11.4763,5529600,miopenConvolutionFwdAlgoGEMM;GemmFwdRest_hipblaslt:12.209,5529600,miopenConvolutionFwdAlgoGEMM;ConvHipImplicitGemmGroupFwdXdlops:13.885,60620800,miopenConvolutionFwdAlgoImplicitGEMM;ConvBinWinogradRxSf3x2:10.7325,0,miopenConvolutionFwdAlgoWinograd;ConvBinWinogradRxSf2x3g1:4.66354,0,miopenConvolutionFwdAlgoWinograd
1920-10-16-1x1-1280-10-16-16-0x0-1x1-1x1-0-NCHW-FP16-F=ConvBinWinogradRxSf2x3g1:4.61915,0,miopenConvolutionFwdAlgoWinograd;GemmFwd1x1_0_1:0.585857,0,miopenConvolutionFwdAlgoGEMM;ConvBinWinogradRxSf3x2:2.79634,0,miopenConvolutionFwdAlgoWinograd;GemmFwd1x1_0_1_hipblaslt:0.928041,0,miopenConvolutionFwdAlgoGEMM;ConvHipImplicitGemmGroupFwdXdlops:1.77505,21299200,miopenConvolutionFwdAlgoImplicitGEMM
1280-20-32-3x3-1280-20-32-16-1x1-1x1-1x1-0-NCHW-FP16-F=GemmFwdRest:13.8354,14745600,miopenConvolutionFwdAlgoGEMM;GemmFwdRest_hipblaslt:16.39,14745600,miopenConvolutionFwdAlgoGEMM;ConvHipImplicitGemmGroupFwdXdlops:34.4504,81920000,miopenConvolutionFwdAlgoImplicitGEMM;ConvBinWinogradRxSf3x2:24.2593,0,miopenConvolutionFwdAlgoWinograd;ConvBinWinogradRxSf2x3g1:12.343,0,miopenConvolutionFwdAlgoWinograd
1920-20-32-3x3-640-20-32-16-1x1-1x1-1x1-0-NCHW-FP16-F=GemmFwdRest:15.3913,22118400,miopenConvolutionFwdAlgoGEMM;GemmFwdRest_hipblaslt:13.5318,22118400,miopenConvolutionFwdAlgoGEMM;ConvHipImplicitGemmGroupFwdXdlops:25.7149,74547200,miopenConvolutionFwdAlgoImplicitGEMM;ConvBinWinogradRxSf3x2:17.6753,0,miopenConvolutionFwdAlgoWinograd;ConvBinWinogradRxSf2x3g1:9.23973,0,miopenConvolutionFwdAlgoWinograd
1920-20-32-1x1-640-20-32-16-0x0-1x1-1x1-0-NCHW-FP16-F=ConvBinWinogradRxSf2x3g1:9.21167,0,miopenConvolutionFwdAlgoWinograd;GemmFwd1x1_0_1:0.83824,0,miopenConvolutionFwdAlgoGEMM;ConvBinWinogradRxSf3x2:4.666,0,miopenConvolutionFwdAlgoWinograd;GemmFwd1x1_0_1_hipblaslt:1.11085,0,miopenConvolutionFwdAlgoGEMM;ConvHipImplicitGemmGroupFwdXdlops:3.53405,54886400,miopenConvolutionFwdAlgoImplicitGEMM
960-20-32-3x3-640-20-32-16-1x1-1x1-1x1-0-NCHW-FP16-F=GemmFwdRest:7.09539,11059200,miopenConvolutionFwdAlgoGEMM;GemmFwdRest_hipblaslt:7.27163,11059200,miopenConvolutionFwdAlgoGEMM;ConvHipImplicitGemmGroupFwdXdlops:12.945,43827200,miopenConvolutionFwdAlgoImplicitGEMM;ConvBinWinogradRxSf3x2:8.89738,0,miopenConvolutionFwdAlgoWinograd;ConvBinWinogradRxSf2x3g1:4.65735,0,miopenConvolutionFwdAlgoWinograd
960-20-32-1x1-640-20-32-16-0x0-1x1-1x1-0-NCHW-FP16-F=ConvBinWinogradRxSf2x3g1:4.66554,0,miopenConvolutionFwdAlgoWinograd;GemmFwd1x1_0_1:0.433604,0,miopenConvolutionFwdAlgoGEMM;ConvBinWinogradRxSf3x2:2.36643,0,miopenConvolutionFwdAlgoWinograd;GemmFwd1x1_0_1_hipblaslt:0.570874,0,miopenConvolutionFwdAlgoGEMM;ConvHipImplicitGemmGroupFwdXdlops:2.0193,33996800,miopenConvolutionFwdAlgoImplicitGEMM
640-40-64-3x3-640-40-64-16-1x1-1x1-1x1-0-NCHW-FP16-F=GemmFwdRest:11.4043,29491200,miopenConvolutionFwdAlgoGEMM;GemmFwdRest_hipblaslt:16.8106,29491200,miopenConvolutionFwdAlgoGEMM;ConvHipImplicitGemmGroupFwdXdlops:35.2603,112230400,miopenConvolutionFwdAlgoImplicitGEMM;ConvBinWinogradRxSf3x2:22.8835,0,miopenConvolutionFwdAlgoWinograd;ConvBinWinogradRxSf2x3g1:12.5381,0,miopenConvolutionFwdAlgoWinograd
960-40-64-3x3-320-40-64-16-1x1-1x1-1x1-0-NCHW-FP16-F=GemmFwdRest:15.211,44236800,miopenConvolutionFwdAlgoGEMM;GemmFwdRest_hipblaslt:18.4047,44236800,miopenConvolutionFwdAlgoGEMM;ConvHipImplicitGemmGroupFwdXdlops:26.2564,110387200,miopenConvolutionFwdAlgoImplicitGEMM;ConvBinWinogradRxSf3x2:17.4918,0,miopenConvolutionFwdAlgoWinograd;ConvBinWinogradRxSf2x3g1:9.52814,0,miopenConvolutionFwdAlgoWinograd
960-40-64-1x1-320-40-64-16-0x0-1x1-1x1-0-NCHW-FP16-F=ConvBinWinogradRxSf2x3g1:9.38499,0,miopenConvolutionFwdAlgoWinograd;GemmFwd1x1_0_1:0.983435,0,miopenConvolutionFwdAlgoGEMM;ConvBinWinogradRxSf3x2:4.56592,0,miopenConvolutionFwdAlgoWinograd;GemmFwd1x1_0_1_hipblaslt:1.24997,0,miopenConvolutionFwdAlgoGEMM;ConvHipImplicitGemmGroupFwdXdlops:4.42174,105472000,miopenConvolutionFwdAlgoImplicitGEMM
640-40-64-3x3-320-40-64-16-1x1-1x1-1x1-0-NCHW-FP16-F=GemmFwdRest:9.29157,29491200,miopenConvolutionFwdAlgoGEMM;GemmFwdRest_hipblaslt:12.3857,29491200,miopenConvolutionFwdAlgoGEMM;ConvHipImplicitGemmGroupFwdXdlops:32.224,82329600,miopenConvolutionFwdAlgoImplicitGEMM;ConvBinWinogradRxSf3x2:11.9086,0,miopenConvolutionFwdAlgoWinograd;ConvBinWinogradRxSf2x3g1:6.5703,0,miopenConvolutionFwdAlgoWinograd
640-40-64-1x1-320-40-64-16-0x0-1x1-1x1-0-NCHW-FP16-F=ConvBinWinogradRxSf2x3g1:6.30278,0,miopenConvolutionFwdAlgoWinograd;GemmFwd1x1_0_1:0.69273,0,miopenConvolutionFwdAlgoGEMM;ConvBinWinogradRxSf3x2:3.11461,0,miopenConvolutionFwdAlgoWinograd;GemmFwd1x1_0_1_hipblaslt:0.802119,0,miopenConvolutionFwdAlgoGEMM;ConvHipImplicitGemmGroupFwdXdlops:3.28219,79052800,miopenConvolutionFwdAlgoImplicitGEMM
320-40-64-3x3-4-40-64-16-1x1-1x1-1x1-0-NCHW-FP16-F=GemmFwdRest:3.69618,14745600,miopenConvolutionFwdAlgoGEMM;GemmFwdRest_hipblaslt:3.50899,14745600,miopenConvolutionFwdAlgoGEMM;ConvHipImplicitGemmGroupFwdXdlops:2.01497,26565120,miopenConvolutionFwdAlgoImplicitGEMM;ConvBinWinogradRxSf3x2:0.6976,0,miopenConvolutionFwdAlgoWinograd;ConvBinWinogradRxSf2x3g1:0.39115,0,miopenConvolutionFwdAlgoWinograd
4-64-64-3x3-320-64-64-2-1x1-1x1-1x1-0-NCHW-FP16-F=GemmFwdRest:0.113553,294912,miopenConvolutionFwdAlgoGEMM;GemmFwdRest_hipblaslt:0.153084,294912,miopenConvolutionFwdAlgoGEMM;ConvHipImplicitGemmGroupFwdXdlops:0.224142,5331456,miopenConvolutionFwdAlgoImplicitGEMM;ConvBinWinogradRxSf3x2:0.0838143,0,miopenConvolutionFwdAlgoWinograd;ConvBinWinogradRxSf2x3g1:0.0726667,0,miopenConvolutionFwdAlgoWinograd
320-64-64-3x3-320-64-64-2-1x1-1x1-1x1-0-NCHW-FP16-F=GemmFwdRest:0.845146,23592960,miopenConvolutionFwdAlgoGEMM;GemmFwdRest_hipblaslt:1.18916,23592960,miopenConvolutionFwdAlgoGEMM;ConvHipImplicitGemmGroupFwdXdlops:1.96911,12328960,miopenConvolutionFwdAlgoImplicitGEMM;ConvBinWinogradRxSf3x2:1.29227,0,miopenConvolutionFwdAlgoWinograd;ConvBinWinogradRxSf2x3g1:0.702,0,miopenConvolutionFwdAlgoWinograd
320-64-64-1x1-320-64-64-2-0x0-1x1-1x1-0-NCHW-FP16-F=ConvBinWinogradRxSf2x3g1:0.702167,0,miopenConvolutionFwdAlgoWinograd;GemmFwd1x1_0_1:0.0793286,0,miopenConvolutionFwdAlgoGEMM;ConvBinWinogradRxSf3x2:0.384814,0,miopenConvolutionFwdAlgoWinograd;GemmFwd1x1_0_1_hipblaslt:0.108795,0,miopenConvolutionFwdAlgoGEMM;ConvHipImplicitGemmGroupFwdXdlops:0.45931,10690560,miopenConvolutionFwdAlgoImplicitGEMM
320-64-64-3x3-320-32-32-2-1x1-2x2-1x1-0-NCHW-FP16-F=GemmFwdRest:0.44887,5898240,miopenConvolutionFwdAlgoGEMM;GemmFwdRest_hipblaslt:0.420936,5898240,miopenConvolutionFwdAlgoGEMM;ConvHipImplicitGemmGroupFwdXdlops:0.60785,8396800,miopenConvolutionFwdAlgoImplicitGEMM;ConvBinWinogradRxSf3x2:0.376814,0,miopenConvolutionFwdAlgoWinograd;ConvBinWinogradRxSf2x3g1:0.75355,0,miopenConvolutionFwdAlgoWinograd
320-32-32-3x3-640-32-32-2-1x1-1x1-1x1-0-NCHW-FP16-F=GemmFwdRest:0.449956,5898240,miopenConvolutionFwdAlgoGEMM;GemmFwdRest_hipblaslt:0.473228,5898240,miopenConvolutionFwdAlgoGEMM;ConvHipImplicitGemmGroupFwdXdlops:1.04381,7618560,miopenConvolutionFwdAlgoImplicitGEMM;ConvBinWinogradRxSf3x2:0.670367,0,miopenConvolutionFwdAlgoWinograd;ConvBinWinogradRxSf2x3g1:0.376871,0,miopenConvolutionFwdAlgoWinograd
640-32-32-3x3-640-32-32-2-1x1-1x1-1x1-0-NCHW-FP16-F=GemmFwdRest:0.77953,11796480,miopenConvolutionFwdAlgoGEMM;GemmFwdRest_hipblaslt:0.827429,11796480,miopenConvolutionFwdAlgoGEMM;ConvHipImplicitGemmGroupFwdXdlops:1.92502,12615680,miopenConvolutionFwdAlgoImplicitGEMM;ConvBinWinogradRxSf3x2:1.2745,0,miopenConvolutionFwdAlgoWinograd;ConvBinWinogradRxSf2x3g1:0.687833,0,miopenConvolutionFwdAlgoWinograd
320-32-32-1x1-640-32-32-2-0x0-1x1-1x1-0-NCHW-FP16-F=ConvBinWinogradRxSf2x3g1:0.380886,0,miopenConvolutionFwdAlgoWinograd;GemmFwd1x1_0_1:0.0495783,0,miopenConvolutionFwdAlgoGEMM;ConvBinWinogradRxSf3x2:0.224586,0,miopenConvolutionFwdAlgoWinograd;GemmFwd1x1_0_1_hipblaslt:0.0753883,0,miopenConvolutionFwdAlgoGEMM;ConvHipImplicitGemmGroupFwdXdlops:0.283187,4341760,miopenConvolutionFwdAlgoImplicitGEMM
640-32-32-1x1-640-32-32-2-0x0-1x1-1x1-0-NCHW-FP16-F=ConvBinWinogradRxSf2x3g1:0.696514,0,miopenConvolutionFwdAlgoWinograd;GemmFwd1x1_0_1:0.0766457,0,miopenConvolutionFwdAlgoGEMM;ConvBinWinogradRxSf3x2:0.3762,0,miopenConvolutionFwdAlgoWinograd;GemmFwd1x1_0_1_hipblaslt:0.109494,0,miopenConvolutionFwdAlgoGEMM;ConvHipImplicitGemmGroupFwdXdlops:0.383617,6062080,miopenConvolutionFwdAlgoImplicitGEMM
640-32-32-3x3-640-16-16-2-1x1-2x2-1x1-0-NCHW-FP16-F=GemmFwdRest:0.50018,2949120,miopenConvolutionFwdAlgoGEMM;GemmFwdRest_hipblaslt:0.444987,2949120,miopenConvolutionFwdAlgoGEMM;ConvHipImplicitGemmGroupFwdXdlops:0.615508,10649600,miopenConvolutionFwdAlgoImplicitGEMM;ConvBinWinogradRxSf3x2:0.695086,0,miopenConvolutionFwdAlgoWinograd;ConvBinWinogradRxSf2x3g1:0.749614,0,miopenConvolutionFwdAlgoWinograd
640-16-16-3x3-1280-16-16-2-1x1-1x1-1x1-0-NCHW-FP16-F=GemmFwdRest:0.491576,2949120,miopenConvolutionFwdAlgoGEMM;GemmFwdRest_hipblaslt:0.493408,2949120,miopenConvolutionFwdAlgoGEMM;ConvHipImplicitGemmGroupFwdXdlops:1.12127,16711680,miopenConvolutionFwdAlgoImplicitGEMM;ConvBinWinogradRxSf3x2:0.9837,0,miopenConvolutionFwdAlgoWinograd;ConvBinWinogradRxSf2x3g1:0.37132,0,miopenConvolutionFwdAlgoWinograd
1280-16-16-3x3-1280-16-16-2-1x1-1x1-1x1-0-NCHW-FP16-F=GemmFwdRest:0.957468,5898240,miopenConvolutionFwdAlgoGEMM;GemmFwdRest_hipblaslt:0.867474,5898240,miopenConvolutionFwdAlgoGEMM;ConvHipImplicitGemmGroupFwdXdlops:2.2319,32112640,miopenConvolutionFwdAlgoImplicitGEMM;ConvBinWinogradRxSf3x2:1.91993,0,miopenConvolutionFwdAlgoWinograd;ConvBinWinogradRxSf2x3g1:0.7018,0,miopenConvolutionFwdAlgoWinograd
640-16-16-1x1-1280-16-16-2-0x0-1x1-1x1-0-NCHW-FP16-F=ConvBinWinogradRxSf2x3g1:0.383683,0,miopenConvolutionFwdAlgoWinograd;GemmFwd1x1_0_1:0.0436017,0,miopenConvolutionFwdAlgoGEMM;ConvBinWinogradRxSf3x2:0.299167,0,miopenConvolutionFwdAlgoWinograd;GemmFwd1x1_0_1_hipblaslt:0.0726167,0,miopenConvolutionFwdAlgoGEMM;ConvHipImplicitGemmGroupFwdXdlops:0.285759,3604480,miopenConvolutionFwdAlgoImplicitGEMM
1280-16-16-1x1-1280-16-16-2-0x0-1x1-1x1-0-NCHW-FP16-F=ConvBinWinogradRxSf2x3g1:0.70255,0,miopenConvolutionFwdAlgoWinograd;GemmFwd1x1_0_1:0.064315,0,miopenConvolutionFwdAlgoGEMM;ConvBinWinogradRxSf3x2:0.527033,0,miopenConvolutionFwdAlgoWinograd;GemmFwd1x1_0_1_hipblaslt:0.11833,0,miopenConvolutionFwdAlgoGEMM;ConvHipImplicitGemmGroupFwdXdlops:0.40007,5898240,miopenConvolutionFwdAlgoImplicitGEMM
1280-16-16-3x3-1280-8-8-2-1x1-2x2-1x1-0-NCHW-FP16-F=GemmFwdRest:0.799494,1474560,miopenConvolutionFwdAlgoGEMM;GemmFwdRest_hipblaslt:0.509327,1474560,miopenConvolutionFwdAlgoGEMM;ConvHipImplicitGemmGroupFwdXdlops:0.948068,31129600,miopenConvolutionFwdAlgoImplicitGEMM;ConvBinWinogradRxSf3x2:0.692283,0,miopenConvolutionFwdAlgoWinograd;ConvBinWinogradRxSf2x3g1:0.743114,0,miopenConvolutionFwdAlgoWinograd
1280-8-8-3x3-1280-8-8-2-1x1-1x1-1x1-0-NCHW-FP16-F=GemmFwdRest:0.78959,1474560,miopenConvolutionFwdAlgoGEMM;GemmFwdRest_hipblaslt:0.477357,1474560,miopenConvolutionFwdAlgoGEMM;ConvHipImplicitGemmGroupFwdXdlops:0.929131,30146560,miopenConvolutionFwdAlgoImplicitGEMM;ConvBinWinogradRxSf3x2:0.681883,0,miopenConvolutionFwdAlgoWinograd;ConvBinWinogradRxSf2x3g1:0.211714,0,miopenConvolutionFwdAlgoWinograd
1280-8-8-1x1-1280-8-8-2-0x0-1x1-1x1-0-NCHW-FP16-F=ConvBinWinogradRxSf2x3g1:0.21738,0,miopenConvolutionFwdAlgoWinograd;GemmFwd1x1_0_1:0.0624943,0,miopenConvolutionFwdAlgoGEMM;ConvBinWinogradRxSf3x2:0.215343,0,miopenConvolutionFwdAlgoWinograd;GemmFwd1x1_0_1_hipblaslt:0.0601517,0,miopenConvolutionFwdAlgoGEMM;ConvHipImplicitGemmGroupFwdXdlops:0.257567,3932160,miopenConvolutionFwdAlgoImplicitGEMM
2560-8-8-3x3-1280-8-8-2-1x1-1x1-1x1-0-NCHW-FP16-F=GemmFwdRest:2.5748,2949120,miopenConvolutionFwdAlgoGEMM;GemmFwdRest_hipblaslt:0.877565,2949120,miopenConvolutionFwdAlgoGEMM;ConvHipImplicitGemmGroupFwdXdlops:2.09996,59965440,miopenConvolutionFwdAlgoImplicitGEMM;ConvBinWinogradRxSf3x2:1.3064,0,miopenConvolutionFwdAlgoWinograd;ConvBinWinogradRxSf2x3g1:0.414757,0,miopenConvolutionFwdAlgoWinograd
2560-8-8-1x1-1280-8-8-2-0x0-1x1-1x1-0-NCHW-FP16-F=ConvBinWinogradRxSf2x3g1:0.377943,0,miopenConvolutionFwdAlgoWinograd;GemmFwd1x1_0_1:0.101042,0,miopenConvolutionFwdAlgoGEMM;ConvBinWinogradRxSf3x2:0.372614,0,miopenConvolutionFwdAlgoWinograd;GemmFwd1x1_0_1_hipblaslt:0.09541,0,miopenConvolutionFwdAlgoGEMM;ConvHipImplicitGemmGroupFwdXdlops:0.33041,7536640,miopenConvolutionFwdAlgoImplicitGEMM
2560-16-16-3x3-1280-16-16-2-1x1-1x1-1x1-0-NCHW-FP16-F=GemmFwdRest:2.64034,11796480,miopenConvolutionFwdAlgoGEMM;GemmFwdRest_hipblaslt:1.69579,11796480,miopenConvolutionFwdAlgoGEMM;ConvHipImplicitGemmGroupFwdXdlops:4.37536,62914560,miopenConvolutionFwdAlgoImplicitGEMM;ConvBinWinogradRxSf3x2:3.73084,0,miopenConvolutionFwdAlgoWinograd;ConvBinWinogradRxSf2x3g1:1.30677,0,miopenConvolutionFwdAlgoWinograd
2560-16-16-1x1-1280-16-16-2-0x0-1x1-1x1-0-NCHW-FP16-F=ConvBinWinogradRxSf2x3g1:1.31747,0,miopenConvolutionFwdAlgoWinograd;GemmFwd1x1_0_1:0.108574,0,miopenConvolutionFwdAlgoGEMM;ConvBinWinogradRxSf3x2:1.00017,0,miopenConvolutionFwdAlgoWinograd;GemmFwd1x1_0_1_hipblaslt:0.196115,0,miopenConvolutionFwdAlgoGEMM;ConvHipImplicitGemmGroupFwdXdlops:0.649354,10485760,miopenConvolutionFwdAlgoImplicitGEMM
1920-16-16-3x3-1280-16-16-2-1x1-1x1-1x1-0-NCHW-FP16-F=GemmFwdRest:1.50482,8847360,miopenConvolutionFwdAlgoGEMM;GemmFwdRest_hipblaslt:1.24044,8847360,miopenConvolutionFwdAlgoGEMM;ConvHipImplicitGemmGroupFwdXdlops:3.32498,47513600,miopenConvolutionFwdAlgoImplicitGEMM;ConvBinWinogradRxSf3x2:2.83963,0,miopenConvolutionFwdAlgoWinograd;ConvBinWinogradRxSf2x3g1:1.00062,0,miopenConvolutionFwdAlgoWinograd
1920-16-16-1x1-1280-16-16-2-0x0-1x1-1x1-0-NCHW-FP16-F=ConvBinWinogradRxSf2x3g1:1.00553,0,miopenConvolutionFwdAlgoWinograd;GemmFwd1x1_0_1:0.0848886,0,miopenConvolutionFwdAlgoGEMM;ConvBinWinogradRxSf3x2:0.764733,0,miopenConvolutionFwdAlgoWinograd;GemmFwd1x1_0_1_hipblaslt:0.162597,0,miopenConvolutionFwdAlgoGEMM;ConvHipImplicitGemmGroupFwdXdlops:0.505947,8192000,miopenConvolutionFwdAlgoImplicitGEMM
1280-32-32-3x3-1280-32-32-2-1x1-1x1-1x1-0-NCHW-FP16-F=GemmFwdRest:2.41831,23592960,miopenConvolutionFwdAlgoGEMM;GemmFwdRest_hipblaslt:2.54561,23592960,miopenConvolutionFwdAlgoGEMM;ConvHipImplicitGemmGroupFwdXdlops:7.46187,39976960,miopenConvolutionFwdAlgoImplicitGEMM;ConvBinWinogradRxSf3x2:4.98003,0,miopenConvolutionFwdAlgoWinograd;ConvBinWinogradRxSf2x3g1:2.58962,0,miopenConvolutionFwdAlgoWinograd
1920-32-32-3x3-640-32-32-2-1x1-1x1-1x1-0-NCHW-FP16-F=GemmFwdRest:2.3253,35389440,miopenConvolutionFwdAlgoGEMM;GemmFwdRest_hipblaslt:2.22017,35389440,miopenConvolutionFwdAlgoGEMM;ConvHipImplicitGemmGroupFwdXdlops:5.64049,32604160,miopenConvolutionFwdAlgoImplicitGEMM;ConvBinWinogradRxSf3x2:3.81442,0,miopenConvolutionFwdAlgoWinograd;ConvBinWinogradRxSf2x3g1:1.96364,0,miopenConvolutionFwdAlgoWinograd
1920-32-32-1x1-640-32-32-2-0x0-1x1-1x1-0-NCHW-FP16-F=ConvBinWinogradRxSf2x3g1:2.06253,0,miopenConvolutionFwdAlgoWinograd;GemmFwd1x1_0_1:0.183035,0,miopenConvolutionFwdAlgoGEMM;ConvBinWinogradRxSf3x2:1.05431,0,miopenConvolutionFwdAlgoWinograd;GemmFwd1x1_0_1_hipblaslt:0.20298,0,miopenConvolutionFwdAlgoGEMM;ConvHipImplicitGemmGroupFwdXdlops:0.843023,12943360,miopenConvolutionFwdAlgoImplicitGEMM
1280-32-32-3x3-640-32-32-2-1x1-1x1-1x1-0-NCHW-FP16-F=GemmFwdRest:1.49315,23592960,miopenConvolutionFwdAlgoGEMM;GemmFwdRest_hipblaslt:1.50291,23592960,miopenConvolutionFwdAlgoGEMM;ConvHipImplicitGemmGroupFwdXdlops:3.68543,22609920,miopenConvolutionFwdAlgoImplicitGEMM;ConvBinWinogradRxSf3x2:2.47691,0,miopenConvolutionFwdAlgoWinograd;ConvBinWinogradRxSf2x3g1:1.29242,0,miopenConvolutionFwdAlgoWinograd
1280-32-32-1x1-640-32-32-2-0x0-1x1-1x1-0-NCHW-FP16-F=ConvBinWinogradRxSf2x3g1:1.34665,0,miopenConvolutionFwdAlgoWinograd;GemmFwd1x1_0_1:0.125122,0,miopenConvolutionFwdAlgoGEMM;ConvBinWinogradRxSf3x2:0.715843,0,miopenConvolutionFwdAlgoWinograd;GemmFwd1x1_0_1_hipblaslt:0.15452,0,miopenConvolutionFwdAlgoGEMM;ConvHipImplicitGemmGroupFwdXdlops:0.641693,9502720,miopenConvolutionFwdAlgoImplicitGEMM
960-32-32-3x3-640-32-32-2-1x1-1x1-1x1-0-NCHW-FP16-F=GemmFwdRest:1.07478,17694720,miopenConvolutionFwdAlgoGEMM;GemmFwdRest_hipblaslt:1.13796,17694720,miopenConvolutionFwdAlgoGEMM;ConvHipImplicitGemmGroupFwdXdlops:2.81257,17612800,miopenConvolutionFwdAlgoImplicitGEMM;ConvBinWinogradRxSf3x2:1.85017,0,miopenConvolutionFwdAlgoWinograd;ConvBinWinogradRxSf2x3g1:0.98285,0,miopenConvolutionFwdAlgoWinograd
960-32-32-1x1-640-32-32-2-0x0-1x1-1x1-0-NCHW-FP16-F=ConvBinWinogradRxSf2x3g1:1.00938,0,miopenConvolutionFwdAlgoWinograd;GemmFwd1x1_0_1:0.105338,0,miopenConvolutionFwdAlgoGEMM;ConvBinWinogradRxSf3x2:0.546971,0,miopenConvolutionFwdAlgoWinograd;GemmFwd1x1_0_1_hipblaslt:0.126464,0,miopenConvolutionFwdAlgoGEMM;ConvHipImplicitGemmGroupFwdXdlops:0.497675,7782400,miopenConvolutionFwdAlgoImplicitGEMM
640-64-64-3x3-640-64-64-2-1x1-1x1-1x1-0-NCHW-FP16-F=GemmFwdRest:3.38153,47185920,miopenConvolutionFwdAlgoGEMM;GemmFwdRest_hipblaslt:4.44558,47185920,miopenConvolutionFwdAlgoGEMM;ConvHipImplicitGemmGroupFwdXdlops:7.04208,28344320,miopenConvolutionFwdAlgoImplicitGEMM;ConvBinWinogradRxSf3x2:5.10105,0,miopenConvolutionFwdAlgoWinograd;ConvBinWinogradRxSf2x3g1:2.59494,0,miopenConvolutionFwdAlgoWinograd
960-64-64-3x3-320-64-64-2-1x1-1x1-1x1-0-NCHW-FP16-F=GemmFwdRest:3.31753,70778880,miopenConvolutionFwdAlgoGEMM;GemmFwdRest_hipblaslt:4.25535,70778880,miopenConvolutionFwdAlgoGEMM;ConvHipImplicitGemmGroupFwdXdlops:5.19082,26501120,miopenConvolutionFwdAlgoImplicitGEMM;ConvBinWinogradRxSf3x2:3.58574,0,miopenConvolutionFwdAlgoWinograd;ConvBinWinogradRxSf2x3g1:1.89711,0,miopenConvolutionFwdAlgoWinograd
960-64-64-1x1-320-64-64-2-0x0-1x1-1x1-0-NCHW-FP16-F=ConvBinWinogradRxSf2x3g1:1.9778,0,miopenConvolutionFwdAlgoWinograd;GemmFwd1x1_0_1:0.186209,0,miopenConvolutionFwdAlgoGEMM;ConvBinWinogradRxSf3x2:0.9932,0,miopenConvolutionFwdAlgoWinograd;GemmFwd1x1_0_1_hipblaslt:0.267972,0,miopenConvolutionFwdAlgoGEMM;ConvHipImplicitGemmGroupFwdXdlops:0.95062,21585920,miopenConvolutionFwdAlgoImplicitGEMM
640-64-64-3x3-320-64-64-2-1x1-1x1-1x1-0-NCHW-FP16-F=GemmFwdRest:2.05566,47185920,miopenConvolutionFwdAlgoGEMM;GemmFwdRest_hipblaslt:2.41956,47185920,miopenConvolutionFwdAlgoGEMM;ConvHipImplicitGemmGroupFwdXdlops:3.48694,19415040,miopenConvolutionFwdAlgoImplicitGEMM;ConvBinWinogradRxSf3x2:2.41818,0,miopenConvolutionFwdAlgoWinograd;ConvBinWinogradRxSf2x3g1:1.2915,0,miopenConvolutionFwdAlgoWinograd
640-64-64-1x1-320-64-64-2-0x0-1x1-1x1-0-NCHW-FP16-F=ConvBinWinogradRxSf2x3g1:1.32374,0,miopenConvolutionFwdAlgoWinograd;GemmFwd1x1_0_1:0.133768,0,miopenConvolutionFwdAlgoGEMM;ConvBinWinogradRxSf3x2:0.696217,0,miopenConvolutionFwdAlgoWinograd;GemmFwd1x1_0_1_hipblaslt:0.197162,0,miopenConvolutionFwdAlgoGEMM;ConvHipImplicitGemmGroupFwdXdlops:0.650701,16138240,miopenConvolutionFwdAlgoImplicitGEMM
320-64-64-3x3-4-64-64-2-1x1-1x1-1x1-0-NCHW-FP16-F=GemmFwdRest:0.616806,23592960,miopenConvolutionFwdAlgoGEMM;GemmFwdRest_hipblaslt:0.579778,23592960,miopenConvolutionFwdAlgoGEMM;ConvHipImplicitGemmGroupFwdXdlops:0.508352,5331456,miopenConvolutionFwdAlgoImplicitGEMM;ConvBinWinogradRxSf3x2:0.212033,0,miopenConvolutionFwdAlgoWinograd;ConvBinWinogradRxSf2x3g1:0.13422,0,miopenConvolutionFwdAlgoWinograd
4-64-64-1x1-4-64-64-1-0x0-1x1-1x1-0-NCHW-FP16-F=ConvBinWinogradRxSf2x3g1:0.05312,0,miopenConvolutionFwdAlgoWinograd;GemmFwd1x1_0_1:0.0418643,0,miopenConvolutionFwdAlgoGEMM;ConvBinWinogradRxSf3x2:0.0593,0,miopenConvolutionFwdAlgoWinograd;GemmFwd1x1_0_1_hipblaslt:0.0275157,0,miopenConvolutionFwdAlgoGEMM;ConvHipImplicitGemmGroupFwdXdlops:0.128645,65792,miopenConvolutionFwdAlgoImplicitGEMM
4-64-64-3x3-512-64-64-1-1x1-1x1-1x1-0-NCHW-FP16-F=GemmFwdRest:0.0812271,294912,miopenConvolutionFwdAlgoGEMM;GemmFwdRest_hipblaslt:0.0975067,294912,miopenConvolutionFwdAlgoGEMM;ConvHipImplicitGemmGroupFwdXdlops:0.259028,4263936,miopenConvolutionFwdAlgoImplicitGEMM;ConvBinWinogradRxSf3x2:0.0884167,0,miopenConvolutionFwdAlgoWinograd;ConvBinWinogradRxSf2x3g1:0.075,0,miopenConvolutionFwdAlgoWinograd
512-64-64-3x3-512-64-64-1-1x1-1x1-1x1-0-NCHW-FP16-F=GemmFwdRest:1.15018,37748736,miopenConvolutionFwdAlgoGEMM;GemmFwdRest_hipblaslt:1.45788,37748736,miopenConvolutionFwdAlgoGEMM;ConvHipImplicitGemmGroupFwdXdlops:2.47456,13107200,miopenConvolutionFwdAlgoImplicitGEMM;ConvBinWinogradRxSf3x2:1.73741,0,miopenConvolutionFwdAlgoWinograd;ConvBinWinogradRxSf2x3g1:0.869557,0,miopenConvolutionFwdAlgoWinograd
512-128-128-3x3-512-128-128-1-1x1-1x1-1x1-0-NCHW-FP16-F=GemmFwdRest:6.17297,150994944,miopenConvolutionFwdAlgoGEMM;GemmFwdRest_hipblaslt:19.2788,150994944,miopenConvolutionFwdAlgoGEMM;ConvHipImplicitGemmGroupFwdXdlops:9.81421,38273024,miopenConvolutionFwdAlgoImplicitGEMM;ConvBinWinogradRxSf3x2:5.88169,0,miopenConvolutionFwdAlgoWinograd;ConvBinWinogradRxSf2x3g1:3.32145,0,miopenConvolutionFwdAlgoWinograd
512-256-256-3x3-512-256-256-1-1x1-1x1-1x1-0-NCHW-FP16-F=GemmFwdRest:34.199,603979776,miopenConvolutionFwdAlgoGEMM;GemmFwdRest_hipblaslt:90.3617,603979776,miopenConvolutionFwdAlgoGEMM;ConvHipImplicitGemmGroupFwdXdlops:40.2321,138936320,miopenConvolutionFwdAlgoImplicitGEMM;ConvBinWinogradRxSf3x2:24.0864,0,miopenConvolutionFwdAlgoWinograd;ConvBinWinogradRxSf2x3g1:19.6577,0,miopenConvolutionFwdAlgoWinograd
512-256-256-3x3-256-256-256-1-1x1-1x1-1x1-0-NCHW-FP16-F=GemmFwdRest:19.3815,603979776,miopenConvolutionFwdAlgoGEMM;GemmFwdRest_hipblaslt:43.7087,603979776,miopenConvolutionFwdAlgoGEMM;ConvHipImplicitGemmGroupFwdXdlops:20.1531,103022592,miopenConvolutionFwdAlgoImplicitGEMM;ConvBinWinogradRxSf3x2:11.9752,0,miopenConvolutionFwdAlgoWinograd;ConvBinWinogradRxSf2x3g1:9.46264,0,miopenConvolutionFwdAlgoWinograd
256-256-256-3x3-256-256-256-1-1x1-1x1-1x1-0-NCHW-FP16-F=GemmFwdRest:8.08312,301989888,miopenConvolutionFwdAlgoGEMM;GemmFwdRest_hipblaslt:19.5399,301989888,miopenConvolutionFwdAlgoGEMM;ConvHipImplicitGemmGroupFwdXdlops:10.6457,68288512,miopenConvolutionFwdAlgoImplicitGEMM;ConvBinWinogradRxSf3x2:6.1743,0,miopenConvolutionFwdAlgoWinograd;ConvBinWinogradRxSf2x3g1:3.77042,0,miopenConvolutionFwdAlgoWinograd
512-256-256-1x1-256-256-256-1-0x0-1x1-1x1-0-NCHW-FP16-F=ConvBinWinogradRxSf2x3g1:7.63837,0,miopenConvolutionFwdAlgoWinograd;GemmFwd1x1_0_1:1.1285,0,miopenConvolutionFwdAlgoGEMM;ConvBinWinogradRxSf3x2:4.19668,0,miopenConvolutionFwdAlgoWinograd;GemmFwd1x1_0_1_hipblaslt:3.06214,0,miopenConvolutionFwdAlgoGEMM;ConvHipImplicitGemmGroupFwdXdlops:5.22927,100925440,miopenConvolutionFwdAlgoImplicitGEMM
256-512-512-3x3-256-512-512-1-1x1-1x1-1x1-0-NCHW-FP16-F=GemmFwdRest:35.4708,1207959552,miopenConvolutionFwdAlgoGEMM;GemmFwdRest_hipblaslt:87.4765,1207959552,miopenConvolutionFwdAlgoGEMM;ConvHipImplicitGemmGroupFwdXdlops:43.0879,269615104,miopenConvolutionFwdAlgoImplicitGEMM;ConvBinWinogradRxSf3x2:23.7244,0,miopenConvolutionFwdAlgoWinograd;ConvBinWinogradRxSf2x3g1:19.4723,0,miopenConvolutionFwdAlgoWinograd
256-512-512-3x3-128-512-512-1-1x1-1x1-1x1-0-NCHW-FP16-F=GemmFwdRest:19.7454,1207959552,miopenConvolutionFwdAlgoGEMM;GemmFwdRest_hipblaslt:55.5524,1207959552,miopenConvolutionFwdAlgoGEMM;ConvHipImplicitGemmGroupFwdXdlops:22.6774,201916416,miopenConvolutionFwdAlgoImplicitGEMM;ConvBinWinogradRxSf3x2:11.7829,0,miopenConvolutionFwdAlgoWinograd;ConvBinWinogradRxSf2x3g1:9.63209,0,miopenConvolutionFwdAlgoWinograd
128-512-512-3x3-128-512-512-1-1x1-1x1-1x1-0-NCHW-FP16-F=GemmFwdRest:9.43882,603979776,miopenConvolutionFwdAlgoGEMM;GemmFwdRest_hipblaslt:24.3849,603979776,miopenConvolutionFwdAlgoGEMM;ConvHipImplicitGemmGroupFwdXdlops:12.2702,134512640,miopenConvolutionFwdAlgoImplicitGEMM;ConvBinWinogradRxSf3x2:6.27839,0,miopenConvolutionFwdAlgoWinograd;ConvBinWinogradRxSf2x3g1:4.34942,0,miopenConvolutionFwdAlgoWinograd
256-512-512-1x1-128-512-512-1-0x0-1x1-1x1-0-NCHW-FP16-F=ConvBinWinogradRxSf2x3g1:7.37456,0,miopenConvolutionFwdAlgoWinograd;GemmFwd1x1_0_1:1.44063,0,miopenConvolutionFwdAlgoGEMM;ConvBinWinogradRxSf3x2:4.87917,0,miopenConvolutionFwdAlgoWinograd;GemmFwd1x1_0_1_hipblaslt:3.33243,0,miopenConvolutionFwdAlgoGEMM;ConvHipImplicitGemmGroupFwdXdlops:7.30486,201392128,miopenConvolutionFwdAlgoImplicitGEMM
128-512-512-3x3-3-512-512-1-1x1-1x1-1x1-0-NCHW-FP16-F=GemmFwdRest:7.62153,603979776,miopenConvolutionFwdAlgoGEMM;GemmFwdRest_hipblaslt:10.708,603979776,miopenConvolutionFwdAlgoGEMM;ConvHipImplicitGemmGroupFwdXdlops:5.98228,68688640,miopenConvolutionFwdAlgoImplicitGEMM;ConvBinWinogradRxSf3x2:1.57131,0,miopenConvolutionFwdAlgoWinograd;ConvBinWinogradRxSf2x3g1:1.06583,0,miopenConvolutionFwdAlgoWinograd
3-224-224-14x14-1024-16-16-1-0x0-14x14-1x1-0-NCHW-FP16-F=GemmFwdRest:0.0914533,301056,miopenConvolutionFwdAlgoGEMM;GemmFwdRest_hipblaslt:0.0941557,301056,miopenConvolutionFwdAlgoGEMM;ConvHipImplicitGemmGroupFwdXdlops:0.190123,2029568,miopenConvolutionFwdAlgoImplicitGEMM
3-512-512-3x3-64-512-512-1-1x1-1x1-1x1-0-NCHW-FP16-F=GemmFwdRest:0.379405,14155776,miopenConvolutionFwdAlgoGEMM;GemmFwdRest_hipblaslt:0.410053,14155776,miopenConvolutionFwdAlgoGEMM;ConvHipImplicitGemmGroupFwdXdlops:1.20191,35130880,miopenConvolutionFwdAlgoImplicitGEMM;ConvBinWinogradRxSf3x2:0.254883,0,miopenConvolutionFwdAlgoWinograd;ConvBinWinogradRxSf2x3g1:0.230283,0,miopenConvolutionFwdAlgoWinograd
64-512-512-3x3-32-512-512-1-1x1-1x1-1x1-0-NCHW-FP16-F=GemmFwdRest:3.93685,301989888,miopenConvolutionFwdAlgoGEMM;GemmFwdRest_hipblaslt:3.83723,301989888,miopenConvolutionFwdAlgoGEMM;ConvHipImplicitGemmGroupFwdXdlops:3.28011,50368512,miopenConvolutionFwdAlgoImplicitGEMM;ConvBinWinogradRxSf3x2:0.826743,0,miopenConvolutionFwdAlgoWinograd;ConvBinWinogradRxSf2x3g1:0.54614,0,miopenConvolutionFwdAlgoWinograd
96-512-512-3x3-32-512-512-1-1x1-1x1-1x1-0-NCHW-FP16-F=GemmFwdRest:5.2112,452984832,miopenConvolutionFwdAlgoGEMM;GemmFwdRest_hipblaslt:5.56354,452984832,miopenConvolutionFwdAlgoGEMM;ConvHipImplicitGemmGroupFwdXdlops:4.65508,67164160,miopenConvolutionFwdAlgoImplicitGEMM;ConvBinWinogradRxSf3x2:1.16948,0,miopenConvolutionFwdAlgoWinograd;ConvBinWinogradRxSf2x3g1:0.758157,0,miopenConvolutionFwdAlgoWinograd
128-512-512-3x3-32-512-512-1-1x1-1x1-1x1-0-NCHW-FP16-F=GemmFwdRest:6.79871,603979776,miopenConvolutionFwdAlgoGEMM;GemmFwdRest_hipblaslt:7.31411,603979776,miopenConvolutionFwdAlgoGEMM;ConvHipImplicitGemmGroupFwdXdlops:5.98746,83959808,miopenConvolutionFwdAlgoImplicitGEMM;ConvBinWinogradRxSf3x2:1.51804,0,miopenConvolutionFwdAlgoWinograd;ConvBinWinogradRxSf2x3g1:0.95238,0,miopenConvolutionFwdAlgoWinograd
160-512-512-3x3-32-512-512-1-1x1-1x1-1x1-0-NCHW-FP16-F=GemmFwdRest:8.36856,754974720,miopenConvolutionFwdAlgoGEMM;GemmFwdRest_hipblaslt:9.0337,754974720,miopenConvolutionFwdAlgoGEMM;ConvHipImplicitGemmGroupFwdXdlops:7.32516,100755456,miopenConvolutionFwdAlgoImplicitGEMM;ConvBinWinogradRxSf3x2:1.88194,0,miopenConvolutionFwdAlgoWinograd;ConvBinWinogradRxSf2x3g1:1.15043,0,miopenConvolutionFwdAlgoWinograd
192-512-512-3x3-64-512-512-1-1x1-1x1-1x1-0-NCHW-FP16-F=GemmFwdRest:12.0117,905969664,miopenConvolutionFwdAlgoGEMM;GemmFwdRest_hipblaslt:18.2537,905969664,miopenConvolutionFwdAlgoGEMM;ConvHipImplicitGemmGroupFwdXdlops:9.19842,134438912,miopenConvolutionFwdAlgoImplicitGEMM;ConvBinWinogradRxSf3x2:4.35156,0,miopenConvolutionFwdAlgoWinograd;ConvBinWinogradRxSf2x3g1:2.6002,0,miopenConvolutionFwdAlgoWinograd
64-512-512-3x3-64-512-512-1-1x1-1x1-1x1-0-NCHW-FP16-F=GemmFwdRest:3.70588,301989888,miopenConvolutionFwdAlgoGEMM;GemmFwdRest_hipblaslt:3.98439,301989888,miopenConvolutionFwdAlgoGEMM;ConvHipImplicitGemmGroupFwdXdlops:3.67532,67182592,miopenConvolutionFwdAlgoImplicitGEMM;ConvBinWinogradRxSf3x2:1.54073,0,miopenConvolutionFwdAlgoWinograd;ConvBinWinogradRxSf2x3g1:1.00435,0,miopenConvolutionFwdAlgoWinograd
64-1024-1024-3x3-64-1024-1024-1-1x1-1x1-1x1-0-NCHW-FP16-F=GemmFwdRest:16.6112,1207959552,miopenConvolutionFwdAlgoGEMM;GemmFwdRest_hipblaslt:17.9288,1207959552,miopenConvolutionFwdAlgoGEMM;ConvHipImplicitGemmGroupFwdXdlops:14.9719,268509184,miopenConvolutionFwdAlgoImplicitGEMM;ConvBinWinogradRxSf3x2:6.29701,0,miopenConvolutionFwdAlgoWinograd;ConvBinWinogradRxSf2x3g1:4.25199,0,miopenConvolutionFwdAlgoWinograd
64-2048-2048-3x3-64-2048-2048-1-1x1-1x1-1x1-0-NCHW-FP16-F=GemmFwdRest:57.9662,4831838208,miopenConvolutionFwdAlgoGEMM;GemmFwdRest_hipblaslt:62.8196,4831838208,miopenConvolutionFwdAlgoGEMM;ConvHipImplicitGemmGroupFwdXdlops:59.3603,1073815552,miopenConvolutionFwdAlgoImplicitGEMM;ConvBinWinogradRxSf3x2:41.9777,0,miopenConvolutionFwdAlgoWinograd;ConvBinWinogradRxSf2x3g1:36.2897,0,miopenConvolutionFwdAlgoWinograd
64-2048-2048-3x3-3-2048-2048-1-1x1-1x1-1x1-0-NCHW-FP16-F=GemmFwdRest:54.3684,4831838208,miopenConvolutionFwdAlgoGEMM;GemmFwdRest_hipblaslt:59.0717,4831838208,miopenConvolutionFwdAlgoGEMM;ConvHipImplicitGemmGroupFwdXdlops:39.7559,562040320,miopenConvolutionFwdAlgoImplicitGEMM;ConvBinWinogradRxSf3x2:13.142,0,miopenConvolutionFwdAlgoWinograd;ConvBinWinogradRxSf2x3g1:18.6638,0,miopenConvolutionFwdAlgoWinograd
3-512-512-3x3-16-512-512-2-1x1-1x1-1x1-0-NCHW-FP16-F=GemmFwdRest:0.662655,14155776,miopenConvolutionFwdAlgoGEMM;GemmFwdRest_hipblaslt:0.375362,14155776,miopenConvolutionFwdAlgoGEMM;ConvHipImplicitGemmGroupFwdXdlops:0.771927,19923968,miopenConvolutionFwdAlgoImplicitGEMM;ConvBinWinogradRxSf3x2:0.2658,0,miopenConvolutionFwdAlgoWinograd;ConvBinWinogradRxSf2x3g1:0.22178,0,miopenConvolutionFwdAlgoWinograd
16-512-512-3x3-16-512-512-2-1x1-1x1-1x1-0-NCHW-FP16-F=GemmFwdRest:2.40951,75497472,miopenConvolutionFwdAlgoGEMM;GemmFwdRest_hipblaslt:2.62151,75497472,miopenConvolutionFwdAlgoGEMM;ConvHipImplicitGemmGroupFwdXdlops:2.62837,33559040,miopenConvolutionFwdAlgoImplicitGEMM;ConvBinWinogradRxSf3x2:0.608117,0,miopenConvolutionFwdAlgoWinograd;ConvBinWinogradRxSf2x3g1:0.4299,0,miopenConvolutionFwdAlgoWinograd
16-512-512-3x3-32-256-256-2-1x1-2x2-1x1-0-NCHW-FP16-F=GemmFwdRest:0.659376,18874368,miopenConvolutionFwdAlgoGEMM;GemmFwdRest_hipblaslt:0.616417,18874368,miopenConvolutionFwdAlgoGEMM;ConvHipImplicitGemmGroupFwdXdlops:0.916545,25175040,miopenConvolutionFwdAlgoImplicitGEMM;ConvBinWinogradRxSf3x2:0.19204,0,miopenConvolutionFwdAlgoWinograd;ConvBinWinogradRxSf2x3g1:0.323129,0,miopenConvolutionFwdAlgoWinograd
32-256-256-3x3-32-256-256-2-1x1-1x1-1x1-0-NCHW-FP16-F=GemmFwdRest:1.17244,37748736,miopenConvolutionFwdAlgoGEMM;GemmFwdRest_hipblaslt:1.1369,37748736,miopenConvolutionFwdAlgoGEMM;ConvHipImplicitGemmGroupFwdXdlops:0.966354,16795648,miopenConvolutionFwdAlgoImplicitGEMM;ConvBinWinogradRxSf3x2:0.276417,0,miopenConvolutionFwdAlgoWinograd;ConvBinWinogradRxSf2x3g1:0.188171,0,miopenConvolutionFwdAlgoWinograd
32-256-256-3x3-96-128-128-2-1x1-2x2-1x1-0-NCHW-FP16-F=GemmFwdRest:0.412639,9437184,miopenConvolutionFwdAlgoGEMM;GemmFwdRest_hipblaslt:0.397032,9437184,miopenConvolutionFwdAlgoGEMM;ConvHipImplicitGemmGroupFwdXdlops:0.590592,14735360,miopenConvolutionFwdAlgoImplicitGEMM;ConvBinWinogradRxSf3x2:0.236971,0,miopenConvolutionFwdAlgoWinograd;ConvBinWinogradRxSf2x3g1:0.422614,0,miopenConvolutionFwdAlgoWinograd
96-128-128-3x3-96-128-128-2-1x1-1x1-1x1-0-NCHW-FP16-F=GemmFwdRest:0.772621,28311552,miopenConvolutionFwdAlgoGEMM;GemmFwdRest_hipblaslt:0.771433,28311552,miopenConvolutionFwdAlgoGEMM;ConvHipImplicitGemmGroupFwdXdlops:1.18662,12748800,miopenConvolutionFwdAlgoImplicitGEMM;ConvBinWinogradRxSf3x2:0.4983,0,miopenConvolutionFwdAlgoWinograd;ConvBinWinogradRxSf2x3g1:0.31955,0,miopenConvolutionFwdAlgoWinograd
96-128-128-3x3-256-64-64-2-1x1-2x2-1x1-0-NCHW-FP16-F=GemmFwdRest:0.348155,7077888,miopenConvolutionFwdAlgoGEMM;GemmFwdRest_hipblaslt:0.395798,7077888,miopenConvolutionFwdAlgoGEMM;ConvHipImplicitGemmGroupFwdXdlops:0.713647,10928128,miopenConvolutionFwdAlgoImplicitGEMM;ConvBinWinogradRxSf3x2:0.411883,0,miopenConvolutionFwdAlgoWinograd;ConvBinWinogradRxSf2x3g1:0.73202,0,miopenConvolutionFwdAlgoWinograd
256-64-64-3x3-320-64-64-2-1x1-1x1-1x1-0-NCHW-FP16-F=GemmFwdRest:0.710117,18874368,miopenConvolutionFwdAlgoGEMM;GemmFwdRest_hipblaslt:0.933518,18874368,miopenConvolutionFwdAlgoGEMM;ConvHipImplicitGemmGroupFwdXdlops:1.72491,10911744,miopenConvolutionFwdAlgoImplicitGEMM;ConvBinWinogradRxSf3x2:1.07973,0,miopenConvolutionFwdAlgoWinograd;ConvBinWinogradRxSf2x3g1:0.584233,0,miopenConvolutionFwdAlgoWinograd
320-32-32-1x1-320-32-32-2-0x0-1x1-1x1-0-NCHW-FP16-F=ConvBinWinogradRxSf2x3g1:0.225571,0,miopenConvolutionFwdAlgoWinograd;GemmFwd1x1_0_1:0.0459286,0,miopenConvolutionFwdAlgoGEMM;ConvBinWinogradRxSf3x2:0.142333,0,miopenConvolutionFwdAlgoWinograd;GemmFwd1x1_0_1_hipblaslt:0.051995,0,miopenConvolutionFwdAlgoGEMM;ConvHipImplicitGemmGroupFwdXdlops:0.211358,2826240,miopenConvolutionFwdAlgoImplicitGEMM
640-16-16-1x1-640-16-16-2-0x0-1x1-1x1-0-NCHW-FP16-F=ConvBinWinogradRxSf2x3g1:0.2242,0,miopenConvolutionFwdAlgoWinograd;GemmFwd1x1_0_1:0.0407586,0,miopenConvolutionFwdAlgoGEMM;ConvBinWinogradRxSf3x2:0.219757,0,miopenConvolutionFwdAlgoWinograd;GemmFwd1x1_0_1_hipblaslt:0.04242,0,miopenConvolutionFwdAlgoGEMM;ConvHipImplicitGemmGroupFwdXdlops:0.193367,2129920,miopenConvolutionFwdAlgoImplicitGEMM
4-64-64-3x3-320-64-64-1-1x1-1x1-1x1-0-NCHW-FP16-F=GemmFwdRest:0.060096,294912,miopenConvolutionFwdAlgoGEMM;GemmFwdRest_hipblaslt:0.0718233,294912,miopenConvolutionFwdAlgoGEMM;ConvHipImplicitGemmGroupFwdXdlops:0.187093,2677248,miopenConvolutionFwdAlgoImplicitGEMM;ConvBinWinogradRxSf3x2:0.0658,0,miopenConvolutionFwdAlgoWinograd;ConvBinWinogradRxSf2x3g1:0.0571167,0,miopenConvolutionFwdAlgoWinograd
3-512-512-3x3-16-512-512-1-1x1-1x1-1x1-0-NCHW-FP16-F=GemmFwdRest:0.328928,14155776,miopenConvolutionFwdAlgoGEMM;GemmFwdRest_hipblaslt:0.199923,14155776,miopenConvolutionFwdAlgoGEMM;ConvHipImplicitGemmGroupFwdXdlops:0.438648,9962496,miopenConvolutionFwdAlgoImplicitGEMM;ConvBinWinogradRxSf3x2:0.167214,0,miopenConvolutionFwdAlgoWinograd;ConvBinWinogradRxSf2x3g1:0.1435,0,miopenConvolutionFwdAlgoWinograd
16-512-512-3x3-16-512-512-1-1x1-1x1-1x1-0-NCHW-FP16-F=GemmFwdRest:1.12703,75497472,miopenConvolutionFwdAlgoGEMM;GemmFwdRest_hipblaslt:1.32822,75497472,miopenConvolutionFwdAlgoGEMM;ConvHipImplicitGemmGroupFwdXdlops:1.1779,16781824,miopenConvolutionFwdAlgoImplicitGEMM;ConvBinWinogradRxSf3x2:0.29846,0,miopenConvolutionFwdAlgoWinograd;ConvBinWinogradRxSf2x3g1:0.2089,0,miopenConvolutionFwdAlgoWinograd
16-512-512-3x3-32-256-256-1-1x1-2x2-1x1-0-NCHW-FP16-F=GemmFwdRest:0.322667,18874368,miopenConvolutionFwdAlgoGEMM;GemmFwdRest_hipblaslt:0.296443,18874368,miopenConvolutionFwdAlgoGEMM;ConvHipImplicitGemmGroupFwdXdlops:0.441055,12592128,miopenConvolutionFwdAlgoImplicitGEMM;ConvBinWinogradRxSf3x2:0.12702,0,miopenConvolutionFwdAlgoWinograd;ConvBinWinogradRxSf2x3g1:0.18345,0,miopenConvolutionFwdAlgoWinograd
32-256-256-3x3-32-256-256-1-1x1-1x1-1x1-0-NCHW-FP16-F=GemmFwdRest:0.575987,37748736,miopenConvolutionFwdAlgoGEMM;GemmFwdRest_hipblaslt:0.556455,37748736,miopenConvolutionFwdAlgoGEMM;ConvHipImplicitGemmGroupFwdXdlops:0.55517,8407040,miopenConvolutionFwdAlgoImplicitGEMM;ConvBinWinogradRxSf3x2:0.1683,0,miopenConvolutionFwdAlgoWinograd;ConvBinWinogradRxSf2x3g1:0.12402,0,miopenConvolutionFwdAlgoWinograd
32-256-256-3x3-96-128-128-1-1x1-2x2-1x1-0-NCHW-FP16-F=GemmFwdRest:0.205413,9437184,miopenConvolutionFwdAlgoGEMM;GemmFwdRest_hipblaslt:0.187362,9437184,miopenConvolutionFwdAlgoGEMM;ConvHipImplicitGemmGroupFwdXdlops:0.37236,7395328,miopenConvolutionFwdAlgoImplicitGEMM;ConvBinWinogradRxSf3x2:0.155133,0,miopenConvolutionFwdAlgoWinograd;ConvBinWinogradRxSf2x3g1:0.245329,0,miopenConvolutionFwdAlgoWinograd
96-128-128-3x3-96-128-128-1-1x1-1x1-1x1-0-NCHW-FP16-F=GemmFwdRest:0.37626,28311552,miopenConvolutionFwdAlgoGEMM;GemmFwdRest_hipblaslt:0.350209,28311552,miopenConvolutionFwdAlgoGEMM;ConvHipImplicitGemmGroupFwdXdlops:0.661497,6457344,miopenConvolutionFwdAlgoImplicitGEMM;ConvBinWinogradRxSf3x2:0.30745,0,miopenConvolutionFwdAlgoWinograd;ConvBinWinogradRxSf2x3g1:0.187267,0,miopenConvolutionFwdAlgoWinograd
96-128-128-3x3-256-64-64-1-1x1-2x2-1x1-0-NCHW-FP16-F=GemmFwdRest:0.16913,7077888,miopenConvolutionFwdAlgoGEMM;GemmFwdRest_hipblaslt:0.199143,7077888,miopenConvolutionFwdAlgoGEMM;ConvHipImplicitGemmGroupFwdXdlops:0.401336,5685248,miopenConvolutionFwdAlgoImplicitGEMM;ConvBinWinogradRxSf3x2:0.268171,0,miopenConvolutionFwdAlgoWinograd;ConvBinWinogradRxSf2x3g1:0.429143,0,miopenConvolutionFwdAlgoWinograd
256-64-64-3x3-320-64-64-1-1x1-1x1-1x1-0-NCHW-FP16-F=GemmFwdRest:0.361852,18874368,miopenConvolutionFwdAlgoGEMM;GemmFwdRest_hipblaslt:0.469538,18874368,miopenConvolutionFwdAlgoGEMM;ConvHipImplicitGemmGroupFwdXdlops:0.94113,6193152,miopenConvolutionFwdAlgoImplicitGEMM;ConvBinWinogradRxSf3x2:0.574143,0,miopenConvolutionFwdAlgoWinograd;ConvBinWinogradRxSf2x3g1:0.324543,0,miopenConvolutionFwdAlgoWinograd
320-64-64-3x3-320-64-64-1-1x1-1x1-1x1-0-NCHW-FP16-F=GemmFwdRest:0.428646,23592960,miopenConvolutionFwdAlgoGEMM;GemmFwdRest_hipblaslt:0.547014,23592960,miopenConvolutionFwdAlgoGEMM;ConvHipImplicitGemmGroupFwdXdlops:1.09094,7086080,miopenConvolutionFwdAlgoImplicitGEMM;ConvBinWinogradRxSf3x2:0.700514,0,miopenConvolutionFwdAlgoWinograd;ConvBinWinogradRxSf2x3g1:0.388386,0,miopenConvolutionFwdAlgoWinograd
320-64-64-1x1-320-64-64-1-0x0-1x1-1x1-0-NCHW-FP16-F=ConvBinWinogradRxSf2x3g1:0.39275,0,miopenConvolutionFwdAlgoWinograd;GemmFwd1x1_0_1:0.0550657,0,miopenConvolutionFwdAlgoGEMM;ConvBinWinogradRxSf3x2:0.22772,0,miopenConvolutionFwdAlgoWinograd;GemmFwd1x1_0_1_hipblaslt:0.066495,0,miopenConvolutionFwdAlgoGEMM;ConvHipImplicitGemmGroupFwdXdlops:0.28552,5447680,miopenConvolutionFwdAlgoImplicitGEMM
320-64-64-3x3-320-32-32-1-1x1-2x2-1x1-0-NCHW-FP16-F=GemmFwdRest:0.191257,5898240,miopenConvolutionFwdAlgoGEMM;GemmFwdRest_hipblaslt:0.208347,5898240,miopenConvolutionFwdAlgoGEMM;ConvHipImplicitGemmGroupFwdXdlops:0.364038,5120000,miopenConvolutionFwdAlgoImplicitGEMM;ConvBinWinogradRxSf3x2:0.226271,0,miopenConvolutionFwdAlgoWinograd;ConvBinWinogradRxSf2x3g1:0.40042,0,miopenConvolutionFwdAlgoWinograd
320-32-32-3x3-640-32-32-1-1x1-1x1-1x1-0-NCHW-FP16-F=GemmFwdRest:0.216567,5898240,miopenConvolutionFwdAlgoGEMM;GemmFwdRest_hipblaslt:0.23126,5898240,miopenConvolutionFwdAlgoGEMM;ConvHipImplicitGemmGroupFwdXdlops:0.645977,5652480,miopenConvolutionFwdAlgoImplicitGEMM;ConvBinWinogradRxSf3x2:0.3815,0,miopenConvolutionFwdAlgoWinograd;ConvBinWinogradRxSf2x3g1:0.225029,0,miopenConvolutionFwdAlgoWinograd
640-32-32-3x3-640-32-32-1-1x1-1x1-1x1-0-NCHW-FP16-F=GemmFwdRest:0.3881,11796480,miopenConvolutionFwdAlgoGEMM;GemmFwdRest_hipblaslt:0.40858,11796480,miopenConvolutionFwdAlgoGEMM;ConvHipImplicitGemmGroupFwdXdlops:1.11718,9994240,miopenConvolutionFwdAlgoImplicitGEMM;ConvBinWinogradRxSf3x2:0.694957,0,miopenConvolutionFwdAlgoWinograd;ConvBinWinogradRxSf2x3g1:0.38146,0,miopenConvolutionFwdAlgoWinograd
320-32-32-1x1-640-32-32-1-0x0-1x1-1x1-0-NCHW-FP16-F=ConvBinWinogradRxSf2x3g1:0.227086,0,miopenConvolutionFwdAlgoWinograd;GemmFwd1x1_0_1:0.0364814,0,miopenConvolutionFwdAlgoGEMM;ConvBinWinogradRxSf3x2:0.14036,0,miopenConvolutionFwdAlgoWinograd;GemmFwd1x1_0_1_hipblaslt:0.0527343,0,miopenConvolutionFwdAlgoGEMM;ConvHipImplicitGemmGroupFwdXdlops:0.209426,2375680,miopenConvolutionFwdAlgoImplicitGEMM
640-32-32-1x1-640-32-32-1-0x0-1x1-1x1-0-NCHW-FP16-F=ConvBinWinogradRxSf2x3g1:0.398533,0,miopenConvolutionFwdAlgoWinograd;GemmFwd1x1_0_1:0.049335,0,miopenConvolutionFwdAlgoGEMM;ConvBinWinogradRxSf3x2:0.221167,0,miopenConvolutionFwdAlgoWinograd;GemmFwd1x1_0_1_hipblaslt:0.0591283,0,miopenConvolutionFwdAlgoGEMM;ConvHipImplicitGemmGroupFwdXdlops:0.266862,3440640,miopenConvolutionFwdAlgoImplicitGEMM
640-32-32-3x3-640-16-16-1-1x1-2x2-1x1-0-NCHW-FP16-F=GemmFwdRest:0.250545,2949120,miopenConvolutionFwdAlgoGEMM;GemmFwdRest_hipblaslt:0.223053,2949120,miopenConvolutionFwdAlgoGEMM;ConvHipImplicitGemmGroupFwdXdlops:0.433485,9011200,miopenConvolutionFwdAlgoImplicitGEMM;ConvBinWinogradRxSf3x2:0.396543,0,miopenConvolutionFwdAlgoWinograd;ConvBinWinogradRxSf2x3g1:0.400914,0,miopenConvolutionFwdAlgoWinograd
640-16-16-3x3-1280-16-16-1-1x1-1x1-1x1-0-NCHW-FP16-F=GemmFwdRest:0.24575,2949120,miopenConvolutionFwdAlgoGEMM;GemmFwdRest_hipblaslt:0.244713,2949120,miopenConvolutionFwdAlgoGEMM;ConvHipImplicitGemmGroupFwdXdlops:0.65929,15728640,miopenConvolutionFwdAlgoImplicitGEMM;ConvBinWinogradRxSf3x2:0.691986,0,miopenConvolutionFwdAlgoWinograd;ConvBinWinogradRxSf2x3g1:0.22005,0,miopenConvolutionFwdAlgoWinograd
1280-16-16-3x3-1280-16-16-1-1x1-1x1-1x1-0-NCHW-FP16-F=GemmFwdRest:0.508869,5898240,miopenConvolutionFwdAlgoGEMM;GemmFwdRest_hipblaslt:0.45095,5898240,miopenConvolutionFwdAlgoGEMM;ConvHipImplicitGemmGroupFwdXdlops:1.28604,30801920,miopenConvolutionFwdAlgoImplicitGEMM;ConvBinWinogradRxSf3x2:1.31452,0,miopenConvolutionFwdAlgoWinograd;ConvBinWinogradRxSf2x3g1:0.37888,0,miopenConvolutionFwdAlgoWinograd
640-16-16-1x1-1280-16-16-1-0x0-1x1-1x1-0-NCHW-FP16-F=ConvBinWinogradRxSf2x3g1:0.225133,0,miopenConvolutionFwdAlgoWinograd;GemmFwd1x1_0_1:0.036065,0,miopenConvolutionFwdAlgoGEMM;ConvBinWinogradRxSf3x2:0.217643,0,miopenConvolutionFwdAlgoWinograd;GemmFwd1x1_0_1_hipblaslt:0.040105,0,miopenConvolutionFwdAlgoGEMM;ConvHipImplicitGemmGroupFwdXdlops:0.215741,2621440,miopenConvolutionFwdAlgoImplicitGEMM
1280-16-16-1x1-1280-16-16-1-0x0-1x1-1x1-0-NCHW-FP16-F=ConvBinWinogradRxSf2x3g1:0.388443,0,miopenConvolutionFwdAlgoWinograd;GemmFwd1x1_0_1:0.0550014,0,miopenConvolutionFwdAlgoGEMM;ConvBinWinogradRxSf3x2:0.37195,0,miopenConvolutionFwdAlgoWinograd;GemmFwd1x1_0_1_hipblaslt:0.0587086,0,miopenConvolutionFwdAlgoGEMM;ConvHipImplicitGemmGroupFwdXdlops:0.27396,4587520,miopenConvolutionFwdAlgoImplicitGEMM
1280-16-16-3x3-1280-8-8-1-1x1-2x2-1x1-0-NCHW-FP16-F=GemmFwdRest:0.394317,1474560,miopenConvolutionFwdAlgoGEMM;GemmFwdRest_hipblaslt:0.256974,1474560,miopenConvolutionFwdAlgoGEMM;ConvHipImplicitGemmGroupFwdXdlops:0.742672,30310400,miopenConvolutionFwdAlgoImplicitGEMM;ConvBinWinogradRxSf3x2:0.730783,0,miopenConvolutionFwdAlgoWinograd;ConvBinWinogradRxSf2x3g1:0.725643,0,miopenConvolutionFwdAlgoWinograd
1280-8-8-3x3-1280-8-8-1-1x1-1x1-1x1-0-NCHW-FP16-F=GemmFwdRest:0.38765,1474560,miopenConvolutionFwdAlgoGEMM;GemmFwdRest_hipblaslt:0.227739,1474560,miopenConvolutionFwdAlgoGEMM;ConvHipImplicitGemmGroupFwdXdlops:0.805277,29818880,miopenConvolutionFwdAlgoImplicitGEMM;ConvBinWinogradRxSf3x2:0.680317,0,miopenConvolutionFwdAlgoWinograd;ConvBinWinogradRxSf2x3g1:0.22512,0,miopenConvolutionFwdAlgoWinograd
1280-8-8-1x1-1280-8-8-1-0x0-1x1-1x1-0-NCHW-FP16-F=ConvBinWinogradRxSf2x3g1:0.223283,0,miopenConvolutionFwdAlgoWinograd;GemmFwd1x1_0_1:0.0512567,0,miopenConvolutionFwdAlgoGEMM;ConvBinWinogradRxSf3x2:0.21215,0,miopenConvolutionFwdAlgoWinograd;GemmFwd1x1_0_1_hipblaslt:0.0365033,0,miopenConvolutionFwdAlgoGEMM;ConvHipImplicitGemmGroupFwdXdlops:0.205082,3604480,miopenConvolutionFwdAlgoImplicitGEMM
320-32-32-1x1-320-32-32-1-0x0-1x1-1x1-0-NCHW-FP16-F=ConvBinWinogradRxSf2x3g1:0.138233,0,miopenConvolutionFwdAlgoWinograd;GemmFwd1x1_0_1:0.03424,0,miopenConvolutionFwdAlgoGEMM;ConvBinWinogradRxSf3x2:0.100371,0,miopenConvolutionFwdAlgoWinograd;GemmFwd1x1_0_1_hipblaslt:0.0356714,0,miopenConvolutionFwdAlgoGEMM;ConvHipImplicitGemmGroupFwdXdlops:0.161944,1515520,miopenConvolutionFwdAlgoImplicitGEMM
640-16-16-1x1-640-16-16-1-0x0-1x1-1x1-0-NCHW-FP16-F=ConvBinWinogradRxSf2x3g1:0.137417,0,miopenConvolutionFwdAlgoWinograd;GemmFwd1x1_0_1:0.042565,0,miopenConvolutionFwdAlgoGEMM;ConvBinWinogradRxSf3x2:0.138133,0,miopenConvolutionFwdAlgoWinograd;GemmFwd1x1_0_1_hipblaslt:0.03195,0,miopenConvolutionFwdAlgoGEMM;ConvHipImplicitGemmGroupFwdXdlops:0.17,1474560,miopenConvolutionFwdAlgoImplicitGEMM
3-512-512-3x3-128-512-512-1-1x1-1x1-1x1-0-NCHW-FP16-F=GemmFwdRest:0.924286,14155776,miopenConvolutionFwdAlgoGEMM;GemmFwdRest_hipblaslt:0.980798,14155776,miopenConvolutionFwdAlgoGEMM;ConvHipImplicitGemmGroupFwdXdlops:2.74031,68688640,miopenConvolutionFwdAlgoImplicitGEMM;ConvBinWinogradRxSf3x2:1.0255,0,miopenConvolutionFwdAlgoWinograd;ConvBinWinogradRxSf2x3g1:0.556343,0,miopenConvolutionFwdAlgoWinograd
128-513-513-3x3-128-256-256-1-0x0-2x2-1x1-0-NCHW-FP16-F=GemmFwdRest:2.6169,150994944,miopenConvolutionFwdAlgoGEMM;GemmFwdRest_hipblaslt:6.18682,150994944,miopenConvolutionFwdAlgoGEMM;ConvHipImplicitGemmGroupFwdXdlops:4.54411,84443392,miopenConvolutionFwdAlgoImplicitGEMM;ConvBinWinogradRxSf3x2:1.952,0,miopenConvolutionFwdAlgoWinograd;ConvBinWinogradRxSf2x3g1:3.8229,0,miopenConvolutionFwdAlgoWinograd
128-256-256-3x3-256-256-256-1-1x1-1x1-1x1-0-NCHW-FP16-F=GemmFwdRest:3.91725,150994944,miopenConvolutionFwdAlgoGEMM;GemmFwdRest_hipblaslt:8.87964,150994944,miopenConvolutionFwdAlgoGEMM;ConvHipImplicitGemmGroupFwdXdlops:6.4433,50921472,miopenConvolutionFwdAlgoImplicitGEMM;ConvBinWinogradRxSf3x2:3.30633,0,miopenConvolutionFwdAlgoWinograd;ConvBinWinogradRxSf2x3g1:1.92676,0,miopenConvolutionFwdAlgoWinograd
128-256-256-1x1-256-256-256-1-0x0-1x1-1x1-0-NCHW-FP16-F=ConvBinWinogradRxSf2x3g1:1.933,0,miopenConvolutionFwdAlgoWinograd;GemmFwd1x1_0_1:0.448097,0,miopenConvolutionFwdAlgoGEMM;ConvBinWinogradRxSf3x2:0.99735,0,miopenConvolutionFwdAlgoWinograd;GemmFwd1x1_0_1_hipblaslt:0.450555,0,miopenConvolutionFwdAlgoGEMM;ConvHipImplicitGemmGroupFwdXdlops:2.18217,50397184,miopenConvolutionFwdAlgoImplicitGEMM
256-257-257-3x3-256-128-128-1-0x0-2x2-1x1-0-NCHW-FP16-F=GemmFwdRest:1.78534,75497472,miopenConvolutionFwdAlgoGEMM;GemmFwdRest_hipblaslt:3.20888,75497472,miopenConvolutionFwdAlgoGEMM;ConvHipImplicitGemmGroupFwdXdlops:3.55018,43385344,miopenConvolutionFwdAlgoImplicitGEMM;ConvBinWinogradRxSf3x2:1.733,0,miopenConvolutionFwdAlgoWinograd;ConvBinWinogradRxSf2x3g1:3.97969,0,miopenConvolutionFwdAlgoWinograd
256-128-128-3x3-512-128-128-1-1x1-1x1-1x1-0-NCHW-FP16-F=GemmFwdRest:2.33592,75497472,miopenConvolutionFwdAlgoGEMM;GemmFwdRest_hipblaslt:7.7591,75497472,miopenConvolutionFwdAlgoGEMM;ConvHipImplicitGemmGroupFwdXdlops:5.72121,27525120,miopenConvolutionFwdAlgoImplicitGEMM;ConvBinWinogradRxSf3x2:3.23732,0,miopenConvolutionFwdAlgoWinograd;ConvBinWinogradRxSf2x3g1:1.84766,0,miopenConvolutionFwdAlgoWinograd
256-128-128-1x1-512-128-128-1-0x0-1x1-1x1-0-NCHW-FP16-F=ConvBinWinogradRxSf2x3g1:1.80082,0,miopenConvolutionFwdAlgoWinograd;GemmFwd1x1_0_1:0.168239,0,miopenConvolutionFwdAlgoGEMM;ConvBinWinogradRxSf3x2:0.871129,0,miopenConvolutionFwdAlgoWinograd;GemmFwd1x1_0_1_hipblaslt:0.255033,0,miopenConvolutionFwdAlgoGEMM;ConvHipImplicitGemmGroupFwdXdlops:1.37579,25427968,miopenConvolutionFwdAlgoImplicitGEMM
512-129-129-3x3-512-64-64-1-0x0-2x2-1x1-0-NCHW-FP16-F=GemmFwdRest:1.38335,37748736,miopenConvolutionFwdAlgoGEMM;GemmFwdRest_hipblaslt:1.67407,37748736,miopenConvolutionFwdAlgoGEMM;ConvHipImplicitGemmGroupFwdXdlops:3.01966,25953280,miopenConvolutionFwdAlgoImplicitGEMM;ConvBinWinogradRxSf3x2:1.90298,0,miopenConvolutionFwdAlgoWinograd;ConvBinWinogradRxSf2x3g1:3.66773,0,miopenConvolutionFwdAlgoWinograd
512-64-64-3x3-8-64-64-1-1x1-1x1-1x1-0-NCHW-FP16-F=GemmFwdRest:0.534252,37748736,miopenConvolutionFwdAlgoGEMM;GemmFwdRest_hipblaslt:0.488066,37748736,miopenConvolutionFwdAlgoGEMM;ConvHipImplicitGemmGroupFwdXdlops:0.46249,4333568,miopenConvolutionFwdAlgoImplicitGEMM;ConvBinWinogradRxSf3x2:0.30055,0,miopenConvolutionFwdAlgoWinograd;ConvBinWinogradRxSf2x3g1:0.117443,0,miopenConvolutionFwdAlgoWinograd
8-64-64-1x1-8-64-64-1-0x0-1x1-1x1-0-NCHW-FP16-F=ConvBinWinogradRxSf2x3g1:0.05195,0,miopenConvolutionFwdAlgoWinograd;GemmFwd1x1_0_1:0.0241514,0,miopenConvolutionFwdAlgoGEMM;ConvBinWinogradRxSf3x2:0.0592714,0,miopenConvolutionFwdAlgoWinograd;GemmFwd1x1_0_1_hipblaslt:0.0244014,0,miopenConvolutionFwdAlgoGEMM;ConvHipImplicitGemmGroupFwdXdlops:0.125816,131328,miopenConvolutionFwdAlgoImplicitGEMM
3-384-384-16x16-1024-24-24-1-0x0-16x16-1x1-0-NCHW-FP16-F=GemmFwdRest:0.123728,884736,miopenConvolutionFwdAlgoGEMM;GemmFwdRest_hipblaslt:0.122828,884736,miopenConvolutionFwdAlgoGEMM;ConvHipImplicitGemmGroupFwdXdlops:0.265191,3637248,miopenConvolutionFwdAlgoImplicitGEMM
16-13-60-104-1x1x1-16-13-60-104-1-0x0x0-1x1x1-1x1x1-0-NCDHW-FP16-F=GemmFwd1x1_0_1:0.078052,0,miopenConvolutionFwdAlgoGEMM;GemmFwd1x1_0_1_hipblaslt:0.03543,0,miopenConvolutionFwdAlgoGEMM;ConvHipImplicitGemm3DGroupFwdXdlops:0.274959,5192192,miopenConvolutionFwdAlgoImplicitGEMM
16-3-62-106-3x3x3-384-1-60-104-1-0x0x0-1x1x1-1x1x1-0-NCDHW-FP16-F=GemmFwdRest:0.273339,5391360,miopenConvolutionFwdAlgoGEMM;ConvHipImplicitGemm3DGroupFwdXdlops:0.549242,5755136,miopenConvolutionFwdAlgoImplicitGEMM;GemmFwdRest_hipblaslt:0.288236,5391360,miopenConvolutionFwdAlgoGEMM
384-3-62-106-3x3x3-384-1-60-104-1-0x0x0-1x1x1-1x1x1-0-NCDHW-FP16-F=GemmFwdRest:5.06935,129392640,miopenConvolutionFwdAlgoGEMM;ConvHipImplicitGemm3DGroupFwdXdlops:8.06481,27896832,miopenConvolutionFwdAlgoImplicitGEMM;GemmFwdRest_hipblaslt:5.20321,129392640,miopenConvolutionFwdAlgoGEMM
384-60-104-1x1-1152-60-104-1-0x0-1x1-1x1-0-NCHW-FP16-F=ConvBinWinogradRxSf2x3g1:2.25566,0,miopenConvolutionFwdAlgoWinograd;GemmFwd1x1_0_1:0.361129,0,miopenConvolutionFwdAlgoGEMM;ConvBinWinogradRxSf3x2:1.03938,0,miopenConvolutionFwdAlgoWinograd;GemmFwd1x1_0_1_hipblaslt:0.37508,0,miopenConvolutionFwdAlgoGEMM;ConvHipImplicitGemmGroupFwdXdlops:1.33525,20054016,miopenConvolutionFwdAlgoImplicitGEMM
384-60-104-1x1-384-60-104-1-0x0-1x1-1x1-0-NCHW-FP16-F=ConvBinWinogradRxSf2x3g1:0.7978,0,miopenConvolutionFwdAlgoWinograd;GemmFwd1x1_0_1:0.0859229,0,miopenConvolutionFwdAlgoGEMM;ConvBinWinogradRxSf3x2:0.391043,0,miopenConvolutionFwdAlgoWinograd;GemmFwd1x1_0_1_hipblaslt:0.106154,0,miopenConvolutionFwdAlgoGEMM;ConvHipImplicitGemmGroupFwdXdlops:0.476192,9879552,miopenConvolutionFwdAlgoImplicitGEMM
384-120-208-3x3-192-120-208-1-1x1-1x1-1x1-0-NCHW-FP16-F=GemmFwdRest:3.10834,172523520,miopenConvolutionFwdAlgoGEMM;GemmFwdRest_hipblaslt:2.38079,172523520,miopenConvolutionFwdAlgoGEMM;ConvHipImplicitGemmGroupFwdXdlops:4.56296,30081024,miopenConvolutionFwdAlgoImplicitGEMM;ConvBinWinogradRxSf3x2:2.71156,0,miopenConvolutionFwdAlgoWinograd;ConvBinWinogradRxSf2x3g1:1.6523,0,miopenConvolutionFwdAlgoWinograd
192-1-120-208-1x1x1-384-1-120-208-1-0x0x0-1x1x1-1x1x1-0-NCDHW-FP16-F=GemmFwd1x1_0_1:0.203854,0,miopenConvolutionFwdAlgoGEMM;GemmFwd1x1_0_1_hipblaslt:0.281963,0,miopenConvolutionFwdAlgoGEMM;ConvHipImplicitGemm3DGroupFwdXdlops:1.24262,28901376,miopenConvolutionFwdAlgoImplicitGEMM
192-3-122-210-3x3x3-384-1-120-208-1-0x0x0-1x1x1-1x1x1-0-NCDHW-FP16-F=GemmFwdRest:12.6557,258785280,miopenConvolutionFwdAlgoGEMM;ConvHipImplicitGemm3DGroupFwdXdlops:15.8695,52664832,miopenConvolutionFwdAlgoImplicitGEMM;GemmFwdRest_hipblaslt:11.8961,258785280,miopenConvolutionFwdAlgoGEMM
384-3-122-210-3x3x3-384-1-120-208-1-0x0x0-1x1x1-1x1x1-0-NCDHW-FP16-F=GemmFwdRest:17.8216,517570560,miopenConvolutionFwdAlgoGEMM;ConvHipImplicitGemm3DGroupFwdXdlops:31.3309,86160384,miopenConvolutionFwdAlgoImplicitGEMM;GemmFwdRest_hipblaslt:19.0046,517570560,miopenConvolutionFwdAlgoGEMM
384-240-416-3x3-192-240-416-1-1x1-1x1-1x1-0-NCHW-FP16-F=GemmFwdRest:21.3179,690094080,miopenConvolutionFwdAlgoGEMM;GemmFwdRest_hipblaslt:28.0532,690094080,miopenConvolutionFwdAlgoGEMM;ConvHipImplicitGemmGroupFwdXdlops:17.7776,116342784,miopenConvolutionFwdAlgoImplicitGEMM;ConvBinWinogradRxSf3x2:10.0732,0,miopenConvolutionFwdAlgoWinograd;ConvBinWinogradRxSf2x3g1:5.90729,0,miopenConvolutionFwdAlgoWinograd
192-3-242-418-3x3x3-192-1-240-416-1-0x0x0-1x1x1-1x1x1-0-NCDHW-FP16-F=GemmFwdRest:62.1632,1035141120,miopenConvolutionFwdAlgoGEMM;ConvHipImplicitGemm3DGroupFwdXdlops:35.2605,156860928,miopenConvolutionFwdAlgoImplicitGEMM;GemmFwdRest_hipblaslt:77.2475,1035141120,miopenConvolutionFwdAlgoGEMM
192-480-832-3x3-96-480-832-1-1x1-1x1-1x1-0-NCHW-FP16-F=GemmFwdRest:24.2625,1380188160,miopenConvolutionFwdAlgoGEMM;GemmFwdRest_hipblaslt:28.8777,1380188160,miopenConvolutionFwdAlgoGEMM;ConvHipImplicitGemmGroupFwdXdlops:26.5166,230363136,miopenConvolutionFwdAlgoImplicitGEMM;ConvBinWinogradRxSf3x2:10.0885,0,miopenConvolutionFwdAlgoWinograd;ConvBinWinogradRxSf2x3g1:5.9657,0,miopenConvolutionFwdAlgoWinograd
96-3-482-834-3x3x3-96-1-480-832-1-0x0x0-1x1x1-1x1x1-0-NCDHW-FP16-F=GemmFwdRest:105.409,2070282240,miopenConvolutionFwdAlgoGEMM;ConvHipImplicitGemm3DGroupFwdXdlops:47.6483,308719872,miopenConvolutionFwdAlgoImplicitGEMM;GemmFwdRest_hipblaslt:112.98,2070282240,miopenConvolutionFwdAlgoGEMM
96-3-482-834-3x3x3-3-1-480-832-1-0x0x0-1x1x1-1x1x1-0-NCDHW-FP16-F=GemmFwdRest:88.932,2070282240,miopenConvolutionFwdAlgoGEMM;ConvHipImplicitGemm3DGroupFwdXdlops:25.4944,233956864,miopenConvolutionFwdAlgoImplicitGEMM;GemmFwdRest_hipblaslt:96.3036,2070282240,miopenConvolutionFwdAlgoGEMM
384-3-60-104-3x1x1-768-1-60-104-1-0x0x0-1x1x1-1x1x1-0-NCDHW-FP16-F=GemmFwdRest:0.926393,14376960,miopenConvolutionFwdAlgoGEMM;ConvHipImplicitGemm3DGroupFwdXdlops:2.1803,25731072,miopenConvolutionFwdAlgoImplicitGEMM;GemmFwdRest_hipblaslt:0.909019,14376960,miopenConvolutionFwdAlgoGEMM
384-120-208-3x3-192-120-208-2-1x1-1x1-1x1-0-NCHW-FP16-F=GemmFwdRest:5.6698,172523520,miopenConvolutionFwdAlgoGEMM;GemmFwdRest_hipblaslt:4.63261,172523520,miopenConvolutionFwdAlgoGEMM;ConvHipImplicitGemmGroupFwdXdlops:9.09585,58834944,miopenConvolutionFwdAlgoImplicitGEMM;ConvBinWinogradRxSf3x2:5.19922,0,miopenConvolutionFwdAlgoWinograd;ConvBinWinogradRxSf2x3g1:2.99323,0,miopenConvolutionFwdAlgoWinograd
192-2-120-208-1x1x1-384-2-120-208-1-0x0x0-1x1x1-1x1x1-0-NCDHW-FP16-F=GemmFwd1x1_0_1:0.391694,0,miopenConvolutionFwdAlgoGEMM;GemmFwd1x1_0_1_hipblaslt:0.478549,0,miopenConvolutionFwdAlgoGEMM;ConvHipImplicitGemm3DGroupFwdXdlops:2.54797,57655296,miopenConvolutionFwdAlgoImplicitGEMM
192-4-122-210-3x3x3-384-2-120-208-1-0x0x0-1x1x1-1x1x1-0-NCDHW-FP16-F=GemmFwdRest:33.7745,517570560,miopenConvolutionFwdAlgoGEMM;ConvHipImplicitGemm3DGroupFwdXdlops:31.4024,81672192,miopenConvolutionFwdAlgoImplicitGEMM;GemmFwdRest_hipblaslt:49.1167,517570560,miopenConvolutionFwdAlgoGEMM
384-4-122-210-3x3x3-384-2-120-208-1-0x0x0-1x1x1-1x1x1-0-NCDHW-FP16-F=GemmFwdRest:89.5613,1035141120,miopenConvolutionFwdAlgoGEMM;ConvHipImplicitGemm3DGroupFwdXdlops:65.1647,125005824,miopenConvolutionFwdAlgoImplicitGEMM;GemmFwdRest_hipblaslt:132.584,1035141120,miopenConvolutionFwdAlgoGEMM
384-4-120-208-3x1x1-768-2-120-208-1-0x0x0-1x1x1-1x1x1-0-NCDHW-FP16-F=GemmFwdRest:7.74639,115015680,miopenConvolutionFwdAlgoGEMM;ConvHipImplicitGemm3DGroupFwdXdlops:16.3728,155123712,miopenConvolutionFwdAlgoImplicitGEMM;GemmFwdRest_hipblaslt:6.91889,115015680,miopenConvolutionFwdAlgoGEMM
384-240-416-3x3-192-240-416-4-1x1-1x1-1x1-0-NCHW-FP16-F=GemmFwdRest:80.5734,690094080,miopenConvolutionFwdAlgoGEMM;GemmFwdRest_hipblaslt:110.584,690094080,miopenConvolutionFwdAlgoGEMM;ConvHipImplicitGemmGroupFwdXdlops:71.2254,461389824,miopenConvolutionFwdAlgoImplicitGEMM;ConvBinWinogradRxSf3x2:39.5532,0,miopenConvolutionFwdAlgoWinograd;ConvBinWinogradRxSf2x3g1:23.8295,0,miopenConvolutionFwdAlgoWinograd
192-6-242-418-3x3x3-192-4-240-416-1-0x0x0-1x1x1-1x1x1-0-NCDHW-FP16-F=GemmFwdRest:299.108,4140564480,miopenConvolutionFwdAlgoGEMM;ConvHipImplicitGemm3DGroupFwdXdlops:133.335,388408320,miopenConvolutionFwdAlgoImplicitGEMM;GemmFwdRest_hipblaslt:360.995,4140564480,miopenConvolutionFwdAlgoGEMM
192-480-832-3x3-96-480-832-4-1x1-1x1-1x1-0-NCHW-FP16-F=GemmFwdRest:104.715,1380188160,miopenConvolutionFwdAlgoGEMM;GemmFwdRest_hipblaslt:121.14,1380188160,miopenConvolutionFwdAlgoGEMM;ConvHipImplicitGemmGroupFwdXdlops:105.292,920457216,miopenConvolutionFwdAlgoImplicitGEMM;ConvBinWinogradRxSf3x2:42.9836,0,miopenConvolutionFwdAlgoWinograd;ConvBinWinogradRxSf2x3g1:41.6665,0,miopenConvolutionFwdAlgoWinograd
96-6-482-834-3x3x3-96-4-480-832-1-0x0x0-1x1x1-1x1x1-0-NCDHW-FP16-F=ConvHipImplicitGemm3DGroupFwdXdlops:182.962,770296320,miopenConvolutionFwdAlgoImplicitGEMM
96-6-482-834-3x3x3-3-4-480-832-1-0x0x0-1x1x1-1x1x1-0-NCDHW-FP16-F=ConvHipImplicitGemm3DGroupFwdXdlops:94.0896,472690432,miopenConvolutionFwdAlgoImplicitGEMM
16-21-60-104-1x1x1-16-21-60-104-1-0x0x0-1x1x1-1x1x1-0-NCDHW-FP16-F=GemmFwd1x1_0_1:0.0931617,0,miopenConvolutionFwdAlgoGEMM;GemmFwd1x1_0_1_hipblaslt:0.0476067,0,miopenConvolutionFwdAlgoGEMM;ConvHipImplicitGemm3DGroupFwdXdlops:0.311219,8387072,miopenConvolutionFwdAlgoImplicitGEMM
16-7-60-104-1x2x2-1536-7-30-52-1-0x0x0-1x2x2-1x1x1-0-NCDHW-FP16-F=GemmFwdRest:0.214282,1397760,miopenConvolutionFwdAlgoGEMM;ConvHipImplicitGemm3DGroupFwdXdlops:1.56438,35140608,miopenConvolutionFwdAlgoImplicitGEMM;GemmFwdRest_hipblaslt:0.356824,1397760,miopenConvolutionFwdAlgoGEMM
16-7-60-104-1x1x1-16-7-60-104-1-0x0x0-1x1x1-1x1x1-0-NCDHW-FP16-F=GemmFwd1x1_0_1:0.0403778,0,miopenConvolutionFwdAlgoGEMM;GemmFwd1x1_0_1_hipblaslt:0.0274618,0,miopenConvolutionFwdAlgoGEMM;ConvHipImplicitGemm3DGroupFwdXdlops:0.193831,2796032,miopenConvolutionFwdAlgoImplicitGEMM
